--------------------------------------------------------
-- Archivo creado  - lunes-marzo-02-2020   
--------------------------------------------------------
--------------------------------------------------------
--  DDL for Table WEBSERV_JUNTA_PROFESIONAL
--------------------------------------------------------

  CREATE TABLE "OASIS4"."WEBSERV_JUNTA_PROFESIONAL" 
   (	"ID_JUPR" NUMBER, 
	"REPO_PERIODO" DATE, 
	"REPO_SERV_ID" NUMBER(11,0), 
	"REPO_TIRE_ID" NUMBER(11,0), 
	"NOPRESCRIPCION" VARCHAR2(500 BYTE), 
	"FPRESCRIPCION" DATE, 
	"TIPOTECNOLOGIA" VARCHAR2(500 BYTE), 
	"CONSECUTIVO" NUMBER, 
	"ESTJM" NUMBER, 
	"CODENTPROC" VARCHAR2(500 BYTE), 
	"OBSERVACIONES" VARCHAR2(500 BYTE), 
	"JUSTIFICACIONTECNICA" VARCHAR2(500 BYTE), 
	"MODALIDAD" NUMBER, 
	"NOACTA" VARCHAR2(500 BYTE), 
	"FECHAACTA" DATE, 
	"FPROCESO" VARCHAR2(500 BYTE), 
	"TIPOIDPACIENTE" VARCHAR2(500 BYTE), 
	"NROIDPACIENTE" VARCHAR2(500 BYTE), 
	"CODENTJM" VARCHAR2(500 BYTE)
   ) SEGMENT CREATION IMMEDIATE 
  PCTFREE 10 PCTUSED 40 INITRANS 1 MAXTRANS 255 
 NOCOMPRESS LOGGING
  STORAGE(INITIAL 65536 NEXT 1048576 MINEXTENTS 1 MAXEXTENTS 2147483645
  PCTINCREASE 0 FREELISTS 1 FREELIST GROUPS 1
  BUFFER_POOL DEFAULT FLASH_CACHE DEFAULT CELL_FLASH_CACHE DEFAULT)
  TABLESPACE "OASIS4" ;
REM INSERTING into OASIS4.WEBSERV_JUNTA_PROFESIONAL
SET DEFINE OFF;
Insert into OASIS4.WEBSERV_JUNTA_PROFESIONAL (ID_JUPR,REPO_PERIODO,REPO_SERV_ID,REPO_TIRE_ID,NOPRESCRIPCION,FPRESCRIPCION,TIPOTECNOLOGIA,CONSECUTIVO,ESTJM,CODENTPROC,OBSERVACIONES,JUSTIFICACIONTECNICA,MODALIDAD,NOACTA,FECHAACTA,FPROCESO,TIPOIDPACIENTE,NROIDPACIENTE,CODENTJM) values ('78',to_date('11/03/19','DD/MM/RR'),'9','2','20190311155010832874',to_date('11/03/19','DD/MM/RR'),'N','1','2',null,null,null,null,null,to_date('01/01/70','DD/MM/RR'),null,'CC','22595397','086380015401');
Insert into OASIS4.WEBSERV_JUNTA_PROFESIONAL (ID_JUPR,REPO_PERIODO,REPO_SERV_ID,REPO_TIRE_ID,NOPRESCRIPCION,FPRESCRIPCION,TIPOTECNOLOGIA,CONSECUTIVO,ESTJM,CODENTPROC,OBSERVACIONES,JUSTIFICACIONTECNICA,MODALIDAD,NOACTA,FECHAACTA,FPROCESO,TIPOIDPACIENTE,NROIDPACIENTE,CODENTJM) values ('79',to_date('14/03/19','DD/MM/RR'),'9','2','20190314141010906798',to_date('14/03/19','DD/MM/RR'),'M','1','3','050010210401',null,'Pte con anemia falciforme, Enf. Toxica del hÃ­gado con colestasis, en trasplante de cÃ©lulas madre, se requiere Ã¡cidos biliares para revenir Enf venosoclusiva hep','1','2179',to_date('15/03/19','DD/MM/RR'),'2019-03-15','TI','1043155383','050010210401');
Insert into OASIS4.WEBSERV_JUNTA_PROFESIONAL (ID_JUPR,REPO_PERIODO,REPO_SERV_ID,REPO_TIRE_ID,NOPRESCRIPCION,FPRESCRIPCION,TIPOTECNOLOGIA,CONSECUTIVO,ESTJM,CODENTPROC,OBSERVACIONES,JUSTIFICACIONTECNICA,MODALIDAD,NOACTA,FECHAACTA,FPROCESO,TIPOIDPACIENTE,NROIDPACIENTE,CODENTJM) values ('80',to_date('14/03/19','DD/MM/RR'),'9','2','20190314194010912938',to_date('14/03/19','DD/MM/RR'),'N','1','2',null,null,null,null,null,to_date('01/01/70','DD/MM/RR'),null,'TI','1043141939','087580016101');
Insert into OASIS4.WEBSERV_JUNTA_PROFESIONAL (ID_JUPR,REPO_PERIODO,REPO_SERV_ID,REPO_TIRE_ID,NOPRESCRIPCION,FPRESCRIPCION,TIPOTECNOLOGIA,CONSECUTIVO,ESTJM,CODENTPROC,OBSERVACIONES,JUSTIFICACIONTECNICA,MODALIDAD,NOACTA,FECHAACTA,FPROCESO,TIPOIDPACIENTE,NROIDPACIENTE,CODENTJM) values ('81',to_date('14/03/19','DD/MM/RR'),'9','2','20190314182010918821',to_date('14/03/19','DD/MM/RR'),'N','1','2',null,null,null,null,null,to_date('01/01/70','DD/MM/RR'),null,'CC','840054','080010003701');
Insert into OASIS4.WEBSERV_JUNTA_PROFESIONAL (ID_JUPR,REPO_PERIODO,REPO_SERV_ID,REPO_TIRE_ID,NOPRESCRIPCION,FPRESCRIPCION,TIPOTECNOLOGIA,CONSECUTIVO,ESTJM,CODENTPROC,OBSERVACIONES,JUSTIFICACIONTECNICA,MODALIDAD,NOACTA,FECHAACTA,FPROCESO,TIPOIDPACIENTE,NROIDPACIENTE,CODENTJM) values ('82',to_date('15/03/19','DD/MM/RR'),'9','2','20190315186010929636',to_date('15/03/19','DD/MM/RR'),'M','1','3','050010210401',null,'Anemia falciforme. colestasis, se usa durante el trasplante para prevenciÃ³n de enfermedad venoocluisva hepÃ¡tica','1','2184',to_date('19/03/19','DD/MM/RR'),'2019-03-19','TI','1043155383','050010210401');
Insert into OASIS4.WEBSERV_JUNTA_PROFESIONAL (ID_JUPR,REPO_PERIODO,REPO_SERV_ID,REPO_TIRE_ID,NOPRESCRIPCION,FPRESCRIPCION,TIPOTECNOLOGIA,CONSECUTIVO,ESTJM,CODENTPROC,OBSERVACIONES,JUSTIFICACIONTECNICA,MODALIDAD,NOACTA,FECHAACTA,FPROCESO,TIPOIDPACIENTE,NROIDPACIENTE,CODENTJM) values ('83',to_date('15/03/19','DD/MM/RR'),'9','2','20190315178010933432',to_date('15/03/19','DD/MM/RR'),'N','1','3','086340010501',null,'paciente de 55 aÃ±os de edad con peso de 40kg,talla1.64cm imc15,3 con diagnostico nutricional de delgadez. ','1','04',to_date('15/03/19','DD/MM/RR'),'2019-03-15','CC','22623638','086340010501');
Insert into OASIS4.WEBSERV_JUNTA_PROFESIONAL (ID_JUPR,REPO_PERIODO,REPO_SERV_ID,REPO_TIRE_ID,NOPRESCRIPCION,FPRESCRIPCION,TIPOTECNOLOGIA,CONSECUTIVO,ESTJM,CODENTPROC,OBSERVACIONES,JUSTIFICACIONTECNICA,MODALIDAD,NOACTA,FECHAACTA,FPROCESO,TIPOIDPACIENTE,NROIDPACIENTE,CODENTJM) values ('84',to_date('15/03/19','DD/MM/RR'),'9','2','20190315152010938235',to_date('15/03/19','DD/MM/RR'),'N','1','3','086380074501',null,'FEM DE 73 AÃ‘OS DE EDAD CON CUADRO DE INCONTINENCIA URINARIA,SECUELAS DE AMPUTACION BILATERAL DE MIEMBROS INFERIORES ,DIABETES MELLITUS ASOCIADA A DESNUTRIcion','1','000',to_date('15/03/19','DD/MM/RR'),'2019-09-23','CC','23247447','086380074501');
Insert into OASIS4.WEBSERV_JUNTA_PROFESIONAL (ID_JUPR,REPO_PERIODO,REPO_SERV_ID,REPO_TIRE_ID,NOPRESCRIPCION,FPRESCRIPCION,TIPOTECNOLOGIA,CONSECUTIVO,ESTJM,CODENTPROC,OBSERVACIONES,JUSTIFICACIONTECNICA,MODALIDAD,NOACTA,FECHAACTA,FPROCESO,TIPOIDPACIENTE,NROIDPACIENTE,CODENTJM) values ('85',to_date('18/03/19','DD/MM/RR'),'9','2','20190318176010954634',to_date('18/03/19','DD/MM/RR'),'N','1','3','086340010501',null,'PACIENTE CON 4 AÃ‘OS 3 MESE DE EDAD CON PESO 11 KG TALLA 95 CM  DIAGNOSTICO NUTRICIONAL DE DESNUTRICIÃ“N AGUDA MODERADA CON RETRASO EN TALLA, SE REALIZA PRUEBA DE','1','05',to_date('18/03/19','DD/MM/RR'),'2019-03-18','RC','1042355377','086340010501');
Insert into OASIS4.WEBSERV_JUNTA_PROFESIONAL (ID_JUPR,REPO_PERIODO,REPO_SERV_ID,REPO_TIRE_ID,NOPRESCRIPCION,FPRESCRIPCION,TIPOTECNOLOGIA,CONSECUTIVO,ESTJM,CODENTPROC,OBSERVACIONES,JUSTIFICACIONTECNICA,MODALIDAD,NOACTA,FECHAACTA,FPROCESO,TIPOIDPACIENTE,NROIDPACIENTE,CODENTJM) values ('86',to_date('18/03/19','DD/MM/RR'),'9','2','20190318193010965739',to_date('18/03/19','DD/MM/RR'),'N','1','2',null,null,null,null,null,to_date('01/01/70','DD/MM/RR'),null,'TI','1043129808','087580016101');
Insert into OASIS4.WEBSERV_JUNTA_PROFESIONAL (ID_JUPR,REPO_PERIODO,REPO_SERV_ID,REPO_TIRE_ID,NOPRESCRIPCION,FPRESCRIPCION,TIPOTECNOLOGIA,CONSECUTIVO,ESTJM,CODENTPROC,OBSERVACIONES,JUSTIFICACIONTECNICA,MODALIDAD,NOACTA,FECHAACTA,FPROCESO,TIPOIDPACIENTE,NROIDPACIENTE,CODENTJM) values ('87',to_date('19/03/19','DD/MM/RR'),'9','2','20190319179010974111',to_date('19/03/19','DD/MM/RR'),'N','1','2',null,null,null,null,null,to_date('01/01/70','DD/MM/RR'),null,'TI','1043673938','087580053305');
Insert into OASIS4.WEBSERV_JUNTA_PROFESIONAL (ID_JUPR,REPO_PERIODO,REPO_SERV_ID,REPO_TIRE_ID,NOPRESCRIPCION,FPRESCRIPCION,TIPOTECNOLOGIA,CONSECUTIVO,ESTJM,CODENTPROC,OBSERVACIONES,JUSTIFICACIONTECNICA,MODALIDAD,NOACTA,FECHAACTA,FPROCESO,TIPOIDPACIENTE,NROIDPACIENTE,CODENTJM) values ('88',to_date('19/03/19','DD/MM/RR'),'9','2','20190319171010983955',to_date('19/03/19','DD/MM/RR'),'N','1','2',null,null,null,null,null,to_date('01/01/70','DD/MM/RR'),null,'CC','22900844','087580016101');
Insert into OASIS4.WEBSERV_JUNTA_PROFESIONAL (ID_JUPR,REPO_PERIODO,REPO_SERV_ID,REPO_TIRE_ID,NOPRESCRIPCION,FPRESCRIPCION,TIPOTECNOLOGIA,CONSECUTIVO,ESTJM,CODENTPROC,OBSERVACIONES,JUSTIFICACIONTECNICA,MODALIDAD,NOACTA,FECHAACTA,FPROCESO,TIPOIDPACIENTE,NROIDPACIENTE,CODENTJM) values ('89',to_date('19/03/19','DD/MM/RR'),'9','2','20190319164010985967',to_date('19/03/19','DD/MM/RR'),'N','1','2',null,null,null,null,null,to_date('01/01/70','DD/MM/RR'),null,'TI','1073819636','087580016101');
Insert into OASIS4.WEBSERV_JUNTA_PROFESIONAL (ID_JUPR,REPO_PERIODO,REPO_SERV_ID,REPO_TIRE_ID,NOPRESCRIPCION,FPRESCRIPCION,TIPOTECNOLOGIA,CONSECUTIVO,ESTJM,CODENTPROC,OBSERVACIONES,JUSTIFICACIONTECNICA,MODALIDAD,NOACTA,FECHAACTA,FPROCESO,TIPOIDPACIENTE,NROIDPACIENTE,CODENTJM) values ('90',to_date('19/03/19','DD/MM/RR'),'9','2','20190319111010986167',to_date('19/03/19','DD/MM/RR'),'N','1','2',null,null,null,null,null,to_date('01/01/70','DD/MM/RR'),null,'RC','1073824913','087580016101');
Insert into OASIS4.WEBSERV_JUNTA_PROFESIONAL (ID_JUPR,REPO_PERIODO,REPO_SERV_ID,REPO_TIRE_ID,NOPRESCRIPCION,FPRESCRIPCION,TIPOTECNOLOGIA,CONSECUTIVO,ESTJM,CODENTPROC,OBSERVACIONES,JUSTIFICACIONTECNICA,MODALIDAD,NOACTA,FECHAACTA,FPROCESO,TIPOIDPACIENTE,NROIDPACIENTE,CODENTJM) values ('91',to_date('19/03/19','DD/MM/RR'),'9','2','20190319154010986385',to_date('19/03/19','DD/MM/RR'),'N','1','3','086340010501',null,'PACIENTE DE 4AÃ‘OS DE EDAD CON PESO 14KG TALLA 100CM CON RETARDO DEL DESARROLLO DEBIDO A RIESGO DE DESNUTRICIÃ“N ','1','06',to_date('19/03/19','DD/MM/RR'),'2019-03-19','RC','1042354901','086340010501');
Insert into OASIS4.WEBSERV_JUNTA_PROFESIONAL (ID_JUPR,REPO_PERIODO,REPO_SERV_ID,REPO_TIRE_ID,NOPRESCRIPCION,FPRESCRIPCION,TIPOTECNOLOGIA,CONSECUTIVO,ESTJM,CODENTPROC,OBSERVACIONES,JUSTIFICACIONTECNICA,MODALIDAD,NOACTA,FECHAACTA,FPROCESO,TIPOIDPACIENTE,NROIDPACIENTE,CODENTJM) values ('92',to_date('19/03/19','DD/MM/RR'),'9','2','20190319113010986789',to_date('19/03/19','DD/MM/RR'),'N','1','2',null,null,null,null,null,to_date('01/01/70','DD/MM/RR'),null,'RC','1043192710','087580016101');
Insert into OASIS4.WEBSERV_JUNTA_PROFESIONAL (ID_JUPR,REPO_PERIODO,REPO_SERV_ID,REPO_TIRE_ID,NOPRESCRIPCION,FPRESCRIPCION,TIPOTECNOLOGIA,CONSECUTIVO,ESTJM,CODENTPROC,OBSERVACIONES,JUSTIFICACIONTECNICA,MODALIDAD,NOACTA,FECHAACTA,FPROCESO,TIPOIDPACIENTE,NROIDPACIENTE,CODENTJM) values ('93',to_date('19/03/19','DD/MM/RR'),'9','2','20190319144010987836',to_date('19/03/19','DD/MM/RR'),'N','1','3','086340010501',null,'PACIENTE DE 48 AÃ‘OS DE EDAD CON PESO 28KG TALLA 150CM IMC12,2 DIAGNOSTICO NUTRICIONAL DE DELGADEZ MODERADA PATOLOGÃ?A ASOCIADA MENINGITIS Y ENCEFALITIS  TENIENDO','1','07',to_date('19/03/19','DD/MM/RR'),'2019-03-19','CC','1010149849','086340010501');
Insert into OASIS4.WEBSERV_JUNTA_PROFESIONAL (ID_JUPR,REPO_PERIODO,REPO_SERV_ID,REPO_TIRE_ID,NOPRESCRIPCION,FPRESCRIPCION,TIPOTECNOLOGIA,CONSECUTIVO,ESTJM,CODENTPROC,OBSERVACIONES,JUSTIFICACIONTECNICA,MODALIDAD,NOACTA,FECHAACTA,FPROCESO,TIPOIDPACIENTE,NROIDPACIENTE,CODENTJM) values ('94',to_date('19/03/19','DD/MM/RR'),'9','2','20190319170010990522',to_date('19/03/19','DD/MM/RR'),'N','1','2',null,null,null,null,null,to_date('01/01/70','DD/MM/RR'),null,'CC','22689257','087580016101');
Insert into OASIS4.WEBSERV_JUNTA_PROFESIONAL (ID_JUPR,REPO_PERIODO,REPO_SERV_ID,REPO_TIRE_ID,NOPRESCRIPCION,FPRESCRIPCION,TIPOTECNOLOGIA,CONSECUTIVO,ESTJM,CODENTPROC,OBSERVACIONES,JUSTIFICACIONTECNICA,MODALIDAD,NOACTA,FECHAACTA,FPROCESO,TIPOIDPACIENTE,NROIDPACIENTE,CODENTJM) values ('95',to_date('20/03/19','DD/MM/RR'),'9','2','20190320119011003829',to_date('20/03/19','DD/MM/RR'),'M','1','2',null,null,null,null,null,to_date('01/01/70','DD/MM/RR'),null,'CC','22583298','080010112201');
Insert into OASIS4.WEBSERV_JUNTA_PROFESIONAL (ID_JUPR,REPO_PERIODO,REPO_SERV_ID,REPO_TIRE_ID,NOPRESCRIPCION,FPRESCRIPCION,TIPOTECNOLOGIA,CONSECUTIVO,ESTJM,CODENTPROC,OBSERVACIONES,JUSTIFICACIONTECNICA,MODALIDAD,NOACTA,FECHAACTA,FPROCESO,TIPOIDPACIENTE,NROIDPACIENTE,CODENTJM) values ('96',to_date('20/03/19','DD/MM/RR'),'9','2','20190320130011000476',to_date('20/03/19','DD/MM/RR'),'N','1','3','080010226001',null,'APROBADO, DIAGNOSTICO CONCUERDA CON LA JUSTIFICACION CLINICA Y ORDENAMIENTO MEDICO ','1','033921032019',to_date('21/03/19','DD/MM/RR'),'2019-03-21','RC','1047363274','080010226001');
Insert into OASIS4.WEBSERV_JUNTA_PROFESIONAL (ID_JUPR,REPO_PERIODO,REPO_SERV_ID,REPO_TIRE_ID,NOPRESCRIPCION,FPRESCRIPCION,TIPOTECNOLOGIA,CONSECUTIVO,ESTJM,CODENTPROC,OBSERVACIONES,JUSTIFICACIONTECNICA,MODALIDAD,NOACTA,FECHAACTA,FPROCESO,TIPOIDPACIENTE,NROIDPACIENTE,CODENTJM) values ('97',to_date('20/03/19','DD/MM/RR'),'9','2','20190320126011003836',to_date('20/03/19','DD/MM/RR'),'N','1','2',null,null,null,null,null,to_date('01/01/70','DD/MM/RR'),null,'TI','1041850427','082960002101');
Insert into OASIS4.WEBSERV_JUNTA_PROFESIONAL (ID_JUPR,REPO_PERIODO,REPO_SERV_ID,REPO_TIRE_ID,NOPRESCRIPCION,FPRESCRIPCION,TIPOTECNOLOGIA,CONSECUTIVO,ESTJM,CODENTPROC,OBSERVACIONES,JUSTIFICACIONTECNICA,MODALIDAD,NOACTA,FECHAACTA,FPROCESO,TIPOIDPACIENTE,NROIDPACIENTE,CODENTJM) values ('98',to_date('21/03/19','DD/MM/RR'),'9','2','20190321153011028619',to_date('21/03/19','DD/MM/RR'),'N','1','2',null,null,null,null,null,to_date('01/01/70','DD/MM/RR'),null,'CC','22900844','087580016101');
Insert into OASIS4.WEBSERV_JUNTA_PROFESIONAL (ID_JUPR,REPO_PERIODO,REPO_SERV_ID,REPO_TIRE_ID,NOPRESCRIPCION,FPRESCRIPCION,TIPOTECNOLOGIA,CONSECUTIVO,ESTJM,CODENTPROC,OBSERVACIONES,JUSTIFICACIONTECNICA,MODALIDAD,NOACTA,FECHAACTA,FPROCESO,TIPOIDPACIENTE,NROIDPACIENTE,CODENTJM) values ('99',to_date('21/03/19','DD/MM/RR'),'9','2','20190321130011029235',to_date('21/03/19','DD/MM/RR'),'N','1','2',null,null,null,null,null,to_date('01/01/70','DD/MM/RR'),null,'RC','1043190669','087580016101');
Insert into OASIS4.WEBSERV_JUNTA_PROFESIONAL (ID_JUPR,REPO_PERIODO,REPO_SERV_ID,REPO_TIRE_ID,NOPRESCRIPCION,FPRESCRIPCION,TIPOTECNOLOGIA,CONSECUTIVO,ESTJM,CODENTPROC,OBSERVACIONES,JUSTIFICACIONTECNICA,MODALIDAD,NOACTA,FECHAACTA,FPROCESO,TIPOIDPACIENTE,NROIDPACIENTE,CODENTJM) values ('100',to_date('23/03/19','DD/MM/RR'),'9','2','20190323195011058343',to_date('23/03/19','DD/MM/RR'),'N','1','3','087580053302',null,'PCTE DESN AGU - MODERADA PESO 10.9 KG TALLA 92 PB 13,2 ','1','0000157',to_date('29/04/19','DD/MM/RR'),'2019-04-29','RC','1234888800','087580053302');
Insert into OASIS4.WEBSERV_JUNTA_PROFESIONAL (ID_JUPR,REPO_PERIODO,REPO_SERV_ID,REPO_TIRE_ID,NOPRESCRIPCION,FPRESCRIPCION,TIPOTECNOLOGIA,CONSECUTIVO,ESTJM,CODENTPROC,OBSERVACIONES,JUSTIFICACIONTECNICA,MODALIDAD,NOACTA,FECHAACTA,FPROCESO,TIPOIDPACIENTE,NROIDPACIENTE,CODENTJM) values ('101',to_date('23/03/19','DD/MM/RR'),'9','2','20190323179011061469',to_date('23/03/19','DD/MM/RR'),'N','1','2',null,null,null,null,null,to_date('01/01/70','DD/MM/RR'),null,'CC','840054','080010054401');
Insert into OASIS4.WEBSERV_JUNTA_PROFESIONAL (ID_JUPR,REPO_PERIODO,REPO_SERV_ID,REPO_TIRE_ID,NOPRESCRIPCION,FPRESCRIPCION,TIPOTECNOLOGIA,CONSECUTIVO,ESTJM,CODENTPROC,OBSERVACIONES,JUSTIFICACIONTECNICA,MODALIDAD,NOACTA,FECHAACTA,FPROCESO,TIPOIDPACIENTE,NROIDPACIENTE,CODENTJM) values ('102',to_date('26/03/19','DD/MM/RR'),'9','2','20190326133011083572',to_date('26/03/19','DD/MM/RR'),'M','1','2',null,null,null,null,null,to_date('01/01/70','DD/MM/RR'),null,'CC','1042347981','080010133501');
Insert into OASIS4.WEBSERV_JUNTA_PROFESIONAL (ID_JUPR,REPO_PERIODO,REPO_SERV_ID,REPO_TIRE_ID,NOPRESCRIPCION,FPRESCRIPCION,TIPOTECNOLOGIA,CONSECUTIVO,ESTJM,CODENTPROC,OBSERVACIONES,JUSTIFICACIONTECNICA,MODALIDAD,NOACTA,FECHAACTA,FPROCESO,TIPOIDPACIENTE,NROIDPACIENTE,CODENTJM) values ('103',to_date('26/03/19','DD/MM/RR'),'9','2','20190326152011069897',to_date('26/03/19','DD/MM/RR'),'N','1','2',null,null,null,null,null,to_date('01/01/70','DD/MM/RR'),null,'CC','3759025','086380074501');
Insert into OASIS4.WEBSERV_JUNTA_PROFESIONAL (ID_JUPR,REPO_PERIODO,REPO_SERV_ID,REPO_TIRE_ID,NOPRESCRIPCION,FPRESCRIPCION,TIPOTECNOLOGIA,CONSECUTIVO,ESTJM,CODENTPROC,OBSERVACIONES,JUSTIFICACIONTECNICA,MODALIDAD,NOACTA,FECHAACTA,FPROCESO,TIPOIDPACIENTE,NROIDPACIENTE,CODENTJM) values ('104',to_date('26/03/19','DD/MM/RR'),'9','2','20190326173011070556',to_date('26/03/19','DD/MM/RR'),'N','1','2',null,null,null,null,null,to_date('01/01/70','DD/MM/RR'),null,'TI','1043164307','080010112201');
Insert into OASIS4.WEBSERV_JUNTA_PROFESIONAL (ID_JUPR,REPO_PERIODO,REPO_SERV_ID,REPO_TIRE_ID,NOPRESCRIPCION,FPRESCRIPCION,TIPOTECNOLOGIA,CONSECUTIVO,ESTJM,CODENTPROC,OBSERVACIONES,JUSTIFICACIONTECNICA,MODALIDAD,NOACTA,FECHAACTA,FPROCESO,TIPOIDPACIENTE,NROIDPACIENTE,CODENTJM) values ('105',to_date('26/03/19','DD/MM/RR'),'9','2','20190326132011070741',to_date('26/03/19','DD/MM/RR'),'N','1','2',null,null,null,null,null,to_date('01/01/70','DD/MM/RR'),null,'CC','8633218','086380074501');
Insert into OASIS4.WEBSERV_JUNTA_PROFESIONAL (ID_JUPR,REPO_PERIODO,REPO_SERV_ID,REPO_TIRE_ID,NOPRESCRIPCION,FPRESCRIPCION,TIPOTECNOLOGIA,CONSECUTIVO,ESTJM,CODENTPROC,OBSERVACIONES,JUSTIFICACIONTECNICA,MODALIDAD,NOACTA,FECHAACTA,FPROCESO,TIPOIDPACIENTE,NROIDPACIENTE,CODENTJM) values ('106',to_date('26/03/19','DD/MM/RR'),'9','2','20190326120011070925',to_date('26/03/19','DD/MM/RR'),'N','1','2',null,null,null,null,null,to_date('01/01/70','DD/MM/RR'),null,'RC','1043933137','080010112201');
Insert into OASIS4.WEBSERV_JUNTA_PROFESIONAL (ID_JUPR,REPO_PERIODO,REPO_SERV_ID,REPO_TIRE_ID,NOPRESCRIPCION,FPRESCRIPCION,TIPOTECNOLOGIA,CONSECUTIVO,ESTJM,CODENTPROC,OBSERVACIONES,JUSTIFICACIONTECNICA,MODALIDAD,NOACTA,FECHAACTA,FPROCESO,TIPOIDPACIENTE,NROIDPACIENTE,CODENTJM) values ('107',to_date('26/03/19','DD/MM/RR'),'9','2','20190326155011072166',to_date('26/03/19','DD/MM/RR'),'N','1','2',null,null,null,null,null,to_date('01/01/70','DD/MM/RR'),null,'RC','1130277643','080010112201');
Insert into OASIS4.WEBSERV_JUNTA_PROFESIONAL (ID_JUPR,REPO_PERIODO,REPO_SERV_ID,REPO_TIRE_ID,NOPRESCRIPCION,FPRESCRIPCION,TIPOTECNOLOGIA,CONSECUTIVO,ESTJM,CODENTPROC,OBSERVACIONES,JUSTIFICACIONTECNICA,MODALIDAD,NOACTA,FECHAACTA,FPROCESO,TIPOIDPACIENTE,NROIDPACIENTE,CODENTJM) values ('108',to_date('26/03/19','DD/MM/RR'),'9','2','20190326136011072449',to_date('26/03/19','DD/MM/RR'),'N','1','2',null,null,null,null,null,to_date('01/01/70','DD/MM/RR'),null,'CC','22629276','086380074501');
Insert into OASIS4.WEBSERV_JUNTA_PROFESIONAL (ID_JUPR,REPO_PERIODO,REPO_SERV_ID,REPO_TIRE_ID,NOPRESCRIPCION,FPRESCRIPCION,TIPOTECNOLOGIA,CONSECUTIVO,ESTJM,CODENTPROC,OBSERVACIONES,JUSTIFICACIONTECNICA,MODALIDAD,NOACTA,FECHAACTA,FPROCESO,TIPOIDPACIENTE,NROIDPACIENTE,CODENTJM) values ('109',to_date('26/03/19','DD/MM/RR'),'9','2','20190326142011073356',to_date('26/03/19','DD/MM/RR'),'N','1','3','086380074501',null,'PACIENTE CON DNT MODERADA, DX MED: ENFER DE  ALZHAIMER,  ESTRENIMIENTO. , PARKINSON, ,SE  AUTORIZA  SUPLEMENTO    ENSURE  ADVANCE  BOTELLA LIQUIDA 237  MIL LIQ','1','18',to_date('24/11/19','DD/MM/RR'),'2019-12-20','CC','22460429','086380074501');
Insert into OASIS4.WEBSERV_JUNTA_PROFESIONAL (ID_JUPR,REPO_PERIODO,REPO_SERV_ID,REPO_TIRE_ID,NOPRESCRIPCION,FPRESCRIPCION,TIPOTECNOLOGIA,CONSECUTIVO,ESTJM,CODENTPROC,OBSERVACIONES,JUSTIFICACIONTECNICA,MODALIDAD,NOACTA,FECHAACTA,FPROCESO,TIPOIDPACIENTE,NROIDPACIENTE,CODENTJM) values ('110',to_date('27/03/19','DD/MM/RR'),'9','2','20190327114011091877',to_date('27/03/19','DD/MM/RR'),'N','1','3','086340010501',null,'PACIENTE DE 2 MESE 28 DÃ?AS CON PESO DE 3.600KG TALLA 55CM DIAGNOSTICO NUTRICIONAL DE RIESGO DE DESNUTRICIÃ“N AGUDA Y RETRASO EN TALLA , PACIENTE CON HEMICOLECTOM','1','08',to_date('27/03/19','DD/MM/RR'),'2019-03-27','RC','1048087282','086340010501');
Insert into OASIS4.WEBSERV_JUNTA_PROFESIONAL (ID_JUPR,REPO_PERIODO,REPO_SERV_ID,REPO_TIRE_ID,NOPRESCRIPCION,FPRESCRIPCION,TIPOTECNOLOGIA,CONSECUTIVO,ESTJM,CODENTPROC,OBSERVACIONES,JUSTIFICACIONTECNICA,MODALIDAD,NOACTA,FECHAACTA,FPROCESO,TIPOIDPACIENTE,NROIDPACIENTE,CODENTJM) values ('111',to_date('28/03/19','DD/MM/RR'),'9','2','20190328188011122100',to_date('28/03/19','DD/MM/RR'),'M','1','2',null,null,null,null,null,to_date('01/01/70','DD/MM/RR'),null,'CC','1002228596','080010112201');
Insert into OASIS4.WEBSERV_JUNTA_PROFESIONAL (ID_JUPR,REPO_PERIODO,REPO_SERV_ID,REPO_TIRE_ID,NOPRESCRIPCION,FPRESCRIPCION,TIPOTECNOLOGIA,CONSECUTIVO,ESTJM,CODENTPROC,OBSERVACIONES,JUSTIFICACIONTECNICA,MODALIDAD,NOACTA,FECHAACTA,FPROCESO,TIPOIDPACIENTE,NROIDPACIENTE,CODENTJM) values ('112',to_date('28/03/19','DD/MM/RR'),'9','2','20190328140011126457',to_date('28/03/19','DD/MM/RR'),'N','1','3','080010054401',null,'LA JUNTA MEDICA HA REVISADO SU CASO Y DECIDEN POR CONDICION CLINICA DEL PACIENTE SE AUTORIZA EL USO DE FORMULA NUTRICIONAL ALTA EN PEPTIDOS PERATIVE 237 ML ','1','0763',to_date('28/03/19','DD/MM/RR'),'2019-03-28','CC','840054','080010054401');
Insert into OASIS4.WEBSERV_JUNTA_PROFESIONAL (ID_JUPR,REPO_PERIODO,REPO_SERV_ID,REPO_TIRE_ID,NOPRESCRIPCION,FPRESCRIPCION,TIPOTECNOLOGIA,CONSECUTIVO,ESTJM,CODENTPROC,OBSERVACIONES,JUSTIFICACIONTECNICA,MODALIDAD,NOACTA,FECHAACTA,FPROCESO,TIPOIDPACIENTE,NROIDPACIENTE,CODENTJM) values ('113',to_date('28/03/19','DD/MM/RR'),'9','2','20190328195011129884',to_date('28/03/19','DD/MM/RR'),'N','1','2',null,null,null,null,null,to_date('01/01/70','DD/MM/RR'),null,'CC','32817535','087580016101');
Insert into OASIS4.WEBSERV_JUNTA_PROFESIONAL (ID_JUPR,REPO_PERIODO,REPO_SERV_ID,REPO_TIRE_ID,NOPRESCRIPCION,FPRESCRIPCION,TIPOTECNOLOGIA,CONSECUTIVO,ESTJM,CODENTPROC,OBSERVACIONES,JUSTIFICACIONTECNICA,MODALIDAD,NOACTA,FECHAACTA,FPROCESO,TIPOIDPACIENTE,NROIDPACIENTE,CODENTJM) values ('114',to_date('29/03/19','DD/MM/RR'),'9','2','20190329132011139252',to_date('29/03/19','DD/MM/RR'),'N','1','2',null,null,null,null,null,to_date('01/01/70','DD/MM/RR'),null,'TI','1047222902','080010112201');
Insert into OASIS4.WEBSERV_JUNTA_PROFESIONAL (ID_JUPR,REPO_PERIODO,REPO_SERV_ID,REPO_TIRE_ID,NOPRESCRIPCION,FPRESCRIPCION,TIPOTECNOLOGIA,CONSECUTIVO,ESTJM,CODENTPROC,OBSERVACIONES,JUSTIFICACIONTECNICA,MODALIDAD,NOACTA,FECHAACTA,FPROCESO,TIPOIDPACIENTE,NROIDPACIENTE,CODENTJM) values ('115',to_date('29/03/19','DD/MM/RR'),'9','2','20190329151011142201',to_date('29/03/19','DD/MM/RR'),'N','1','3','087580053302',null,'PCTE CON DESNU PROTEICO CALORICA IMC/EDAD <1 Y -2 TALLA <2 RELACION PESO TALLA INADECUADA MAL REGISTRO ALIMENTARIO SE APRUEBA SOPORTE NUTRICIONAL','1','0000173',to_date('06/05/19','DD/MM/RR'),'2019-05-06','RC','1043170002','087580053302');
Insert into OASIS4.WEBSERV_JUNTA_PROFESIONAL (ID_JUPR,REPO_PERIODO,REPO_SERV_ID,REPO_TIRE_ID,NOPRESCRIPCION,FPRESCRIPCION,TIPOTECNOLOGIA,CONSECUTIVO,ESTJM,CODENTPROC,OBSERVACIONES,JUSTIFICACIONTECNICA,MODALIDAD,NOACTA,FECHAACTA,FPROCESO,TIPOIDPACIENTE,NROIDPACIENTE,CODENTJM) values ('116',to_date('29/03/19','DD/MM/RR'),'9','2','20190329151011145224',to_date('29/03/19','DD/MM/RR'),'N','1','3','087580053302',null,'PACIENTE QUE ASISTE A CONSULTA POR PRESENTAR TALLA BAJAPARA LA EDAD DELGADEZ MARCADA IMC EDAD MENOR-2 DE POCO APETITO SELECTIVIDAD DE LOS ALIMENTOS','1','0000159',to_date('08/04/19','DD/MM/RR'),'2019-04-09','RC','1042353114','087580053302');
Insert into OASIS4.WEBSERV_JUNTA_PROFESIONAL (ID_JUPR,REPO_PERIODO,REPO_SERV_ID,REPO_TIRE_ID,NOPRESCRIPCION,FPRESCRIPCION,TIPOTECNOLOGIA,CONSECUTIVO,ESTJM,CODENTPROC,OBSERVACIONES,JUSTIFICACIONTECNICA,MODALIDAD,NOACTA,FECHAACTA,FPROCESO,TIPOIDPACIENTE,NROIDPACIENTE,CODENTJM) values ('117',to_date('30/03/19','DD/MM/RR'),'9','2','20190330161011152363',to_date('30/03/19','DD/MM/RR'),'N','1','3','087580053302',null,'PRESENTA BAJO PESO PERDIDA DEL APETITO ANTECD RIESGO DE DESNUTRICION  PESO 5.5 Kg TALLA 64 IMC 13.4 PACIENTE CON DESNUTRICION PROTEICO CALORICA MODERADA','1','0000165',to_date('04/05/19','DD/MM/RR'),'2019-05-04','RC','1130283909','087580053302');
Insert into OASIS4.WEBSERV_JUNTA_PROFESIONAL (ID_JUPR,REPO_PERIODO,REPO_SERV_ID,REPO_TIRE_ID,NOPRESCRIPCION,FPRESCRIPCION,TIPOTECNOLOGIA,CONSECUTIVO,ESTJM,CODENTPROC,OBSERVACIONES,JUSTIFICACIONTECNICA,MODALIDAD,NOACTA,FECHAACTA,FPROCESO,TIPOIDPACIENTE,NROIDPACIENTE,CODENTJM) values ('118',to_date('30/03/19','DD/MM/RR'),'9','2','20190330170011153934',to_date('30/03/19','DD/MM/RR'),'N','1','3','087580053302',null,'DX DESN PROTEICOCAL MODERADA PESO 13 KG TALLA 103 PESO TALLA -2 Y -3 DE TALLA/EDAD -1 Y -2','1','0000194',to_date('15/06/19','DD/MM/RR'),'2019-06-15','RC','1042354825','087580053302');
Insert into OASIS4.WEBSERV_JUNTA_PROFESIONAL (ID_JUPR,REPO_PERIODO,REPO_SERV_ID,REPO_TIRE_ID,NOPRESCRIPCION,FPRESCRIPCION,TIPOTECNOLOGIA,CONSECUTIVO,ESTJM,CODENTPROC,OBSERVACIONES,JUSTIFICACIONTECNICA,MODALIDAD,NOACTA,FECHAACTA,FPROCESO,TIPOIDPACIENTE,NROIDPACIENTE,CODENTJM) values ('119',to_date('30/03/19','DD/MM/RR'),'9','2','20190330176011154421',to_date('30/03/19','DD/MM/RR'),'N','1','2',null,null,null,null,null,to_date('01/01/70','DD/MM/RR'),null,'CC','874427','086380074501');
Insert into OASIS4.WEBSERV_JUNTA_PROFESIONAL (ID_JUPR,REPO_PERIODO,REPO_SERV_ID,REPO_TIRE_ID,NOPRESCRIPCION,FPRESCRIPCION,TIPOTECNOLOGIA,CONSECUTIVO,ESTJM,CODENTPROC,OBSERVACIONES,JUSTIFICACIONTECNICA,MODALIDAD,NOACTA,FECHAACTA,FPROCESO,TIPOIDPACIENTE,NROIDPACIENTE,CODENTJM) values ('120',to_date('01/04/19','DD/MM/RR'),'9','2','20190401171011164884',to_date('01/04/19','DD/MM/RR'),'M','1','2',null,null,null,null,null,to_date('01/01/70','DD/MM/RR'),null,'CC','5558039','080010133501');
Insert into OASIS4.WEBSERV_JUNTA_PROFESIONAL (ID_JUPR,REPO_PERIODO,REPO_SERV_ID,REPO_TIRE_ID,NOPRESCRIPCION,FPRESCRIPCION,TIPOTECNOLOGIA,CONSECUTIVO,ESTJM,CODENTPROC,OBSERVACIONES,JUSTIFICACIONTECNICA,MODALIDAD,NOACTA,FECHAACTA,FPROCESO,TIPOIDPACIENTE,NROIDPACIENTE,CODENTJM) values ('121',to_date('01/04/19','DD/MM/RR'),'9','2','20190401115011169276',to_date('01/04/19','DD/MM/RR'),'M','1','1','080010112401',null,'diagnostico de  sÃ­ndrome nefrÃ³tico en adultos no se encuentra dentro del listado unirs pÃ³r lo cual no requiere junta, ','1',null,to_date('01/01/70','DD/MM/RR'),'2019-05-13','CC','1043020881','080010112401');
Insert into OASIS4.WEBSERV_JUNTA_PROFESIONAL (ID_JUPR,REPO_PERIODO,REPO_SERV_ID,REPO_TIRE_ID,NOPRESCRIPCION,FPRESCRIPCION,TIPOTECNOLOGIA,CONSECUTIVO,ESTJM,CODENTPROC,OBSERVACIONES,JUSTIFICACIONTECNICA,MODALIDAD,NOACTA,FECHAACTA,FPROCESO,TIPOIDPACIENTE,NROIDPACIENTE,CODENTJM) values ('122',to_date('01/04/19','DD/MM/RR'),'9','2','20190401125011169618',to_date('01/04/19','DD/MM/RR'),'N','1','2',null,null,null,null,null,to_date('01/01/70','DD/MM/RR'),null,'RC','1042454320','087580016101');
Insert into OASIS4.WEBSERV_JUNTA_PROFESIONAL (ID_JUPR,REPO_PERIODO,REPO_SERV_ID,REPO_TIRE_ID,NOPRESCRIPCION,FPRESCRIPCION,TIPOTECNOLOGIA,CONSECUTIVO,ESTJM,CODENTPROC,OBSERVACIONES,JUSTIFICACIONTECNICA,MODALIDAD,NOACTA,FECHAACTA,FPROCESO,TIPOIDPACIENTE,NROIDPACIENTE,CODENTJM) values ('123',to_date('01/04/19','DD/MM/RR'),'9','2','20190401177011170177',to_date('01/04/19','DD/MM/RR'),'N','1','3','087580001301',null,'PACIENTE DE 53 AÃ‘OS DE EDAD CON DIAGNOSTICO DE DESNUTRICIÃ“N PROTEICO CALORICA SEVERA CON COMPROMISOS DE LAS RESERVAS MUSCULARES, SE LE INDICA C.NUT. GLUCERNA.','1','031-2019',to_date('01/04/19','DD/MM/RR'),'2019-04-02','CC','32822226','087580001301');
Insert into OASIS4.WEBSERV_JUNTA_PROFESIONAL (ID_JUPR,REPO_PERIODO,REPO_SERV_ID,REPO_TIRE_ID,NOPRESCRIPCION,FPRESCRIPCION,TIPOTECNOLOGIA,CONSECUTIVO,ESTJM,CODENTPROC,OBSERVACIONES,JUSTIFICACIONTECNICA,MODALIDAD,NOACTA,FECHAACTA,FPROCESO,TIPOIDPACIENTE,NROIDPACIENTE,CODENTJM) values ('165',to_date('10/04/19','DD/MM/RR'),'9','2','20190410149011349926',to_date('10/04/19','DD/MM/RR'),'N','1','2',null,null,null,null,null,to_date('01/01/70','DD/MM/RR'),null,'RC','1048330617','087580053302');
Insert into OASIS4.WEBSERV_JUNTA_PROFESIONAL (ID_JUPR,REPO_PERIODO,REPO_SERV_ID,REPO_TIRE_ID,NOPRESCRIPCION,FPRESCRIPCION,TIPOTECNOLOGIA,CONSECUTIVO,ESTJM,CODENTPROC,OBSERVACIONES,JUSTIFICACIONTECNICA,MODALIDAD,NOACTA,FECHAACTA,FPROCESO,TIPOIDPACIENTE,NROIDPACIENTE,CODENTJM) values ('166',to_date('10/04/19','DD/MM/RR'),'9','2','20190410149011351962',to_date('10/04/19','DD/MM/RR'),'N','1','3','087580016101',null,'SE SOLICITA ALIMENTO LIQUIDO COMPLETO Y BALANCEADO PARA RECUPERAR ESTADO NUTRICIONAL DEL PACIENTE.','1','00009',to_date('25/06/19','DD/MM/RR'),'2019-06-25','CC','22353544','087580016101');
Insert into OASIS4.WEBSERV_JUNTA_PROFESIONAL (ID_JUPR,REPO_PERIODO,REPO_SERV_ID,REPO_TIRE_ID,NOPRESCRIPCION,FPRESCRIPCION,TIPOTECNOLOGIA,CONSECUTIVO,ESTJM,CODENTPROC,OBSERVACIONES,JUSTIFICACIONTECNICA,MODALIDAD,NOACTA,FECHAACTA,FPROCESO,TIPOIDPACIENTE,NROIDPACIENTE,CODENTJM) values ('167',to_date('10/04/19','DD/MM/RR'),'9','2','20190410118011354574',to_date('10/04/19','DD/MM/RR'),'N','1','2',null,null,null,null,null,to_date('01/01/70','DD/MM/RR'),null,'TI','1044216776','080010409201');
Insert into OASIS4.WEBSERV_JUNTA_PROFESIONAL (ID_JUPR,REPO_PERIODO,REPO_SERV_ID,REPO_TIRE_ID,NOPRESCRIPCION,FPRESCRIPCION,TIPOTECNOLOGIA,CONSECUTIVO,ESTJM,CODENTPROC,OBSERVACIONES,JUSTIFICACIONTECNICA,MODALIDAD,NOACTA,FECHAACTA,FPROCESO,TIPOIDPACIENTE,NROIDPACIENTE,CODENTJM) values ('168',to_date('10/04/19','DD/MM/RR'),'9','2','20190410110011355586',to_date('10/04/19','DD/MM/RR'),'N','1','2',null,null,null,null,null,to_date('01/01/70','DD/MM/RR'),null,'TI','1046708007','087580016101');
Insert into OASIS4.WEBSERV_JUNTA_PROFESIONAL (ID_JUPR,REPO_PERIODO,REPO_SERV_ID,REPO_TIRE_ID,NOPRESCRIPCION,FPRESCRIPCION,TIPOTECNOLOGIA,CONSECUTIVO,ESTJM,CODENTPROC,OBSERVACIONES,JUSTIFICACIONTECNICA,MODALIDAD,NOACTA,FECHAACTA,FPROCESO,TIPOIDPACIENTE,NROIDPACIENTE,CODENTJM) values ('169',to_date('10/04/19','DD/MM/RR'),'9','2','20190410140011358914',to_date('10/04/19','DD/MM/RR'),'N','1','2',null,null,null,null,null,to_date('01/01/70','DD/MM/RR'),null,'CC','26781696','087580016101');
Insert into OASIS4.WEBSERV_JUNTA_PROFESIONAL (ID_JUPR,REPO_PERIODO,REPO_SERV_ID,REPO_TIRE_ID,NOPRESCRIPCION,FPRESCRIPCION,TIPOTECNOLOGIA,CONSECUTIVO,ESTJM,CODENTPROC,OBSERVACIONES,JUSTIFICACIONTECNICA,MODALIDAD,NOACTA,FECHAACTA,FPROCESO,TIPOIDPACIENTE,NROIDPACIENTE,CODENTJM) values ('170',to_date('10/04/19','DD/MM/RR'),'9','2','20190410155011359708',to_date('10/04/19','DD/MM/RR'),'N','1','2',null,null,null,null,null,to_date('01/01/70','DD/MM/RR'),null,'CC','26781696','087580016101');
Insert into OASIS4.WEBSERV_JUNTA_PROFESIONAL (ID_JUPR,REPO_PERIODO,REPO_SERV_ID,REPO_TIRE_ID,NOPRESCRIPCION,FPRESCRIPCION,TIPOTECNOLOGIA,CONSECUTIVO,ESTJM,CODENTPROC,OBSERVACIONES,JUSTIFICACIONTECNICA,MODALIDAD,NOACTA,FECHAACTA,FPROCESO,TIPOIDPACIENTE,NROIDPACIENTE,CODENTJM) values ('171',to_date('10/04/19','DD/MM/RR'),'9','2','20190410193011361678',to_date('10/04/19','DD/MM/RR'),'N','1','2',null,null,null,null,null,to_date('01/01/70','DD/MM/RR'),null,'CC','3704688','086380015401');
Insert into OASIS4.WEBSERV_JUNTA_PROFESIONAL (ID_JUPR,REPO_PERIODO,REPO_SERV_ID,REPO_TIRE_ID,NOPRESCRIPCION,FPRESCRIPCION,TIPOTECNOLOGIA,CONSECUTIVO,ESTJM,CODENTPROC,OBSERVACIONES,JUSTIFICACIONTECNICA,MODALIDAD,NOACTA,FECHAACTA,FPROCESO,TIPOIDPACIENTE,NROIDPACIENTE,CODENTJM) values ('172',to_date('10/04/19','DD/MM/RR'),'9','2','20190410135011339598',to_date('10/04/19','DD/MM/RR'),'S','1','3','200010029001',null,'PACIENTE CON DIAGNOSTICO DE MIELOMENINGOCELE, PARAPARESIA ESPASTICA E INCONTINENCIA URINARIA.','2','006',to_date('10/04/19','DD/MM/RR'),'2019-04-10','CC','1003238300','200010029001');
Insert into OASIS4.WEBSERV_JUNTA_PROFESIONAL (ID_JUPR,REPO_PERIODO,REPO_SERV_ID,REPO_TIRE_ID,NOPRESCRIPCION,FPRESCRIPCION,TIPOTECNOLOGIA,CONSECUTIVO,ESTJM,CODENTPROC,OBSERVACIONES,JUSTIFICACIONTECNICA,MODALIDAD,NOACTA,FECHAACTA,FPROCESO,TIPOIDPACIENTE,NROIDPACIENTE,CODENTJM) values ('173',to_date('10/04/19','DD/MM/RR'),'9','2','20190410137011351355',to_date('10/04/19','DD/MM/RR'),'S','1','2',null,null,null,null,null,to_date('01/01/70','DD/MM/RR'),null,'CC','22390467','080010003601');
Insert into OASIS4.WEBSERV_JUNTA_PROFESIONAL (ID_JUPR,REPO_PERIODO,REPO_SERV_ID,REPO_TIRE_ID,NOPRESCRIPCION,FPRESCRIPCION,TIPOTECNOLOGIA,CONSECUTIVO,ESTJM,CODENTPROC,OBSERVACIONES,JUSTIFICACIONTECNICA,MODALIDAD,NOACTA,FECHAACTA,FPROCESO,TIPOIDPACIENTE,NROIDPACIENTE,CODENTJM) values ('174',to_date('11/04/19','DD/MM/RR'),'9','2','20190411169011363478',to_date('11/04/19','DD/MM/RR'),'N','1','3','080010445411',null,'PACIENTE MASCULINIO DE 71 AÃ‘OS CON DX MEDICO DE poliartrosis, adinamia, astenia, fatiga, dificultad para la masticaciÃ³n Y  DESNUTRICIÃ“N proteico calorica severa','1','117',to_date('12/06/19','DD/MM/RR'),'2019-06-12','CC','7443734','080010445411');
Insert into OASIS4.WEBSERV_JUNTA_PROFESIONAL (ID_JUPR,REPO_PERIODO,REPO_SERV_ID,REPO_TIRE_ID,NOPRESCRIPCION,FPRESCRIPCION,TIPOTECNOLOGIA,CONSECUTIVO,ESTJM,CODENTPROC,OBSERVACIONES,JUSTIFICACIONTECNICA,MODALIDAD,NOACTA,FECHAACTA,FPROCESO,TIPOIDPACIENTE,NROIDPACIENTE,CODENTJM) values ('175',to_date('11/04/19','DD/MM/RR'),'9','2','20190411123011367713',to_date('11/04/19','DD/MM/RR'),'N','1','2',null,null,null,null,null,to_date('01/01/70','DD/MM/RR'),null,'CC','22857213','134300049201');
Insert into OASIS4.WEBSERV_JUNTA_PROFESIONAL (ID_JUPR,REPO_PERIODO,REPO_SERV_ID,REPO_TIRE_ID,NOPRESCRIPCION,FPRESCRIPCION,TIPOTECNOLOGIA,CONSECUTIVO,ESTJM,CODENTPROC,OBSERVACIONES,JUSTIFICACIONTECNICA,MODALIDAD,NOACTA,FECHAACTA,FPROCESO,TIPOIDPACIENTE,NROIDPACIENTE,CODENTJM) values ('176',to_date('11/04/19','DD/MM/RR'),'9','2','20190411150011370001',to_date('11/04/19','DD/MM/RR'),'N','1','3','086340010501',null,'PACIENTE DE 4AÃ‘OS 4 MESES DE EDAD CON PESO DE 13 KG TALLA 100 CM DIAGONOSTICO NUTRICIONAL RIESGO DE DESNUTRICION TRAE UN PROCESO DE SEGUIMIENTO NUTRICIONAL. ','1','14',to_date('12/04/19','DD/MM/RR'),'2019-04-12','RC','1042355377','086340010501');
Insert into OASIS4.WEBSERV_JUNTA_PROFESIONAL (ID_JUPR,REPO_PERIODO,REPO_SERV_ID,REPO_TIRE_ID,NOPRESCRIPCION,FPRESCRIPCION,TIPOTECNOLOGIA,CONSECUTIVO,ESTJM,CODENTPROC,OBSERVACIONES,JUSTIFICACIONTECNICA,MODALIDAD,NOACTA,FECHAACTA,FPROCESO,TIPOIDPACIENTE,NROIDPACIENTE,CODENTJM) values ('177',to_date('11/04/19','DD/MM/RR'),'9','2','20190411173011371940',to_date('11/04/19','DD/MM/RR'),'N','1','2',null,null,null,null,null,to_date('01/01/70','DD/MM/RR'),null,'TI','1052984759','134300034901');
Insert into OASIS4.WEBSERV_JUNTA_PROFESIONAL (ID_JUPR,REPO_PERIODO,REPO_SERV_ID,REPO_TIRE_ID,NOPRESCRIPCION,FPRESCRIPCION,TIPOTECNOLOGIA,CONSECUTIVO,ESTJM,CODENTPROC,OBSERVACIONES,JUSTIFICACIONTECNICA,MODALIDAD,NOACTA,FECHAACTA,FPROCESO,TIPOIDPACIENTE,NROIDPACIENTE,CODENTJM) values ('178',to_date('11/04/19','DD/MM/RR'),'9','2','20190411165011373603',to_date('11/04/19','DD/MM/RR'),'N','1','2',null,null,null,null,null,to_date('01/01/70','DD/MM/RR'),null,'CC','33082663','134300034901');
Insert into OASIS4.WEBSERV_JUNTA_PROFESIONAL (ID_JUPR,REPO_PERIODO,REPO_SERV_ID,REPO_TIRE_ID,NOPRESCRIPCION,FPRESCRIPCION,TIPOTECNOLOGIA,CONSECUTIVO,ESTJM,CODENTPROC,OBSERVACIONES,JUSTIFICACIONTECNICA,MODALIDAD,NOACTA,FECHAACTA,FPROCESO,TIPOIDPACIENTE,NROIDPACIENTE,CODENTJM) values ('179',to_date('11/04/19','DD/MM/RR'),'9','2','20190411155011379049',to_date('11/04/19','DD/MM/RR'),'N','1','2',null,null,null,null,null,to_date('01/01/70','DD/MM/RR'),null,'CC','26835785','087580016101');
Insert into OASIS4.WEBSERV_JUNTA_PROFESIONAL (ID_JUPR,REPO_PERIODO,REPO_SERV_ID,REPO_TIRE_ID,NOPRESCRIPCION,FPRESCRIPCION,TIPOTECNOLOGIA,CONSECUTIVO,ESTJM,CODENTPROC,OBSERVACIONES,JUSTIFICACIONTECNICA,MODALIDAD,NOACTA,FECHAACTA,FPROCESO,TIPOIDPACIENTE,NROIDPACIENTE,CODENTJM) values ('180',to_date('11/04/19','DD/MM/RR'),'9','2','20190411189011381166',to_date('11/04/19','DD/MM/RR'),'N','1','2',null,null,null,null,null,to_date('01/01/70','DD/MM/RR'),null,'CC','26781696','087580016101');
Insert into OASIS4.WEBSERV_JUNTA_PROFESIONAL (ID_JUPR,REPO_PERIODO,REPO_SERV_ID,REPO_TIRE_ID,NOPRESCRIPCION,FPRESCRIPCION,TIPOTECNOLOGIA,CONSECUTIVO,ESTJM,CODENTPROC,OBSERVACIONES,JUSTIFICACIONTECNICA,MODALIDAD,NOACTA,FECHAACTA,FPROCESO,TIPOIDPACIENTE,NROIDPACIENTE,CODENTJM) values ('181',to_date('11/04/19','DD/MM/RR'),'9','2','20190411129011384886',to_date('11/04/19','DD/MM/RR'),'N','1','2',null,null,null,null,null,to_date('01/01/70','DD/MM/RR'),null,'CC','22314908','086380074501');
Insert into OASIS4.WEBSERV_JUNTA_PROFESIONAL (ID_JUPR,REPO_PERIODO,REPO_SERV_ID,REPO_TIRE_ID,NOPRESCRIPCION,FPRESCRIPCION,TIPOTECNOLOGIA,CONSECUTIVO,ESTJM,CODENTPROC,OBSERVACIONES,JUSTIFICACIONTECNICA,MODALIDAD,NOACTA,FECHAACTA,FPROCESO,TIPOIDPACIENTE,NROIDPACIENTE,CODENTJM) values ('182',to_date('11/04/19','DD/MM/RR'),'9','2','20190411188011386948',to_date('11/04/19','DD/MM/RR'),'N','1','2',null,null,null,null,null,to_date('01/01/70','DD/MM/RR'),null,'RC','1066881556','200010205401');
Insert into OASIS4.WEBSERV_JUNTA_PROFESIONAL (ID_JUPR,REPO_PERIODO,REPO_SERV_ID,REPO_TIRE_ID,NOPRESCRIPCION,FPRESCRIPCION,TIPOTECNOLOGIA,CONSECUTIVO,ESTJM,CODENTPROC,OBSERVACIONES,JUSTIFICACIONTECNICA,MODALIDAD,NOACTA,FECHAACTA,FPROCESO,TIPOIDPACIENTE,NROIDPACIENTE,CODENTJM) values ('183',to_date('12/04/19','DD/MM/RR'),'9','2','20190412112011394039',to_date('12/04/19','DD/MM/RR'),'N','1','2',null,null,null,null,null,to_date('01/01/70','DD/MM/RR'),null,'TI','1130294190','080010112201');
Insert into OASIS4.WEBSERV_JUNTA_PROFESIONAL (ID_JUPR,REPO_PERIODO,REPO_SERV_ID,REPO_TIRE_ID,NOPRESCRIPCION,FPRESCRIPCION,TIPOTECNOLOGIA,CONSECUTIVO,ESTJM,CODENTPROC,OBSERVACIONES,JUSTIFICACIONTECNICA,MODALIDAD,NOACTA,FECHAACTA,FPROCESO,TIPOIDPACIENTE,NROIDPACIENTE,CODENTJM) values ('184',to_date('12/04/19','DD/MM/RR'),'9','2','20190412174011396150',to_date('12/04/19','DD/MM/RR'),'N','1','3','761470851601',null,'QUIEN REQUIERE COMPLEMENTAR SU NUTRICION CON ALIMENTO LIQUIDO, COMPLETO Y BALANCEADO, CON HMB (ÃŸ-HIDROXIÃŸ- METILBUTIRATO), PROTEÃ?NA Y VITAMINA D, VÃ?A ORAL ','1','MP0069',to_date('16/04/19','DD/MM/RR'),'2019-04-16','CC','29768653','761470851601');
Insert into OASIS4.WEBSERV_JUNTA_PROFESIONAL (ID_JUPR,REPO_PERIODO,REPO_SERV_ID,REPO_TIRE_ID,NOPRESCRIPCION,FPRESCRIPCION,TIPOTECNOLOGIA,CONSECUTIVO,ESTJM,CODENTPROC,OBSERVACIONES,JUSTIFICACIONTECNICA,MODALIDAD,NOACTA,FECHAACTA,FPROCESO,TIPOIDPACIENTE,NROIDPACIENTE,CODENTJM) values ('185',to_date('12/04/19','DD/MM/RR'),'9','2','20190412151011403238',to_date('12/04/19','DD/MM/RR'),'N','1','3','761470851601',null,'PACIENTE CON DESNUTRICIÃ“N QUE REQUIERE SOPORTE NUTRICIONAL ADICIONAL AL IMPLEMENTADO EN LA DIETA PARA COMPLETAR KILOCALORIAS NECESARIAS ','1','MP0068',to_date('16/04/19','DD/MM/RR'),'2019-04-16','RC','1115423586','761470851601');
Insert into OASIS4.WEBSERV_JUNTA_PROFESIONAL (ID_JUPR,REPO_PERIODO,REPO_SERV_ID,REPO_TIRE_ID,NOPRESCRIPCION,FPRESCRIPCION,TIPOTECNOLOGIA,CONSECUTIVO,ESTJM,CODENTPROC,OBSERVACIONES,JUSTIFICACIONTECNICA,MODALIDAD,NOACTA,FECHAACTA,FPROCESO,TIPOIDPACIENTE,NROIDPACIENTE,CODENTJM) values ('186',to_date('12/04/19','DD/MM/RR'),'9','2','20190412150011403556',to_date('12/04/19','DD/MM/RR'),'N','1','2',null,null,null,null,null,to_date('01/01/70','DD/MM/RR'),null,'RC','1051451031','130010210201');
Insert into OASIS4.WEBSERV_JUNTA_PROFESIONAL (ID_JUPR,REPO_PERIODO,REPO_SERV_ID,REPO_TIRE_ID,NOPRESCRIPCION,FPRESCRIPCION,TIPOTECNOLOGIA,CONSECUTIVO,ESTJM,CODENTPROC,OBSERVACIONES,JUSTIFICACIONTECNICA,MODALIDAD,NOACTA,FECHAACTA,FPROCESO,TIPOIDPACIENTE,NROIDPACIENTE,CODENTJM) values ('187',to_date('12/04/19','DD/MM/RR'),'9','2','20190412147011405054',to_date('12/04/19','DD/MM/RR'),'N','1','2',null,null,null,null,null,to_date('01/01/70','DD/MM/RR'),null,'RC','1130283909','087580016101');
Insert into OASIS4.WEBSERV_JUNTA_PROFESIONAL (ID_JUPR,REPO_PERIODO,REPO_SERV_ID,REPO_TIRE_ID,NOPRESCRIPCION,FPRESCRIPCION,TIPOTECNOLOGIA,CONSECUTIVO,ESTJM,CODENTPROC,OBSERVACIONES,JUSTIFICACIONTECNICA,MODALIDAD,NOACTA,FECHAACTA,FPROCESO,TIPOIDPACIENTE,NROIDPACIENTE,CODENTJM) values ('188',to_date('12/04/19','DD/MM/RR'),'9','2','20190412139011405441',to_date('12/04/19','DD/MM/RR'),'N','1','2',null,null,null,null,null,to_date('01/01/70','DD/MM/RR'),null,'RC','1130283909','087580016101');
Insert into OASIS4.WEBSERV_JUNTA_PROFESIONAL (ID_JUPR,REPO_PERIODO,REPO_SERV_ID,REPO_TIRE_ID,NOPRESCRIPCION,FPRESCRIPCION,TIPOTECNOLOGIA,CONSECUTIVO,ESTJM,CODENTPROC,OBSERVACIONES,JUSTIFICACIONTECNICA,MODALIDAD,NOACTA,FECHAACTA,FPROCESO,TIPOIDPACIENTE,NROIDPACIENTE,CODENTJM) values ('189',to_date('13/04/19','DD/MM/RR'),'9','2','20190413180011417923',to_date('13/04/19','DD/MM/RR'),'N','1','3','082960002101',null,'OTROS TIPOS DE PARALISIS CEREBRAL','1','0008',to_date('30/04/19','DD/MM/RR'),'2019-04-30','TI','1007595269','082960002101');
Insert into OASIS4.WEBSERV_JUNTA_PROFESIONAL (ID_JUPR,REPO_PERIODO,REPO_SERV_ID,REPO_TIRE_ID,NOPRESCRIPCION,FPRESCRIPCION,TIPOTECNOLOGIA,CONSECUTIVO,ESTJM,CODENTPROC,OBSERVACIONES,JUSTIFICACIONTECNICA,MODALIDAD,NOACTA,FECHAACTA,FPROCESO,TIPOIDPACIENTE,NROIDPACIENTE,CODENTJM) values ('190',to_date('13/04/19','DD/MM/RR'),'9','2','20190413184011414557',to_date('13/04/19','DD/MM/RR'),'S','1','2',null,null,null,null,null,to_date('01/01/70','DD/MM/RR'),null,'RC','1103516117','700010096901');
Insert into OASIS4.WEBSERV_JUNTA_PROFESIONAL (ID_JUPR,REPO_PERIODO,REPO_SERV_ID,REPO_TIRE_ID,NOPRESCRIPCION,FPRESCRIPCION,TIPOTECNOLOGIA,CONSECUTIVO,ESTJM,CODENTPROC,OBSERVACIONES,JUSTIFICACIONTECNICA,MODALIDAD,NOACTA,FECHAACTA,FPROCESO,TIPOIDPACIENTE,NROIDPACIENTE,CODENTJM) values ('191',to_date('13/04/19','DD/MM/RR'),'9','2','20190413156011419010',to_date('13/04/19','DD/MM/RR'),'S','1','2',null,null,null,null,null,to_date('01/01/70','DD/MM/RR'),null,'RC','1103513753','700010096901');
Insert into OASIS4.WEBSERV_JUNTA_PROFESIONAL (ID_JUPR,REPO_PERIODO,REPO_SERV_ID,REPO_TIRE_ID,NOPRESCRIPCION,FPRESCRIPCION,TIPOTECNOLOGIA,CONSECUTIVO,ESTJM,CODENTPROC,OBSERVACIONES,JUSTIFICACIONTECNICA,MODALIDAD,NOACTA,FECHAACTA,FPROCESO,TIPOIDPACIENTE,NROIDPACIENTE,CODENTJM) values ('192',to_date('15/04/19','DD/MM/RR'),'9','2','20190415139011429367',to_date('15/04/19','DD/MM/RR'),'N','1','2',null,null,null,null,null,to_date('01/01/70','DD/MM/RR'),null,'TI','1065138927','080010409201');
Insert into OASIS4.WEBSERV_JUNTA_PROFESIONAL (ID_JUPR,REPO_PERIODO,REPO_SERV_ID,REPO_TIRE_ID,NOPRESCRIPCION,FPRESCRIPCION,TIPOTECNOLOGIA,CONSECUTIVO,ESTJM,CODENTPROC,OBSERVACIONES,JUSTIFICACIONTECNICA,MODALIDAD,NOACTA,FECHAACTA,FPROCESO,TIPOIDPACIENTE,NROIDPACIENTE,CODENTJM) values ('193',to_date('15/04/19','DD/MM/RR'),'9','2','20190415191011430761',to_date('15/04/19','DD/MM/RR'),'N','1','3','080010112201',null,'LUEGO DE ESTA PRESCRIPCIÃ“N DEBE TENER SOPORTE NUTRICIONAL ENTERAL PARA EVITAR LA CAQUEXIA Y FORTALECER LA MASTICACIÃ“N Y DISMINUIR LA PRODUCCIÃ“N DEL CO2.','1','004',to_date('03/05/19','DD/MM/RR'),'2019-05-03','CC','19108338','080010112201');
Insert into OASIS4.WEBSERV_JUNTA_PROFESIONAL (ID_JUPR,REPO_PERIODO,REPO_SERV_ID,REPO_TIRE_ID,NOPRESCRIPCION,FPRESCRIPCION,TIPOTECNOLOGIA,CONSECUTIVO,ESTJM,CODENTPROC,OBSERVACIONES,JUSTIFICACIONTECNICA,MODALIDAD,NOACTA,FECHAACTA,FPROCESO,TIPOIDPACIENTE,NROIDPACIENTE,CODENTJM) values ('194',to_date('15/04/19','DD/MM/RR'),'9','2','20190415179011432477',to_date('15/04/19','DD/MM/RR'),'N','1','2',null,null,null,null,null,to_date('01/01/70','DD/MM/RR'),null,'RC','1158465814','080010409201');
Insert into OASIS4.WEBSERV_JUNTA_PROFESIONAL (ID_JUPR,REPO_PERIODO,REPO_SERV_ID,REPO_TIRE_ID,NOPRESCRIPCION,FPRESCRIPCION,TIPOTECNOLOGIA,CONSECUTIVO,ESTJM,CODENTPROC,OBSERVACIONES,JUSTIFICACIONTECNICA,MODALIDAD,NOACTA,FECHAACTA,FPROCESO,TIPOIDPACIENTE,NROIDPACIENTE,CODENTJM) values ('195',to_date('15/04/19','DD/MM/RR'),'9','2','20190415114011433639',to_date('15/04/19','DD/MM/RR'),'N','1','2',null,null,null,null,null,to_date('01/01/70','DD/MM/RR'),null,'RC','1045721765','080010409201');
Insert into OASIS4.WEBSERV_JUNTA_PROFESIONAL (ID_JUPR,REPO_PERIODO,REPO_SERV_ID,REPO_TIRE_ID,NOPRESCRIPCION,FPRESCRIPCION,TIPOTECNOLOGIA,CONSECUTIVO,ESTJM,CODENTPROC,OBSERVACIONES,JUSTIFICACIONTECNICA,MODALIDAD,NOACTA,FECHAACTA,FPROCESO,TIPOIDPACIENTE,NROIDPACIENTE,CODENTJM) values ('196',to_date('15/04/19','DD/MM/RR'),'9','2','20190415189011434312',to_date('15/04/19','DD/MM/RR'),'N','1','3','761470851601',null,'PACIENTE QUIEN REQUIERE COMPLEMENTAR SU NUTRICIÃ“N, CON ALIMENTO EN POLVO CON CARBOHIDRATOS DE DIGESTIÃ“N LENTA QUE FAVORECE EL CONTROL DE LA GLUCEMIA.','1','MP0067',to_date('16/04/19','DD/MM/RR'),'2019-04-16','CC','29202185','761470851601');
Insert into OASIS4.WEBSERV_JUNTA_PROFESIONAL (ID_JUPR,REPO_PERIODO,REPO_SERV_ID,REPO_TIRE_ID,NOPRESCRIPCION,FPRESCRIPCION,TIPOTECNOLOGIA,CONSECUTIVO,ESTJM,CODENTPROC,OBSERVACIONES,JUSTIFICACIONTECNICA,MODALIDAD,NOACTA,FECHAACTA,FPROCESO,TIPOIDPACIENTE,NROIDPACIENTE,CODENTJM) values ('197',to_date('15/04/19','DD/MM/RR'),'9','2','20190415160011435919',to_date('15/04/19','DD/MM/RR'),'N','1','2',null,null,null,null,null,to_date('01/01/70','DD/MM/RR'),null,'RC','1052739371','130010210201');
Insert into OASIS4.WEBSERV_JUNTA_PROFESIONAL (ID_JUPR,REPO_PERIODO,REPO_SERV_ID,REPO_TIRE_ID,NOPRESCRIPCION,FPRESCRIPCION,TIPOTECNOLOGIA,CONSECUTIVO,ESTJM,CODENTPROC,OBSERVACIONES,JUSTIFICACIONTECNICA,MODALIDAD,NOACTA,FECHAACTA,FPROCESO,TIPOIDPACIENTE,NROIDPACIENTE,CODENTJM) values ('198',to_date('15/04/19','DD/MM/RR'),'9','2','20190415195011438901',to_date('15/04/19','DD/MM/RR'),'N','1','2',null,null,null,null,null,to_date('01/01/70','DD/MM/RR'),null,'CC','1047433072','130010178101');
Insert into OASIS4.WEBSERV_JUNTA_PROFESIONAL (ID_JUPR,REPO_PERIODO,REPO_SERV_ID,REPO_TIRE_ID,NOPRESCRIPCION,FPRESCRIPCION,TIPOTECNOLOGIA,CONSECUTIVO,ESTJM,CODENTPROC,OBSERVACIONES,JUSTIFICACIONTECNICA,MODALIDAD,NOACTA,FECHAACTA,FPROCESO,TIPOIDPACIENTE,NROIDPACIENTE,CODENTJM) values ('199',to_date('15/04/19','DD/MM/RR'),'9','2','20190415191011441091',to_date('15/04/19','DD/MM/RR'),'N','1','2',null,null,null,null,null,to_date('01/01/70','DD/MM/RR'),null,'CC','22688991','087580016101');
Insert into OASIS4.WEBSERV_JUNTA_PROFESIONAL (ID_JUPR,REPO_PERIODO,REPO_SERV_ID,REPO_TIRE_ID,NOPRESCRIPCION,FPRESCRIPCION,TIPOTECNOLOGIA,CONSECUTIVO,ESTJM,CODENTPROC,OBSERVACIONES,JUSTIFICACIONTECNICA,MODALIDAD,NOACTA,FECHAACTA,FPROCESO,TIPOIDPACIENTE,NROIDPACIENTE,CODENTJM) values ('200',to_date('15/04/19','DD/MM/RR'),'9','2','20190415122011443881',to_date('15/04/19','DD/MM/RR'),'N','1','2',null,null,null,null,null,to_date('01/01/70','DD/MM/RR'),null,'CC','29366136','761470067210');
Insert into OASIS4.WEBSERV_JUNTA_PROFESIONAL (ID_JUPR,REPO_PERIODO,REPO_SERV_ID,REPO_TIRE_ID,NOPRESCRIPCION,FPRESCRIPCION,TIPOTECNOLOGIA,CONSECUTIVO,ESTJM,CODENTPROC,OBSERVACIONES,JUSTIFICACIONTECNICA,MODALIDAD,NOACTA,FECHAACTA,FPROCESO,TIPOIDPACIENTE,NROIDPACIENTE,CODENTJM) values ('201',to_date('15/04/19','DD/MM/RR'),'9','2','20190415120011445124',to_date('15/04/19','DD/MM/RR'),'N','1','4','080010226001',null,'extemporÃ¡neo. no se aprueba junta medica ','1','20190410713',to_date('04/10/19','DD/MM/RR'),'2019-10-04','TI','1043165226','080010226001');
Insert into OASIS4.WEBSERV_JUNTA_PROFESIONAL (ID_JUPR,REPO_PERIODO,REPO_SERV_ID,REPO_TIRE_ID,NOPRESCRIPCION,FPRESCRIPCION,TIPOTECNOLOGIA,CONSECUTIVO,ESTJM,CODENTPROC,OBSERVACIONES,JUSTIFICACIONTECNICA,MODALIDAD,NOACTA,FECHAACTA,FPROCESO,TIPOIDPACIENTE,NROIDPACIENTE,CODENTJM) values ('202',to_date('15/04/19','DD/MM/RR'),'9','2','20190415118011430002',to_date('15/04/19','DD/MM/RR'),'S','1','3','130010118701',null,'paciente en contexto de microcefalia, con dnt proteicocalorica, deficit NEUROLÃ“GICO marcado, con incontinencia de esfinteres, con riesgo de infecciones locales.','1','1',to_date('22/04/19','DD/MM/RR'),'2019-04-22','RC','1048460102','130010118701');
Insert into OASIS4.WEBSERV_JUNTA_PROFESIONAL (ID_JUPR,REPO_PERIODO,REPO_SERV_ID,REPO_TIRE_ID,NOPRESCRIPCION,FPRESCRIPCION,TIPOTECNOLOGIA,CONSECUTIVO,ESTJM,CODENTPROC,OBSERVACIONES,JUSTIFICACIONTECNICA,MODALIDAD,NOACTA,FECHAACTA,FPROCESO,TIPOIDPACIENTE,NROIDPACIENTE,CODENTJM) values ('203',to_date('15/04/19','DD/MM/RR'),'9','2','20190415187011439325',to_date('15/04/19','DD/MM/RR'),'S','1','2',null,null,null,null,null,to_date('01/01/70','DD/MM/RR'),null,'CC','1010095778','230010011601');
Insert into OASIS4.WEBSERV_JUNTA_PROFESIONAL (ID_JUPR,REPO_PERIODO,REPO_SERV_ID,REPO_TIRE_ID,NOPRESCRIPCION,FPRESCRIPCION,TIPOTECNOLOGIA,CONSECUTIVO,ESTJM,CODENTPROC,OBSERVACIONES,JUSTIFICACIONTECNICA,MODALIDAD,NOACTA,FECHAACTA,FPROCESO,TIPOIDPACIENTE,NROIDPACIENTE,CODENTJM) values ('204',to_date('16/04/19','DD/MM/RR'),'9','2','20190416119011451750',to_date('16/04/19','DD/MM/RR'),'M','1','2',null,null,null,null,null,to_date('01/01/70','DD/MM/RR'),null,'CC','19897888','130010210201');
Insert into OASIS4.WEBSERV_JUNTA_PROFESIONAL (ID_JUPR,REPO_PERIODO,REPO_SERV_ID,REPO_TIRE_ID,NOPRESCRIPCION,FPRESCRIPCION,TIPOTECNOLOGIA,CONSECUTIVO,ESTJM,CODENTPROC,OBSERVACIONES,JUSTIFICACIONTECNICA,MODALIDAD,NOACTA,FECHAACTA,FPROCESO,TIPOIDPACIENTE,NROIDPACIENTE,CODENTJM) values ('205',to_date('16/04/19','DD/MM/RR'),'9','2','20190416162011461517',to_date('16/04/19','DD/MM/RR'),'M','1','2',null,null,null,null,null,to_date('01/01/70','DD/MM/RR'),null,'TI','1114157745','ESS076');
Insert into OASIS4.WEBSERV_JUNTA_PROFESIONAL (ID_JUPR,REPO_PERIODO,REPO_SERV_ID,REPO_TIRE_ID,NOPRESCRIPCION,FPRESCRIPCION,TIPOTECNOLOGIA,CONSECUTIVO,ESTJM,CODENTPROC,OBSERVACIONES,JUSTIFICACIONTECNICA,MODALIDAD,NOACTA,FECHAACTA,FPROCESO,TIPOIDPACIENTE,NROIDPACIENTE,CODENTJM) values ('206',to_date('16/04/19','DD/MM/RR'),'9','2','20190416178011464943',to_date('16/04/19','DD/MM/RR'),'M','1','3','760010379901',null,'ASOCIACIÃ“N MUTUAL BARRIOS UNIDOS DE QUIBDÃ“ E.S.S. - AMBUQ','2','0128-19',to_date('23/04/19','DD/MM/RR'),'2019-04-23','CC','14630011','760010379901');
Insert into OASIS4.WEBSERV_JUNTA_PROFESIONAL (ID_JUPR,REPO_PERIODO,REPO_SERV_ID,REPO_TIRE_ID,NOPRESCRIPCION,FPRESCRIPCION,TIPOTECNOLOGIA,CONSECUTIVO,ESTJM,CODENTPROC,OBSERVACIONES,JUSTIFICACIONTECNICA,MODALIDAD,NOACTA,FECHAACTA,FPROCESO,TIPOIDPACIENTE,NROIDPACIENTE,CODENTJM) values ('207',to_date('16/04/19','DD/MM/RR'),'9','2','20190416161011458318',to_date('16/04/19','DD/MM/RR'),'N','1','3','761470851601',null,'CUADRO DE DESNUTRICIÃ“N AGUDA SEVERA LO CUAL REQUIERE COMPLEMENTAR SU ALIMENTACIÃ“N CON FTLC','1','MP0065',to_date('16/04/19','DD/MM/RR'),'2019-04-16','RC','1114096116','761470851601');
Insert into OASIS4.WEBSERV_JUNTA_PROFESIONAL (ID_JUPR,REPO_PERIODO,REPO_SERV_ID,REPO_TIRE_ID,NOPRESCRIPCION,FPRESCRIPCION,TIPOTECNOLOGIA,CONSECUTIVO,ESTJM,CODENTPROC,OBSERVACIONES,JUSTIFICACIONTECNICA,MODALIDAD,NOACTA,FECHAACTA,FPROCESO,TIPOIDPACIENTE,NROIDPACIENTE,CODENTJM) values ('208',to_date('16/04/19','DD/MM/RR'),'9','2','20190416149011461203',to_date('16/04/19','DD/MM/RR'),'N','1','2',null,null,null,null,null,to_date('01/01/70','DD/MM/RR'),null,'TI','1114157745','ESS076');
Insert into OASIS4.WEBSERV_JUNTA_PROFESIONAL (ID_JUPR,REPO_PERIODO,REPO_SERV_ID,REPO_TIRE_ID,NOPRESCRIPCION,FPRESCRIPCION,TIPOTECNOLOGIA,CONSECUTIVO,ESTJM,CODENTPROC,OBSERVACIONES,JUSTIFICACIONTECNICA,MODALIDAD,NOACTA,FECHAACTA,FPROCESO,TIPOIDPACIENTE,NROIDPACIENTE,CODENTJM) values ('209',to_date('16/04/19','DD/MM/RR'),'9','2','20190416190011461683',to_date('16/04/19','DD/MM/RR'),'N','1','2',null,null,null,null,null,to_date('01/01/70','DD/MM/RR'),null,'CC','9109816','130010210201');
Insert into OASIS4.WEBSERV_JUNTA_PROFESIONAL (ID_JUPR,REPO_PERIODO,REPO_SERV_ID,REPO_TIRE_ID,NOPRESCRIPCION,FPRESCRIPCION,TIPOTECNOLOGIA,CONSECUTIVO,ESTJM,CODENTPROC,OBSERVACIONES,JUSTIFICACIONTECNICA,MODALIDAD,NOACTA,FECHAACTA,FPROCESO,TIPOIDPACIENTE,NROIDPACIENTE,CODENTJM) values ('210',to_date('16/04/19','DD/MM/RR'),'9','2','20190416148011462623',to_date('16/04/19','DD/MM/RR'),'N','1','2',null,null,null,null,null,to_date('01/01/70','DD/MM/RR'),null,'CC','18470959','ESS076');
Insert into OASIS4.WEBSERV_JUNTA_PROFESIONAL (ID_JUPR,REPO_PERIODO,REPO_SERV_ID,REPO_TIRE_ID,NOPRESCRIPCION,FPRESCRIPCION,TIPOTECNOLOGIA,CONSECUTIVO,ESTJM,CODENTPROC,OBSERVACIONES,JUSTIFICACIONTECNICA,MODALIDAD,NOACTA,FECHAACTA,FPROCESO,TIPOIDPACIENTE,NROIDPACIENTE,CODENTJM) values ('211',to_date('16/04/19','DD/MM/RR'),'9','2','20190416141011463355',to_date('16/04/19','DD/MM/RR'),'N','1','2',null,null,null,null,null,to_date('01/01/70','DD/MM/RR'),null,'CC','1114399226','ESS076');
Insert into OASIS4.WEBSERV_JUNTA_PROFESIONAL (ID_JUPR,REPO_PERIODO,REPO_SERV_ID,REPO_TIRE_ID,NOPRESCRIPCION,FPRESCRIPCION,TIPOTECNOLOGIA,CONSECUTIVO,ESTJM,CODENTPROC,OBSERVACIONES,JUSTIFICACIONTECNICA,MODALIDAD,NOACTA,FECHAACTA,FPROCESO,TIPOIDPACIENTE,NROIDPACIENTE,CODENTJM) values ('212',to_date('16/04/19','DD/MM/RR'),'9','2','20190416131011464686',to_date('16/04/19','DD/MM/RR'),'N','1','3','087580001301',null,'PACIENTE QUE ASISTE A CITA DE CONTROL POR NUTRICIÃ“N POR PRIMERA VEZ REMITIDA POR EL SERVICIO DE PEDiatria RECIBE DIETA SEMIBLADA, LICUADO se le indica pediasure','1','039-2019',to_date('20/04/19','DD/MM/RR'),'2019-04-21','TI','1048277196','087580001301');
Insert into OASIS4.WEBSERV_JUNTA_PROFESIONAL (ID_JUPR,REPO_PERIODO,REPO_SERV_ID,REPO_TIRE_ID,NOPRESCRIPCION,FPRESCRIPCION,TIPOTECNOLOGIA,CONSECUTIVO,ESTJM,CODENTPROC,OBSERVACIONES,JUSTIFICACIONTECNICA,MODALIDAD,NOACTA,FECHAACTA,FPROCESO,TIPOIDPACIENTE,NROIDPACIENTE,CODENTJM) values ('213',to_date('16/04/19','DD/MM/RR'),'9','2','20190416113011469588',to_date('16/04/19','DD/MM/RR'),'N','1','2',null,null,null,null,null,to_date('01/01/70','DD/MM/RR'),null,'CC','17642974','761470067210');
Insert into OASIS4.WEBSERV_JUNTA_PROFESIONAL (ID_JUPR,REPO_PERIODO,REPO_SERV_ID,REPO_TIRE_ID,NOPRESCRIPCION,FPRESCRIPCION,TIPOTECNOLOGIA,CONSECUTIVO,ESTJM,CODENTPROC,OBSERVACIONES,JUSTIFICACIONTECNICA,MODALIDAD,NOACTA,FECHAACTA,FPROCESO,TIPOIDPACIENTE,NROIDPACIENTE,CODENTJM) values ('214',to_date('16/04/19','DD/MM/RR'),'9','2','20190416107011470792',to_date('16/04/19','DD/MM/RR'),'N','1','2',null,null,null,null,null,to_date('01/01/70','DD/MM/RR'),null,'RC','1140904733','087580016101');
Insert into OASIS4.WEBSERV_JUNTA_PROFESIONAL (ID_JUPR,REPO_PERIODO,REPO_SERV_ID,REPO_TIRE_ID,NOPRESCRIPCION,FPRESCRIPCION,TIPOTECNOLOGIA,CONSECUTIVO,ESTJM,CODENTPROC,OBSERVACIONES,JUSTIFICACIONTECNICA,MODALIDAD,NOACTA,FECHAACTA,FPROCESO,TIPOIDPACIENTE,NROIDPACIENTE,CODENTJM) values ('216',to_date('17/04/19','DD/MM/RR'),'9','2','20190417145011479477',to_date('17/04/19','DD/MM/RR'),'M','1','2',null,null,null,null,null,to_date('01/01/70','DD/MM/RR'),null,'CC','24891183','761471036701');
Insert into OASIS4.WEBSERV_JUNTA_PROFESIONAL (ID_JUPR,REPO_PERIODO,REPO_SERV_ID,REPO_TIRE_ID,NOPRESCRIPCION,FPRESCRIPCION,TIPOTECNOLOGIA,CONSECUTIVO,ESTJM,CODENTPROC,OBSERVACIONES,JUSTIFICACIONTECNICA,MODALIDAD,NOACTA,FECHAACTA,FPROCESO,TIPOIDPACIENTE,NROIDPACIENTE,CODENTJM) values ('215',to_date('16/04/19','DD/MM/RR'),'9','2','20190416123011473238',to_date('16/04/19','DD/MM/RR'),'S','1','2',null,null,null,null,null,to_date('01/01/70','DD/MM/RR'),null,'CC','1193521915','130010226003');
Insert into OASIS4.WEBSERV_JUNTA_PROFESIONAL (ID_JUPR,REPO_PERIODO,REPO_SERV_ID,REPO_TIRE_ID,NOPRESCRIPCION,FPRESCRIPCION,TIPOTECNOLOGIA,CONSECUTIVO,ESTJM,CODENTPROC,OBSERVACIONES,JUSTIFICACIONTECNICA,MODALIDAD,NOACTA,FECHAACTA,FPROCESO,TIPOIDPACIENTE,NROIDPACIENTE,CODENTJM) values ('217',to_date('17/04/19','DD/MM/RR'),'9','2','20190417126011481757',to_date('17/04/19','DD/MM/RR'),'M','1','2',null,null,null,null,null,to_date('01/01/70','DD/MM/RR'),null,'CC','29152309','761471036701');
Insert into OASIS4.WEBSERV_JUNTA_PROFESIONAL (ID_JUPR,REPO_PERIODO,REPO_SERV_ID,REPO_TIRE_ID,NOPRESCRIPCION,FPRESCRIPCION,TIPOTECNOLOGIA,CONSECUTIVO,ESTJM,CODENTPROC,OBSERVACIONES,JUSTIFICACIONTECNICA,MODALIDAD,NOACTA,FECHAACTA,FPROCESO,TIPOIDPACIENTE,NROIDPACIENTE,CODENTJM) values ('218',to_date('17/04/19','DD/MM/RR'),'9','2','20190417193011476193',to_date('17/04/19','DD/MM/RR'),'N','1','2',null,null,null,null,null,to_date('01/01/70','DD/MM/RR'),null,'CC','29936249','761470067210');
Insert into OASIS4.WEBSERV_JUNTA_PROFESIONAL (ID_JUPR,REPO_PERIODO,REPO_SERV_ID,REPO_TIRE_ID,NOPRESCRIPCION,FPRESCRIPCION,TIPOTECNOLOGIA,CONSECUTIVO,ESTJM,CODENTPROC,OBSERVACIONES,JUSTIFICACIONTECNICA,MODALIDAD,NOACTA,FECHAACTA,FPROCESO,TIPOIDPACIENTE,NROIDPACIENTE,CODENTJM) values ('219',to_date('17/04/19','DD/MM/RR'),'9','2','20190417145011479477',to_date('17/04/19','DD/MM/RR'),'N','1','2',null,null,null,null,null,to_date('01/01/70','DD/MM/RR'),null,'CC','24891183','761471036701');
Insert into OASIS4.WEBSERV_JUNTA_PROFESIONAL (ID_JUPR,REPO_PERIODO,REPO_SERV_ID,REPO_TIRE_ID,NOPRESCRIPCION,FPRESCRIPCION,TIPOTECNOLOGIA,CONSECUTIVO,ESTJM,CODENTPROC,OBSERVACIONES,JUSTIFICACIONTECNICA,MODALIDAD,NOACTA,FECHAACTA,FPROCESO,TIPOIDPACIENTE,NROIDPACIENTE,CODENTJM) values ('220',to_date('17/04/19','DD/MM/RR'),'9','2','20190417142011488626',to_date('17/04/19','DD/MM/RR'),'N','1','2',null,null,null,null,null,to_date('01/01/70','DD/MM/RR'),null,'CC','29137803','ESS076');
Insert into OASIS4.WEBSERV_JUNTA_PROFESIONAL (ID_JUPR,REPO_PERIODO,REPO_SERV_ID,REPO_TIRE_ID,NOPRESCRIPCION,FPRESCRIPCION,TIPOTECNOLOGIA,CONSECUTIVO,ESTJM,CODENTPROC,OBSERVACIONES,JUSTIFICACIONTECNICA,MODALIDAD,NOACTA,FECHAACTA,FPROCESO,TIPOIDPACIENTE,NROIDPACIENTE,CODENTJM) values ('221',to_date('17/04/19','DD/MM/RR'),'9','2','20190417129011489266',to_date('17/04/19','DD/MM/RR'),'N','1','3','087580016101',null,'se solicita alimento liquido completo y balanceado con proteinas vitaminas y minerales para recuperar estado nutricional del paciente.','1','00007',to_date('17/06/19','DD/MM/RR'),'2019-06-17','TI','1043163515','087580016101');
Insert into OASIS4.WEBSERV_JUNTA_PROFESIONAL (ID_JUPR,REPO_PERIODO,REPO_SERV_ID,REPO_TIRE_ID,NOPRESCRIPCION,FPRESCRIPCION,TIPOTECNOLOGIA,CONSECUTIVO,ESTJM,CODENTPROC,OBSERVACIONES,JUSTIFICACIONTECNICA,MODALIDAD,NOACTA,FECHAACTA,FPROCESO,TIPOIDPACIENTE,NROIDPACIENTE,CODENTJM) values ('222',to_date('17/04/19','DD/MM/RR'),'9','2','20190417160011490120',to_date('17/04/19','DD/MM/RR'),'N','1','2',null,null,null,null,null,to_date('01/01/70','DD/MM/RR'),null,'RC','1143458370','087580016101');
Insert into OASIS4.WEBSERV_JUNTA_PROFESIONAL (ID_JUPR,REPO_PERIODO,REPO_SERV_ID,REPO_TIRE_ID,NOPRESCRIPCION,FPRESCRIPCION,TIPOTECNOLOGIA,CONSECUTIVO,ESTJM,CODENTPROC,OBSERVACIONES,JUSTIFICACIONTECNICA,MODALIDAD,NOACTA,FECHAACTA,FPROCESO,TIPOIDPACIENTE,NROIDPACIENTE,CODENTJM) values ('223',to_date('17/04/19','DD/MM/RR'),'9','2','20190417186011486021',to_date('17/04/19','DD/MM/RR'),'S','1','3','470010096901',null,'PACIENTE SECUELAR NEUROLÃ“GICO RECIBE OXÃ?GENO POR TRAQUEOSTOMIA POSTRADA EN CAMA CON TRAQUEOSTOMIA SE INDICA TRASLADO REDONDO EN AMBULANCIA','1','874',to_date('17/04/19','DD/MM/RR'),'2019-04-17','CC','22787177','470010096901');
Insert into OASIS4.WEBSERV_JUNTA_PROFESIONAL (ID_JUPR,REPO_PERIODO,REPO_SERV_ID,REPO_TIRE_ID,NOPRESCRIPCION,FPRESCRIPCION,TIPOTECNOLOGIA,CONSECUTIVO,ESTJM,CODENTPROC,OBSERVACIONES,JUSTIFICACIONTECNICA,MODALIDAD,NOACTA,FECHAACTA,FPROCESO,TIPOIDPACIENTE,NROIDPACIENTE,CODENTJM) values ('224',to_date('17/04/19','DD/MM/RR'),'9','2','20190417196011487123',to_date('17/04/19','DD/MM/RR'),'S','1','3','470010096901',null,'TRASLADO DE AMBULANCIA REDONDO CUMPLIR CITA MEDICA CLINICA DIVINO NIÃ‘O CALLE 9 # 38-44 EL DIA 2 DE MAYO 2019 8:30 AM','1','875',to_date('17/04/19','DD/MM/RR'),'2019-04-17','CC','5133831','470010096901');
Insert into OASIS4.WEBSERV_JUNTA_PROFESIONAL (ID_JUPR,REPO_PERIODO,REPO_SERV_ID,REPO_TIRE_ID,NOPRESCRIPCION,FPRESCRIPCION,TIPOTECNOLOGIA,CONSECUTIVO,ESTJM,CODENTPROC,OBSERVACIONES,JUSTIFICACIONTECNICA,MODALIDAD,NOACTA,FECHAACTA,FPROCESO,TIPOIDPACIENTE,NROIDPACIENTE,CODENTJM) values ('225',to_date('17/04/19','DD/MM/RR'),'9','2','20190417142011488626',to_date('17/04/19','DD/MM/RR'),'S','2','2',null,null,null,null,null,to_date('01/01/70','DD/MM/RR'),null,'CC','29137803','ESS076');
Insert into OASIS4.WEBSERV_JUNTA_PROFESIONAL (ID_JUPR,REPO_PERIODO,REPO_SERV_ID,REPO_TIRE_ID,NOPRESCRIPCION,FPRESCRIPCION,TIPOTECNOLOGIA,CONSECUTIVO,ESTJM,CODENTPROC,OBSERVACIONES,JUSTIFICACIONTECNICA,MODALIDAD,NOACTA,FECHAACTA,FPROCESO,TIPOIDPACIENTE,NROIDPACIENTE,CODENTJM) values ('226',to_date('17/04/19','DD/MM/RR'),'9','2','20190417169011489981',to_date('17/04/19','DD/MM/RR'),'S','1','2',null,null,null,null,null,to_date('01/01/70','DD/MM/RR'),null,'CC','7448046','080010409201');
Insert into OASIS4.WEBSERV_JUNTA_PROFESIONAL (ID_JUPR,REPO_PERIODO,REPO_SERV_ID,REPO_TIRE_ID,NOPRESCRIPCION,FPRESCRIPCION,TIPOTECNOLOGIA,CONSECUTIVO,ESTJM,CODENTPROC,OBSERVACIONES,JUSTIFICACIONTECNICA,MODALIDAD,NOACTA,FECHAACTA,FPROCESO,TIPOIDPACIENTE,NROIDPACIENTE,CODENTJM) values ('227',to_date('17/04/19','DD/MM/RR'),'9','2','20190417166011491048',to_date('17/04/19','DD/MM/RR'),'S','1','2',null,null,null,null,null,to_date('01/01/70','DD/MM/RR'),null,'CC','6238350','761470067210');
Insert into OASIS4.WEBSERV_JUNTA_PROFESIONAL (ID_JUPR,REPO_PERIODO,REPO_SERV_ID,REPO_TIRE_ID,NOPRESCRIPCION,FPRESCRIPCION,TIPOTECNOLOGIA,CONSECUTIVO,ESTJM,CODENTPROC,OBSERVACIONES,JUSTIFICACIONTECNICA,MODALIDAD,NOACTA,FECHAACTA,FPROCESO,TIPOIDPACIENTE,NROIDPACIENTE,CODENTJM) values ('228',to_date('17/04/19','DD/MM/RR'),'9','2','20190417160011496128',to_date('17/04/19','DD/MM/RR'),'S','2','2',null,null,null,null,null,to_date('01/01/70','DD/MM/RR'),null,'CC','26796647','200010205401');
Insert into OASIS4.WEBSERV_JUNTA_PROFESIONAL (ID_JUPR,REPO_PERIODO,REPO_SERV_ID,REPO_TIRE_ID,NOPRESCRIPCION,FPRESCRIPCION,TIPOTECNOLOGIA,CONSECUTIVO,ESTJM,CODENTPROC,OBSERVACIONES,JUSTIFICACIONTECNICA,MODALIDAD,NOACTA,FECHAACTA,FPROCESO,TIPOIDPACIENTE,NROIDPACIENTE,CODENTJM) values ('229',to_date('17/04/19','DD/MM/RR'),'9','2','20190417160011496128',to_date('17/04/19','DD/MM/RR'),'S','3','2',null,null,null,null,null,to_date('01/01/70','DD/MM/RR'),null,'CC','26796647','200010205401');
Insert into OASIS4.WEBSERV_JUNTA_PROFESIONAL (ID_JUPR,REPO_PERIODO,REPO_SERV_ID,REPO_TIRE_ID,NOPRESCRIPCION,FPRESCRIPCION,TIPOTECNOLOGIA,CONSECUTIVO,ESTJM,CODENTPROC,OBSERVACIONES,JUSTIFICACIONTECNICA,MODALIDAD,NOACTA,FECHAACTA,FPROCESO,TIPOIDPACIENTE,NROIDPACIENTE,CODENTJM) values ('230',to_date('17/04/19','DD/MM/RR'),'9','2','20190417160011496128',to_date('17/04/19','DD/MM/RR'),'S','4','2',null,null,null,null,null,to_date('01/01/70','DD/MM/RR'),null,'CC','26796647','200010205401');
Insert into OASIS4.WEBSERV_JUNTA_PROFESIONAL (ID_JUPR,REPO_PERIODO,REPO_SERV_ID,REPO_TIRE_ID,NOPRESCRIPCION,FPRESCRIPCION,TIPOTECNOLOGIA,CONSECUTIVO,ESTJM,CODENTPROC,OBSERVACIONES,JUSTIFICACIONTECNICA,MODALIDAD,NOACTA,FECHAACTA,FPROCESO,TIPOIDPACIENTE,NROIDPACIENTE,CODENTJM) values ('231',to_date('17/04/19','DD/MM/RR'),'9','2','20190417160011496128',to_date('17/04/19','DD/MM/RR'),'S','5','2',null,null,null,null,null,to_date('01/01/70','DD/MM/RR'),null,'CC','26796647','200010205401');
Insert into OASIS4.WEBSERV_JUNTA_PROFESIONAL (ID_JUPR,REPO_PERIODO,REPO_SERV_ID,REPO_TIRE_ID,NOPRESCRIPCION,FPRESCRIPCION,TIPOTECNOLOGIA,CONSECUTIVO,ESTJM,CODENTPROC,OBSERVACIONES,JUSTIFICACIONTECNICA,MODALIDAD,NOACTA,FECHAACTA,FPROCESO,TIPOIDPACIENTE,NROIDPACIENTE,CODENTJM) values ('232',to_date('18/04/19','DD/MM/RR'),'9','2','20190418175011497477',to_date('18/04/19','DD/MM/RR'),'M','1','2',null,null,null,null,null,to_date('01/01/70','DD/MM/RR'),null,'CC','33197518','134300049201');
Insert into OASIS4.WEBSERV_JUNTA_PROFESIONAL (ID_JUPR,REPO_PERIODO,REPO_SERV_ID,REPO_TIRE_ID,NOPRESCRIPCION,FPRESCRIPCION,TIPOTECNOLOGIA,CONSECUTIVO,ESTJM,CODENTPROC,OBSERVACIONES,JUSTIFICACIONTECNICA,MODALIDAD,NOACTA,FECHAACTA,FPROCESO,TIPOIDPACIENTE,NROIDPACIENTE,CODENTJM) values ('233',to_date('22/04/19','DD/MM/RR'),'9','2','20190422121011523357',to_date('22/04/19','DD/MM/RR'),'M','1','2',null,null,null,null,null,to_date('01/01/70','DD/MM/RR'),null,'CC','1042347981','080010133501');
Insert into OASIS4.WEBSERV_JUNTA_PROFESIONAL (ID_JUPR,REPO_PERIODO,REPO_SERV_ID,REPO_TIRE_ID,NOPRESCRIPCION,FPRESCRIPCION,TIPOTECNOLOGIA,CONSECUTIVO,ESTJM,CODENTPROC,OBSERVACIONES,JUSTIFICACIONTECNICA,MODALIDAD,NOACTA,FECHAACTA,FPROCESO,TIPOIDPACIENTE,NROIDPACIENTE,CODENTJM) values ('234',to_date('22/04/19','DD/MM/RR'),'9','2','20190422183011523606',to_date('22/04/19','DD/MM/RR'),'M','1','2',null,null,null,null,null,to_date('01/01/70','DD/MM/RR'),null,'CC','1048219804','080010078901');
Insert into OASIS4.WEBSERV_JUNTA_PROFESIONAL (ID_JUPR,REPO_PERIODO,REPO_SERV_ID,REPO_TIRE_ID,NOPRESCRIPCION,FPRESCRIPCION,TIPOTECNOLOGIA,CONSECUTIVO,ESTJM,CODENTPROC,OBSERVACIONES,JUSTIFICACIONTECNICA,MODALIDAD,NOACTA,FECHAACTA,FPROCESO,TIPOIDPACIENTE,NROIDPACIENTE,CODENTJM) values ('235',to_date('22/04/19','DD/MM/RR'),'9','2','20190422168011507297',to_date('22/04/19','DD/MM/RR'),'N','1','2',null,null,null,null,null,to_date('01/01/70','DD/MM/RR'),null,'TI','1114157232','761470067210');
Insert into OASIS4.WEBSERV_JUNTA_PROFESIONAL (ID_JUPR,REPO_PERIODO,REPO_SERV_ID,REPO_TIRE_ID,NOPRESCRIPCION,FPRESCRIPCION,TIPOTECNOLOGIA,CONSECUTIVO,ESTJM,CODENTPROC,OBSERVACIONES,JUSTIFICACIONTECNICA,MODALIDAD,NOACTA,FECHAACTA,FPROCESO,TIPOIDPACIENTE,NROIDPACIENTE,CODENTJM) values ('236',to_date('22/04/19','DD/MM/RR'),'9','2','20190422122011507372',to_date('22/04/19','DD/MM/RR'),'N','1','2',null,null,null,null,null,to_date('01/01/70','DD/MM/RR'),null,'TI','1114157232','761470067210');
Insert into OASIS4.WEBSERV_JUNTA_PROFESIONAL (ID_JUPR,REPO_PERIODO,REPO_SERV_ID,REPO_TIRE_ID,NOPRESCRIPCION,FPRESCRIPCION,TIPOTECNOLOGIA,CONSECUTIVO,ESTJM,CODENTPROC,OBSERVACIONES,JUSTIFICACIONTECNICA,MODALIDAD,NOACTA,FECHAACTA,FPROCESO,TIPOIDPACIENTE,NROIDPACIENTE,CODENTJM) values ('237',to_date('22/04/19','DD/MM/RR'),'9','2','20190422195011514629',to_date('22/04/19','DD/MM/RR'),'N','1','3','080010054401',null,' LA JUNTA MEDICA HA REVISADO SU CASO Y DECIDEN POR CONDICION CLINICA DEL PACIENTE SE AUTORIZA E INDICAN EL USO DE FORMULA NUTRICIONAL  PEDIASURE ','1','0796',to_date('22/04/19','DD/MM/RR'),'2019-04-22','TI','1041693829','080010054401');
Insert into OASIS4.WEBSERV_JUNTA_PROFESIONAL (ID_JUPR,REPO_PERIODO,REPO_SERV_ID,REPO_TIRE_ID,NOPRESCRIPCION,FPRESCRIPCION,TIPOTECNOLOGIA,CONSECUTIVO,ESTJM,CODENTPROC,OBSERVACIONES,JUSTIFICACIONTECNICA,MODALIDAD,NOACTA,FECHAACTA,FPROCESO,TIPOIDPACIENTE,NROIDPACIENTE,CODENTJM) values ('238',to_date('22/04/19','DD/MM/RR'),'9','2','20190422114011524379',to_date('22/04/19','DD/MM/RR'),'N','1','2',null,null,null,null,null,to_date('01/01/70','DD/MM/RR'),null,'CC','29132945','ESS076');
Insert into OASIS4.WEBSERV_JUNTA_PROFESIONAL (ID_JUPR,REPO_PERIODO,REPO_SERV_ID,REPO_TIRE_ID,NOPRESCRIPCION,FPRESCRIPCION,TIPOTECNOLOGIA,CONSECUTIVO,ESTJM,CODENTPROC,OBSERVACIONES,JUSTIFICACIONTECNICA,MODALIDAD,NOACTA,FECHAACTA,FPROCESO,TIPOIDPACIENTE,NROIDPACIENTE,CODENTJM) values ('239',to_date('22/04/19','DD/MM/RR'),'9','2','20190422137011524552',to_date('22/04/19','DD/MM/RR'),'N','1','3','080010226001',null,'extemporÃ¡neo no se aprueba junta medica ','1','201904100716',to_date('04/10/19','DD/MM/RR'),'2019-10-04','TI','1043165226','080010226001');
Insert into OASIS4.WEBSERV_JUNTA_PROFESIONAL (ID_JUPR,REPO_PERIODO,REPO_SERV_ID,REPO_TIRE_ID,NOPRESCRIPCION,FPRESCRIPCION,TIPOTECNOLOGIA,CONSECUTIVO,ESTJM,CODENTPROC,OBSERVACIONES,JUSTIFICACIONTECNICA,MODALIDAD,NOACTA,FECHAACTA,FPROCESO,TIPOIDPACIENTE,NROIDPACIENTE,CODENTJM) values ('240',to_date('22/04/19','DD/MM/RR'),'9','2','20190422131011507200',to_date('22/04/19','DD/MM/RR'),'S','1','2',null,null,null,null,null,to_date('01/01/70','DD/MM/RR'),null,'TI','1114157232','761470067210');
Insert into OASIS4.WEBSERV_JUNTA_PROFESIONAL (ID_JUPR,REPO_PERIODO,REPO_SERV_ID,REPO_TIRE_ID,NOPRESCRIPCION,FPRESCRIPCION,TIPOTECNOLOGIA,CONSECUTIVO,ESTJM,CODENTPROC,OBSERVACIONES,JUSTIFICACIONTECNICA,MODALIDAD,NOACTA,FECHAACTA,FPROCESO,TIPOIDPACIENTE,NROIDPACIENTE,CODENTJM) values ('241',to_date('22/04/19','DD/MM/RR'),'9','2','20190422145011508064',to_date('22/04/19','DD/MM/RR'),'S','1','2',null,null,null,null,null,to_date('01/01/70','DD/MM/RR'),null,'TI','1114157232','761470067210');
Insert into OASIS4.WEBSERV_JUNTA_PROFESIONAL (ID_JUPR,REPO_PERIODO,REPO_SERV_ID,REPO_TIRE_ID,NOPRESCRIPCION,FPRESCRIPCION,TIPOTECNOLOGIA,CONSECUTIVO,ESTJM,CODENTPROC,OBSERVACIONES,JUSTIFICACIONTECNICA,MODALIDAD,NOACTA,FECHAACTA,FPROCESO,TIPOIDPACIENTE,NROIDPACIENTE,CODENTJM) values ('242',to_date('22/04/19','DD/MM/RR'),'9','2','20190422120011514727',to_date('22/04/19','DD/MM/RR'),'S','2','2',null,null,null,null,null,to_date('01/01/70','DD/MM/RR'),null,'CC','16402365','768230220101');
Insert into OASIS4.WEBSERV_JUNTA_PROFESIONAL (ID_JUPR,REPO_PERIODO,REPO_SERV_ID,REPO_TIRE_ID,NOPRESCRIPCION,FPRESCRIPCION,TIPOTECNOLOGIA,CONSECUTIVO,ESTJM,CODENTPROC,OBSERVACIONES,JUSTIFICACIONTECNICA,MODALIDAD,NOACTA,FECHAACTA,FPROCESO,TIPOIDPACIENTE,NROIDPACIENTE,CODENTJM) values ('243',to_date('22/04/19','DD/MM/RR'),'9','2','20190422120011514727',to_date('22/04/19','DD/MM/RR'),'S','3','2',null,null,null,null,null,to_date('01/01/70','DD/MM/RR'),null,'CC','16402365','768230220101');
Insert into OASIS4.WEBSERV_JUNTA_PROFESIONAL (ID_JUPR,REPO_PERIODO,REPO_SERV_ID,REPO_TIRE_ID,NOPRESCRIPCION,FPRESCRIPCION,TIPOTECNOLOGIA,CONSECUTIVO,ESTJM,CODENTPROC,OBSERVACIONES,JUSTIFICACIONTECNICA,MODALIDAD,NOACTA,FECHAACTA,FPROCESO,TIPOIDPACIENTE,NROIDPACIENTE,CODENTJM) values ('244',to_date('23/04/19','DD/MM/RR'),'9','2','20190425171011602981',to_date('23/04/19','DD/MM/RR'),'M','1','2',null,null,null,null,null,to_date('01/01/70','DD/MM/RR'),null,'CC','34966891','ESS076');
Insert into OASIS4.WEBSERV_JUNTA_PROFESIONAL (ID_JUPR,REPO_PERIODO,REPO_SERV_ID,REPO_TIRE_ID,NOPRESCRIPCION,FPRESCRIPCION,TIPOTECNOLOGIA,CONSECUTIVO,ESTJM,CODENTPROC,OBSERVACIONES,JUSTIFICACIONTECNICA,MODALIDAD,NOACTA,FECHAACTA,FPROCESO,TIPOIDPACIENTE,NROIDPACIENTE,CODENTJM) values ('245',to_date('23/04/19','DD/MM/RR'),'9','2','20190423126011560708',to_date('23/04/19','DD/MM/RR'),'M','1','2',null,null,null,null,null,to_date('01/01/70','DD/MM/RR'),null,'TI','1050838053','134300049201');
Insert into OASIS4.WEBSERV_JUNTA_PROFESIONAL (ID_JUPR,REPO_PERIODO,REPO_SERV_ID,REPO_TIRE_ID,NOPRESCRIPCION,FPRESCRIPCION,TIPOTECNOLOGIA,CONSECUTIVO,ESTJM,CODENTPROC,OBSERVACIONES,JUSTIFICACIONTECNICA,MODALIDAD,NOACTA,FECHAACTA,FPROCESO,TIPOIDPACIENTE,NROIDPACIENTE,CODENTJM) values ('246',to_date('23/04/19','DD/MM/RR'),'9','2','20190423130011537587',to_date('23/04/19','DD/MM/RR'),'N','1','3','082960002101',null,'DESNUTRICIÃ“N PROTEICO CALORICA','1','0005',to_date('23/04/19','DD/MM/RR'),'2019-04-23','RC','1047234001','082960002101');
Insert into OASIS4.WEBSERV_JUNTA_PROFESIONAL (ID_JUPR,REPO_PERIODO,REPO_SERV_ID,REPO_TIRE_ID,NOPRESCRIPCION,FPRESCRIPCION,TIPOTECNOLOGIA,CONSECUTIVO,ESTJM,CODENTPROC,OBSERVACIONES,JUSTIFICACIONTECNICA,MODALIDAD,NOACTA,FECHAACTA,FPROCESO,TIPOIDPACIENTE,NROIDPACIENTE,CODENTJM) values ('247',to_date('23/04/19','DD/MM/RR'),'9','2','20190423114011539188',to_date('23/04/19','DD/MM/RR'),'N','1','4','080010112201',null,'PTE EN CONTEXTO SOCIAL COMPLEJO NO HAY PATOLOGÃ?AS SOBRE AGREGADAS QUE JUSTIFIQUEN EL SOPORTE NUTRICIONAL, DEBE SER ABORDADO DESDE ICBF Y SU EPS PARA EL MANEJO. ','1','005',to_date('03/05/19','DD/MM/RR'),'2019-05-03','TI','1044638005','080010112201');
Insert into OASIS4.WEBSERV_JUNTA_PROFESIONAL (ID_JUPR,REPO_PERIODO,REPO_SERV_ID,REPO_TIRE_ID,NOPRESCRIPCION,FPRESCRIPCION,TIPOTECNOLOGIA,CONSECUTIVO,ESTJM,CODENTPROC,OBSERVACIONES,JUSTIFICACIONTECNICA,MODALIDAD,NOACTA,FECHAACTA,FPROCESO,TIPOIDPACIENTE,NROIDPACIENTE,CODENTJM) values ('248',to_date('23/04/19','DD/MM/RR'),'9','2','20190423149011545610',to_date('23/04/19','DD/MM/RR'),'N','1','3','472450060501',null,'paciente con retardo en el desarrollo, quien no controla esfinteres, y presenta desnutricion por dificultad para ingesta de alimentos, ','2','012',to_date('23/04/19','DD/MM/RR'),'2019-04-23','RC','1216978162','472450060501');
Insert into OASIS4.WEBSERV_JUNTA_PROFESIONAL (ID_JUPR,REPO_PERIODO,REPO_SERV_ID,REPO_TIRE_ID,NOPRESCRIPCION,FPRESCRIPCION,TIPOTECNOLOGIA,CONSECUTIVO,ESTJM,CODENTPROC,OBSERVACIONES,JUSTIFICACIONTECNICA,MODALIDAD,NOACTA,FECHAACTA,FPROCESO,TIPOIDPACIENTE,NROIDPACIENTE,CODENTJM) values ('249',to_date('23/04/19','DD/MM/RR'),'9','2','20190423167011546899',to_date('23/04/19','DD/MM/RR'),'N','1','2',null,null,null,null,null,to_date('01/01/70','DD/MM/RR'),null,'RC','1045240005','130010118701');
Insert into OASIS4.WEBSERV_JUNTA_PROFESIONAL (ID_JUPR,REPO_PERIODO,REPO_SERV_ID,REPO_TIRE_ID,NOPRESCRIPCION,FPRESCRIPCION,TIPOTECNOLOGIA,CONSECUTIVO,ESTJM,CODENTPROC,OBSERVACIONES,JUSTIFICACIONTECNICA,MODALIDAD,NOACTA,FECHAACTA,FPROCESO,TIPOIDPACIENTE,NROIDPACIENTE,CODENTJM) values ('250',to_date('23/04/19','DD/MM/RR'),'9','2','20190423186011548985',to_date('23/04/19','DD/MM/RR'),'N','1','2',null,null,null,null,null,to_date('01/01/70','DD/MM/RR'),null,'CC','881692','130010178101');
Insert into OASIS4.WEBSERV_JUNTA_PROFESIONAL (ID_JUPR,REPO_PERIODO,REPO_SERV_ID,REPO_TIRE_ID,NOPRESCRIPCION,FPRESCRIPCION,TIPOTECNOLOGIA,CONSECUTIVO,ESTJM,CODENTPROC,OBSERVACIONES,JUSTIFICACIONTECNICA,MODALIDAD,NOACTA,FECHAACTA,FPROCESO,TIPOIDPACIENTE,NROIDPACIENTE,CODENTJM) values ('251',to_date('23/04/19','DD/MM/RR'),'9','2','20190423187011549920',to_date('23/04/19','DD/MM/RR'),'N','1','2',null,null,null,null,null,to_date('01/01/70','DD/MM/RR'),null,'CC','1114122077','761000252401');
Insert into OASIS4.WEBSERV_JUNTA_PROFESIONAL (ID_JUPR,REPO_PERIODO,REPO_SERV_ID,REPO_TIRE_ID,NOPRESCRIPCION,FPRESCRIPCION,TIPOTECNOLOGIA,CONSECUTIVO,ESTJM,CODENTPROC,OBSERVACIONES,JUSTIFICACIONTECNICA,MODALIDAD,NOACTA,FECHAACTA,FPROCESO,TIPOIDPACIENTE,NROIDPACIENTE,CODENTJM) values ('252',to_date('23/04/19','DD/MM/RR'),'9','2','20190423169011553647',to_date('23/04/19','DD/MM/RR'),'N','1','2',null,null,null,null,null,to_date('01/01/70','DD/MM/RR'),null,'CC','29132876','761470067210');
Insert into OASIS4.WEBSERV_JUNTA_PROFESIONAL (ID_JUPR,REPO_PERIODO,REPO_SERV_ID,REPO_TIRE_ID,NOPRESCRIPCION,FPRESCRIPCION,TIPOTECNOLOGIA,CONSECUTIVO,ESTJM,CODENTPROC,OBSERVACIONES,JUSTIFICACIONTECNICA,MODALIDAD,NOACTA,FECHAACTA,FPROCESO,TIPOIDPACIENTE,NROIDPACIENTE,CODENTJM) values ('253',to_date('23/04/19','DD/MM/RR'),'9','2','20190423111011558367',to_date('23/04/19','DD/MM/RR'),'N','1','2',null,null,null,null,null,to_date('01/01/70','DD/MM/RR'),null,'RC','1043192710','087580016101');
Insert into OASIS4.WEBSERV_JUNTA_PROFESIONAL (ID_JUPR,REPO_PERIODO,REPO_SERV_ID,REPO_TIRE_ID,NOPRESCRIPCION,FPRESCRIPCION,TIPOTECNOLOGIA,CONSECUTIVO,ESTJM,CODENTPROC,OBSERVACIONES,JUSTIFICACIONTECNICA,MODALIDAD,NOACTA,FECHAACTA,FPROCESO,TIPOIDPACIENTE,NROIDPACIENTE,CODENTJM) values ('254',to_date('23/04/19','DD/MM/RR'),'9','2','20190423132011543325',to_date('23/04/19','DD/MM/RR'),'S','1','3','200010053001',null,'PACIENTE CON DIAGNOSTICO DE DEMENCIA SENILESTABLE QUE LE IMPIDE MOVILIZACION POR SUS PROPIOS MEDIOS LA CUAL ES NECESARIO LA AUTORIZACION OTRASLADO A SU DOMIC','1','0023',to_date('23/04/19','DD/MM/RR'),'2019-04-23','CC','26764072','200010053001');
Insert into OASIS4.WEBSERV_JUNTA_PROFESIONAL (ID_JUPR,REPO_PERIODO,REPO_SERV_ID,REPO_TIRE_ID,NOPRESCRIPCION,FPRESCRIPCION,TIPOTECNOLOGIA,CONSECUTIVO,ESTJM,CODENTPROC,OBSERVACIONES,JUSTIFICACIONTECNICA,MODALIDAD,NOACTA,FECHAACTA,FPROCESO,TIPOIDPACIENTE,NROIDPACIENTE,CODENTJM) values ('255',to_date('23/04/19','DD/MM/RR'),'9','2','20190423199011559719',to_date('23/04/19','DD/MM/RR'),'S','1','2',null,null,null,null,null,to_date('01/01/70','DD/MM/RR'),null,'CC','5113761','087580001301');
Insert into OASIS4.WEBSERV_JUNTA_PROFESIONAL (ID_JUPR,REPO_PERIODO,REPO_SERV_ID,REPO_TIRE_ID,NOPRESCRIPCION,FPRESCRIPCION,TIPOTECNOLOGIA,CONSECUTIVO,ESTJM,CODENTPROC,OBSERVACIONES,JUSTIFICACIONTECNICA,MODALIDAD,NOACTA,FECHAACTA,FPROCESO,TIPOIDPACIENTE,NROIDPACIENTE,CODENTJM) values ('256',to_date('23/04/19','DD/MM/RR'),'9','2','20190423138011559810',to_date('23/04/19','DD/MM/RR'),'S','1','2',null,null,null,null,null,to_date('01/01/70','DD/MM/RR'),null,'CC','5113761','087580001301');
Insert into OASIS4.WEBSERV_JUNTA_PROFESIONAL (ID_JUPR,REPO_PERIODO,REPO_SERV_ID,REPO_TIRE_ID,NOPRESCRIPCION,FPRESCRIPCION,TIPOTECNOLOGIA,CONSECUTIVO,ESTJM,CODENTPROC,OBSERVACIONES,JUSTIFICACIONTECNICA,MODALIDAD,NOACTA,FECHAACTA,FPROCESO,TIPOIDPACIENTE,NROIDPACIENTE,CODENTJM) values ('257',to_date('24/04/19','DD/MM/RR'),'9','2','20190424128011567884',to_date('24/04/19','DD/MM/RR'),'N','1','2',null,null,null,null,null,to_date('01/01/70','DD/MM/RR'),null,'CC','33210491','130010210201');
Insert into OASIS4.WEBSERV_JUNTA_PROFESIONAL (ID_JUPR,REPO_PERIODO,REPO_SERV_ID,REPO_TIRE_ID,NOPRESCRIPCION,FPRESCRIPCION,TIPOTECNOLOGIA,CONSECUTIVO,ESTJM,CODENTPROC,OBSERVACIONES,JUSTIFICACIONTECNICA,MODALIDAD,NOACTA,FECHAACTA,FPROCESO,TIPOIDPACIENTE,NROIDPACIENTE,CODENTJM) values ('258',to_date('24/04/19','DD/MM/RR'),'9','2','20190424194011570027',to_date('24/04/19','DD/MM/RR'),'N','1','3','080010226001',null,'paciente  con bajo peso y talla. en seguimiento desde los 2 meses de nacimiento actualmente con talla/edad -2.29ds peso/talla -250ds con dx de desnutricion ','1','060720190802',to_date('06/07/19','DD/MM/RR'),'2019-07-06','RC','1043600691','080010226001');
Insert into OASIS4.WEBSERV_JUNTA_PROFESIONAL (ID_JUPR,REPO_PERIODO,REPO_SERV_ID,REPO_TIRE_ID,NOPRESCRIPCION,FPRESCRIPCION,TIPOTECNOLOGIA,CONSECUTIVO,ESTJM,CODENTPROC,OBSERVACIONES,JUSTIFICACIONTECNICA,MODALIDAD,NOACTA,FECHAACTA,FPROCESO,TIPOIDPACIENTE,NROIDPACIENTE,CODENTJM) values ('259',to_date('24/04/19','DD/MM/RR'),'9','2','20190424113011574452',to_date('24/04/19','DD/MM/RR'),'N','1','2',null,null,null,null,null,to_date('01/01/70','DD/MM/RR'),null,'TI','1051890242','130010210201');
Insert into OASIS4.WEBSERV_JUNTA_PROFESIONAL (ID_JUPR,REPO_PERIODO,REPO_SERV_ID,REPO_TIRE_ID,NOPRESCRIPCION,FPRESCRIPCION,TIPOTECNOLOGIA,CONSECUTIVO,ESTJM,CODENTPROC,OBSERVACIONES,JUSTIFICACIONTECNICA,MODALIDAD,NOACTA,FECHAACTA,FPROCESO,TIPOIDPACIENTE,NROIDPACIENTE,CODENTJM) values ('260',to_date('24/04/19','DD/MM/RR'),'9','2','20190424165011566756',to_date('24/04/19','DD/MM/RR'),'S','1','3','080010003601',null,'PACIENTE QUE PRESENTA ALGÃšN GRADO DE LESIÃ“N EPITELIAL CORNEAL CON LA EXPOSICIÃ“N DE TERMINACIONES NERVIOSAS OCASIONANDO DOLOR \n','1','001',to_date('24/04/19','DD/MM/RR'),'2019-04-24','CC','22390467','080010003601');
Insert into OASIS4.WEBSERV_JUNTA_PROFESIONAL (ID_JUPR,REPO_PERIODO,REPO_SERV_ID,REPO_TIRE_ID,NOPRESCRIPCION,FPRESCRIPCION,TIPOTECNOLOGIA,CONSECUTIVO,ESTJM,CODENTPROC,OBSERVACIONES,JUSTIFICACIONTECNICA,MODALIDAD,NOACTA,FECHAACTA,FPROCESO,TIPOIDPACIENTE,NROIDPACIENTE,CODENTJM) values ('261',to_date('24/04/19','DD/MM/RR'),'9','2','20190424166011579523',to_date('24/04/19','DD/MM/RR'),'S','1','3','470010096901',null,'PACIENTE QUE POR SU DIAGNÃ“STICO NO SE PUEDE TRASLADAR SOLO CON DIAGNÃ“STICO PARAPLEJIA ESPASTICIDAD SEVERA  REQUIERE TRASLADO REDONDO  EN AMBULANCIA PARA ESTUDIO','1','876',to_date('24/04/19','DD/MM/RR'),'2019-04-24','CC','5107258','470010096901');
Insert into OASIS4.WEBSERV_JUNTA_PROFESIONAL (ID_JUPR,REPO_PERIODO,REPO_SERV_ID,REPO_TIRE_ID,NOPRESCRIPCION,FPRESCRIPCION,TIPOTECNOLOGIA,CONSECUTIVO,ESTJM,CODENTPROC,OBSERVACIONES,JUSTIFICACIONTECNICA,MODALIDAD,NOACTA,FECHAACTA,FPROCESO,TIPOIDPACIENTE,NROIDPACIENTE,CODENTJM) values ('262',to_date('25/04/19','DD/MM/RR'),'9','2','20190425121011590361',to_date('25/04/19','DD/MM/RR'),'N','1','2',null,null,null,null,null,to_date('01/01/70','DD/MM/RR'),null,'TI','1112626333','764000165501');
Insert into OASIS4.WEBSERV_JUNTA_PROFESIONAL (ID_JUPR,REPO_PERIODO,REPO_SERV_ID,REPO_TIRE_ID,NOPRESCRIPCION,FPRESCRIPCION,TIPOTECNOLOGIA,CONSECUTIVO,ESTJM,CODENTPROC,OBSERVACIONES,JUSTIFICACIONTECNICA,MODALIDAD,NOACTA,FECHAACTA,FPROCESO,TIPOIDPACIENTE,NROIDPACIENTE,CODENTJM) values ('263',to_date('25/04/19','DD/MM/RR'),'9','2','20190425111011594845',to_date('25/04/19','DD/MM/RR'),'N','1','3','700010146401',null,'bajo peso sin ganancia desde el ultimo control ','1','1',to_date('27/04/19','DD/MM/RR'),'2019-04-27','RC','1103518564','700010146401');
Insert into OASIS4.WEBSERV_JUNTA_PROFESIONAL (ID_JUPR,REPO_PERIODO,REPO_SERV_ID,REPO_TIRE_ID,NOPRESCRIPCION,FPRESCRIPCION,TIPOTECNOLOGIA,CONSECUTIVO,ESTJM,CODENTPROC,OBSERVACIONES,JUSTIFICACIONTECNICA,MODALIDAD,NOACTA,FECHAACTA,FPROCESO,TIPOIDPACIENTE,NROIDPACIENTE,CODENTJM) values ('264',to_date('25/04/19','DD/MM/RR'),'9','2','20190425129011600428',to_date('25/04/19','DD/MM/RR'),'N','1','3','080010003716',null,'PACIENTE CON DX DE DESNUTRICION PROTEICOCALORICA SEVERA PACIENTE CAQUEXICA CON PROCESO DEPLETORIO , PERDIDAD DE TEJIDO ADIPOSO Y TEJIDO MUSCULAR GRAVE ','1','39',to_date('26/04/19','DD/MM/RR'),'2019-04-26','CC','28015022','080010003716');
Insert into OASIS4.WEBSERV_JUNTA_PROFESIONAL (ID_JUPR,REPO_PERIODO,REPO_SERV_ID,REPO_TIRE_ID,NOPRESCRIPCION,FPRESCRIPCION,TIPOTECNOLOGIA,CONSECUTIVO,ESTJM,CODENTPROC,OBSERVACIONES,JUSTIFICACIONTECNICA,MODALIDAD,NOACTA,FECHAACTA,FPROCESO,TIPOIDPACIENTE,NROIDPACIENTE,CODENTJM) values ('124',to_date('02/04/19','DD/MM/RR'),'9','2','20190402180011191695',to_date('02/04/19','DD/MM/RR'),'N','1','3','082960002101',null,'DIFICULTADES Y MALA ADMINISTRACION DE LA ALIMENTACION, RIESGO DE DESNUTRICION AGUDA.','1','31',to_date('08/07/19','DD/MM/RR'),'2019-07-08','RC','1047240128','082960002101');
Insert into OASIS4.WEBSERV_JUNTA_PROFESIONAL (ID_JUPR,REPO_PERIODO,REPO_SERV_ID,REPO_TIRE_ID,NOPRESCRIPCION,FPRESCRIPCION,TIPOTECNOLOGIA,CONSECUTIVO,ESTJM,CODENTPROC,OBSERVACIONES,JUSTIFICACIONTECNICA,MODALIDAD,NOACTA,FECHAACTA,FPROCESO,TIPOIDPACIENTE,NROIDPACIENTE,CODENTJM) values ('125',to_date('03/04/19','DD/MM/RR'),'9','2','20190403129011224557',to_date('03/04/19','DD/MM/RR'),'M','1','2',null,null,null,null,null,to_date('01/01/70','DD/MM/RR'),null,'CC','22645284','080010133501');
Insert into OASIS4.WEBSERV_JUNTA_PROFESIONAL (ID_JUPR,REPO_PERIODO,REPO_SERV_ID,REPO_TIRE_ID,NOPRESCRIPCION,FPRESCRIPCION,TIPOTECNOLOGIA,CONSECUTIVO,ESTJM,CODENTPROC,OBSERVACIONES,JUSTIFICACIONTECNICA,MODALIDAD,NOACTA,FECHAACTA,FPROCESO,TIPOIDPACIENTE,NROIDPACIENTE,CODENTJM) values ('126',to_date('03/04/19','DD/MM/RR'),'9','2','20190403117011220096',to_date('03/04/19','DD/MM/RR'),'N','1','2',null,null,null,null,null,to_date('01/01/70','DD/MM/RR'),null,'RC','1043184248','087580016101');
Insert into OASIS4.WEBSERV_JUNTA_PROFESIONAL (ID_JUPR,REPO_PERIODO,REPO_SERV_ID,REPO_TIRE_ID,NOPRESCRIPCION,FPRESCRIPCION,TIPOTECNOLOGIA,CONSECUTIVO,ESTJM,CODENTPROC,OBSERVACIONES,JUSTIFICACIONTECNICA,MODALIDAD,NOACTA,FECHAACTA,FPROCESO,TIPOIDPACIENTE,NROIDPACIENTE,CODENTJM) values ('127',to_date('03/04/19','DD/MM/RR'),'9','2','20190403188011222008',to_date('03/04/19','DD/MM/RR'),'N','1','2',null,null,null,null,null,to_date('01/01/70','DD/MM/RR'),null,'CC','22435887','087580016101');
Insert into OASIS4.WEBSERV_JUNTA_PROFESIONAL (ID_JUPR,REPO_PERIODO,REPO_SERV_ID,REPO_TIRE_ID,NOPRESCRIPCION,FPRESCRIPCION,TIPOTECNOLOGIA,CONSECUTIVO,ESTJM,CODENTPROC,OBSERVACIONES,JUSTIFICACIONTECNICA,MODALIDAD,NOACTA,FECHAACTA,FPROCESO,TIPOIDPACIENTE,NROIDPACIENTE,CODENTJM) values ('128',to_date('03/04/19','DD/MM/RR'),'9','2','20190403137011225999',to_date('03/04/19','DD/MM/RR'),'N','1','2',null,null,null,null,null,to_date('01/01/70','DD/MM/RR'),null,'CC','809986','080010409201');
Insert into OASIS4.WEBSERV_JUNTA_PROFESIONAL (ID_JUPR,REPO_PERIODO,REPO_SERV_ID,REPO_TIRE_ID,NOPRESCRIPCION,FPRESCRIPCION,TIPOTECNOLOGIA,CONSECUTIVO,ESTJM,CODENTPROC,OBSERVACIONES,JUSTIFICACIONTECNICA,MODALIDAD,NOACTA,FECHAACTA,FPROCESO,TIPOIDPACIENTE,NROIDPACIENTE,CODENTJM) values ('129',to_date('03/04/19','DD/MM/RR'),'9','2','20190403181011226127',to_date('03/04/19','DD/MM/RR'),'N','1','2',null,null,null,null,null,to_date('01/01/70','DD/MM/RR'),null,'CC','22634343','086380074501');
Insert into OASIS4.WEBSERV_JUNTA_PROFESIONAL (ID_JUPR,REPO_PERIODO,REPO_SERV_ID,REPO_TIRE_ID,NOPRESCRIPCION,FPRESCRIPCION,TIPOTECNOLOGIA,CONSECUTIVO,ESTJM,CODENTPROC,OBSERVACIONES,JUSTIFICACIONTECNICA,MODALIDAD,NOACTA,FECHAACTA,FPROCESO,TIPOIDPACIENTE,NROIDPACIENTE,CODENTJM) values ('130',to_date('03/04/19','DD/MM/RR'),'9','2','20190403139011210723',to_date('03/04/19','DD/MM/RR'),'S','1','2',null,null,null,null,null,to_date('01/01/70','DD/MM/RR'),null,'CC','4989641','200010033001');
Insert into OASIS4.WEBSERV_JUNTA_PROFESIONAL (ID_JUPR,REPO_PERIODO,REPO_SERV_ID,REPO_TIRE_ID,NOPRESCRIPCION,FPRESCRIPCION,TIPOTECNOLOGIA,CONSECUTIVO,ESTJM,CODENTPROC,OBSERVACIONES,JUSTIFICACIONTECNICA,MODALIDAD,NOACTA,FECHAACTA,FPROCESO,TIPOIDPACIENTE,NROIDPACIENTE,CODENTJM) values ('131',to_date('04/04/19','DD/MM/RR'),'9','2','20190404189011240520',to_date('04/04/19','DD/MM/RR'),'M','1','3','080010226001',null,'APROBADO, DIAGNOSTICO CONCUERDA CON LA JUSTIFICACION CLINICA Y ORDENAMIENTO MEDICO','1','040420190450',to_date('04/04/19','DD/MM/RR'),'2019-04-04','TI','1043585420','080010226001');
Insert into OASIS4.WEBSERV_JUNTA_PROFESIONAL (ID_JUPR,REPO_PERIODO,REPO_SERV_ID,REPO_TIRE_ID,NOPRESCRIPCION,FPRESCRIPCION,TIPOTECNOLOGIA,CONSECUTIVO,ESTJM,CODENTPROC,OBSERVACIONES,JUSTIFICACIONTECNICA,MODALIDAD,NOACTA,FECHAACTA,FPROCESO,TIPOIDPACIENTE,NROIDPACIENTE,CODENTJM) values ('132',to_date('04/04/19','DD/MM/RR'),'9','2','20190404153011243640',to_date('04/04/19','DD/MM/RR'),'M','1','2',null,null,null,null,null,to_date('01/01/70','DD/MM/RR'),null,'CC','22704244','080010133501');
Insert into OASIS4.WEBSERV_JUNTA_PROFESIONAL (ID_JUPR,REPO_PERIODO,REPO_SERV_ID,REPO_TIRE_ID,NOPRESCRIPCION,FPRESCRIPCION,TIPOTECNOLOGIA,CONSECUTIVO,ESTJM,CODENTPROC,OBSERVACIONES,JUSTIFICACIONTECNICA,MODALIDAD,NOACTA,FECHAACTA,FPROCESO,TIPOIDPACIENTE,NROIDPACIENTE,CODENTJM) values ('133',to_date('04/04/19','DD/MM/RR'),'9','2','20190404116011244754',to_date('04/04/19','DD/MM/RR'),'M','1','1','080010112401',null,'nefritis lÃºpica en adultos no  se encuentra dentro del listado unirs','1',null,to_date('01/01/70','DD/MM/RR'),'2019-05-13','CC','64744392','080010112401');
Insert into OASIS4.WEBSERV_JUNTA_PROFESIONAL (ID_JUPR,REPO_PERIODO,REPO_SERV_ID,REPO_TIRE_ID,NOPRESCRIPCION,FPRESCRIPCION,TIPOTECNOLOGIA,CONSECUTIVO,ESTJM,CODENTPROC,OBSERVACIONES,JUSTIFICACIONTECNICA,MODALIDAD,NOACTA,FECHAACTA,FPROCESO,TIPOIDPACIENTE,NROIDPACIENTE,CODENTJM) values ('134',to_date('04/04/19','DD/MM/RR'),'9','2','20190404178011252506',to_date('04/04/19','DD/MM/RR'),'M','1','3','200010001801',null,'PACIENTE CON17 AÃ‘OS  ANTECEDENTE DE LUPUS ERITEMATOSO SISTEMICO CON COMPROMISO RENAL, CON NEFROPATIA LUPICA TIPO IV.','1','02',to_date('04/04/19','DD/MM/RR'),'2019-04-04','TI','1007138878','200010001801');
Insert into OASIS4.WEBSERV_JUNTA_PROFESIONAL (ID_JUPR,REPO_PERIODO,REPO_SERV_ID,REPO_TIRE_ID,NOPRESCRIPCION,FPRESCRIPCION,TIPOTECNOLOGIA,CONSECUTIVO,ESTJM,CODENTPROC,OBSERVACIONES,JUSTIFICACIONTECNICA,MODALIDAD,NOACTA,FECHAACTA,FPROCESO,TIPOIDPACIENTE,NROIDPACIENTE,CODENTJM) values ('135',to_date('04/04/19','DD/MM/RR'),'9','2','20190404178011252506',to_date('04/04/19','DD/MM/RR'),'M','2','3','200010001801',null,'PACIENTE CON ANTECEDENTE DE LUPUS ERITEMATOSO SISTEMICO CON COMPROMISO RENAL, CON NEFROPATÃ?A LÃšPICA TIPO IV EL CUAL REQUIERE DE TRATAMIENTO PARA SU ENFERMEDAD','1','01',to_date('04/04/19','DD/MM/RR'),'2019-04-04','TI','1007138878','200010001801');
Insert into OASIS4.WEBSERV_JUNTA_PROFESIONAL (ID_JUPR,REPO_PERIODO,REPO_SERV_ID,REPO_TIRE_ID,NOPRESCRIPCION,FPRESCRIPCION,TIPOTECNOLOGIA,CONSECUTIVO,ESTJM,CODENTPROC,OBSERVACIONES,JUSTIFICACIONTECNICA,MODALIDAD,NOACTA,FECHAACTA,FPROCESO,TIPOIDPACIENTE,NROIDPACIENTE,CODENTJM) values ('136',to_date('04/04/19','DD/MM/RR'),'9','2','20190404149011232435',to_date('04/04/19','DD/MM/RR'),'N','1','4','080010445411',null,'PACIENTE FEMENINA DE 38 AÃ‘OS CON DX MEDICO DE Hipotiroidismo. NO SE APRUEBA POR FALTA DE INFORMACIÃ“N EN LA HISTORIA CLÃ?NICA. ','1','114',to_date('12/06/19','DD/MM/RR'),'2019-06-12','CC','22648866','080010445411');
Insert into OASIS4.WEBSERV_JUNTA_PROFESIONAL (ID_JUPR,REPO_PERIODO,REPO_SERV_ID,REPO_TIRE_ID,NOPRESCRIPCION,FPRESCRIPCION,TIPOTECNOLOGIA,CONSECUTIVO,ESTJM,CODENTPROC,OBSERVACIONES,JUSTIFICACIONTECNICA,MODALIDAD,NOACTA,FECHAACTA,FPROCESO,TIPOIDPACIENTE,NROIDPACIENTE,CODENTJM) values ('137',to_date('04/04/19','DD/MM/RR'),'9','2','20190404199011236318',to_date('04/04/19','DD/MM/RR'),'N','1','2',null,null,null,null,null,to_date('01/01/70','DD/MM/RR'),null,'RC','1103518564','700010096901');
Insert into OASIS4.WEBSERV_JUNTA_PROFESIONAL (ID_JUPR,REPO_PERIODO,REPO_SERV_ID,REPO_TIRE_ID,NOPRESCRIPCION,FPRESCRIPCION,TIPOTECNOLOGIA,CONSECUTIVO,ESTJM,CODENTPROC,OBSERVACIONES,JUSTIFICACIONTECNICA,MODALIDAD,NOACTA,FECHAACTA,FPROCESO,TIPOIDPACIENTE,NROIDPACIENTE,CODENTJM) values ('138',to_date('04/04/19','DD/MM/RR'),'9','2','20190404193011243763',to_date('04/04/19','DD/MM/RR'),'N','1','2',null,null,null,null,null,to_date('01/01/70','DD/MM/RR'),null,'TI','1043673938','087580016101');
Insert into OASIS4.WEBSERV_JUNTA_PROFESIONAL (ID_JUPR,REPO_PERIODO,REPO_SERV_ID,REPO_TIRE_ID,NOPRESCRIPCION,FPRESCRIPCION,TIPOTECNOLOGIA,CONSECUTIVO,ESTJM,CODENTPROC,OBSERVACIONES,JUSTIFICACIONTECNICA,MODALIDAD,NOACTA,FECHAACTA,FPROCESO,TIPOIDPACIENTE,NROIDPACIENTE,CODENTJM) values ('139',to_date('04/04/19','DD/MM/RR'),'9','2','20190404160011245318',to_date('04/04/19','DD/MM/RR'),'N','1','3','080010445431',null,'PACIENTE FEMENINO DE 3 AÃ‘OS CON DEFICIT EN TEJIDO ADIPOSO Y POCA MASA MUSCULAR Y DX NUTRICIONAL DE DESNUTRICIÃ“N Aguda Moderada. REQUIERE SUPLEMENTO. \n','1','120',to_date('12/06/19','DD/MM/RR'),'2019-06-12','RC','1158465443','080010445431');
Insert into OASIS4.WEBSERV_JUNTA_PROFESIONAL (ID_JUPR,REPO_PERIODO,REPO_SERV_ID,REPO_TIRE_ID,NOPRESCRIPCION,FPRESCRIPCION,TIPOTECNOLOGIA,CONSECUTIVO,ESTJM,CODENTPROC,OBSERVACIONES,JUSTIFICACIONTECNICA,MODALIDAD,NOACTA,FECHAACTA,FPROCESO,TIPOIDPACIENTE,NROIDPACIENTE,CODENTJM) values ('140',to_date('04/04/19','DD/MM/RR'),'9','2','20190404197011253339',to_date('04/04/19','DD/MM/RR'),'S','1','3','080010349401',null,'PACIENTE DE 70 AÃ‘OS, con INCONTINENCIA FECAL Y URINARIA QUE REQUIERE SUMINISTRO DE PAÃ‘ALES DESECHABLES Y PAÃ‘OS HÃšMEDOS PARA OPTIMIZAR CONDICIONES DE HIGIENE.','2','001',to_date('08/04/19','DD/MM/RR'),'2019-05-16','CC','32617036','080010349401');
Insert into OASIS4.WEBSERV_JUNTA_PROFESIONAL (ID_JUPR,REPO_PERIODO,REPO_SERV_ID,REPO_TIRE_ID,NOPRESCRIPCION,FPRESCRIPCION,TIPOTECNOLOGIA,CONSECUTIVO,ESTJM,CODENTPROC,OBSERVACIONES,JUSTIFICACIONTECNICA,MODALIDAD,NOACTA,FECHAACTA,FPROCESO,TIPOIDPACIENTE,NROIDPACIENTE,CODENTJM) values ('141',to_date('05/04/19','DD/MM/RR'),'9','2','20190405143011265275',to_date('05/04/19','DD/MM/RR'),'N','1','2',null,null,null,null,null,to_date('01/01/70','DD/MM/RR'),null,'CC','24937763','087580016101');
Insert into OASIS4.WEBSERV_JUNTA_PROFESIONAL (ID_JUPR,REPO_PERIODO,REPO_SERV_ID,REPO_TIRE_ID,NOPRESCRIPCION,FPRESCRIPCION,TIPOTECNOLOGIA,CONSECUTIVO,ESTJM,CODENTPROC,OBSERVACIONES,JUSTIFICACIONTECNICA,MODALIDAD,NOACTA,FECHAACTA,FPROCESO,TIPOIDPACIENTE,NROIDPACIENTE,CODENTJM) values ('142',to_date('05/04/19','DD/MM/RR'),'9','2','20190405147011266643',to_date('05/04/19','DD/MM/RR'),'N','1','3','130010178101',null,'  CONSIDERA INICIAR SUPLEMENTO NUTRICIONAL, PARA RECUPERAR MASA CORPORAL, MEJORAR DEGLUCIÃ“N, INAPETENCIA ESTADO NUTRICIONAL, COMPLETAR SUS REQUERIMientos','1','19',to_date('14/05/19','DD/MM/RR'),'2019-05-14','CC','23143745','130010178101');
Insert into OASIS4.WEBSERV_JUNTA_PROFESIONAL (ID_JUPR,REPO_PERIODO,REPO_SERV_ID,REPO_TIRE_ID,NOPRESCRIPCION,FPRESCRIPCION,TIPOTECNOLOGIA,CONSECUTIVO,ESTJM,CODENTPROC,OBSERVACIONES,JUSTIFICACIONTECNICA,MODALIDAD,NOACTA,FECHAACTA,FPROCESO,TIPOIDPACIENTE,NROIDPACIENTE,CODENTJM) values ('143',to_date('05/04/19','DD/MM/RR'),'9','2','20190405187011266908',to_date('05/04/19','DD/MM/RR'),'N','1','2',null,null,null,null,null,to_date('01/01/70','DD/MM/RR'),null,'CC','22311977','087580016101');
Insert into OASIS4.WEBSERV_JUNTA_PROFESIONAL (ID_JUPR,REPO_PERIODO,REPO_SERV_ID,REPO_TIRE_ID,NOPRESCRIPCION,FPRESCRIPCION,TIPOTECNOLOGIA,CONSECUTIVO,ESTJM,CODENTPROC,OBSERVACIONES,JUSTIFICACIONTECNICA,MODALIDAD,NOACTA,FECHAACTA,FPROCESO,TIPOIDPACIENTE,NROIDPACIENTE,CODENTJM) values ('144',to_date('05/04/19','DD/MM/RR'),'9','2','20190405178011270571',to_date('05/04/19','DD/MM/RR'),'N','1','2',null,null,null,null,null,to_date('01/01/70','DD/MM/RR'),null,'CC','1002317370','130010210201');
Insert into OASIS4.WEBSERV_JUNTA_PROFESIONAL (ID_JUPR,REPO_PERIODO,REPO_SERV_ID,REPO_TIRE_ID,NOPRESCRIPCION,FPRESCRIPCION,TIPOTECNOLOGIA,CONSECUTIVO,ESTJM,CODENTPROC,OBSERVACIONES,JUSTIFICACIONTECNICA,MODALIDAD,NOACTA,FECHAACTA,FPROCESO,TIPOIDPACIENTE,NROIDPACIENTE,CODENTJM) values ('145',to_date('05/04/19','DD/MM/RR'),'9','2','20190405100011256630',to_date('05/04/19','DD/MM/RR'),'S','1','2',null,null,null,null,null,to_date('01/01/70','DD/MM/RR'),null,'CC','32827705','085730086901');
Insert into OASIS4.WEBSERV_JUNTA_PROFESIONAL (ID_JUPR,REPO_PERIODO,REPO_SERV_ID,REPO_TIRE_ID,NOPRESCRIPCION,FPRESCRIPCION,TIPOTECNOLOGIA,CONSECUTIVO,ESTJM,CODENTPROC,OBSERVACIONES,JUSTIFICACIONTECNICA,MODALIDAD,NOACTA,FECHAACTA,FPROCESO,TIPOIDPACIENTE,NROIDPACIENTE,CODENTJM) values ('146',to_date('05/04/19','DD/MM/RR'),'9','2','20190405122011267950',to_date('05/04/19','DD/MM/RR'),'S','1','3','080010349401',null,', no tiene control de esfÃ­nteres con deterioro cognitivo progresivo','2','023',to_date('15/07/19','DD/MM/RR'),'2019-07-15','CC','32843522','080010349401');
Insert into OASIS4.WEBSERV_JUNTA_PROFESIONAL (ID_JUPR,REPO_PERIODO,REPO_SERV_ID,REPO_TIRE_ID,NOPRESCRIPCION,FPRESCRIPCION,TIPOTECNOLOGIA,CONSECUTIVO,ESTJM,CODENTPROC,OBSERVACIONES,JUSTIFICACIONTECNICA,MODALIDAD,NOACTA,FECHAACTA,FPROCESO,TIPOIDPACIENTE,NROIDPACIENTE,CODENTJM) values ('147',to_date('06/04/19','DD/MM/RR'),'9','2','20190406184011276972',to_date('06/04/19','DD/MM/RR'),'N','1','3','080010445439',null,'PACIENTE FEMENINO DE 58 AÃ‘OS CON DX MEDICO DE  RGE, dispepsia Y DX NUTRICIONAL DE DESNUTRICIÃ“N PROTEICO CALORICA SEVERA. REQUIERE SUPLEMENTO. ','1','125',to_date('12/06/19','DD/MM/RR'),'2019-06-12','CC','55240260','080010445439');
Insert into OASIS4.WEBSERV_JUNTA_PROFESIONAL (ID_JUPR,REPO_PERIODO,REPO_SERV_ID,REPO_TIRE_ID,NOPRESCRIPCION,FPRESCRIPCION,TIPOTECNOLOGIA,CONSECUTIVO,ESTJM,CODENTPROC,OBSERVACIONES,JUSTIFICACIONTECNICA,MODALIDAD,NOACTA,FECHAACTA,FPROCESO,TIPOIDPACIENTE,NROIDPACIENTE,CODENTJM) values ('148',to_date('06/04/19','DD/MM/RR'),'9','2','20190406120011278683',to_date('06/04/19','DD/MM/RR'),'S','1','3','080010054401',null,'LA JUNTA MEDICA HA REVISADO SU CASO Y DECIDEN POR CONDICION CLINICA DEL PACIENTE SE AUTORIZA EL TRASLADO EN AMBULANCIA REALIZACION DE QUIMIOTERAPIA Y 4 CITAS','1','0775',to_date('06/04/19','DD/MM/RR'),'2019-04-06','CC','22540092','080010054401');
Insert into OASIS4.WEBSERV_JUNTA_PROFESIONAL (ID_JUPR,REPO_PERIODO,REPO_SERV_ID,REPO_TIRE_ID,NOPRESCRIPCION,FPRESCRIPCION,TIPOTECNOLOGIA,CONSECUTIVO,ESTJM,CODENTPROC,OBSERVACIONES,JUSTIFICACIONTECNICA,MODALIDAD,NOACTA,FECHAACTA,FPROCESO,TIPOIDPACIENTE,NROIDPACIENTE,CODENTJM) values ('149',to_date('08/04/19','DD/MM/RR'),'9','2','20190408133011300807',to_date('08/04/19','DD/MM/RR'),'N','1','2',null,null,null,null,null,to_date('01/01/70','DD/MM/RR'),null,'RC','1130280196','087580016101');
Insert into OASIS4.WEBSERV_JUNTA_PROFESIONAL (ID_JUPR,REPO_PERIODO,REPO_SERV_ID,REPO_TIRE_ID,NOPRESCRIPCION,FPRESCRIPCION,TIPOTECNOLOGIA,CONSECUTIVO,ESTJM,CODENTPROC,OBSERVACIONES,JUSTIFICACIONTECNICA,MODALIDAD,NOACTA,FECHAACTA,FPROCESO,TIPOIDPACIENTE,NROIDPACIENTE,CODENTJM) values ('150',to_date('08/04/19','DD/MM/RR'),'9','2','20190408174011302475',to_date('08/04/19','DD/MM/RR'),'N','1','2',null,null,null,null,null,to_date('01/01/70','DD/MM/RR'),null,'RC','1140898253','087580053302');
Insert into OASIS4.WEBSERV_JUNTA_PROFESIONAL (ID_JUPR,REPO_PERIODO,REPO_SERV_ID,REPO_TIRE_ID,NOPRESCRIPCION,FPRESCRIPCION,TIPOTECNOLOGIA,CONSECUTIVO,ESTJM,CODENTPROC,OBSERVACIONES,JUSTIFICACIONTECNICA,MODALIDAD,NOACTA,FECHAACTA,FPROCESO,TIPOIDPACIENTE,NROIDPACIENTE,CODENTJM) values ('151',to_date('08/04/19','DD/MM/RR'),'9','2','20190408119011306410',to_date('08/04/19','DD/MM/RR'),'N','1','3','080010445403',null,'paciente con perdida progresiva de peso, asociado a secuelas de ecv isquemica, con disfagia a sÃ³lidos,  se considera inicio de suplementaciÃ³n nutricional.','1','1',to_date('10/04/19','DD/MM/RR'),'2019-04-10','CC','831942','080010445403');
Insert into OASIS4.WEBSERV_JUNTA_PROFESIONAL (ID_JUPR,REPO_PERIODO,REPO_SERV_ID,REPO_TIRE_ID,NOPRESCRIPCION,FPRESCRIPCION,TIPOTECNOLOGIA,CONSECUTIVO,ESTJM,CODENTPROC,OBSERVACIONES,JUSTIFICACIONTECNICA,MODALIDAD,NOACTA,FECHAACTA,FPROCESO,TIPOIDPACIENTE,NROIDPACIENTE,CODENTJM) values ('152',to_date('08/04/19','DD/MM/RR'),'9','2','20190408135011289456',to_date('08/04/19','DD/MM/RR'),'S','1','3','470010096901',null,'PACIENTE CON SECUELAS DE ENFERMEDAD CEREBRO VASCULAR CON TRAQUEOSTOMIA Y GASTROSTOMÃ?A CON DEPENDENCIA FUNCIONAL TOTAL POR LO Q REQUIERE SER TRASLADADO EN AMBUL','1','871',to_date('08/04/19','DD/MM/RR'),'2019-04-08','CC','26951444','470010096901');
Insert into OASIS4.WEBSERV_JUNTA_PROFESIONAL (ID_JUPR,REPO_PERIODO,REPO_SERV_ID,REPO_TIRE_ID,NOPRESCRIPCION,FPRESCRIPCION,TIPOTECNOLOGIA,CONSECUTIVO,ESTJM,CODENTPROC,OBSERVACIONES,JUSTIFICACIONTECNICA,MODALIDAD,NOACTA,FECHAACTA,FPROCESO,TIPOIDPACIENTE,NROIDPACIENTE,CODENTJM) values ('153',to_date('08/04/19','DD/MM/RR'),'9','2','20190408120011291170',to_date('08/04/19','DD/MM/RR'),'S','1','3','470010096901',null,'PACIENTE CON SECUELAS NEUROLÃ“GICAS DE ENFERMEDAD CEREBRO VASCULAR Y POSTRADO EN CAMA CON TRAQUEOSTOMÃ?A Y GASTROSTOMÃ?A CON DEPENDENCIA TOTAL QUE IMPIDEN TRASLADO','1','872',to_date('08/04/19','DD/MM/RR'),'2019-04-08','CC','5133831','470010096901');
Insert into OASIS4.WEBSERV_JUNTA_PROFESIONAL (ID_JUPR,REPO_PERIODO,REPO_SERV_ID,REPO_TIRE_ID,NOPRESCRIPCION,FPRESCRIPCION,TIPOTECNOLOGIA,CONSECUTIVO,ESTJM,CODENTPROC,OBSERVACIONES,JUSTIFICACIONTECNICA,MODALIDAD,NOACTA,FECHAACTA,FPROCESO,TIPOIDPACIENTE,NROIDPACIENTE,CODENTJM) values ('154',to_date('08/04/19','DD/MM/RR'),'9','2','20190408119011300774',to_date('08/04/19','DD/MM/RR'),'S','1','3','470010096901',null,'PACIENTE CON TRAUMA RAQUIMEDULAR EL CUAL NO SE PUEDE TRASLADAR POR SU PROPIOS MEDIOS PARA CITA MÃ‰DICA DE CONTROL REQUIERE TRASLADO EN AMBULANCIA REDONDO ','1','873',to_date('08/04/19','DD/MM/RR'),'2019-04-08','CC','5107258','470010096901');
Insert into OASIS4.WEBSERV_JUNTA_PROFESIONAL (ID_JUPR,REPO_PERIODO,REPO_SERV_ID,REPO_TIRE_ID,NOPRESCRIPCION,FPRESCRIPCION,TIPOTECNOLOGIA,CONSECUTIVO,ESTJM,CODENTPROC,OBSERVACIONES,JUSTIFICACIONTECNICA,MODALIDAD,NOACTA,FECHAACTA,FPROCESO,TIPOIDPACIENTE,NROIDPACIENTE,CODENTJM) values ('155',to_date('08/04/19','DD/MM/RR'),'9','2','20190408196011307093',to_date('08/04/19','DD/MM/RR'),'S','1','2',null,null,null,null,null,to_date('01/01/70','DD/MM/RR'),null,'CC','32915023','134300290801');
Insert into OASIS4.WEBSERV_JUNTA_PROFESIONAL (ID_JUPR,REPO_PERIODO,REPO_SERV_ID,REPO_TIRE_ID,NOPRESCRIPCION,FPRESCRIPCION,TIPOTECNOLOGIA,CONSECUTIVO,ESTJM,CODENTPROC,OBSERVACIONES,JUSTIFICACIONTECNICA,MODALIDAD,NOACTA,FECHAACTA,FPROCESO,TIPOIDPACIENTE,NROIDPACIENTE,CODENTJM) values ('156',to_date('09/04/19','DD/MM/RR'),'9','2','20190409168011310139',to_date('09/04/19','DD/MM/RR'),'N','1','2',null,null,null,null,null,to_date('01/01/70','DD/MM/RR'),null,'CC','2525259','660010178901');
Insert into OASIS4.WEBSERV_JUNTA_PROFESIONAL (ID_JUPR,REPO_PERIODO,REPO_SERV_ID,REPO_TIRE_ID,NOPRESCRIPCION,FPRESCRIPCION,TIPOTECNOLOGIA,CONSECUTIVO,ESTJM,CODENTPROC,OBSERVACIONES,JUSTIFICACIONTECNICA,MODALIDAD,NOACTA,FECHAACTA,FPROCESO,TIPOIDPACIENTE,NROIDPACIENTE,CODENTJM) values ('157',to_date('09/04/19','DD/MM/RR'),'9','2','20190409135011311966',to_date('09/04/19','DD/MM/RR'),'N','1','3','082960002101',null,'DESNUTRICIÃ“N PROTEICO CALORICA','1','0002',to_date('09/04/19','DD/MM/RR'),'2019-04-09','RC','1041852508','082960002101');
Insert into OASIS4.WEBSERV_JUNTA_PROFESIONAL (ID_JUPR,REPO_PERIODO,REPO_SERV_ID,REPO_TIRE_ID,NOPRESCRIPCION,FPRESCRIPCION,TIPOTECNOLOGIA,CONSECUTIVO,ESTJM,CODENTPROC,OBSERVACIONES,JUSTIFICACIONTECNICA,MODALIDAD,NOACTA,FECHAACTA,FPROCESO,TIPOIDPACIENTE,NROIDPACIENTE,CODENTJM) values ('158',to_date('09/04/19','DD/MM/RR'),'9','2','20190409170011314547',to_date('09/04/19','DD/MM/RR'),'N','1','2',null,null,null,null,null,to_date('01/01/70','DD/MM/RR'),null,'TI','1042260914','087580053305');
Insert into OASIS4.WEBSERV_JUNTA_PROFESIONAL (ID_JUPR,REPO_PERIODO,REPO_SERV_ID,REPO_TIRE_ID,NOPRESCRIPCION,FPRESCRIPCION,TIPOTECNOLOGIA,CONSECUTIVO,ESTJM,CODENTPROC,OBSERVACIONES,JUSTIFICACIONTECNICA,MODALIDAD,NOACTA,FECHAACTA,FPROCESO,TIPOIDPACIENTE,NROIDPACIENTE,CODENTJM) values ('159',to_date('09/04/19','DD/MM/RR'),'9','2','20190409199011317443',to_date('09/04/19','DD/MM/RR'),'N','1','3','086340010501',null,'PACIENTE DE 70 AÃ‘OS DE EDAD CON PESO DE 37 KG TALLA 146 CM IMC 17 DIAGNOSTICO NUTRICIONAL DELGADEZ LEVE , CUENTA CON POCO APETITO, SOLO COME TRES TIEMPOS DE COM','1','13',to_date('09/04/19','DD/MM/RR'),'2019-04-09','CC','22621861','086340010501');
Insert into OASIS4.WEBSERV_JUNTA_PROFESIONAL (ID_JUPR,REPO_PERIODO,REPO_SERV_ID,REPO_TIRE_ID,NOPRESCRIPCION,FPRESCRIPCION,TIPOTECNOLOGIA,CONSECUTIVO,ESTJM,CODENTPROC,OBSERVACIONES,JUSTIFICACIONTECNICA,MODALIDAD,NOACTA,FECHAACTA,FPROCESO,TIPOIDPACIENTE,NROIDPACIENTE,CODENTJM) values ('160',to_date('09/04/19','DD/MM/RR'),'9','2','20190409130011328222',to_date('09/04/19','DD/MM/RR'),'N','1','3','080010445414',null,'PACIENTE FEMENINA DE 92 AÃ‘OS CON DX MEDICO Alzheimer, bajo peso, dificultad para deglutir alimentos Y DX NUTRICIONAL Desnutricion proteico calorica severa\n','1','164',to_date('13/06/19','DD/MM/RR'),'2019-06-13','CC','22946348','080010445414');
Insert into OASIS4.WEBSERV_JUNTA_PROFESIONAL (ID_JUPR,REPO_PERIODO,REPO_SERV_ID,REPO_TIRE_ID,NOPRESCRIPCION,FPRESCRIPCION,TIPOTECNOLOGIA,CONSECUTIVO,ESTJM,CODENTPROC,OBSERVACIONES,JUSTIFICACIONTECNICA,MODALIDAD,NOACTA,FECHAACTA,FPROCESO,TIPOIDPACIENTE,NROIDPACIENTE,CODENTJM) values ('161',to_date('09/04/19','DD/MM/RR'),'9','2','20190409112011315302',to_date('09/04/19','DD/MM/RR'),'S','1','2',null,null,null,null,null,to_date('01/01/70','DD/MM/RR'),null,'TI','1042260914','087580053305');
Insert into OASIS4.WEBSERV_JUNTA_PROFESIONAL (ID_JUPR,REPO_PERIODO,REPO_SERV_ID,REPO_TIRE_ID,NOPRESCRIPCION,FPRESCRIPCION,TIPOTECNOLOGIA,CONSECUTIVO,ESTJM,CODENTPROC,OBSERVACIONES,JUSTIFICACIONTECNICA,MODALIDAD,NOACTA,FECHAACTA,FPROCESO,TIPOIDPACIENTE,NROIDPACIENTE,CODENTJM) values ('162',to_date('10/04/19','DD/MM/RR'),'9','2','20190410170011338035',to_date('10/04/19','DD/MM/RR'),'N','1','3','080010226001',null,'APROBADO, DIAGNOSTICO CONCUERDA CON LA JUSTIFICACION CLINICA Y ORDENAMIENTO MEDICO','1','0905201907',to_date('09/05/19','DD/MM/RR'),'2019-05-09','RC','1043172059','080010226001');
Insert into OASIS4.WEBSERV_JUNTA_PROFESIONAL (ID_JUPR,REPO_PERIODO,REPO_SERV_ID,REPO_TIRE_ID,NOPRESCRIPCION,FPRESCRIPCION,TIPOTECNOLOGIA,CONSECUTIVO,ESTJM,CODENTPROC,OBSERVACIONES,JUSTIFICACIONTECNICA,MODALIDAD,NOACTA,FECHAACTA,FPROCESO,TIPOIDPACIENTE,NROIDPACIENTE,CODENTJM) values ('163',to_date('10/04/19','DD/MM/RR'),'9','2','20190410185011342945',to_date('10/04/19','DD/MM/RR'),'N','1','2',null,null,null,null,null,to_date('01/01/70','DD/MM/RR'),null,'CC','880755','130010178101');
Insert into OASIS4.WEBSERV_JUNTA_PROFESIONAL (ID_JUPR,REPO_PERIODO,REPO_SERV_ID,REPO_TIRE_ID,NOPRESCRIPCION,FPRESCRIPCION,TIPOTECNOLOGIA,CONSECUTIVO,ESTJM,CODENTPROC,OBSERVACIONES,JUSTIFICACIONTECNICA,MODALIDAD,NOACTA,FECHAACTA,FPROCESO,TIPOIDPACIENTE,NROIDPACIENTE,CODENTJM) values ('164',to_date('10/04/19','DD/MM/RR'),'9','2','20190410195011347070',to_date('10/04/19','DD/MM/RR'),'N','1','2',null,null,null,null,null,to_date('01/01/70','DD/MM/RR'),null,'CC','22595397','086380015401');
Insert into OASIS4.WEBSERV_JUNTA_PROFESIONAL (ID_JUPR,REPO_PERIODO,REPO_SERV_ID,REPO_TIRE_ID,NOPRESCRIPCION,FPRESCRIPCION,TIPOTECNOLOGIA,CONSECUTIVO,ESTJM,CODENTPROC,OBSERVACIONES,JUSTIFICACIONTECNICA,MODALIDAD,NOACTA,FECHAACTA,FPROCESO,TIPOIDPACIENTE,NROIDPACIENTE,CODENTJM) values ('18',to_date('17/01/19','DD/MM/RR'),'9','2','20190117188009997059',to_date('17/01/19','DD/MM/RR'),'N','1','3','080010054401',null,'LA JUNTA MEDICA HA REVISADO SU CASO Y DECIDEN POR CONDICION CLINICA DEL PACIENTE SE AUTORIZA EL USO DE FORMULA NUTRICIONAL POLIMERICA ENSURE PLUS HN  237 ML','1','0702',to_date('01/01/70','DD/MM/RR'),'2019-01-17','CC','55245518','080010054401');
Insert into OASIS4.WEBSERV_JUNTA_PROFESIONAL (ID_JUPR,REPO_PERIODO,REPO_SERV_ID,REPO_TIRE_ID,NOPRESCRIPCION,FPRESCRIPCION,TIPOTECNOLOGIA,CONSECUTIVO,ESTJM,CODENTPROC,OBSERVACIONES,JUSTIFICACIONTECNICA,MODALIDAD,NOACTA,FECHAACTA,FPROCESO,TIPOIDPACIENTE,NROIDPACIENTE,CODENTJM) values ('19',to_date('01/02/19','DD/MM/RR'),'9','2','20190201137010239474',to_date('01/02/19','DD/MM/RR'),'N','1','2',null,null,null,null,null,to_date('01/01/70','DD/MM/RR'),null,'RC','1047347317','080010112201');
Insert into OASIS4.WEBSERV_JUNTA_PROFESIONAL (ID_JUPR,REPO_PERIODO,REPO_SERV_ID,REPO_TIRE_ID,NOPRESCRIPCION,FPRESCRIPCION,TIPOTECNOLOGIA,CONSECUTIVO,ESTJM,CODENTPROC,OBSERVACIONES,JUSTIFICACIONTECNICA,MODALIDAD,NOACTA,FECHAACTA,FPROCESO,TIPOIDPACIENTE,NROIDPACIENTE,CODENTJM) values ('20',to_date('01/02/19','DD/MM/RR'),'9','2','20190201174010239893',to_date('01/02/19','DD/MM/RR'),'N','1','2',null,null,null,null,null,to_date('01/01/70','DD/MM/RR'),null,'TI','1048404759','080010112201');
Insert into OASIS4.WEBSERV_JUNTA_PROFESIONAL (ID_JUPR,REPO_PERIODO,REPO_SERV_ID,REPO_TIRE_ID,NOPRESCRIPCION,FPRESCRIPCION,TIPOTECNOLOGIA,CONSECUTIVO,ESTJM,CODENTPROC,OBSERVACIONES,JUSTIFICACIONTECNICA,MODALIDAD,NOACTA,FECHAACTA,FPROCESO,TIPOIDPACIENTE,NROIDPACIENTE,CODENTJM) values ('21',to_date('04/02/19','DD/MM/RR'),'9','2','20190204173010262707',to_date('04/02/19','DD/MM/RR'),'N','1','2',null,null,null,null,null,to_date('01/01/70','DD/MM/RR'),null,'TI','1043932115','080010112201');
Insert into OASIS4.WEBSERV_JUNTA_PROFESIONAL (ID_JUPR,REPO_PERIODO,REPO_SERV_ID,REPO_TIRE_ID,NOPRESCRIPCION,FPRESCRIPCION,TIPOTECNOLOGIA,CONSECUTIVO,ESTJM,CODENTPROC,OBSERVACIONES,JUSTIFICACIONTECNICA,MODALIDAD,NOACTA,FECHAACTA,FPROCESO,TIPOIDPACIENTE,NROIDPACIENTE,CODENTJM) values ('22',to_date('04/02/19','DD/MM/RR'),'9','2','20190204168010266752',to_date('04/02/19','DD/MM/RR'),'N','1','2',null,null,null,null,null,to_date('01/01/70','DD/MM/RR'),null,'RC','1044434289','080010112201');
Insert into OASIS4.WEBSERV_JUNTA_PROFESIONAL (ID_JUPR,REPO_PERIODO,REPO_SERV_ID,REPO_TIRE_ID,NOPRESCRIPCION,FPRESCRIPCION,TIPOTECNOLOGIA,CONSECUTIVO,ESTJM,CODENTPROC,OBSERVACIONES,JUSTIFICACIONTECNICA,MODALIDAD,NOACTA,FECHAACTA,FPROCESO,TIPOIDPACIENTE,NROIDPACIENTE,CODENTJM) values ('23',to_date('04/02/19','DD/MM/RR'),'9','2','20190204190010267282',to_date('04/02/19','DD/MM/RR'),'N','1','2',null,null,null,null,null,to_date('01/01/70','DD/MM/RR'),null,'CC','22431647','080010112201');
Insert into OASIS4.WEBSERV_JUNTA_PROFESIONAL (ID_JUPR,REPO_PERIODO,REPO_SERV_ID,REPO_TIRE_ID,NOPRESCRIPCION,FPRESCRIPCION,TIPOTECNOLOGIA,CONSECUTIVO,ESTJM,CODENTPROC,OBSERVACIONES,JUSTIFICACIONTECNICA,MODALIDAD,NOACTA,FECHAACTA,FPROCESO,TIPOIDPACIENTE,NROIDPACIENTE,CODENTJM) values ('24',to_date('05/02/19','DD/MM/RR'),'9','2','20190205119010286366',to_date('05/02/19','DD/MM/RR'),'N','1','2',null,null,null,null,null,to_date('01/01/70','DD/MM/RR'),null,'CC','22581415','080010112201');
Insert into OASIS4.WEBSERV_JUNTA_PROFESIONAL (ID_JUPR,REPO_PERIODO,REPO_SERV_ID,REPO_TIRE_ID,NOPRESCRIPCION,FPRESCRIPCION,TIPOTECNOLOGIA,CONSECUTIVO,ESTJM,CODENTPROC,OBSERVACIONES,JUSTIFICACIONTECNICA,MODALIDAD,NOACTA,FECHAACTA,FPROCESO,TIPOIDPACIENTE,NROIDPACIENTE,CODENTJM) values ('25',to_date('05/02/19','DD/MM/RR'),'9','2','20190205146010303207',to_date('05/02/19','DD/MM/RR'),'N','1','2',null,null,null,null,null,to_date('01/01/70','DD/MM/RR'),null,'CC','22635003','086380021701');
Insert into OASIS4.WEBSERV_JUNTA_PROFESIONAL (ID_JUPR,REPO_PERIODO,REPO_SERV_ID,REPO_TIRE_ID,NOPRESCRIPCION,FPRESCRIPCION,TIPOTECNOLOGIA,CONSECUTIVO,ESTJM,CODENTPROC,OBSERVACIONES,JUSTIFICACIONTECNICA,MODALIDAD,NOACTA,FECHAACTA,FPROCESO,TIPOIDPACIENTE,NROIDPACIENTE,CODENTJM) values ('26',to_date('06/02/19','DD/MM/RR'),'9','2','20190206171010312708',to_date('06/02/19','DD/MM/RR'),'N','1','2',null,null,null,null,null,to_date('01/01/70','DD/MM/RR'),null,'RC','1048405620','080010112201');
Insert into OASIS4.WEBSERV_JUNTA_PROFESIONAL (ID_JUPR,REPO_PERIODO,REPO_SERV_ID,REPO_TIRE_ID,NOPRESCRIPCION,FPRESCRIPCION,TIPOTECNOLOGIA,CONSECUTIVO,ESTJM,CODENTPROC,OBSERVACIONES,JUSTIFICACIONTECNICA,MODALIDAD,NOACTA,FECHAACTA,FPROCESO,TIPOIDPACIENTE,NROIDPACIENTE,CODENTJM) values ('27',to_date('07/02/19','DD/MM/RR'),'9','2','20190207170010336117',to_date('07/02/19','DD/MM/RR'),'M','1','2',null,null,null,null,null,to_date('01/01/70','DD/MM/RR'),null,'CC','39025811','080010133501');
Insert into OASIS4.WEBSERV_JUNTA_PROFESIONAL (ID_JUPR,REPO_PERIODO,REPO_SERV_ID,REPO_TIRE_ID,NOPRESCRIPCION,FPRESCRIPCION,TIPOTECNOLOGIA,CONSECUTIVO,ESTJM,CODENTPROC,OBSERVACIONES,JUSTIFICACIONTECNICA,MODALIDAD,NOACTA,FECHAACTA,FPROCESO,TIPOIDPACIENTE,NROIDPACIENTE,CODENTJM) values ('28',to_date('08/02/19','DD/MM/RR'),'9','2','20190208125010352161',to_date('08/02/19','DD/MM/RR'),'N','1','2',null,null,null,null,null,to_date('01/01/70','DD/MM/RR'),null,'CC','32613698','080010112201');
Insert into OASIS4.WEBSERV_JUNTA_PROFESIONAL (ID_JUPR,REPO_PERIODO,REPO_SERV_ID,REPO_TIRE_ID,NOPRESCRIPCION,FPRESCRIPCION,TIPOTECNOLOGIA,CONSECUTIVO,ESTJM,CODENTPROC,OBSERVACIONES,JUSTIFICACIONTECNICA,MODALIDAD,NOACTA,FECHAACTA,FPROCESO,TIPOIDPACIENTE,NROIDPACIENTE,CODENTJM) values ('16',to_date('17/01/19','DD/MM/RR'),'9','2','20190117129009995464',to_date('17/01/19','DD/MM/RR'),'N','1','3','080010054401',null,'LA JUNTA MEDICA HA REVISADO SU CASO Y DECIDEN POR CONDICION CLINICA DEL PACIENTE SE AUTORIZA EL USO DE FORMULA NUTRICIONAL PROWHEY NET  ','1','0701',to_date('01/01/70','DD/MM/RR'),'2019-01-17','CC','1047360412','080010054401');
Insert into OASIS4.WEBSERV_JUNTA_PROFESIONAL (ID_JUPR,REPO_PERIODO,REPO_SERV_ID,REPO_TIRE_ID,NOPRESCRIPCION,FPRESCRIPCION,TIPOTECNOLOGIA,CONSECUTIVO,ESTJM,CODENTPROC,OBSERVACIONES,JUSTIFICACIONTECNICA,MODALIDAD,NOACTA,FECHAACTA,FPROCESO,TIPOIDPACIENTE,NROIDPACIENTE,CODENTJM) values ('17',to_date('17/01/19','DD/MM/RR'),'9','2','20190117132009996930',to_date('17/01/19','DD/MM/RR'),'N','1','2',null,null,null,null,null,to_date('01/01/70','DD/MM/RR'),null,'CC','55245518','080010054401');
Insert into OASIS4.WEBSERV_JUNTA_PROFESIONAL (ID_JUPR,REPO_PERIODO,REPO_SERV_ID,REPO_TIRE_ID,NOPRESCRIPCION,FPRESCRIPCION,TIPOTECNOLOGIA,CONSECUTIVO,ESTJM,CODENTPROC,OBSERVACIONES,JUSTIFICACIONTECNICA,MODALIDAD,NOACTA,FECHAACTA,FPROCESO,TIPOIDPACIENTE,NROIDPACIENTE,CODENTJM) values ('29',to_date('08/02/19','DD/MM/RR'),'9','2','20190208177010357124',to_date('08/02/19','DD/MM/RR'),'N','1','2',null,null,null,null,null,to_date('01/01/70','DD/MM/RR'),null,'CC','22619040','080010112201');
Insert into OASIS4.WEBSERV_JUNTA_PROFESIONAL (ID_JUPR,REPO_PERIODO,REPO_SERV_ID,REPO_TIRE_ID,NOPRESCRIPCION,FPRESCRIPCION,TIPOTECNOLOGIA,CONSECUTIVO,ESTJM,CODENTPROC,OBSERVACIONES,JUSTIFICACIONTECNICA,MODALIDAD,NOACTA,FECHAACTA,FPROCESO,TIPOIDPACIENTE,NROIDPACIENTE,CODENTJM) values ('30',to_date('09/02/19','DD/MM/RR'),'9','2','20190209172010369113',to_date('09/02/19','DD/MM/RR'),'N','1','3','080010054401',null,'LA JUNTA MEDICA HA REVISADO SU CASO Y DECIDEN POR CONDICION CLINICA DEL PACIENTE SE AUTORIZA EL USO DE FORMULA NUTRICIONAL PROWHEY NET LATA 434 GRAMOS','1','0724',to_date('01/01/70','DD/MM/RR'),'2019-02-09','CC','32616585','080010054401');
Insert into OASIS4.WEBSERV_JUNTA_PROFESIONAL (ID_JUPR,REPO_PERIODO,REPO_SERV_ID,REPO_TIRE_ID,NOPRESCRIPCION,FPRESCRIPCION,TIPOTECNOLOGIA,CONSECUTIVO,ESTJM,CODENTPROC,OBSERVACIONES,JUSTIFICACIONTECNICA,MODALIDAD,NOACTA,FECHAACTA,FPROCESO,TIPOIDPACIENTE,NROIDPACIENTE,CODENTJM) values ('31',to_date('11/02/19','DD/MM/RR'),'9','2','20190211140010378900',to_date('11/02/19','DD/MM/RR'),'N','1','2',null,null,null,null,null,to_date('01/01/70','DD/MM/RR'),null,'CC','26741917','080010112201');
Insert into OASIS4.WEBSERV_JUNTA_PROFESIONAL (ID_JUPR,REPO_PERIODO,REPO_SERV_ID,REPO_TIRE_ID,NOPRESCRIPCION,FPRESCRIPCION,TIPOTECNOLOGIA,CONSECUTIVO,ESTJM,CODENTPROC,OBSERVACIONES,JUSTIFICACIONTECNICA,MODALIDAD,NOACTA,FECHAACTA,FPROCESO,TIPOIDPACIENTE,NROIDPACIENTE,CODENTJM) values ('32',to_date('11/02/19','DD/MM/RR'),'9','2','20190211175010387918',to_date('11/02/19','DD/MM/RR'),'N','1','2',null,null,null,null,null,to_date('01/01/70','DD/MM/RR'),null,'RC','1042358469','080010112201');
Insert into OASIS4.WEBSERV_JUNTA_PROFESIONAL (ID_JUPR,REPO_PERIODO,REPO_SERV_ID,REPO_TIRE_ID,NOPRESCRIPCION,FPRESCRIPCION,TIPOTECNOLOGIA,CONSECUTIVO,ESTJM,CODENTPROC,OBSERVACIONES,JUSTIFICACIONTECNICA,MODALIDAD,NOACTA,FECHAACTA,FPROCESO,TIPOIDPACIENTE,NROIDPACIENTE,CODENTJM) values ('33',to_date('11/02/19','DD/MM/RR'),'9','2','20190211143010391125',to_date('11/02/19','DD/MM/RR'),'S','1','2',null,null,null,null,null,to_date('01/01/70','DD/MM/RR'),null,'CC','1143147363','080010003601');
Insert into OASIS4.WEBSERV_JUNTA_PROFESIONAL (ID_JUPR,REPO_PERIODO,REPO_SERV_ID,REPO_TIRE_ID,NOPRESCRIPCION,FPRESCRIPCION,TIPOTECNOLOGIA,CONSECUTIVO,ESTJM,CODENTPROC,OBSERVACIONES,JUSTIFICACIONTECNICA,MODALIDAD,NOACTA,FECHAACTA,FPROCESO,TIPOIDPACIENTE,NROIDPACIENTE,CODENTJM) values ('34',to_date('12/02/19','DD/MM/RR'),'9','2','20190212128010398788',to_date('12/02/19','DD/MM/RR'),'N','1','2',null,null,null,null,null,to_date('01/01/70','DD/MM/RR'),null,'CC','1048266347','080010112201');
Insert into OASIS4.WEBSERV_JUNTA_PROFESIONAL (ID_JUPR,REPO_PERIODO,REPO_SERV_ID,REPO_TIRE_ID,NOPRESCRIPCION,FPRESCRIPCION,TIPOTECNOLOGIA,CONSECUTIVO,ESTJM,CODENTPROC,OBSERVACIONES,JUSTIFICACIONTECNICA,MODALIDAD,NOACTA,FECHAACTA,FPROCESO,TIPOIDPACIENTE,NROIDPACIENTE,CODENTJM) values ('35',to_date('12/02/19','DD/MM/RR'),'9','2','20190212167010401363',to_date('12/02/19','DD/MM/RR'),'N','1','2',null,null,null,null,null,to_date('01/01/70','DD/MM/RR'),null,'RC','1043878966','080010112201');
Insert into OASIS4.WEBSERV_JUNTA_PROFESIONAL (ID_JUPR,REPO_PERIODO,REPO_SERV_ID,REPO_TIRE_ID,NOPRESCRIPCION,FPRESCRIPCION,TIPOTECNOLOGIA,CONSECUTIVO,ESTJM,CODENTPROC,OBSERVACIONES,JUSTIFICACIONTECNICA,MODALIDAD,NOACTA,FECHAACTA,FPROCESO,TIPOIDPACIENTE,NROIDPACIENTE,CODENTJM) values ('36',to_date('12/02/19','DD/MM/RR'),'9','2','20190212193010403106',to_date('12/02/19','DD/MM/RR'),'N','1','2',null,null,null,null,null,to_date('01/01/70','DD/MM/RR'),null,'CC','25772630','080010112201');
Insert into OASIS4.WEBSERV_JUNTA_PROFESIONAL (ID_JUPR,REPO_PERIODO,REPO_SERV_ID,REPO_TIRE_ID,NOPRESCRIPCION,FPRESCRIPCION,TIPOTECNOLOGIA,CONSECUTIVO,ESTJM,CODENTPROC,OBSERVACIONES,JUSTIFICACIONTECNICA,MODALIDAD,NOACTA,FECHAACTA,FPROCESO,TIPOIDPACIENTE,NROIDPACIENTE,CODENTJM) values ('37',to_date('13/02/19','DD/MM/RR'),'9','2','20190213153010420265',to_date('13/02/19','DD/MM/RR'),'M','1','2',null,null,null,null,null,to_date('01/01/70','DD/MM/RR'),null,'TI','1043155383','050010210401');
Insert into OASIS4.WEBSERV_JUNTA_PROFESIONAL (ID_JUPR,REPO_PERIODO,REPO_SERV_ID,REPO_TIRE_ID,NOPRESCRIPCION,FPRESCRIPCION,TIPOTECNOLOGIA,CONSECUTIVO,ESTJM,CODENTPROC,OBSERVACIONES,JUSTIFICACIONTECNICA,MODALIDAD,NOACTA,FECHAACTA,FPROCESO,TIPOIDPACIENTE,NROIDPACIENTE,CODENTJM) values ('38',to_date('13/02/19','DD/MM/RR'),'9','2','20190213170010428448',to_date('13/02/19','DD/MM/RR'),'M','1','3','050010210401',null,'En trasplante alogÃ©nico de cÃ©l madre requiere profilaxis de la Enf veno-oclusiva en Ptes sometidos a trasplante de progenitores hematopoyÃ©ticos ya que presenta ','1','2095',to_date('01/01/70','DD/MM/RR'),'2019-02-15','TI','1043155383','050010210401');
Insert into OASIS4.WEBSERV_JUNTA_PROFESIONAL (ID_JUPR,REPO_PERIODO,REPO_SERV_ID,REPO_TIRE_ID,NOPRESCRIPCION,FPRESCRIPCION,TIPOTECNOLOGIA,CONSECUTIVO,ESTJM,CODENTPROC,OBSERVACIONES,JUSTIFICACIONTECNICA,MODALIDAD,NOACTA,FECHAACTA,FPROCESO,TIPOIDPACIENTE,NROIDPACIENTE,CODENTJM) values ('39',to_date('13/02/19','DD/MM/RR'),'9','2','20190213181010421000',to_date('13/02/19','DD/MM/RR'),'S','1','2',null,null,null,null,null,to_date('01/01/70','DD/MM/RR'),null,'CC','32583828','080010349401');
Insert into OASIS4.WEBSERV_JUNTA_PROFESIONAL (ID_JUPR,REPO_PERIODO,REPO_SERV_ID,REPO_TIRE_ID,NOPRESCRIPCION,FPRESCRIPCION,TIPOTECNOLOGIA,CONSECUTIVO,ESTJM,CODENTPROC,OBSERVACIONES,JUSTIFICACIONTECNICA,MODALIDAD,NOACTA,FECHAACTA,FPROCESO,TIPOIDPACIENTE,NROIDPACIENTE,CODENTJM) values ('40',to_date('13/02/19','DD/MM/RR'),'9','2','20190213166010421146',to_date('13/02/19','DD/MM/RR'),'S','1','2',null,null,null,null,null,to_date('01/01/70','DD/MM/RR'),null,'CC','32614302','080010349401');
Insert into OASIS4.WEBSERV_JUNTA_PROFESIONAL (ID_JUPR,REPO_PERIODO,REPO_SERV_ID,REPO_TIRE_ID,NOPRESCRIPCION,FPRESCRIPCION,TIPOTECNOLOGIA,CONSECUTIVO,ESTJM,CODENTPROC,OBSERVACIONES,JUSTIFICACIONTECNICA,MODALIDAD,NOACTA,FECHAACTA,FPROCESO,TIPOIDPACIENTE,NROIDPACIENTE,CODENTJM) values ('41',to_date('14/02/19','DD/MM/RR'),'9','2','20190214112010454329',to_date('14/02/19','DD/MM/RR'),'S','1','2',null,null,null,null,null,to_date('01/01/70','DD/MM/RR'),null,'CC','1002142459','080010003601');
Insert into OASIS4.WEBSERV_JUNTA_PROFESIONAL (ID_JUPR,REPO_PERIODO,REPO_SERV_ID,REPO_TIRE_ID,NOPRESCRIPCION,FPRESCRIPCION,TIPOTECNOLOGIA,CONSECUTIVO,ESTJM,CODENTPROC,OBSERVACIONES,JUSTIFICACIONTECNICA,MODALIDAD,NOACTA,FECHAACTA,FPROCESO,TIPOIDPACIENTE,NROIDPACIENTE,CODENTJM) values ('42',to_date('15/02/19','DD/MM/RR'),'9','2','20190215178010464120',to_date('15/02/19','DD/MM/RR'),'N','1','2',null,null,null,null,null,to_date('01/01/70','DD/MM/RR'),null,'CC','8740486','080010112201');
Insert into OASIS4.WEBSERV_JUNTA_PROFESIONAL (ID_JUPR,REPO_PERIODO,REPO_SERV_ID,REPO_TIRE_ID,NOPRESCRIPCION,FPRESCRIPCION,TIPOTECNOLOGIA,CONSECUTIVO,ESTJM,CODENTPROC,OBSERVACIONES,JUSTIFICACIONTECNICA,MODALIDAD,NOACTA,FECHAACTA,FPROCESO,TIPOIDPACIENTE,NROIDPACIENTE,CODENTJM) values ('43',to_date('15/02/19','DD/MM/RR'),'9','2','20190215197010466242',to_date('15/02/19','DD/MM/RR'),'N','1','2',null,null,null,null,null,to_date('01/01/70','DD/MM/RR'),null,'CC','22475018','080010112201');
Insert into OASIS4.WEBSERV_JUNTA_PROFESIONAL (ID_JUPR,REPO_PERIODO,REPO_SERV_ID,REPO_TIRE_ID,NOPRESCRIPCION,FPRESCRIPCION,TIPOTECNOLOGIA,CONSECUTIVO,ESTJM,CODENTPROC,OBSERVACIONES,JUSTIFICACIONTECNICA,MODALIDAD,NOACTA,FECHAACTA,FPROCESO,TIPOIDPACIENTE,NROIDPACIENTE,CODENTJM) values ('44',to_date('15/02/19','DD/MM/RR'),'9','2','20190215161010467231',to_date('15/02/19','DD/MM/RR'),'N','1','2',null,null,null,null,null,to_date('01/01/70','DD/MM/RR'),null,'RC','1045751954','080010112201');
Insert into OASIS4.WEBSERV_JUNTA_PROFESIONAL (ID_JUPR,REPO_PERIODO,REPO_SERV_ID,REPO_TIRE_ID,NOPRESCRIPCION,FPRESCRIPCION,TIPOTECNOLOGIA,CONSECUTIVO,ESTJM,CODENTPROC,OBSERVACIONES,JUSTIFICACIONTECNICA,MODALIDAD,NOACTA,FECHAACTA,FPROCESO,TIPOIDPACIENTE,NROIDPACIENTE,CODENTJM) values ('45',to_date('15/02/19','DD/MM/RR'),'9','2','20190215124010475520',to_date('15/02/19','DD/MM/RR'),'N','1','2',null,null,null,null,null,to_date('01/01/70','DD/MM/RR'),null,'TI','1001878512','080010112201');
Insert into OASIS4.WEBSERV_JUNTA_PROFESIONAL (ID_JUPR,REPO_PERIODO,REPO_SERV_ID,REPO_TIRE_ID,NOPRESCRIPCION,FPRESCRIPCION,TIPOTECNOLOGIA,CONSECUTIVO,ESTJM,CODENTPROC,OBSERVACIONES,JUSTIFICACIONTECNICA,MODALIDAD,NOACTA,FECHAACTA,FPROCESO,TIPOIDPACIENTE,NROIDPACIENTE,CODENTJM) values ('46',to_date('15/02/19','DD/MM/RR'),'9','2','20190215124010475978',to_date('15/02/19','DD/MM/RR'),'S','1','2',null,null,null,null,null,to_date('01/01/70','DD/MM/RR'),null,'CC','32614302','080010349401');
Insert into OASIS4.WEBSERV_JUNTA_PROFESIONAL (ID_JUPR,REPO_PERIODO,REPO_SERV_ID,REPO_TIRE_ID,NOPRESCRIPCION,FPRESCRIPCION,TIPOTECNOLOGIA,CONSECUTIVO,ESTJM,CODENTPROC,OBSERVACIONES,JUSTIFICACIONTECNICA,MODALIDAD,NOACTA,FECHAACTA,FPROCESO,TIPOIDPACIENTE,NROIDPACIENTE,CODENTJM) values ('47',to_date('16/02/19','DD/MM/RR'),'9','2','20190216141010483881',to_date('16/02/19','DD/MM/RR'),'N','1','3','080010054401',null,' LA JUNTA MEDICA HA REVISADO SU CASO Y DECIDEN POR CONDICION CLINICA DEL PACIENTE SE AUTORIZA EL USO DE FORMULA NUTRICIONAL PROWHEY NET LATA 434 GRAMOS','1','0730',to_date('01/01/70','DD/MM/RR'),'2019-02-16','CC','1048270750','080010054401');
Insert into OASIS4.WEBSERV_JUNTA_PROFESIONAL (ID_JUPR,REPO_PERIODO,REPO_SERV_ID,REPO_TIRE_ID,NOPRESCRIPCION,FPRESCRIPCION,TIPOTECNOLOGIA,CONSECUTIVO,ESTJM,CODENTPROC,OBSERVACIONES,JUSTIFICACIONTECNICA,MODALIDAD,NOACTA,FECHAACTA,FPROCESO,TIPOIDPACIENTE,NROIDPACIENTE,CODENTJM) values ('48',to_date('18/02/19','DD/MM/RR'),'9','2','20190218118010492542',to_date('18/02/19','DD/MM/RR'),'N','1','2',null,null,null,null,null,to_date('01/01/70','DD/MM/RR'),null,'CC','23213020','086850011001');
Insert into OASIS4.WEBSERV_JUNTA_PROFESIONAL (ID_JUPR,REPO_PERIODO,REPO_SERV_ID,REPO_TIRE_ID,NOPRESCRIPCION,FPRESCRIPCION,TIPOTECNOLOGIA,CONSECUTIVO,ESTJM,CODENTPROC,OBSERVACIONES,JUSTIFICACIONTECNICA,MODALIDAD,NOACTA,FECHAACTA,FPROCESO,TIPOIDPACIENTE,NROIDPACIENTE,CODENTJM) values ('49',to_date('18/02/19','DD/MM/RR'),'9','2','20190218186010493468',to_date('18/02/19','DD/MM/RR'),'N','1','2',null,null,null,null,null,to_date('01/01/70','DD/MM/RR'),null,'CC','22670599','086850011001');
Insert into OASIS4.WEBSERV_JUNTA_PROFESIONAL (ID_JUPR,REPO_PERIODO,REPO_SERV_ID,REPO_TIRE_ID,NOPRESCRIPCION,FPRESCRIPCION,TIPOTECNOLOGIA,CONSECUTIVO,ESTJM,CODENTPROC,OBSERVACIONES,JUSTIFICACIONTECNICA,MODALIDAD,NOACTA,FECHAACTA,FPROCESO,TIPOIDPACIENTE,NROIDPACIENTE,CODENTJM) values ('50',to_date('18/02/19','DD/MM/RR'),'9','2','20190218147010496603',to_date('18/02/19','DD/MM/RR'),'N','1','2',null,null,null,null,null,to_date('01/01/70','DD/MM/RR'),null,'CC','22458989','086380015401');
Insert into OASIS4.WEBSERV_JUNTA_PROFESIONAL (ID_JUPR,REPO_PERIODO,REPO_SERV_ID,REPO_TIRE_ID,NOPRESCRIPCION,FPRESCRIPCION,TIPOTECNOLOGIA,CONSECUTIVO,ESTJM,CODENTPROC,OBSERVACIONES,JUSTIFICACIONTECNICA,MODALIDAD,NOACTA,FECHAACTA,FPROCESO,TIPOIDPACIENTE,NROIDPACIENTE,CODENTJM) values ('51',to_date('18/02/19','DD/MM/RR'),'9','2','20190218140010507615',to_date('18/02/19','DD/MM/RR'),'N','1','2',null,null,null,null,null,to_date('01/01/70','DD/MM/RR'),null,'TI','1007133547','086850011001');
Insert into OASIS4.WEBSERV_JUNTA_PROFESIONAL (ID_JUPR,REPO_PERIODO,REPO_SERV_ID,REPO_TIRE_ID,NOPRESCRIPCION,FPRESCRIPCION,TIPOTECNOLOGIA,CONSECUTIVO,ESTJM,CODENTPROC,OBSERVACIONES,JUSTIFICACIONTECNICA,MODALIDAD,NOACTA,FECHAACTA,FPROCESO,TIPOIDPACIENTE,NROIDPACIENTE,CODENTJM) values ('52',to_date('19/02/19','DD/MM/RR'),'9','2','20190219116010512472',to_date('19/02/19','DD/MM/RR'),'N','1','2',null,null,null,null,null,to_date('01/01/70','DD/MM/RR'),null,'RC','1047237986','080010112201');
Insert into OASIS4.WEBSERV_JUNTA_PROFESIONAL (ID_JUPR,REPO_PERIODO,REPO_SERV_ID,REPO_TIRE_ID,NOPRESCRIPCION,FPRESCRIPCION,TIPOTECNOLOGIA,CONSECUTIVO,ESTJM,CODENTPROC,OBSERVACIONES,JUSTIFICACIONTECNICA,MODALIDAD,NOACTA,FECHAACTA,FPROCESO,TIPOIDPACIENTE,NROIDPACIENTE,CODENTJM) values ('53',to_date('19/02/19','DD/MM/RR'),'9','2','20190219140010517072',to_date('19/02/19','DD/MM/RR'),'N','1','2',null,null,null,null,null,to_date('01/01/70','DD/MM/RR'),null,'RC','1048323573','080010112201');
Insert into OASIS4.WEBSERV_JUNTA_PROFESIONAL (ID_JUPR,REPO_PERIODO,REPO_SERV_ID,REPO_TIRE_ID,NOPRESCRIPCION,FPRESCRIPCION,TIPOTECNOLOGIA,CONSECUTIVO,ESTJM,CODENTPROC,OBSERVACIONES,JUSTIFICACIONTECNICA,MODALIDAD,NOACTA,FECHAACTA,FPROCESO,TIPOIDPACIENTE,NROIDPACIENTE,CODENTJM) values ('54',to_date('19/02/19','DD/MM/RR'),'9','2','20190219111010517656',to_date('19/02/19','DD/MM/RR'),'N','1','2',null,null,null,null,null,to_date('01/01/70','DD/MM/RR'),null,'CC','28041821','080010112201');
Insert into OASIS4.WEBSERV_JUNTA_PROFESIONAL (ID_JUPR,REPO_PERIODO,REPO_SERV_ID,REPO_TIRE_ID,NOPRESCRIPCION,FPRESCRIPCION,TIPOTECNOLOGIA,CONSECUTIVO,ESTJM,CODENTPROC,OBSERVACIONES,JUSTIFICACIONTECNICA,MODALIDAD,NOACTA,FECHAACTA,FPROCESO,TIPOIDPACIENTE,NROIDPACIENTE,CODENTJM) values ('55',to_date('19/02/19','DD/MM/RR'),'9','2','20190219166010523131',to_date('19/02/19','DD/MM/RR'),'N','1','2',null,null,null,null,null,to_date('01/01/70','DD/MM/RR'),null,'RC','1042354901','087580053305');
Insert into OASIS4.WEBSERV_JUNTA_PROFESIONAL (ID_JUPR,REPO_PERIODO,REPO_SERV_ID,REPO_TIRE_ID,NOPRESCRIPCION,FPRESCRIPCION,TIPOTECNOLOGIA,CONSECUTIVO,ESTJM,CODENTPROC,OBSERVACIONES,JUSTIFICACIONTECNICA,MODALIDAD,NOACTA,FECHAACTA,FPROCESO,TIPOIDPACIENTE,NROIDPACIENTE,CODENTJM) values ('56',to_date('19/02/19','DD/MM/RR'),'9','2','20190219115010532759',to_date('19/02/19','DD/MM/RR'),'N','1','2',null,null,null,null,null,to_date('01/01/70','DD/MM/RR'),null,'CC','1046813436','080010349401');
Insert into OASIS4.WEBSERV_JUNTA_PROFESIONAL (ID_JUPR,REPO_PERIODO,REPO_SERV_ID,REPO_TIRE_ID,NOPRESCRIPCION,FPRESCRIPCION,TIPOTECNOLOGIA,CONSECUTIVO,ESTJM,CODENTPROC,OBSERVACIONES,JUSTIFICACIONTECNICA,MODALIDAD,NOACTA,FECHAACTA,FPROCESO,TIPOIDPACIENTE,NROIDPACIENTE,CODENTJM) values ('57',to_date('19/02/19','DD/MM/RR'),'9','2','20190219146010526589',to_date('19/02/19','DD/MM/RR'),'S','1','2',null,null,null,null,null,to_date('01/01/70','DD/MM/RR'),null,'RC','1140904733','080010349401');
Insert into OASIS4.WEBSERV_JUNTA_PROFESIONAL (ID_JUPR,REPO_PERIODO,REPO_SERV_ID,REPO_TIRE_ID,NOPRESCRIPCION,FPRESCRIPCION,TIPOTECNOLOGIA,CONSECUTIVO,ESTJM,CODENTPROC,OBSERVACIONES,JUSTIFICACIONTECNICA,MODALIDAD,NOACTA,FECHAACTA,FPROCESO,TIPOIDPACIENTE,NROIDPACIENTE,CODENTJM) values ('58',to_date('20/02/19','DD/MM/RR'),'9','2','20190220143010537757',to_date('20/02/19','DD/MM/RR'),'N','1','2',null,null,null,null,null,to_date('01/01/70','DD/MM/RR'),null,'RC','1044434289','080010112201');
Insert into OASIS4.WEBSERV_JUNTA_PROFESIONAL (ID_JUPR,REPO_PERIODO,REPO_SERV_ID,REPO_TIRE_ID,NOPRESCRIPCION,FPRESCRIPCION,TIPOTECNOLOGIA,CONSECUTIVO,ESTJM,CODENTPROC,OBSERVACIONES,JUSTIFICACIONTECNICA,MODALIDAD,NOACTA,FECHAACTA,FPROCESO,TIPOIDPACIENTE,NROIDPACIENTE,CODENTJM) values ('59',to_date('21/02/19','DD/MM/RR'),'9','2','20190221137010571919',to_date('21/02/19','DD/MM/RR'),'M','1','2',null,null,null,null,null,to_date('01/01/70','DD/MM/RR'),null,'TI','1143236189','080010054401');
Insert into OASIS4.WEBSERV_JUNTA_PROFESIONAL (ID_JUPR,REPO_PERIODO,REPO_SERV_ID,REPO_TIRE_ID,NOPRESCRIPCION,FPRESCRIPCION,TIPOTECNOLOGIA,CONSECUTIVO,ESTJM,CODENTPROC,OBSERVACIONES,JUSTIFICACIONTECNICA,MODALIDAD,NOACTA,FECHAACTA,FPROCESO,TIPOIDPACIENTE,NROIDPACIENTE,CODENTJM) values ('60',to_date('22/02/19','DD/MM/RR'),'9','2','20190222117010582680',to_date('22/02/19','DD/MM/RR'),'N','1','2',null,null,null,null,null,to_date('01/01/70','DD/MM/RR'),null,'CC','22323263','080010112201');
Insert into OASIS4.WEBSERV_JUNTA_PROFESIONAL (ID_JUPR,REPO_PERIODO,REPO_SERV_ID,REPO_TIRE_ID,NOPRESCRIPCION,FPRESCRIPCION,TIPOTECNOLOGIA,CONSECUTIVO,ESTJM,CODENTPROC,OBSERVACIONES,JUSTIFICACIONTECNICA,MODALIDAD,NOACTA,FECHAACTA,FPROCESO,TIPOIDPACIENTE,NROIDPACIENTE,CODENTJM) values ('61',to_date('22/02/19','DD/MM/RR'),'9','2','20190222130010583339',to_date('22/02/19','DD/MM/RR'),'N','1','2',null,null,null,null,null,to_date('01/01/70','DD/MM/RR'),null,'CC','1045764628','080010112201');
Insert into OASIS4.WEBSERV_JUNTA_PROFESIONAL (ID_JUPR,REPO_PERIODO,REPO_SERV_ID,REPO_TIRE_ID,NOPRESCRIPCION,FPRESCRIPCION,TIPOTECNOLOGIA,CONSECUTIVO,ESTJM,CODENTPROC,OBSERVACIONES,JUSTIFICACIONTECNICA,MODALIDAD,NOACTA,FECHAACTA,FPROCESO,TIPOIDPACIENTE,NROIDPACIENTE,CODENTJM) values ('62',to_date('25/02/19','DD/MM/RR'),'9','2','20190225122010614958',to_date('25/02/19','DD/MM/RR'),'M','1','2',null,null,null,null,null,to_date('01/01/70','DD/MM/RR'),null,'TI','1143236189','080010054401');
Insert into OASIS4.WEBSERV_JUNTA_PROFESIONAL (ID_JUPR,REPO_PERIODO,REPO_SERV_ID,REPO_TIRE_ID,NOPRESCRIPCION,FPRESCRIPCION,TIPOTECNOLOGIA,CONSECUTIVO,ESTJM,CODENTPROC,OBSERVACIONES,JUSTIFICACIONTECNICA,MODALIDAD,NOACTA,FECHAACTA,FPROCESO,TIPOIDPACIENTE,NROIDPACIENTE,CODENTJM) values ('63',to_date('25/02/19','DD/MM/RR'),'9','2','20190225175010608509',to_date('25/02/19','DD/MM/RR'),'N','1','2',null,null,null,null,null,to_date('01/01/70','DD/MM/RR'),null,'CC','8791701','080010112201');
Insert into OASIS4.WEBSERV_JUNTA_PROFESIONAL (ID_JUPR,REPO_PERIODO,REPO_SERV_ID,REPO_TIRE_ID,NOPRESCRIPCION,FPRESCRIPCION,TIPOTECNOLOGIA,CONSECUTIVO,ESTJM,CODENTPROC,OBSERVACIONES,JUSTIFICACIONTECNICA,MODALIDAD,NOACTA,FECHAACTA,FPROCESO,TIPOIDPACIENTE,NROIDPACIENTE,CODENTJM) values ('64',to_date('25/02/19','DD/MM/RR'),'9','2','20190225154010610147',to_date('25/02/19','DD/MM/RR'),'N','1','2',null,null,null,null,null,to_date('01/01/70','DD/MM/RR'),null,'CC','22498731','080010112201');
Insert into OASIS4.WEBSERV_JUNTA_PROFESIONAL (ID_JUPR,REPO_PERIODO,REPO_SERV_ID,REPO_TIRE_ID,NOPRESCRIPCION,FPRESCRIPCION,TIPOTECNOLOGIA,CONSECUTIVO,ESTJM,CODENTPROC,OBSERVACIONES,JUSTIFICACIONTECNICA,MODALIDAD,NOACTA,FECHAACTA,FPROCESO,TIPOIDPACIENTE,NROIDPACIENTE,CODENTJM) values ('65',to_date('25/02/19','DD/MM/RR'),'9','2','20190225110010612921',to_date('25/02/19','DD/MM/RR'),'N','1','2',null,null,null,null,null,to_date('01/01/70','DD/MM/RR'),null,'CC','7410381','086850011001');
Insert into OASIS4.WEBSERV_JUNTA_PROFESIONAL (ID_JUPR,REPO_PERIODO,REPO_SERV_ID,REPO_TIRE_ID,NOPRESCRIPCION,FPRESCRIPCION,TIPOTECNOLOGIA,CONSECUTIVO,ESTJM,CODENTPROC,OBSERVACIONES,JUSTIFICACIONTECNICA,MODALIDAD,NOACTA,FECHAACTA,FPROCESO,TIPOIDPACIENTE,NROIDPACIENTE,CODENTJM) values ('66',to_date('26/02/19','DD/MM/RR'),'9','2','20190226171010632122',to_date('26/02/19','DD/MM/RR'),'N','1','2',null,null,null,null,null,to_date('01/01/70','DD/MM/RR'),null,'CC','25751045','080010112201');
Insert into OASIS4.WEBSERV_JUNTA_PROFESIONAL (ID_JUPR,REPO_PERIODO,REPO_SERV_ID,REPO_TIRE_ID,NOPRESCRIPCION,FPRESCRIPCION,TIPOTECNOLOGIA,CONSECUTIVO,ESTJM,CODENTPROC,OBSERVACIONES,JUSTIFICACIONTECNICA,MODALIDAD,NOACTA,FECHAACTA,FPROCESO,TIPOIDPACIENTE,NROIDPACIENTE,CODENTJM) values ('67',to_date('27/02/19','DD/MM/RR'),'9','2','20190227158010665908',to_date('27/02/19','DD/MM/RR'),'N','1','2',null,null,null,null,null,to_date('01/01/70','DD/MM/RR'),null,'CC','1043587921','080010409201');
Insert into OASIS4.WEBSERV_JUNTA_PROFESIONAL (ID_JUPR,REPO_PERIODO,REPO_SERV_ID,REPO_TIRE_ID,NOPRESCRIPCION,FPRESCRIPCION,TIPOTECNOLOGIA,CONSECUTIVO,ESTJM,CODENTPROC,OBSERVACIONES,JUSTIFICACIONTECNICA,MODALIDAD,NOACTA,FECHAACTA,FPROCESO,TIPOIDPACIENTE,NROIDPACIENTE,CODENTJM) values ('68',to_date('28/02/19','DD/MM/RR'),'9','2','20190228199010678407',to_date('28/02/19','DD/MM/RR'),'N','1','2',null,null,null,null,null,to_date('01/01/70','DD/MM/RR'),null,'TI','1001878512','080010112201');
Insert into OASIS4.WEBSERV_JUNTA_PROFESIONAL (ID_JUPR,REPO_PERIODO,REPO_SERV_ID,REPO_TIRE_ID,NOPRESCRIPCION,FPRESCRIPCION,TIPOTECNOLOGIA,CONSECUTIVO,ESTJM,CODENTPROC,OBSERVACIONES,JUSTIFICACIONTECNICA,MODALIDAD,NOACTA,FECHAACTA,FPROCESO,TIPOIDPACIENTE,NROIDPACIENTE,CODENTJM) values ('69',to_date('01/03/19','DD/MM/RR'),'9','2','20190301120010693984',to_date('01/03/19','DD/MM/RR'),'S','1','2',null,null,null,null,null,to_date('01/01/70','DD/MM/RR'),null,'CC','18880923','080010349401');
Insert into OASIS4.WEBSERV_JUNTA_PROFESIONAL (ID_JUPR,REPO_PERIODO,REPO_SERV_ID,REPO_TIRE_ID,NOPRESCRIPCION,FPRESCRIPCION,TIPOTECNOLOGIA,CONSECUTIVO,ESTJM,CODENTPROC,OBSERVACIONES,JUSTIFICACIONTECNICA,MODALIDAD,NOACTA,FECHAACTA,FPROCESO,TIPOIDPACIENTE,NROIDPACIENTE,CODENTJM) values ('70',to_date('01/03/19','DD/MM/RR'),'9','2','20190301164010694524',to_date('01/03/19','DD/MM/RR'),'S','1','2',null,null,null,null,null,to_date('01/01/70','DD/MM/RR'),null,'CC','26992789','080010349401');
Insert into OASIS4.WEBSERV_JUNTA_PROFESIONAL (ID_JUPR,REPO_PERIODO,REPO_SERV_ID,REPO_TIRE_ID,NOPRESCRIPCION,FPRESCRIPCION,TIPOTECNOLOGIA,CONSECUTIVO,ESTJM,CODENTPROC,OBSERVACIONES,JUSTIFICACIONTECNICA,MODALIDAD,NOACTA,FECHAACTA,FPROCESO,TIPOIDPACIENTE,NROIDPACIENTE,CODENTJM) values ('71',to_date('08/03/19','DD/MM/RR'),'9','2','20190308124010807647',to_date('08/03/19','DD/MM/RR'),'N','1','3','086340010501',null,'paciente de 80 aÃ±os de edad con peso de 36 kg talla 1.47 cm imc 17.1 con dx nutricional de delgadez leve RAZÃ“N por lo cual requiere este soporte ','1','02',to_date('01/01/70','DD/MM/RR'),'2019-03-08','CC','28023395','086340010501');
Insert into OASIS4.WEBSERV_JUNTA_PROFESIONAL (ID_JUPR,REPO_PERIODO,REPO_SERV_ID,REPO_TIRE_ID,NOPRESCRIPCION,FPRESCRIPCION,TIPOTECNOLOGIA,CONSECUTIVO,ESTJM,CODENTPROC,OBSERVACIONES,JUSTIFICACIONTECNICA,MODALIDAD,NOACTA,FECHAACTA,FPROCESO,TIPOIDPACIENTE,NROIDPACIENTE,CODENTJM) values ('72',to_date('08/03/19','DD/MM/RR'),'9','2','20190308110010808215',to_date('08/03/19','DD/MM/RR'),'N','1','2',null,null,null,null,null,to_date('01/01/70','DD/MM/RR'),null,'RC','1130277643','080010112201');
Insert into OASIS4.WEBSERV_JUNTA_PROFESIONAL (ID_JUPR,REPO_PERIODO,REPO_SERV_ID,REPO_TIRE_ID,NOPRESCRIPCION,FPRESCRIPCION,TIPOTECNOLOGIA,CONSECUTIVO,ESTJM,CODENTPROC,OBSERVACIONES,JUSTIFICACIONTECNICA,MODALIDAD,NOACTA,FECHAACTA,FPROCESO,TIPOIDPACIENTE,NROIDPACIENTE,CODENTJM) values ('73',to_date('08/03/19','DD/MM/RR'),'9','2','20190308170010811149',to_date('08/03/19','DD/MM/RR'),'N','1','2',null,null,null,null,null,to_date('01/01/70','DD/MM/RR'),null,'CC','32305708','080010112201');
Insert into OASIS4.WEBSERV_JUNTA_PROFESIONAL (ID_JUPR,REPO_PERIODO,REPO_SERV_ID,REPO_TIRE_ID,NOPRESCRIPCION,FPRESCRIPCION,TIPOTECNOLOGIA,CONSECUTIVO,ESTJM,CODENTPROC,OBSERVACIONES,JUSTIFICACIONTECNICA,MODALIDAD,NOACTA,FECHAACTA,FPROCESO,TIPOIDPACIENTE,NROIDPACIENTE,CODENTJM) values ('74',to_date('08/03/19','DD/MM/RR'),'9','2','20190308185010814766',to_date('08/03/19','DD/MM/RR'),'N','1','2',null,null,null,null,null,to_date('01/01/70','DD/MM/RR'),null,'RC','1046818076','087580053302');
Insert into OASIS4.WEBSERV_JUNTA_PROFESIONAL (ID_JUPR,REPO_PERIODO,REPO_SERV_ID,REPO_TIRE_ID,NOPRESCRIPCION,FPRESCRIPCION,TIPOTECNOLOGIA,CONSECUTIVO,ESTJM,CODENTPROC,OBSERVACIONES,JUSTIFICACIONTECNICA,MODALIDAD,NOACTA,FECHAACTA,FPROCESO,TIPOIDPACIENTE,NROIDPACIENTE,CODENTJM) values ('75',to_date('08/03/19','DD/MM/RR'),'9','2','20190308145010816912',to_date('08/03/19','DD/MM/RR'),'N','1','2',null,null,null,null,null,to_date('01/01/70','DD/MM/RR'),null,'RC','1048332256','087580053302');
Insert into OASIS4.WEBSERV_JUNTA_PROFESIONAL (ID_JUPR,REPO_PERIODO,REPO_SERV_ID,REPO_TIRE_ID,NOPRESCRIPCION,FPRESCRIPCION,TIPOTECNOLOGIA,CONSECUTIVO,ESTJM,CODENTPROC,OBSERVACIONES,JUSTIFICACIONTECNICA,MODALIDAD,NOACTA,FECHAACTA,FPROCESO,TIPOIDPACIENTE,NROIDPACIENTE,CODENTJM) values ('76',to_date('08/03/19','DD/MM/RR'),'9','2','20190308197010817481',to_date('08/03/19','DD/MM/RR'),'N','1','2',null,null,null,null,null,to_date('01/01/70','DD/MM/RR'),null,'RC','1043181150','087580053302');
Insert into OASIS4.WEBSERV_JUNTA_PROFESIONAL (ID_JUPR,REPO_PERIODO,REPO_SERV_ID,REPO_TIRE_ID,NOPRESCRIPCION,FPRESCRIPCION,TIPOTECNOLOGIA,CONSECUTIVO,ESTJM,CODENTPROC,OBSERVACIONES,JUSTIFICACIONTECNICA,MODALIDAD,NOACTA,FECHAACTA,FPROCESO,TIPOIDPACIENTE,NROIDPACIENTE,CODENTJM) values ('77',to_date('11/03/19','DD/MM/RR'),'9','2','20190311187010847730',to_date('11/03/19','DD/MM/RR'),'M','1','2',null,null,null,null,null,to_date('01/01/70','DD/MM/RR'),null,'RC','1043601633','086380021701');
Insert into OASIS4.WEBSERV_JUNTA_PROFESIONAL (ID_JUPR,REPO_PERIODO,REPO_SERV_ID,REPO_TIRE_ID,NOPRESCRIPCION,FPRESCRIPCION,TIPOTECNOLOGIA,CONSECUTIVO,ESTJM,CODENTPROC,OBSERVACIONES,JUSTIFICACIONTECNICA,MODALIDAD,NOACTA,FECHAACTA,FPROCESO,TIPOIDPACIENTE,NROIDPACIENTE,CODENTJM) values ('352',to_date('09/05/19','DD/MM/RR'),'9','2','20190509188011881726',to_date('09/05/19','DD/MM/RR'),'S','1','3','660010076201',null,'paciente de 75 aÃ±os, con lasceraciones en el craneo, reportan lesion intraparenquimatosa temporo occipital, paciente postrado requiere traslado basico en ambula','1','JPHUSJSB000023',to_date('10/05/19','DD/MM/RR'),'2019-05-20','CC','4411309','660010076201');
Insert into OASIS4.WEBSERV_JUNTA_PROFESIONAL (ID_JUPR,REPO_PERIODO,REPO_SERV_ID,REPO_TIRE_ID,NOPRESCRIPCION,FPRESCRIPCION,TIPOTECNOLOGIA,CONSECUTIVO,ESTJM,CODENTPROC,OBSERVACIONES,JUSTIFICACIONTECNICA,MODALIDAD,NOACTA,FECHAACTA,FPROCESO,TIPOIDPACIENTE,NROIDPACIENTE,CODENTJM) values ('353',to_date('09/05/19','DD/MM/RR'),'9','2','20190509198011886842',to_date('09/05/19','DD/MM/RR'),'S','1','2',null,null,null,null,null,to_date('01/01/70','DD/MM/RR'),null,'CC','23023516','134300074601');
Insert into OASIS4.WEBSERV_JUNTA_PROFESIONAL (ID_JUPR,REPO_PERIODO,REPO_SERV_ID,REPO_TIRE_ID,NOPRESCRIPCION,FPRESCRIPCION,TIPOTECNOLOGIA,CONSECUTIVO,ESTJM,CODENTPROC,OBSERVACIONES,JUSTIFICACIONTECNICA,MODALIDAD,NOACTA,FECHAACTA,FPROCESO,TIPOIDPACIENTE,NROIDPACIENTE,CODENTJM) values ('354',to_date('10/05/19','DD/MM/RR'),'9','2','20190510165011892303',to_date('10/05/19','DD/MM/RR'),'N','1','3','080010445404',null,'PACIENTE MASCULINO DE 69 AÃ‘OS CON DX HTA, DM, Secuelas ECV, SÃ?NDROME coronario agudo, DESNUTRICIÃ“N PROTEICO CALORICA. REQUIERE SUPLEMENTO.','1','167',to_date('13/06/19','DD/MM/RR'),'2019-06-13','CC','7449050','080010445404');
Insert into OASIS4.WEBSERV_JUNTA_PROFESIONAL (ID_JUPR,REPO_PERIODO,REPO_SERV_ID,REPO_TIRE_ID,NOPRESCRIPCION,FPRESCRIPCION,TIPOTECNOLOGIA,CONSECUTIVO,ESTJM,CODENTPROC,OBSERVACIONES,JUSTIFICACIONTECNICA,MODALIDAD,NOACTA,FECHAACTA,FPROCESO,TIPOIDPACIENTE,NROIDPACIENTE,CODENTJM) values ('355',to_date('10/05/19','DD/MM/RR'),'9','2','20190510190011893005',to_date('10/05/19','DD/MM/RR'),'N','1','3','700010151301',null,'con dÃ©ficit nutricional relacionado con sus estados mÃ³rbidos - -neumonÃ­a / septicemia resuelta, y su contexto de    -parÃ¡lisis cerebral.    -discapacidad cogni','1','037',to_date('24/07/19','DD/MM/RR'),'2019-07-24','RC','1129186469','700010151301');
Insert into OASIS4.WEBSERV_JUNTA_PROFESIONAL (ID_JUPR,REPO_PERIODO,REPO_SERV_ID,REPO_TIRE_ID,NOPRESCRIPCION,FPRESCRIPCION,TIPOTECNOLOGIA,CONSECUTIVO,ESTJM,CODENTPROC,OBSERVACIONES,JUSTIFICACIONTECNICA,MODALIDAD,NOACTA,FECHAACTA,FPROCESO,TIPOIDPACIENTE,NROIDPACIENTE,CODENTJM) values ('356',to_date('10/05/19','DD/MM/RR'),'9','2','20190510123011895669',to_date('10/05/19','DD/MM/RR'),'N','1','4','080010226001',null,'NO APROBADO EXTEMPORANEO ','1','201923071254',to_date('23/07/19','DD/MM/RR'),'2019-07-23','RC','1048325956','080010226001');
Insert into OASIS4.WEBSERV_JUNTA_PROFESIONAL (ID_JUPR,REPO_PERIODO,REPO_SERV_ID,REPO_TIRE_ID,NOPRESCRIPCION,FPRESCRIPCION,TIPOTECNOLOGIA,CONSECUTIVO,ESTJM,CODENTPROC,OBSERVACIONES,JUSTIFICACIONTECNICA,MODALIDAD,NOACTA,FECHAACTA,FPROCESO,TIPOIDPACIENTE,NROIDPACIENTE,CODENTJM) values ('357',to_date('10/05/19','DD/MM/RR'),'9','2','20190510123011897956',to_date('10/05/19','DD/MM/RR'),'N','1','2',null,null,null,null,null,to_date('01/01/70','DD/MM/RR'),null,'CC','25019154','ESS076');
Insert into OASIS4.WEBSERV_JUNTA_PROFESIONAL (ID_JUPR,REPO_PERIODO,REPO_SERV_ID,REPO_TIRE_ID,NOPRESCRIPCION,FPRESCRIPCION,TIPOTECNOLOGIA,CONSECUTIVO,ESTJM,CODENTPROC,OBSERVACIONES,JUSTIFICACIONTECNICA,MODALIDAD,NOACTA,FECHAACTA,FPROCESO,TIPOIDPACIENTE,NROIDPACIENTE,CODENTJM) values ('358',to_date('10/05/19','DD/MM/RR'),'9','2','20190510192011898106',to_date('10/05/19','DD/MM/RR'),'N','1','2',null,null,null,null,null,to_date('01/01/70','DD/MM/RR'),null,'CC','25019154','ESS076');
Insert into OASIS4.WEBSERV_JUNTA_PROFESIONAL (ID_JUPR,REPO_PERIODO,REPO_SERV_ID,REPO_TIRE_ID,NOPRESCRIPCION,FPRESCRIPCION,TIPOTECNOLOGIA,CONSECUTIVO,ESTJM,CODENTPROC,OBSERVACIONES,JUSTIFICACIONTECNICA,MODALIDAD,NOACTA,FECHAACTA,FPROCESO,TIPOIDPACIENTE,NROIDPACIENTE,CODENTJM) values ('359',to_date('10/05/19','DD/MM/RR'),'9','2','20190510176011899542',to_date('10/05/19','DD/MM/RR'),'N','1','4','080010226001',null,'NO APROBADO EXTEMPORANEO ','1','201923071252',to_date('23/07/19','DD/MM/RR'),'2019-07-23','RC','1046817710','080010226001');
Insert into OASIS4.WEBSERV_JUNTA_PROFESIONAL (ID_JUPR,REPO_PERIODO,REPO_SERV_ID,REPO_TIRE_ID,NOPRESCRIPCION,FPRESCRIPCION,TIPOTECNOLOGIA,CONSECUTIVO,ESTJM,CODENTPROC,OBSERVACIONES,JUSTIFICACIONTECNICA,MODALIDAD,NOACTA,FECHAACTA,FPROCESO,TIPOIDPACIENTE,NROIDPACIENTE,CODENTJM) values ('360',to_date('10/05/19','DD/MM/RR'),'9','2','20190510145011902933',to_date('10/05/19','DD/MM/RR'),'N','1','2',null,null,null,null,null,to_date('01/01/70','DD/MM/RR'),null,'CC','1114399342','ESS076');
Insert into OASIS4.WEBSERV_JUNTA_PROFESIONAL (ID_JUPR,REPO_PERIODO,REPO_SERV_ID,REPO_TIRE_ID,NOPRESCRIPCION,FPRESCRIPCION,TIPOTECNOLOGIA,CONSECUTIVO,ESTJM,CODENTPROC,OBSERVACIONES,JUSTIFICACIONTECNICA,MODALIDAD,NOACTA,FECHAACTA,FPROCESO,TIPOIDPACIENTE,NROIDPACIENTE,CODENTJM) values ('361',to_date('11/05/19','DD/MM/RR'),'9','2','20190511131011914545',to_date('11/05/19','DD/MM/RR'),'N','1','2',null,null,null,null,null,to_date('01/01/70','DD/MM/RR'),null,'TI','1051886897','130010118701');
Insert into OASIS4.WEBSERV_JUNTA_PROFESIONAL (ID_JUPR,REPO_PERIODO,REPO_SERV_ID,REPO_TIRE_ID,NOPRESCRIPCION,FPRESCRIPCION,TIPOTECNOLOGIA,CONSECUTIVO,ESTJM,CODENTPROC,OBSERVACIONES,JUSTIFICACIONTECNICA,MODALIDAD,NOACTA,FECHAACTA,FPROCESO,TIPOIDPACIENTE,NROIDPACIENTE,CODENTJM) values ('362',to_date('11/05/19','DD/MM/RR'),'9','2','20190511189011915955',to_date('11/05/19','DD/MM/RR'),'N','1','2',null,null,null,null,null,to_date('01/01/70','DD/MM/RR'),null,'TI','1051887297','130010118701');
Insert into OASIS4.WEBSERV_JUNTA_PROFESIONAL (ID_JUPR,REPO_PERIODO,REPO_SERV_ID,REPO_TIRE_ID,NOPRESCRIPCION,FPRESCRIPCION,TIPOTECNOLOGIA,CONSECUTIVO,ESTJM,CODENTPROC,OBSERVACIONES,JUSTIFICACIONTECNICA,MODALIDAD,NOACTA,FECHAACTA,FPROCESO,TIPOIDPACIENTE,NROIDPACIENTE,CODENTJM) values ('363',to_date('11/05/19','DD/MM/RR'),'9','2','20190511191011916966',to_date('11/05/19','DD/MM/RR'),'S','1','3','470010096901',null,'paciente con PARÃ?LISIS requiere traslado redondo en ambulancia para cita MEDICA especializada con cirujano en BARRANQUILLA  ','1','878',to_date('11/05/19','DD/MM/RR'),'2019-05-11','RC','1044225939','470010096901');
Insert into OASIS4.WEBSERV_JUNTA_PROFESIONAL (ID_JUPR,REPO_PERIODO,REPO_SERV_ID,REPO_TIRE_ID,NOPRESCRIPCION,FPRESCRIPCION,TIPOTECNOLOGIA,CONSECUTIVO,ESTJM,CODENTPROC,OBSERVACIONES,JUSTIFICACIONTECNICA,MODALIDAD,NOACTA,FECHAACTA,FPROCESO,TIPOIDPACIENTE,NROIDPACIENTE,CODENTJM) values ('364',to_date('13/05/19','DD/MM/RR'),'9','2','20190513182011937893',to_date('13/05/19','DD/MM/RR'),'M','1','2',null,null,null,null,null,to_date('01/01/70','DD/MM/RR'),null,'CC','1143379241','130010178101');
Insert into OASIS4.WEBSERV_JUNTA_PROFESIONAL (ID_JUPR,REPO_PERIODO,REPO_SERV_ID,REPO_TIRE_ID,NOPRESCRIPCION,FPRESCRIPCION,TIPOTECNOLOGIA,CONSECUTIVO,ESTJM,CODENTPROC,OBSERVACIONES,JUSTIFICACIONTECNICA,MODALIDAD,NOACTA,FECHAACTA,FPROCESO,TIPOIDPACIENTE,NROIDPACIENTE,CODENTJM) values ('365',to_date('13/05/19','DD/MM/RR'),'9','2','20190513134011950859',to_date('13/05/19','DD/MM/RR'),'M','1','3','080010349401',null,'PACIENTE EN SEGUIMIENTO POR PSIQUIATRÃ?A MEDICADO CON QUETIAPINA, PERO NO RECIBE MEDICACION EN LOS ULTIMOS MESES, POR LO QUE SE SOLICITA VALORACION Y SE REALIZA ','2','007',to_date('27/05/19','DD/MM/RR'),'2019-05-27','CC','72151276','080010349401');
Insert into OASIS4.WEBSERV_JUNTA_PROFESIONAL (ID_JUPR,REPO_PERIODO,REPO_SERV_ID,REPO_TIRE_ID,NOPRESCRIPCION,FPRESCRIPCION,TIPOTECNOLOGIA,CONSECUTIVO,ESTJM,CODENTPROC,OBSERVACIONES,JUSTIFICACIONTECNICA,MODALIDAD,NOACTA,FECHAACTA,FPROCESO,TIPOIDPACIENTE,NROIDPACIENTE,CODENTJM) values ('366',to_date('13/05/19','DD/MM/RR'),'9','2','20190513164011935330',to_date('13/05/19','DD/MM/RR'),'N','1','2',null,null,null,null,null,to_date('01/01/70','DD/MM/RR'),null,'CC','16400898','768230220101');
Insert into OASIS4.WEBSERV_JUNTA_PROFESIONAL (ID_JUPR,REPO_PERIODO,REPO_SERV_ID,REPO_TIRE_ID,NOPRESCRIPCION,FPRESCRIPCION,TIPOTECNOLOGIA,CONSECUTIVO,ESTJM,CODENTPROC,OBSERVACIONES,JUSTIFICACIONTECNICA,MODALIDAD,NOACTA,FECHAACTA,FPROCESO,TIPOIDPACIENTE,NROIDPACIENTE,CODENTJM) values ('367',to_date('13/05/19','DD/MM/RR'),'9','2','20190513143011938779',to_date('13/05/19','DD/MM/RR'),'N','1','3','130010178101',null,'SE CONSIDERA SEGUIR CON SUPLEMENTO NUTRICIONAL, PARA RECUPERAR, MASA CORPORAL MEJORAR DEGLUCIÃ“N, INAPETENCIA, ESTADO NUTRICIONAL, COMPLETAR SUS REQUERIMIENTOS N','1','18',to_date('14/05/19','DD/MM/RR'),'2019-05-14','CC','3976151','130010178101');
Insert into OASIS4.WEBSERV_JUNTA_PROFESIONAL (ID_JUPR,REPO_PERIODO,REPO_SERV_ID,REPO_TIRE_ID,NOPRESCRIPCION,FPRESCRIPCION,TIPOTECNOLOGIA,CONSECUTIVO,ESTJM,CODENTPROC,OBSERVACIONES,JUSTIFICACIONTECNICA,MODALIDAD,NOACTA,FECHAACTA,FPROCESO,TIPOIDPACIENTE,NROIDPACIENTE,CODENTJM) values ('368',to_date('13/05/19','DD/MM/RR'),'9','2','20190513171011939662',to_date('13/05/19','DD/MM/RR'),'N','1','3','130010178101',null,'SE CONSIDERA INICIAR SUPLEMENTO NUTRICIONAL, PARA RECUPERAR MASA CORPORAL, MEJORAR ESTADO NUTRICIONAL, DEGLUCIÃ“N, COMPLETAR SUS REQUERIMIENTOS NUTRICIONALES, ','1','20',to_date('14/05/19','DD/MM/RR'),'2019-05-14','CC','1067715057','130010178101');
Insert into OASIS4.WEBSERV_JUNTA_PROFESIONAL (ID_JUPR,REPO_PERIODO,REPO_SERV_ID,REPO_TIRE_ID,NOPRESCRIPCION,FPRESCRIPCION,TIPOTECNOLOGIA,CONSECUTIVO,ESTJM,CODENTPROC,OBSERVACIONES,JUSTIFICACIONTECNICA,MODALIDAD,NOACTA,FECHAACTA,FPROCESO,TIPOIDPACIENTE,NROIDPACIENTE,CODENTJM) values ('369',to_date('13/05/19','DD/MM/RR'),'9','2','20190513162011942685',to_date('13/05/19','DD/MM/RR'),'N','1','3','087580016101',null,'se solicita alimento liquido completo y balanceado con proteinas vitaminas y minerales para niÃ±os para recuperar estado nutricional del paciente.','1','00002',to_date('15/06/19','DD/MM/RR'),'2019-06-15','TI','1043127869','087580016101');
Insert into OASIS4.WEBSERV_JUNTA_PROFESIONAL (ID_JUPR,REPO_PERIODO,REPO_SERV_ID,REPO_TIRE_ID,NOPRESCRIPCION,FPRESCRIPCION,TIPOTECNOLOGIA,CONSECUTIVO,ESTJM,CODENTPROC,OBSERVACIONES,JUSTIFICACIONTECNICA,MODALIDAD,NOACTA,FECHAACTA,FPROCESO,TIPOIDPACIENTE,NROIDPACIENTE,CODENTJM) values ('370',to_date('13/05/19','DD/MM/RR'),'9','2','20190513191011947803',to_date('13/05/19','DD/MM/RR'),'N','1','2',null,null,null,null,null,to_date('01/01/70','DD/MM/RR'),null,'CC','32811242','080010054401');
Insert into OASIS4.WEBSERV_JUNTA_PROFESIONAL (ID_JUPR,REPO_PERIODO,REPO_SERV_ID,REPO_TIRE_ID,NOPRESCRIPCION,FPRESCRIPCION,TIPOTECNOLOGIA,CONSECUTIVO,ESTJM,CODENTPROC,OBSERVACIONES,JUSTIFICACIONTECNICA,MODALIDAD,NOACTA,FECHAACTA,FPROCESO,TIPOIDPACIENTE,NROIDPACIENTE,CODENTJM) values ('371',to_date('13/05/19','DD/MM/RR'),'9','2','20190513171011937625',to_date('13/05/19','DD/MM/RR'),'S','1','3','080010121201',null,' paciente de 81 aÃ±os de edad con diagnostico de INCONTINENCIA URINARIA, NO ESPECIFICADA al cual se aprueba el insumo con tipo de prestaciÃ³n sucesiva','2','052',to_date('16/05/19','DD/MM/RR'),'2019-05-16','CC','4308085','080010121201');
Insert into OASIS4.WEBSERV_JUNTA_PROFESIONAL (ID_JUPR,REPO_PERIODO,REPO_SERV_ID,REPO_TIRE_ID,NOPRESCRIPCION,FPRESCRIPCION,TIPOTECNOLOGIA,CONSECUTIVO,ESTJM,CODENTPROC,OBSERVACIONES,JUSTIFICACIONTECNICA,MODALIDAD,NOACTA,FECHAACTA,FPROCESO,TIPOIDPACIENTE,NROIDPACIENTE,CODENTJM) values ('372',to_date('13/05/19','DD/MM/RR'),'9','2','20190513136011937672',to_date('13/05/19','DD/MM/RR'),'S','1','2',null,null,null,null,null,to_date('01/01/70','DD/MM/RR'),null,'CC','22463171','080010344801');
Insert into OASIS4.WEBSERV_JUNTA_PROFESIONAL (ID_JUPR,REPO_PERIODO,REPO_SERV_ID,REPO_TIRE_ID,NOPRESCRIPCION,FPRESCRIPCION,TIPOTECNOLOGIA,CONSECUTIVO,ESTJM,CODENTPROC,OBSERVACIONES,JUSTIFICACIONTECNICA,MODALIDAD,NOACTA,FECHAACTA,FPROCESO,TIPOIDPACIENTE,NROIDPACIENTE,CODENTJM) values ('373',to_date('13/05/19','DD/MM/RR'),'9','2','20190513198011941630',to_date('13/05/19','DD/MM/RR'),'S','1','4','200010035201',null,'Mipres mal diligenciado esta indicando 26 traslados en 2 dias. ','1','1759',to_date('30/05/19','DD/MM/RR'),'2019-05-30','CC','1780022','200010035201');
Insert into OASIS4.WEBSERV_JUNTA_PROFESIONAL (ID_JUPR,REPO_PERIODO,REPO_SERV_ID,REPO_TIRE_ID,NOPRESCRIPCION,FPRESCRIPCION,TIPOTECNOLOGIA,CONSECUTIVO,ESTJM,CODENTPROC,OBSERVACIONES,JUSTIFICACIONTECNICA,MODALIDAD,NOACTA,FECHAACTA,FPROCESO,TIPOIDPACIENTE,NROIDPACIENTE,CODENTJM) values ('374',to_date('13/05/19','DD/MM/RR'),'9','2','20190513133011946340',to_date('13/05/19','DD/MM/RR'),'S','1','3','080010349401',null,'PACIENTE CON LIMITACIÃ“N DE MOVIMIENTO POR LESIONES OSEAS E INDICE DE DEPENDENCIA MENOR A 20, CON ALTO RIESGO LESIONES EN PIEL','2','004',to_date('21/05/19','DD/MM/RR'),'2019-05-21','CC','23075969','080010349401');
Insert into OASIS4.WEBSERV_JUNTA_PROFESIONAL (ID_JUPR,REPO_PERIODO,REPO_SERV_ID,REPO_TIRE_ID,NOPRESCRIPCION,FPRESCRIPCION,TIPOTECNOLOGIA,CONSECUTIVO,ESTJM,CODENTPROC,OBSERVACIONES,JUSTIFICACIONTECNICA,MODALIDAD,NOACTA,FECHAACTA,FPROCESO,TIPOIDPACIENTE,NROIDPACIENTE,CODENTJM) values ('375',to_date('14/05/19','DD/MM/RR'),'9','2','20190514178011953619',to_date('14/05/19','DD/MM/RR'),'N','1','2',null,null,null,null,null,to_date('01/01/70','DD/MM/RR'),null,'CC','1114121015','761000252401');
Insert into OASIS4.WEBSERV_JUNTA_PROFESIONAL (ID_JUPR,REPO_PERIODO,REPO_SERV_ID,REPO_TIRE_ID,NOPRESCRIPCION,FPRESCRIPCION,TIPOTECNOLOGIA,CONSECUTIVO,ESTJM,CODENTPROC,OBSERVACIONES,JUSTIFICACIONTECNICA,MODALIDAD,NOACTA,FECHAACTA,FPROCESO,TIPOIDPACIENTE,NROIDPACIENTE,CODENTJM) values ('376',to_date('14/05/19','DD/MM/RR'),'9','2','20190514182011954734',to_date('14/05/19','DD/MM/RR'),'N','1','3','087580106601',null,'PACIENTE CON DX DESNUTRICION PROTEICO CALORICA Y ESTENOSIS VALVULAR PULMONAR PESO 6KG TALLA 67 PESO/EDAD -3 TALLA/EDAD DS-2 Y-3 PESO/ESTATURAMENOR DS-3','1','0000184',to_date('18/05/19','DD/MM/RR'),'2019-05-18','RC','1047062746','087580106601');
Insert into OASIS4.WEBSERV_JUNTA_PROFESIONAL (ID_JUPR,REPO_PERIODO,REPO_SERV_ID,REPO_TIRE_ID,NOPRESCRIPCION,FPRESCRIPCION,TIPOTECNOLOGIA,CONSECUTIVO,ESTJM,CODENTPROC,OBSERVACIONES,JUSTIFICACIONTECNICA,MODALIDAD,NOACTA,FECHAACTA,FPROCESO,TIPOIDPACIENTE,NROIDPACIENTE,CODENTJM) values ('377',to_date('14/05/19','DD/MM/RR'),'9','2','20190514125011960075',to_date('14/05/19','DD/MM/RR'),'N','1','2',null,null,null,null,null,to_date('01/01/70','DD/MM/RR'),null,'TI','1052962875','134300290801');
Insert into OASIS4.WEBSERV_JUNTA_PROFESIONAL (ID_JUPR,REPO_PERIODO,REPO_SERV_ID,REPO_TIRE_ID,NOPRESCRIPCION,FPRESCRIPCION,TIPOTECNOLOGIA,CONSECUTIVO,ESTJM,CODENTPROC,OBSERVACIONES,JUSTIFICACIONTECNICA,MODALIDAD,NOACTA,FECHAACTA,FPROCESO,TIPOIDPACIENTE,NROIDPACIENTE,CODENTJM) values ('378',to_date('14/05/19','DD/MM/RR'),'9','2','20190514113011960594',to_date('14/05/19','DD/MM/RR'),'N','1','3','134300290801',null,'DESNUTRICIÃ“N PROTEICOCALORICA severa ','1','06',to_date('04/06/19','DD/MM/RR'),'2019-06-04','CC','22995018','134300290801');
Insert into OASIS4.WEBSERV_JUNTA_PROFESIONAL (ID_JUPR,REPO_PERIODO,REPO_SERV_ID,REPO_TIRE_ID,NOPRESCRIPCION,FPRESCRIPCION,TIPOTECNOLOGIA,CONSECUTIVO,ESTJM,CODENTPROC,OBSERVACIONES,JUSTIFICACIONTECNICA,MODALIDAD,NOACTA,FECHAACTA,FPROCESO,TIPOIDPACIENTE,NROIDPACIENTE,CODENTJM) values ('379',to_date('14/05/19','DD/MM/RR'),'9','2','20190514136011967711',to_date('14/05/19','DD/MM/RR'),'N','1','3','130010178101',null,'DÃ‰FICIT DE PESO, TUMOR MALIGNO EN EL ESTOMAGO, ANEMIA, GASTRITIS CRÃ“NICA.CEFALEA por lo que se requiere complementar requerimientos nutricional.','1','21',to_date('14/05/19','DD/MM/RR'),'2019-05-14','CC','23138841','130010178101');
Insert into OASIS4.WEBSERV_JUNTA_PROFESIONAL (ID_JUPR,REPO_PERIODO,REPO_SERV_ID,REPO_TIRE_ID,NOPRESCRIPCION,FPRESCRIPCION,TIPOTECNOLOGIA,CONSECUTIVO,ESTJM,CODENTPROC,OBSERVACIONES,JUSTIFICACIONTECNICA,MODALIDAD,NOACTA,FECHAACTA,FPROCESO,TIPOIDPACIENTE,NROIDPACIENTE,CODENTJM) values ('380',to_date('14/05/19','DD/MM/RR'),'9','2','20190514157011972671',to_date('14/05/19','DD/MM/RR'),'N','1','3','472450060501',null,'PACIENTE CON SECUELAS DE Acv ISQUEMICO HEMISFERICO IZQUIERDO, QUIEN NO CONTROLA ESFINTERES, requiere soporte nutricional no presenta adecuada deglucion','2','012',to_date('14/05/19','DD/MM/RR'),'2019-05-14','CC','23037193','472450060501');
Insert into OASIS4.WEBSERV_JUNTA_PROFESIONAL (ID_JUPR,REPO_PERIODO,REPO_SERV_ID,REPO_TIRE_ID,NOPRESCRIPCION,FPRESCRIPCION,TIPOTECNOLOGIA,CONSECUTIVO,ESTJM,CODENTPROC,OBSERVACIONES,JUSTIFICACIONTECNICA,MODALIDAD,NOACTA,FECHAACTA,FPROCESO,TIPOIDPACIENTE,NROIDPACIENTE,CODENTJM) values ('381',to_date('14/05/19','DD/MM/RR'),'9','2','20190514178011953619',to_date('14/05/19','DD/MM/RR'),'S','2','2',null,null,null,null,null,to_date('01/01/70','DD/MM/RR'),null,'CC','1114121015','761000252401');
Insert into OASIS4.WEBSERV_JUNTA_PROFESIONAL (ID_JUPR,REPO_PERIODO,REPO_SERV_ID,REPO_TIRE_ID,NOPRESCRIPCION,FPRESCRIPCION,TIPOTECNOLOGIA,CONSECUTIVO,ESTJM,CODENTPROC,OBSERVACIONES,JUSTIFICACIONTECNICA,MODALIDAD,NOACTA,FECHAACTA,FPROCESO,TIPOIDPACIENTE,NROIDPACIENTE,CODENTJM) values ('382',to_date('14/05/19','DD/MM/RR'),'9','2','20190514135011954703',to_date('14/05/19','DD/MM/RR'),'S','1','3','470010096901',null,'traslado en ambulancia redondo en la santa paulina CRA CRA 16 #13C-39 16 de mayo 3:30 pm domicilio CRA 42 #5C-14 LA NEVADA','1','879',to_date('14/05/19','DD/MM/RR'),'2019-05-14','CC','5107258','470010096901');
Insert into OASIS4.WEBSERV_JUNTA_PROFESIONAL (ID_JUPR,REPO_PERIODO,REPO_SERV_ID,REPO_TIRE_ID,NOPRESCRIPCION,FPRESCRIPCION,TIPOTECNOLOGIA,CONSECUTIVO,ESTJM,CODENTPROC,OBSERVACIONES,JUSTIFICACIONTECNICA,MODALIDAD,NOACTA,FECHAACTA,FPROCESO,TIPOIDPACIENTE,NROIDPACIENTE,CODENTJM) values ('383',to_date('15/05/19','DD/MM/RR'),'9','2','20190515137011986513',to_date('15/05/19','DD/MM/RR'),'N','1','3','761470067210',null,'aprobado ensure 16 latas, para 4 latas al mes, prescripcion de acuerdo a diagnostico.','1','28',to_date('08/07/19','DD/MM/RR'),'2019-07-08','CC','16210068','761470067210');
Insert into OASIS4.WEBSERV_JUNTA_PROFESIONAL (ID_JUPR,REPO_PERIODO,REPO_SERV_ID,REPO_TIRE_ID,NOPRESCRIPCION,FPRESCRIPCION,TIPOTECNOLOGIA,CONSECUTIVO,ESTJM,CODENTPROC,OBSERVACIONES,JUSTIFICACIONTECNICA,MODALIDAD,NOACTA,FECHAACTA,FPROCESO,TIPOIDPACIENTE,NROIDPACIENTE,CODENTJM) values ('384',to_date('15/05/19','DD/MM/RR'),'9','2','20190515195011988556',to_date('15/05/19','DD/MM/RR'),'N','1','2',null,null,null,null,null,to_date('01/01/70','DD/MM/RR'),null,'TI','1082242826','080010380001');
Insert into OASIS4.WEBSERV_JUNTA_PROFESIONAL (ID_JUPR,REPO_PERIODO,REPO_SERV_ID,REPO_TIRE_ID,NOPRESCRIPCION,FPRESCRIPCION,TIPOTECNOLOGIA,CONSECUTIVO,ESTJM,CODENTPROC,OBSERVACIONES,JUSTIFICACIONTECNICA,MODALIDAD,NOACTA,FECHAACTA,FPROCESO,TIPOIDPACIENTE,NROIDPACIENTE,CODENTJM) values ('385',to_date('15/05/19','DD/MM/RR'),'9','2','20190515192011990229',to_date('15/05/19','DD/MM/RR'),'N','1','3','080010054401',null,'LA JUNTA MEDICA HA REVISADO SU CASO Y DECIDEN POR CONDICION CLINICA DEL PACIENTE SE AUTORIZA EL USO DE FORMULA NUTRICIONAL  PEDIASURE','1','0826',to_date('15/05/19','DD/MM/RR'),'2019-05-15','RC','1043029863','080010054401');
Insert into OASIS4.WEBSERV_JUNTA_PROFESIONAL (ID_JUPR,REPO_PERIODO,REPO_SERV_ID,REPO_TIRE_ID,NOPRESCRIPCION,FPRESCRIPCION,TIPOTECNOLOGIA,CONSECUTIVO,ESTJM,CODENTPROC,OBSERVACIONES,JUSTIFICACIONTECNICA,MODALIDAD,NOACTA,FECHAACTA,FPROCESO,TIPOIDPACIENTE,NROIDPACIENTE,CODENTJM) values ('386',to_date('15/05/19','DD/MM/RR'),'9','2','20190515138011994275',to_date('15/05/19','DD/MM/RR'),'N','1','3','087580106601',null,'PCTE CON DESNUTRICION CRONICA TALLA BAJA PARA LA EDAD CON PESO 9KG TALLA 78 CM PESO/TALLA -1 Y -2 TALLA/EDAD < -2','1','0000186',to_date('18/05/19','DD/MM/RR'),'2019-05-18','RC','1234892032','087580106601');
Insert into OASIS4.WEBSERV_JUNTA_PROFESIONAL (ID_JUPR,REPO_PERIODO,REPO_SERV_ID,REPO_TIRE_ID,NOPRESCRIPCION,FPRESCRIPCION,TIPOTECNOLOGIA,CONSECUTIVO,ESTJM,CODENTPROC,OBSERVACIONES,JUSTIFICACIONTECNICA,MODALIDAD,NOACTA,FECHAACTA,FPROCESO,TIPOIDPACIENTE,NROIDPACIENTE,CODENTJM) values ('387',to_date('15/05/19','DD/MM/RR'),'9','2','20190515166011994367',to_date('15/05/19','DD/MM/RR'),'N','1','2',null,null,null,null,null,to_date('01/01/70','DD/MM/RR'),null,'CC','22458989','086380015401');
Insert into OASIS4.WEBSERV_JUNTA_PROFESIONAL (ID_JUPR,REPO_PERIODO,REPO_SERV_ID,REPO_TIRE_ID,NOPRESCRIPCION,FPRESCRIPCION,TIPOTECNOLOGIA,CONSECUTIVO,ESTJM,CODENTPROC,OBSERVACIONES,JUSTIFICACIONTECNICA,MODALIDAD,NOACTA,FECHAACTA,FPROCESO,TIPOIDPACIENTE,NROIDPACIENTE,CODENTJM) values ('388',to_date('15/05/19','DD/MM/RR'),'9','2','20190515136011994702',to_date('15/05/19','DD/MM/RR'),'N','1','2',null,null,null,null,null,to_date('01/01/70','DD/MM/RR'),null,'CC','26792962','200010205401');
Insert into OASIS4.WEBSERV_JUNTA_PROFESIONAL (ID_JUPR,REPO_PERIODO,REPO_SERV_ID,REPO_TIRE_ID,NOPRESCRIPCION,FPRESCRIPCION,TIPOTECNOLOGIA,CONSECUTIVO,ESTJM,CODENTPROC,OBSERVACIONES,JUSTIFICACIONTECNICA,MODALIDAD,NOACTA,FECHAACTA,FPROCESO,TIPOIDPACIENTE,NROIDPACIENTE,CODENTJM) values ('389',to_date('15/05/19','DD/MM/RR'),'9','2','20190515174011994969',to_date('15/05/19','DD/MM/RR'),'N','1','3','087580106601',null,'PCTE CON DESN PROTEICOCALORICA PESO 6.5KG TALLA 71 CMS PC 44CM PESO/TALLA -2 Y -3 TALLA/EDAD -1 DE PB 12.4 CM','1','0000185',to_date('18/05/19','DD/MM/RR'),'2019-05-18','RC','1044667835','087580106601');
Insert into OASIS4.WEBSERV_JUNTA_PROFESIONAL (ID_JUPR,REPO_PERIODO,REPO_SERV_ID,REPO_TIRE_ID,NOPRESCRIPCION,FPRESCRIPCION,TIPOTECNOLOGIA,CONSECUTIVO,ESTJM,CODENTPROC,OBSERVACIONES,JUSTIFICACIONTECNICA,MODALIDAD,NOACTA,FECHAACTA,FPROCESO,TIPOIDPACIENTE,NROIDPACIENTE,CODENTJM) values ('390',to_date('15/05/19','DD/MM/RR'),'9','2','20190515130012004549',to_date('15/05/19','DD/MM/RR'),'N','1','3','700010146401',null,'bajo peso con riesgo a desnutricion ','1','1',to_date('15/05/19','DD/MM/RR'),'2019-05-15','RC','1100696159','700010146401');
Insert into OASIS4.WEBSERV_JUNTA_PROFESIONAL (ID_JUPR,REPO_PERIODO,REPO_SERV_ID,REPO_TIRE_ID,NOPRESCRIPCION,FPRESCRIPCION,TIPOTECNOLOGIA,CONSECUTIVO,ESTJM,CODENTPROC,OBSERVACIONES,JUSTIFICACIONTECNICA,MODALIDAD,NOACTA,FECHAACTA,FPROCESO,TIPOIDPACIENTE,NROIDPACIENTE,CODENTJM) values ('391',to_date('15/05/19','DD/MM/RR'),'9','2','20190515178011984870',to_date('15/05/19','DD/MM/RR'),'S','1','2',null,null,null,null,null,to_date('01/01/70','DD/MM/RR'),null,'TI','1001899704','130010181303');
Insert into OASIS4.WEBSERV_JUNTA_PROFESIONAL (ID_JUPR,REPO_PERIODO,REPO_SERV_ID,REPO_TIRE_ID,NOPRESCRIPCION,FPRESCRIPCION,TIPOTECNOLOGIA,CONSECUTIVO,ESTJM,CODENTPROC,OBSERVACIONES,JUSTIFICACIONTECNICA,MODALIDAD,NOACTA,FECHAACTA,FPROCESO,TIPOIDPACIENTE,NROIDPACIENTE,CODENTJM) values ('392',to_date('15/05/19','DD/MM/RR'),'9','2','20190515168011995506',to_date('15/05/19','DD/MM/RR'),'S','2','2',null,null,null,null,null,to_date('01/01/70','DD/MM/RR'),null,'CC','26792962','200010205401');
Insert into OASIS4.WEBSERV_JUNTA_PROFESIONAL (ID_JUPR,REPO_PERIODO,REPO_SERV_ID,REPO_TIRE_ID,NOPRESCRIPCION,FPRESCRIPCION,TIPOTECNOLOGIA,CONSECUTIVO,ESTJM,CODENTPROC,OBSERVACIONES,JUSTIFICACIONTECNICA,MODALIDAD,NOACTA,FECHAACTA,FPROCESO,TIPOIDPACIENTE,NROIDPACIENTE,CODENTJM) values ('393',to_date('15/05/19','DD/MM/RR'),'9','2','20190515145012006760',to_date('15/05/19','DD/MM/RR'),'S','1','4','200010033001',null,'PACIENTE CON METÃ?STASIS PULMONAR CON SOBRE INFECCIÃ“N PULMONAR CON SUPLENCIA BÃ?SICA PERMANENTE DE OXIGENO Y IMPSOBILIDAD PARA DEAMBULAR. ','1','09',to_date('18/05/19','DD/MM/RR'),'2019-05-18','CC','27641194','200010033001');
Insert into OASIS4.WEBSERV_JUNTA_PROFESIONAL (ID_JUPR,REPO_PERIODO,REPO_SERV_ID,REPO_TIRE_ID,NOPRESCRIPCION,FPRESCRIPCION,TIPOTECNOLOGIA,CONSECUTIVO,ESTJM,CODENTPROC,OBSERVACIONES,JUSTIFICACIONTECNICA,MODALIDAD,NOACTA,FECHAACTA,FPROCESO,TIPOIDPACIENTE,NROIDPACIENTE,CODENTJM) values ('394',to_date('16/05/19','DD/MM/RR'),'9','2','20190516126012017034',to_date('16/05/19','DD/MM/RR'),'M','1','2',null,null,null,null,null,to_date('01/01/70','DD/MM/RR'),null,'CC','23115713','130010046102');
Insert into OASIS4.WEBSERV_JUNTA_PROFESIONAL (ID_JUPR,REPO_PERIODO,REPO_SERV_ID,REPO_TIRE_ID,NOPRESCRIPCION,FPRESCRIPCION,TIPOTECNOLOGIA,CONSECUTIVO,ESTJM,CODENTPROC,OBSERVACIONES,JUSTIFICACIONTECNICA,MODALIDAD,NOACTA,FECHAACTA,FPROCESO,TIPOIDPACIENTE,NROIDPACIENTE,CODENTJM) values ('395',to_date('16/05/19','DD/MM/RR'),'9','2','20190516100012023927',to_date('16/05/19','DD/MM/RR'),'N','1','2',null,null,null,null,null,to_date('01/01/70','DD/MM/RR'),null,'CC','842159','080010409201');
Insert into OASIS4.WEBSERV_JUNTA_PROFESIONAL (ID_JUPR,REPO_PERIODO,REPO_SERV_ID,REPO_TIRE_ID,NOPRESCRIPCION,FPRESCRIPCION,TIPOTECNOLOGIA,CONSECUTIVO,ESTJM,CODENTPROC,OBSERVACIONES,JUSTIFICACIONTECNICA,MODALIDAD,NOACTA,FECHAACTA,FPROCESO,TIPOIDPACIENTE,NROIDPACIENTE,CODENTJM) values ('396',to_date('16/05/19','DD/MM/RR'),'9','2','20190516168012025063',to_date('16/05/19','DD/MM/RR'),'N','1','3','050010217501',null,'7 AÃ‘, DESNUTRIC SEVERA, XEROSI GENERALIZA, RESECCIÃ“N INTEST DELGADO, POR NECROSIS INTEST. REQ MAYOR DEMANDA DIARIA DE CALORIAS Y NUTRIENTES, REQ COMP NUTRICIO  ','1','1044',to_date('17/05/19','DD/MM/RR'),'2019-05-17','RC','1076330825','050010217501');
Insert into OASIS4.WEBSERV_JUNTA_PROFESIONAL (ID_JUPR,REPO_PERIODO,REPO_SERV_ID,REPO_TIRE_ID,NOPRESCRIPCION,FPRESCRIPCION,TIPOTECNOLOGIA,CONSECUTIVO,ESTJM,CODENTPROC,OBSERVACIONES,JUSTIFICACIONTECNICA,MODALIDAD,NOACTA,FECHAACTA,FPROCESO,TIPOIDPACIENTE,NROIDPACIENTE,CODENTJM) values ('397',to_date('16/05/19','DD/MM/RR'),'9','2','20190516130012027008',to_date('16/05/19','DD/MM/RR'),'N','1','3','086340010501',null,'PACIENTE DE 3 AÃ‘OS 9 MESES  DE EDAD CON PESO DE 12 KG TALLA 95 CM CON DIAGNOSTICO NUTRICIONAL DE RETARDO DE CRECIMIENTO Y RIESGO DE DESNUTRICIÃ“N.  ','1','16',to_date('16/05/19','DD/MM/RR'),'2019-05-16','RC','1042355925','086340010501');
Insert into OASIS4.WEBSERV_JUNTA_PROFESIONAL (ID_JUPR,REPO_PERIODO,REPO_SERV_ID,REPO_TIRE_ID,NOPRESCRIPCION,FPRESCRIPCION,TIPOTECNOLOGIA,CONSECUTIVO,ESTJM,CODENTPROC,OBSERVACIONES,JUSTIFICACIONTECNICA,MODALIDAD,NOACTA,FECHAACTA,FPROCESO,TIPOIDPACIENTE,NROIDPACIENTE,CODENTJM) values ('398',to_date('16/05/19','DD/MM/RR'),'9','2','20190516173012027278',to_date('16/05/19','DD/MM/RR'),'N','1','2',null,null,null,null,null,to_date('01/01/70','DD/MM/RR'),null,'RC','1043192710','087580016101');
Insert into OASIS4.WEBSERV_JUNTA_PROFESIONAL (ID_JUPR,REPO_PERIODO,REPO_SERV_ID,REPO_TIRE_ID,NOPRESCRIPCION,FPRESCRIPCION,TIPOTECNOLOGIA,CONSECUTIVO,ESTJM,CODENTPROC,OBSERVACIONES,JUSTIFICACIONTECNICA,MODALIDAD,NOACTA,FECHAACTA,FPROCESO,TIPOIDPACIENTE,NROIDPACIENTE,CODENTJM) values ('399',to_date('16/05/19','DD/MM/RR'),'9','2','20190516145012034092',to_date('16/05/19','DD/MM/RR'),'N','1','3','761470851601',null,'quien requiere COMPLEMENTAR SU NUTRICION, con alimento en polvo,completo y balanceado, con HMB (ÃŸ-hidroxi- Metilbutirato), proteÃ­na y vitamina D, vÃ­a oral','1','MP0078',to_date('20/05/19','DD/MM/RR'),'2019-05-20','CC','16206746','761470851601');
Insert into OASIS4.WEBSERV_JUNTA_PROFESIONAL (ID_JUPR,REPO_PERIODO,REPO_SERV_ID,REPO_TIRE_ID,NOPRESCRIPCION,FPRESCRIPCION,TIPOTECNOLOGIA,CONSECUTIVO,ESTJM,CODENTPROC,OBSERVACIONES,JUSTIFICACIONTECNICA,MODALIDAD,NOACTA,FECHAACTA,FPROCESO,TIPOIDPACIENTE,NROIDPACIENTE,CODENTJM) values ('400',to_date('16/05/19','DD/MM/RR'),'9','2','20190516173012024184',to_date('16/05/19','DD/MM/RR'),'S','1','2',null,null,null,null,null,to_date('01/01/70','DD/MM/RR'),null,'TI','1002277166','200010205401');
Insert into OASIS4.WEBSERV_JUNTA_PROFESIONAL (ID_JUPR,REPO_PERIODO,REPO_SERV_ID,REPO_TIRE_ID,NOPRESCRIPCION,FPRESCRIPCION,TIPOTECNOLOGIA,CONSECUTIVO,ESTJM,CODENTPROC,OBSERVACIONES,JUSTIFICACIONTECNICA,MODALIDAD,NOACTA,FECHAACTA,FPROCESO,TIPOIDPACIENTE,NROIDPACIENTE,CODENTJM) values ('401',to_date('16/05/19','DD/MM/RR'),'9','2','20190516193012028724',to_date('16/05/19','DD/MM/RR'),'S','2','2',null,null,null,null,null,to_date('01/01/70','DD/MM/RR'),null,'CC','26796647','200010205401');
Insert into OASIS4.WEBSERV_JUNTA_PROFESIONAL (ID_JUPR,REPO_PERIODO,REPO_SERV_ID,REPO_TIRE_ID,NOPRESCRIPCION,FPRESCRIPCION,TIPOTECNOLOGIA,CONSECUTIVO,ESTJM,CODENTPROC,OBSERVACIONES,JUSTIFICACIONTECNICA,MODALIDAD,NOACTA,FECHAACTA,FPROCESO,TIPOIDPACIENTE,NROIDPACIENTE,CODENTJM) values ('402',to_date('16/05/19','DD/MM/RR'),'9','2','20190516193012028724',to_date('16/05/19','DD/MM/RR'),'S','3','2',null,null,null,null,null,to_date('01/01/70','DD/MM/RR'),null,'CC','26796647','200010205401');
Insert into OASIS4.WEBSERV_JUNTA_PROFESIONAL (ID_JUPR,REPO_PERIODO,REPO_SERV_ID,REPO_TIRE_ID,NOPRESCRIPCION,FPRESCRIPCION,TIPOTECNOLOGIA,CONSECUTIVO,ESTJM,CODENTPROC,OBSERVACIONES,JUSTIFICACIONTECNICA,MODALIDAD,NOACTA,FECHAACTA,FPROCESO,TIPOIDPACIENTE,NROIDPACIENTE,CODENTJM) values ('403',to_date('16/05/19','DD/MM/RR'),'9','2','20190516123012029308',to_date('16/05/19','DD/MM/RR'),'S','1','2',null,null,null,null,null,to_date('01/01/70','DD/MM/RR'),null,'CC','26796647','200010205401');
Insert into OASIS4.WEBSERV_JUNTA_PROFESIONAL (ID_JUPR,REPO_PERIODO,REPO_SERV_ID,REPO_TIRE_ID,NOPRESCRIPCION,FPRESCRIPCION,TIPOTECNOLOGIA,CONSECUTIVO,ESTJM,CODENTPROC,OBSERVACIONES,JUSTIFICACIONTECNICA,MODALIDAD,NOACTA,FECHAACTA,FPROCESO,TIPOIDPACIENTE,NROIDPACIENTE,CODENTJM) values ('404',to_date('16/05/19','DD/MM/RR'),'9','2','20190516129012031311',to_date('16/05/19','DD/MM/RR'),'S','1','2',null,null,null,null,null,to_date('01/01/70','DD/MM/RR'),null,'CC','5107258','200010205401');
Insert into OASIS4.WEBSERV_JUNTA_PROFESIONAL (ID_JUPR,REPO_PERIODO,REPO_SERV_ID,REPO_TIRE_ID,NOPRESCRIPCION,FPRESCRIPCION,TIPOTECNOLOGIA,CONSECUTIVO,ESTJM,CODENTPROC,OBSERVACIONES,JUSTIFICACIONTECNICA,MODALIDAD,NOACTA,FECHAACTA,FPROCESO,TIPOIDPACIENTE,NROIDPACIENTE,CODENTJM) values ('405',to_date('16/05/19','DD/MM/RR'),'9','2','20190516198012031825',to_date('16/05/19','DD/MM/RR'),'S','1','3','470010096901',null,'traslado en AMBULANCIA REDONDO paciente postrado en cama para realizar un rayos x de TÃ“RAX con cuadro RESPIRATORIO severo ','1','880',to_date('16/05/19','DD/MM/RR'),'2019-05-16','CC','5133831','470010096901');
Insert into OASIS4.WEBSERV_JUNTA_PROFESIONAL (ID_JUPR,REPO_PERIODO,REPO_SERV_ID,REPO_TIRE_ID,NOPRESCRIPCION,FPRESCRIPCION,TIPOTECNOLOGIA,CONSECUTIVO,ESTJM,CODENTPROC,OBSERVACIONES,JUSTIFICACIONTECNICA,MODALIDAD,NOACTA,FECHAACTA,FPROCESO,TIPOIDPACIENTE,NROIDPACIENTE,CODENTJM) values ('406',to_date('16/05/19','DD/MM/RR'),'9','2','20190516120012032244',to_date('16/05/19','DD/MM/RR'),'S','1','3','470010096901',null,'PACIENTE POSTRADA EN CAMA DEPENDIENTE CON SECUELAS DE ENFERMEDAD CEREBRO VASCULAR QUE AMERITA TRASLADO EN AMBULANCIA YA QUE POR SUS CONDICIONES NO SE PUEDE TRA','1','1',to_date('16/05/19','DD/MM/RR'),'2019-05-16','CC','26934818','470010096901');
Insert into OASIS4.WEBSERV_JUNTA_PROFESIONAL (ID_JUPR,REPO_PERIODO,REPO_SERV_ID,REPO_TIRE_ID,NOPRESCRIPCION,FPRESCRIPCION,TIPOTECNOLOGIA,CONSECUTIVO,ESTJM,CODENTPROC,OBSERVACIONES,JUSTIFICACIONTECNICA,MODALIDAD,NOACTA,FECHAACTA,FPROCESO,TIPOIDPACIENTE,NROIDPACIENTE,CODENTJM) values ('407',to_date('17/05/19','DD/MM/RR'),'9','2','20190517122012038633',to_date('17/05/19','DD/MM/RR'),'N','1','3','134300290801',null,'DESNUTRICIÃ“N PROTEICOCALORICA SEVERA NO ESPECIFICADA ','1','014',to_date('04/06/19','DD/MM/RR'),'2019-06-05','CC','22920666','134300290801');
Insert into OASIS4.WEBSERV_JUNTA_PROFESIONAL (ID_JUPR,REPO_PERIODO,REPO_SERV_ID,REPO_TIRE_ID,NOPRESCRIPCION,FPRESCRIPCION,TIPOTECNOLOGIA,CONSECUTIVO,ESTJM,CODENTPROC,OBSERVACIONES,JUSTIFICACIONTECNICA,MODALIDAD,NOACTA,FECHAACTA,FPROCESO,TIPOIDPACIENTE,NROIDPACIENTE,CODENTJM) values ('408',to_date('17/05/19','DD/MM/RR'),'9','2','20190517127012040644',to_date('17/05/19','DD/MM/RR'),'N','1','3','134300290801',null,'DESNUTRICIÃ“N PROTEICOCALORICA','1','05',to_date('04/06/19','DD/MM/RR'),'2019-06-04','RC','1052997440','134300290801');
Insert into OASIS4.WEBSERV_JUNTA_PROFESIONAL (ID_JUPR,REPO_PERIODO,REPO_SERV_ID,REPO_TIRE_ID,NOPRESCRIPCION,FPRESCRIPCION,TIPOTECNOLOGIA,CONSECUTIVO,ESTJM,CODENTPROC,OBSERVACIONES,JUSTIFICACIONTECNICA,MODALIDAD,NOACTA,FECHAACTA,FPROCESO,TIPOIDPACIENTE,NROIDPACIENTE,CODENTJM) values ('409',to_date('17/05/19','DD/MM/RR'),'9','2','20190517165012041239',to_date('17/05/19','DD/MM/RR'),'N','1','3','134300290801',null,'DESNUTRICIÃ“N PROTEICOCALORICA','1','04',to_date('04/06/19','DD/MM/RR'),'2019-06-04','CC','22923285','134300290801');
Insert into OASIS4.WEBSERV_JUNTA_PROFESIONAL (ID_JUPR,REPO_PERIODO,REPO_SERV_ID,REPO_TIRE_ID,NOPRESCRIPCION,FPRESCRIPCION,TIPOTECNOLOGIA,CONSECUTIVO,ESTJM,CODENTPROC,OBSERVACIONES,JUSTIFICACIONTECNICA,MODALIDAD,NOACTA,FECHAACTA,FPROCESO,TIPOIDPACIENTE,NROIDPACIENTE,CODENTJM) values ('410',to_date('17/05/19','DD/MM/RR'),'9','2','20190517180012041434',to_date('17/05/19','DD/MM/RR'),'N','1','2',null,null,null,null,null,to_date('01/01/70','DD/MM/RR'),null,'RC','1045751954','080010112201');
Insert into OASIS4.WEBSERV_JUNTA_PROFESIONAL (ID_JUPR,REPO_PERIODO,REPO_SERV_ID,REPO_TIRE_ID,NOPRESCRIPCION,FPRESCRIPCION,TIPOTECNOLOGIA,CONSECUTIVO,ESTJM,CODENTPROC,OBSERVACIONES,JUSTIFICACIONTECNICA,MODALIDAD,NOACTA,FECHAACTA,FPROCESO,TIPOIDPACIENTE,NROIDPACIENTE,CODENTJM) values ('411',to_date('17/05/19','DD/MM/RR'),'9','2','20190517125012042044',to_date('17/05/19','DD/MM/RR'),'N','1','3','134300290801',null,'DESNUTRICION PROTEICOCALORICA SEVERA ','1','02',to_date('04/06/19','DD/MM/RR'),'2019-06-04','TI','1052954518','134300290801');
Insert into OASIS4.WEBSERV_JUNTA_PROFESIONAL (ID_JUPR,REPO_PERIODO,REPO_SERV_ID,REPO_TIRE_ID,NOPRESCRIPCION,FPRESCRIPCION,TIPOTECNOLOGIA,CONSECUTIVO,ESTJM,CODENTPROC,OBSERVACIONES,JUSTIFICACIONTECNICA,MODALIDAD,NOACTA,FECHAACTA,FPROCESO,TIPOIDPACIENTE,NROIDPACIENTE,CODENTJM) values ('412',to_date('17/05/19','DD/MM/RR'),'9','2','20190517196012042126',to_date('17/05/19','DD/MM/RR'),'N','1','3','470580002301',null,'ADULTO MAYOR CON 92 AÃ‘OS DE EDAD CON DESNUTRICION CALORICO PROTEICA SEVEREA IMC 16.6 ANTECEDENTE DE HIPERPLASIA PROSTATICA, DEAMBULA EN SILLA DE RUEDAS','1','001',to_date('24/06/19','DD/MM/RR'),'2019-06-25','CC','5071461','470580002301');
Insert into OASIS4.WEBSERV_JUNTA_PROFESIONAL (ID_JUPR,REPO_PERIODO,REPO_SERV_ID,REPO_TIRE_ID,NOPRESCRIPCION,FPRESCRIPCION,TIPOTECNOLOGIA,CONSECUTIVO,ESTJM,CODENTPROC,OBSERVACIONES,JUSTIFICACIONTECNICA,MODALIDAD,NOACTA,FECHAACTA,FPROCESO,TIPOIDPACIENTE,NROIDPACIENTE,CODENTJM) values ('413',to_date('17/05/19','DD/MM/RR'),'9','2','20190517190012043610',to_date('17/05/19','DD/MM/RR'),'N','1','3','134300290801',null,'DESNUTRICIÃ“N PROTEICOCALORICA SEVERA NO ESPECIFICADA ','1','022',to_date('11/06/19','DD/MM/RR'),'2019-06-11','CC','33209608','134300290801');
Insert into OASIS4.WEBSERV_JUNTA_PROFESIONAL (ID_JUPR,REPO_PERIODO,REPO_SERV_ID,REPO_TIRE_ID,NOPRESCRIPCION,FPRESCRIPCION,TIPOTECNOLOGIA,CONSECUTIVO,ESTJM,CODENTPROC,OBSERVACIONES,JUSTIFICACIONTECNICA,MODALIDAD,NOACTA,FECHAACTA,FPROCESO,TIPOIDPACIENTE,NROIDPACIENTE,CODENTJM) values ('414',to_date('17/05/19','DD/MM/RR'),'9','2','20190517118012045895',to_date('17/05/19','DD/MM/RR'),'N','1','3','134300290801',null,'DESNUTRICIÃ“N PROTEICOCALORICA SEVERA','1','07',to_date('04/06/19','DD/MM/RR'),'2019-06-04','CC','22921042','134300290801');
Insert into OASIS4.WEBSERV_JUNTA_PROFESIONAL (ID_JUPR,REPO_PERIODO,REPO_SERV_ID,REPO_TIRE_ID,NOPRESCRIPCION,FPRESCRIPCION,TIPOTECNOLOGIA,CONSECUTIVO,ESTJM,CODENTPROC,OBSERVACIONES,JUSTIFICACIONTECNICA,MODALIDAD,NOACTA,FECHAACTA,FPROCESO,TIPOIDPACIENTE,NROIDPACIENTE,CODENTJM) values ('415',to_date('17/05/19','DD/MM/RR'),'9','2','20190517135012046793',to_date('17/05/19','DD/MM/RR'),'N','1','3','134300290801',null,'DESNUTRICIÃ“N PROTEICOCALORICA SEVERA NO ESPECIFICADA ','1','015',to_date('04/06/19','DD/MM/RR'),'2019-06-05','CC','22927481','134300290801');
Insert into OASIS4.WEBSERV_JUNTA_PROFESIONAL (ID_JUPR,REPO_PERIODO,REPO_SERV_ID,REPO_TIRE_ID,NOPRESCRIPCION,FPRESCRIPCION,TIPOTECNOLOGIA,CONSECUTIVO,ESTJM,CODENTPROC,OBSERVACIONES,JUSTIFICACIONTECNICA,MODALIDAD,NOACTA,FECHAACTA,FPROCESO,TIPOIDPACIENTE,NROIDPACIENTE,CODENTJM) values ('416',to_date('17/05/19','DD/MM/RR'),'9','2','20190517110012047859',to_date('17/05/19','DD/MM/RR'),'N','1','3','134300290801',null,'diabetes mellitus no insulinodependiente, sin mencio de complicacion, paciente requiere xsuplemnto ','1','016',to_date('04/06/19','DD/MM/RR'),'2019-06-05','CC','33310377','134300290801');
Insert into OASIS4.WEBSERV_JUNTA_PROFESIONAL (ID_JUPR,REPO_PERIODO,REPO_SERV_ID,REPO_TIRE_ID,NOPRESCRIPCION,FPRESCRIPCION,TIPOTECNOLOGIA,CONSECUTIVO,ESTJM,CODENTPROC,OBSERVACIONES,JUSTIFICACIONTECNICA,MODALIDAD,NOACTA,FECHAACTA,FPROCESO,TIPOIDPACIENTE,NROIDPACIENTE,CODENTJM) values ('417',to_date('17/05/19','DD/MM/RR'),'9','2','20190517143012051645',to_date('17/05/19','DD/MM/RR'),'N','1','3','087580016101',null,'se solicita alimento liquido completo y balanceado con proteinas vitamina d, hmb para recuperar estado nutricional del paciente.','1','00003',to_date('15/06/19','DD/MM/RR'),'2019-06-15','CC','26835785','087580016101');
Insert into OASIS4.WEBSERV_JUNTA_PROFESIONAL (ID_JUPR,REPO_PERIODO,REPO_SERV_ID,REPO_TIRE_ID,NOPRESCRIPCION,FPRESCRIPCION,TIPOTECNOLOGIA,CONSECUTIVO,ESTJM,CODENTPROC,OBSERVACIONES,JUSTIFICACIONTECNICA,MODALIDAD,NOACTA,FECHAACTA,FPROCESO,TIPOIDPACIENTE,NROIDPACIENTE,CODENTJM) values ('418',to_date('17/05/19','DD/MM/RR'),'9','2','20190517126012054071',to_date('17/05/19','DD/MM/RR'),'N','1','2',null,null,null,null,null,to_date('01/01/70','DD/MM/RR'),null,'CC','24999535','761470067210');
Insert into OASIS4.WEBSERV_JUNTA_PROFESIONAL (ID_JUPR,REPO_PERIODO,REPO_SERV_ID,REPO_TIRE_ID,NOPRESCRIPCION,FPRESCRIPCION,TIPOTECNOLOGIA,CONSECUTIVO,ESTJM,CODENTPROC,OBSERVACIONES,JUSTIFICACIONTECNICA,MODALIDAD,NOACTA,FECHAACTA,FPROCESO,TIPOIDPACIENTE,NROIDPACIENTE,CODENTJM) values ('419',to_date('18/05/19','DD/MM/RR'),'9','2','20190518148012058788',to_date('18/05/19','DD/MM/RR'),'N','1','3','134300290801',null,'DESNUTRICIÃ“N PROTEICOCALORICA SEVERA NO ESPECIFICADA ','1','09',to_date('04/06/19','DD/MM/RR'),'2019-06-04','CC','9127740','134300290801');
Insert into OASIS4.WEBSERV_JUNTA_PROFESIONAL (ID_JUPR,REPO_PERIODO,REPO_SERV_ID,REPO_TIRE_ID,NOPRESCRIPCION,FPRESCRIPCION,TIPOTECNOLOGIA,CONSECUTIVO,ESTJM,CODENTPROC,OBSERVACIONES,JUSTIFICACIONTECNICA,MODALIDAD,NOACTA,FECHAACTA,FPROCESO,TIPOIDPACIENTE,NROIDPACIENTE,CODENTJM) values ('420',to_date('18/05/19','DD/MM/RR'),'9','2','20190518167012063146',to_date('18/05/19','DD/MM/RR'),'N','1','3','134300290801',null,'BAJO PESO PARA LA EDAD GESTACIONAL ','1','011',to_date('04/06/19','DD/MM/RR'),'2019-06-04','CC','1052947079','134300290801');
Insert into OASIS4.WEBSERV_JUNTA_PROFESIONAL (ID_JUPR,REPO_PERIODO,REPO_SERV_ID,REPO_TIRE_ID,NOPRESCRIPCION,FPRESCRIPCION,TIPOTECNOLOGIA,CONSECUTIVO,ESTJM,CODENTPROC,OBSERVACIONES,JUSTIFICACIONTECNICA,MODALIDAD,NOACTA,FECHAACTA,FPROCESO,TIPOIDPACIENTE,NROIDPACIENTE,CODENTJM) values ('421',to_date('20/05/19','DD/MM/RR'),'9','2','20190520173012074363',to_date('20/05/19','DD/MM/RR'),'N','1','2',null,null,null,null,null,to_date('01/01/70','DD/MM/RR'),null,'RC','1114158466','761470067210');
Insert into OASIS4.WEBSERV_JUNTA_PROFESIONAL (ID_JUPR,REPO_PERIODO,REPO_SERV_ID,REPO_TIRE_ID,NOPRESCRIPCION,FPRESCRIPCION,TIPOTECNOLOGIA,CONSECUTIVO,ESTJM,CODENTPROC,OBSERVACIONES,JUSTIFICACIONTECNICA,MODALIDAD,NOACTA,FECHAACTA,FPROCESO,TIPOIDPACIENTE,NROIDPACIENTE,CODENTJM) values ('422',to_date('20/05/19','DD/MM/RR'),'9','2','20190520187012075285',to_date('20/05/19','DD/MM/RR'),'N','1','2',null,null,null,null,null,to_date('01/01/70','DD/MM/RR'),null,'RC','1114158466','761470067210');
Insert into OASIS4.WEBSERV_JUNTA_PROFESIONAL (ID_JUPR,REPO_PERIODO,REPO_SERV_ID,REPO_TIRE_ID,NOPRESCRIPCION,FPRESCRIPCION,TIPOTECNOLOGIA,CONSECUTIVO,ESTJM,CODENTPROC,OBSERVACIONES,JUSTIFICACIONTECNICA,MODALIDAD,NOACTA,FECHAACTA,FPROCESO,TIPOIDPACIENTE,NROIDPACIENTE,CODENTJM) values ('423',to_date('20/05/19','DD/MM/RR'),'9','2','20190520190012077708',to_date('20/05/19','DD/MM/RR'),'N','1','3','080010445401',null,'paciente masculino de 76 aÃ±os, con dx medico de enfermedad pulmonar obstructiva cronica, hipertensiÃ³n y delgadez, requiere soporte nutricional.','2','37',to_date('20/05/19','DD/MM/RR'),'2019-05-20','CC','7421413','080010445401');
Insert into OASIS4.WEBSERV_JUNTA_PROFESIONAL (ID_JUPR,REPO_PERIODO,REPO_SERV_ID,REPO_TIRE_ID,NOPRESCRIPCION,FPRESCRIPCION,TIPOTECNOLOGIA,CONSECUTIVO,ESTJM,CODENTPROC,OBSERVACIONES,JUSTIFICACIONTECNICA,MODALIDAD,NOACTA,FECHAACTA,FPROCESO,TIPOIDPACIENTE,NROIDPACIENTE,CODENTJM) values ('424',to_date('20/05/19','DD/MM/RR'),'9','2','20190520142012078050',to_date('20/05/19','DD/MM/RR'),'N','1','2',null,null,null,null,null,to_date('01/01/70','DD/MM/RR'),null,'CC','31420061','761470067210');
Insert into OASIS4.WEBSERV_JUNTA_PROFESIONAL (ID_JUPR,REPO_PERIODO,REPO_SERV_ID,REPO_TIRE_ID,NOPRESCRIPCION,FPRESCRIPCION,TIPOTECNOLOGIA,CONSECUTIVO,ESTJM,CODENTPROC,OBSERVACIONES,JUSTIFICACIONTECNICA,MODALIDAD,NOACTA,FECHAACTA,FPROCESO,TIPOIDPACIENTE,NROIDPACIENTE,CODENTJM) values ('425',to_date('20/05/19','DD/MM/RR'),'9','2','20190520196012078598',to_date('20/05/19','DD/MM/RR'),'N','1','2',null,null,null,null,null,to_date('01/01/70','DD/MM/RR'),null,'CC','22670599','086850011001');
Insert into OASIS4.WEBSERV_JUNTA_PROFESIONAL (ID_JUPR,REPO_PERIODO,REPO_SERV_ID,REPO_TIRE_ID,NOPRESCRIPCION,FPRESCRIPCION,TIPOTECNOLOGIA,CONSECUTIVO,ESTJM,CODENTPROC,OBSERVACIONES,JUSTIFICACIONTECNICA,MODALIDAD,NOACTA,FECHAACTA,FPROCESO,TIPOIDPACIENTE,NROIDPACIENTE,CODENTJM) values ('426',to_date('20/05/19','DD/MM/RR'),'9','2','20190520168012079776',to_date('20/05/19','DD/MM/RR'),'N','1','3','761470851601',null,' QUIEN REQUIERE COMPLEMENTAR SU NUTRICION CON con alimento liquido densamente calÃ³rico 1.3 Kcal/mL, hiperprotÃ©ico 20.5%, proteÃ­na hidrolizada a base de pÃ©ptido','1','MP0077',to_date('20/05/19','DD/MM/RR'),'2019-05-20','CC','1097395951','761470851601');
Insert into OASIS4.WEBSERV_JUNTA_PROFESIONAL (ID_JUPR,REPO_PERIODO,REPO_SERV_ID,REPO_TIRE_ID,NOPRESCRIPCION,FPRESCRIPCION,TIPOTECNOLOGIA,CONSECUTIVO,ESTJM,CODENTPROC,OBSERVACIONES,JUSTIFICACIONTECNICA,MODALIDAD,NOACTA,FECHAACTA,FPROCESO,TIPOIDPACIENTE,NROIDPACIENTE,CODENTJM) values ('427',to_date('20/05/19','DD/MM/RR'),'9','2','20190520141012087211',to_date('20/05/19','DD/MM/RR'),'N','1','2',null,null,null,null,null,to_date('01/01/70','DD/MM/RR'),null,'CC','6111164','ESS076');
Insert into OASIS4.WEBSERV_JUNTA_PROFESIONAL (ID_JUPR,REPO_PERIODO,REPO_SERV_ID,REPO_TIRE_ID,NOPRESCRIPCION,FPRESCRIPCION,TIPOTECNOLOGIA,CONSECUTIVO,ESTJM,CODENTPROC,OBSERVACIONES,JUSTIFICACIONTECNICA,MODALIDAD,NOACTA,FECHAACTA,FPROCESO,TIPOIDPACIENTE,NROIDPACIENTE,CODENTJM) values ('428',to_date('20/05/19','DD/MM/RR'),'9','2','20190520160012087631',to_date('20/05/19','DD/MM/RR'),'N','1','3','761470851601',null,'paciente con dx principal confirmado con alimento completo y balanceado a base de proteÃ­na 15% VCT, vitaminas y minerales,','1','MP0079',to_date('20/05/19','DD/MM/RR'),'2019-05-20','CC','29622979','761470851601');
Insert into OASIS4.WEBSERV_JUNTA_PROFESIONAL (ID_JUPR,REPO_PERIODO,REPO_SERV_ID,REPO_TIRE_ID,NOPRESCRIPCION,FPRESCRIPCION,TIPOTECNOLOGIA,CONSECUTIVO,ESTJM,CODENTPROC,OBSERVACIONES,JUSTIFICACIONTECNICA,MODALIDAD,NOACTA,FECHAACTA,FPROCESO,TIPOIDPACIENTE,NROIDPACIENTE,CODENTJM) values ('429',to_date('20/05/19','DD/MM/RR'),'9','2','20190520127012088704',to_date('20/05/19','DD/MM/RR'),'N','1','3','087580106601',null,'PACIENTE CON DESNUTRICION PROTEICO CALORICA  PESO 6.1 KG TALLA 63 CM TALLA/EDAD <2 PESO/TALLA <2 Y <3  IMC 15.4','1','00004',to_date('05/06/19','DD/MM/RR'),'2019-06-05','RC','1130283875','087580106601');
Insert into OASIS4.WEBSERV_JUNTA_PROFESIONAL (ID_JUPR,REPO_PERIODO,REPO_SERV_ID,REPO_TIRE_ID,NOPRESCRIPCION,FPRESCRIPCION,TIPOTECNOLOGIA,CONSECUTIVO,ESTJM,CODENTPROC,OBSERVACIONES,JUSTIFICACIONTECNICA,MODALIDAD,NOACTA,FECHAACTA,FPROCESO,TIPOIDPACIENTE,NROIDPACIENTE,CODENTJM) values ('430',to_date('20/05/19','DD/MM/RR'),'9','2','20190520133012088869',to_date('20/05/19','DD/MM/RR'),'N','1','3','087580106601',null,'PCTE CON DESNUTRICION PROTEICO CALORICA  PESO 6.2 KG TALLA 63 CM PESO/TALLA -2 Y -3  IMC 15.6','1','00005',to_date('05/06/19','DD/MM/RR'),'2019-06-05','RC','1130283874','087580106601');
Insert into OASIS4.WEBSERV_JUNTA_PROFESIONAL (ID_JUPR,REPO_PERIODO,REPO_SERV_ID,REPO_TIRE_ID,NOPRESCRIPCION,FPRESCRIPCION,TIPOTECNOLOGIA,CONSECUTIVO,ESTJM,CODENTPROC,OBSERVACIONES,JUSTIFICACIONTECNICA,MODALIDAD,NOACTA,FECHAACTA,FPROCESO,TIPOIDPACIENTE,NROIDPACIENTE,CODENTJM) values ('431',to_date('20/05/19','DD/MM/RR'),'9','2','20190520183012090442',to_date('20/05/19','DD/MM/RR'),'N','1','2',null,null,null,null,null,to_date('01/01/70','DD/MM/RR'),null,'CC','22435887','087580016101');
Insert into OASIS4.WEBSERV_JUNTA_PROFESIONAL (ID_JUPR,REPO_PERIODO,REPO_SERV_ID,REPO_TIRE_ID,NOPRESCRIPCION,FPRESCRIPCION,TIPOTECNOLOGIA,CONSECUTIVO,ESTJM,CODENTPROC,OBSERVACIONES,JUSTIFICACIONTECNICA,MODALIDAD,NOACTA,FECHAACTA,FPROCESO,TIPOIDPACIENTE,NROIDPACIENTE,CODENTJM) values ('432',to_date('20/05/19','DD/MM/RR'),'9','2','20190520185012078405',to_date('20/05/19','DD/MM/RR'),'S','1','3','470010096901',null,'traslado redondo en ambulancia para estudio diagnostico en valledupar ','1','882',to_date('20/05/19','DD/MM/RR'),'2019-05-20','CC','22787177','470010096901');
Insert into OASIS4.WEBSERV_JUNTA_PROFESIONAL (ID_JUPR,REPO_PERIODO,REPO_SERV_ID,REPO_TIRE_ID,NOPRESCRIPCION,FPRESCRIPCION,TIPOTECNOLOGIA,CONSECUTIVO,ESTJM,CODENTPROC,OBSERVACIONES,JUSTIFICACIONTECNICA,MODALIDAD,NOACTA,FECHAACTA,FPROCESO,TIPOIDPACIENTE,NROIDPACIENTE,CODENTJM) values ('433',to_date('20/05/19','DD/MM/RR'),'9','2','20190520128012079144',to_date('20/05/19','DD/MM/RR'),'S','1','3','470010096901',null,'TRASLADO REDONDO DE AMBULANCIA DIA 30 DE MAYO 2019 8:00 AM LUGAR: CRA 16 #13C-39 SANTA PAULINA IPS BARRIO ALFONSO LÃ“PEZ CASA MANZANA 89 CASA 11 GARUPAL IV ETAPA','1','892',to_date('20/05/19','DD/MM/RR'),'2019-05-20','CC','42486073','470010096901');
Insert into OASIS4.WEBSERV_JUNTA_PROFESIONAL (ID_JUPR,REPO_PERIODO,REPO_SERV_ID,REPO_TIRE_ID,NOPRESCRIPCION,FPRESCRIPCION,TIPOTECNOLOGIA,CONSECUTIVO,ESTJM,CODENTPROC,OBSERVACIONES,JUSTIFICACIONTECNICA,MODALIDAD,NOACTA,FECHAACTA,FPROCESO,TIPOIDPACIENTE,NROIDPACIENTE,CODENTJM) values ('434',to_date('20/05/19','DD/MM/RR'),'9','2','20190520151012079986',to_date('20/05/19','DD/MM/RR'),'S','1','3','470010096901',null,'traslado en ambulancia redondo dia 22/05/2019 a las 8:00 am lugar laura daniela CRA 19 #14-47  MANZANA 22 BLOQUE G APARTAMENTO 103 NANDO MARÃ?N \n\n','1','893',to_date('20/05/19','DD/MM/RR'),'2019-05-20','CC','26951444','470010096901');
Insert into OASIS4.WEBSERV_JUNTA_PROFESIONAL (ID_JUPR,REPO_PERIODO,REPO_SERV_ID,REPO_TIRE_ID,NOPRESCRIPCION,FPRESCRIPCION,TIPOTECNOLOGIA,CONSECUTIVO,ESTJM,CODENTPROC,OBSERVACIONES,JUSTIFICACIONTECNICA,MODALIDAD,NOACTA,FECHAACTA,FPROCESO,TIPOIDPACIENTE,NROIDPACIENTE,CODENTJM) values ('435',to_date('20/05/19','DD/MM/RR'),'9','2','20190520152012086961',to_date('20/05/19','DD/MM/RR'),'S','1','2',null,null,null,null,null,to_date('01/01/70','DD/MM/RR'),null,'CC','6111164','ESS076');
Insert into OASIS4.WEBSERV_JUNTA_PROFESIONAL (ID_JUPR,REPO_PERIODO,REPO_SERV_ID,REPO_TIRE_ID,NOPRESCRIPCION,FPRESCRIPCION,TIPOTECNOLOGIA,CONSECUTIVO,ESTJM,CODENTPROC,OBSERVACIONES,JUSTIFICACIONTECNICA,MODALIDAD,NOACTA,FECHAACTA,FPROCESO,TIPOIDPACIENTE,NROIDPACIENTE,CODENTJM) values ('436',to_date('20/05/19','DD/MM/RR'),'9','2','20190520196012091558',to_date('20/05/19','DD/MM/RR'),'S','1','2',null,null,null,null,null,to_date('01/01/70','DD/MM/RR'),null,'CC','36458206','200010029001');
Insert into OASIS4.WEBSERV_JUNTA_PROFESIONAL (ID_JUPR,REPO_PERIODO,REPO_SERV_ID,REPO_TIRE_ID,NOPRESCRIPCION,FPRESCRIPCION,TIPOTECNOLOGIA,CONSECUTIVO,ESTJM,CODENTPROC,OBSERVACIONES,JUSTIFICACIONTECNICA,MODALIDAD,NOACTA,FECHAACTA,FPROCESO,TIPOIDPACIENTE,NROIDPACIENTE,CODENTJM) values ('437',to_date('21/05/19','DD/MM/RR'),'9','2','20190521153012103468',to_date('21/05/19','DD/MM/RR'),'M','1','2',null,null,null,null,null,to_date('01/01/70','DD/MM/RR'),null,'CC','33205767','134300068301');
Insert into OASIS4.WEBSERV_JUNTA_PROFESIONAL (ID_JUPR,REPO_PERIODO,REPO_SERV_ID,REPO_TIRE_ID,NOPRESCRIPCION,FPRESCRIPCION,TIPOTECNOLOGIA,CONSECUTIVO,ESTJM,CODENTPROC,OBSERVACIONES,JUSTIFICACIONTECNICA,MODALIDAD,NOACTA,FECHAACTA,FPROCESO,TIPOIDPACIENTE,NROIDPACIENTE,CODENTJM) values ('438',to_date('21/05/19','DD/MM/RR'),'9','2','20190521196012120761',to_date('21/05/19','DD/MM/RR'),'M','1','3','200010001801',null,' paciente con diagnostico LLA BCR/ABL POSITIVO MUY ALTO RIESGO EN RECAIDA TEMPRANA, la cual requiere de quimioterapia PARA LEUCEMIA LINFOBLASTICA BCR/ABL ','1','12',to_date('24/07/19','DD/MM/RR'),'2019-07-24','CC','39015334','200010001801');
Insert into OASIS4.WEBSERV_JUNTA_PROFESIONAL (ID_JUPR,REPO_PERIODO,REPO_SERV_ID,REPO_TIRE_ID,NOPRESCRIPCION,FPRESCRIPCION,TIPOTECNOLOGIA,CONSECUTIVO,ESTJM,CODENTPROC,OBSERVACIONES,JUSTIFICACIONTECNICA,MODALIDAD,NOACTA,FECHAACTA,FPROCESO,TIPOIDPACIENTE,NROIDPACIENTE,CODENTJM) values ('439',to_date('21/05/19','DD/MM/RR'),'9','2','20190521143012124360',to_date('21/05/19','DD/MM/RR'),'M','1','3','200010053001',null,'PACIENTE CON PATRON MEMBRANOSO Y PROLIFERATIVO CLASE V DE NO RESPUESTA A C ICLOFOSFAMIDA ANTE LA PROGRESION DE LA PROTEINURIA A 6G Y DETERIORO DE FUNCION RENAL','1','0000027',to_date('22/05/19','DD/MM/RR'),'2019-05-22','CC','36695869','200010053001');
Insert into OASIS4.WEBSERV_JUNTA_PROFESIONAL (ID_JUPR,REPO_PERIODO,REPO_SERV_ID,REPO_TIRE_ID,NOPRESCRIPCION,FPRESCRIPCION,TIPOTECNOLOGIA,CONSECUTIVO,ESTJM,CODENTPROC,OBSERVACIONES,JUSTIFICACIONTECNICA,MODALIDAD,NOACTA,FECHAACTA,FPROCESO,TIPOIDPACIENTE,NROIDPACIENTE,CODENTJM) values ('440',to_date('21/05/19','DD/MM/RR'),'9','2','20190521198012101610',to_date('21/05/19','DD/MM/RR'),'N','1','2',null,null,null,null,null,to_date('01/01/70','DD/MM/RR'),null,'CC','2478297','760410406501');
Insert into OASIS4.WEBSERV_JUNTA_PROFESIONAL (ID_JUPR,REPO_PERIODO,REPO_SERV_ID,REPO_TIRE_ID,NOPRESCRIPCION,FPRESCRIPCION,TIPOTECNOLOGIA,CONSECUTIVO,ESTJM,CODENTPROC,OBSERVACIONES,JUSTIFICACIONTECNICA,MODALIDAD,NOACTA,FECHAACTA,FPROCESO,TIPOIDPACIENTE,NROIDPACIENTE,CODENTJM) values ('441',to_date('21/05/19','DD/MM/RR'),'9','2','20190521170012101722',to_date('21/05/19','DD/MM/RR'),'N','1','3','134300290801',null,'DESNUTRICIÃ“N PROTEICOCALORICA SEVERA NO ESPECIFICADA ','1','012',to_date('04/06/19','DD/MM/RR'),'2019-06-04','TI','1047045188','134300290801');
Insert into OASIS4.WEBSERV_JUNTA_PROFESIONAL (ID_JUPR,REPO_PERIODO,REPO_SERV_ID,REPO_TIRE_ID,NOPRESCRIPCION,FPRESCRIPCION,TIPOTECNOLOGIA,CONSECUTIVO,ESTJM,CODENTPROC,OBSERVACIONES,JUSTIFICACIONTECNICA,MODALIDAD,NOACTA,FECHAACTA,FPROCESO,TIPOIDPACIENTE,NROIDPACIENTE,CODENTJM) values ('442',to_date('21/05/19','DD/MM/RR'),'9','2','20190521163012102993',to_date('21/05/19','DD/MM/RR'),'N','1','2',null,null,null,null,null,to_date('01/01/70','DD/MM/RR'),null,'CC','22520836','080010112201');
Insert into OASIS4.WEBSERV_JUNTA_PROFESIONAL (ID_JUPR,REPO_PERIODO,REPO_SERV_ID,REPO_TIRE_ID,NOPRESCRIPCION,FPRESCRIPCION,TIPOTECNOLOGIA,CONSECUTIVO,ESTJM,CODENTPROC,OBSERVACIONES,JUSTIFICACIONTECNICA,MODALIDAD,NOACTA,FECHAACTA,FPROCESO,TIPOIDPACIENTE,NROIDPACIENTE,CODENTJM) values ('443',to_date('21/05/19','DD/MM/RR'),'9','2','20190521118012103656',to_date('21/05/19','DD/MM/RR'),'N','1','2',null,null,null,null,null,to_date('01/01/70','DD/MM/RR'),null,'TI','1052944232','134300290801');
Insert into OASIS4.WEBSERV_JUNTA_PROFESIONAL (ID_JUPR,REPO_PERIODO,REPO_SERV_ID,REPO_TIRE_ID,NOPRESCRIPCION,FPRESCRIPCION,TIPOTECNOLOGIA,CONSECUTIVO,ESTJM,CODENTPROC,OBSERVACIONES,JUSTIFICACIONTECNICA,MODALIDAD,NOACTA,FECHAACTA,FPROCESO,TIPOIDPACIENTE,NROIDPACIENTE,CODENTJM) values ('444',to_date('21/05/19','DD/MM/RR'),'9','2','20190521180012105434',to_date('21/05/19','DD/MM/RR'),'N','1','3','134300290801',null,'DESNUTRICIÃ“N PROTEICOCALORICA SEVERA NO ESPECIFICADA ','1','010',to_date('04/06/19','DD/MM/RR'),'2019-06-04','TI','1052944232','134300290801');
Insert into OASIS4.WEBSERV_JUNTA_PROFESIONAL (ID_JUPR,REPO_PERIODO,REPO_SERV_ID,REPO_TIRE_ID,NOPRESCRIPCION,FPRESCRIPCION,TIPOTECNOLOGIA,CONSECUTIVO,ESTJM,CODENTPROC,OBSERVACIONES,JUSTIFICACIONTECNICA,MODALIDAD,NOACTA,FECHAACTA,FPROCESO,TIPOIDPACIENTE,NROIDPACIENTE,CODENTJM) values ('445',to_date('21/05/19','DD/MM/RR'),'9','2','20190521133012105903',to_date('21/05/19','DD/MM/RR'),'N','1','3','134300290801',null,'DESNUTRICIÃ“N proteicocalorica severa, paciente requiere el suplemento ','1','01',to_date('04/06/19','DD/MM/RR'),'2019-06-04','TI','1050725715','134300290801');
Insert into OASIS4.WEBSERV_JUNTA_PROFESIONAL (ID_JUPR,REPO_PERIODO,REPO_SERV_ID,REPO_TIRE_ID,NOPRESCRIPCION,FPRESCRIPCION,TIPOTECNOLOGIA,CONSECUTIVO,ESTJM,CODENTPROC,OBSERVACIONES,JUSTIFICACIONTECNICA,MODALIDAD,NOACTA,FECHAACTA,FPROCESO,TIPOIDPACIENTE,NROIDPACIENTE,CODENTJM) values ('446',to_date('21/05/19','DD/MM/RR'),'9','2','20190521156012108269',to_date('21/05/19','DD/MM/RR'),'N','1','3','130010210201',null,'ADOLESCENTE femenina de alto riesgo  con DESNUTRICIÃ“N moderada  PREVIAMENTE al embarazo con perdida de peso  con alto riesgo de neonato de bajo peso al nacer  ','2','1',to_date('21/05/19','DD/MM/RR'),'2019-05-21','TI','1002316627','130010210201');
Insert into OASIS4.WEBSERV_JUNTA_PROFESIONAL (ID_JUPR,REPO_PERIODO,REPO_SERV_ID,REPO_TIRE_ID,NOPRESCRIPCION,FPRESCRIPCION,TIPOTECNOLOGIA,CONSECUTIVO,ESTJM,CODENTPROC,OBSERVACIONES,JUSTIFICACIONTECNICA,MODALIDAD,NOACTA,FECHAACTA,FPROCESO,TIPOIDPACIENTE,NROIDPACIENTE,CODENTJM) values ('447',to_date('21/05/19','DD/MM/RR'),'9','2','20190521125012109864',to_date('21/05/19','DD/MM/RR'),'N','1','2',null,null,null,null,null,to_date('01/01/70','DD/MM/RR'),null,'CC','32811242','080010054401');
Insert into OASIS4.WEBSERV_JUNTA_PROFESIONAL (ID_JUPR,REPO_PERIODO,REPO_SERV_ID,REPO_TIRE_ID,NOPRESCRIPCION,FPRESCRIPCION,TIPOTECNOLOGIA,CONSECUTIVO,ESTJM,CODENTPROC,OBSERVACIONES,JUSTIFICACIONTECNICA,MODALIDAD,NOACTA,FECHAACTA,FPROCESO,TIPOIDPACIENTE,NROIDPACIENTE,CODENTJM) values ('448',to_date('21/05/19','DD/MM/RR'),'9','2','20190521198012101610',to_date('21/05/19','DD/MM/RR'),'S','2','2',null,null,null,null,null,to_date('01/01/70','DD/MM/RR'),null,'CC','2478297','760410406501');
Insert into OASIS4.WEBSERV_JUNTA_PROFESIONAL (ID_JUPR,REPO_PERIODO,REPO_SERV_ID,REPO_TIRE_ID,NOPRESCRIPCION,FPRESCRIPCION,TIPOTECNOLOGIA,CONSECUTIVO,ESTJM,CODENTPROC,OBSERVACIONES,JUSTIFICACIONTECNICA,MODALIDAD,NOACTA,FECHAACTA,FPROCESO,TIPOIDPACIENTE,NROIDPACIENTE,CODENTJM) values ('449',to_date('21/05/19','DD/MM/RR'),'9','2','20190521198012101610',to_date('21/05/19','DD/MM/RR'),'S','3','2',null,null,null,null,null,to_date('01/01/70','DD/MM/RR'),null,'CC','2478297','760410406501');
Insert into OASIS4.WEBSERV_JUNTA_PROFESIONAL (ID_JUPR,REPO_PERIODO,REPO_SERV_ID,REPO_TIRE_ID,NOPRESCRIPCION,FPRESCRIPCION,TIPOTECNOLOGIA,CONSECUTIVO,ESTJM,CODENTPROC,OBSERVACIONES,JUSTIFICACIONTECNICA,MODALIDAD,NOACTA,FECHAACTA,FPROCESO,TIPOIDPACIENTE,NROIDPACIENTE,CODENTJM) values ('450',to_date('21/05/19','DD/MM/RR'),'9','2','20190521137012116309',to_date('21/05/19','DD/MM/RR'),'S','1','3','080010349401',null,'PACIENTE CON INCONTINENCIA FECAL Y URINARIA QUE REQUIERE SUMINISTRO DE PAÃ‘ALES DESECHABLES Y PAÃ‘OS HUMEDOS PARA OPTIMIZAR CONDICIONES DE HIGIENE.','2','003',to_date('21/05/19','DD/MM/RR'),'2019-05-21','CC','32617036','080010349401');
Insert into OASIS4.WEBSERV_JUNTA_PROFESIONAL (ID_JUPR,REPO_PERIODO,REPO_SERV_ID,REPO_TIRE_ID,NOPRESCRIPCION,FPRESCRIPCION,TIPOTECNOLOGIA,CONSECUTIVO,ESTJM,CODENTPROC,OBSERVACIONES,JUSTIFICACIONTECNICA,MODALIDAD,NOACTA,FECHAACTA,FPROCESO,TIPOIDPACIENTE,NROIDPACIENTE,CODENTJM) values ('451',to_date('21/05/19','DD/MM/RR'),'9','2','20190521193012121193',to_date('21/05/19','DD/MM/RR'),'S','1','2',null,null,null,null,null,to_date('01/01/70','DD/MM/RR'),null,'CC','6785362','761470067210');
Insert into OASIS4.WEBSERV_JUNTA_PROFESIONAL (ID_JUPR,REPO_PERIODO,REPO_SERV_ID,REPO_TIRE_ID,NOPRESCRIPCION,FPRESCRIPCION,TIPOTECNOLOGIA,CONSECUTIVO,ESTJM,CODENTPROC,OBSERVACIONES,JUSTIFICACIONTECNICA,MODALIDAD,NOACTA,FECHAACTA,FPROCESO,TIPOIDPACIENTE,NROIDPACIENTE,CODENTJM) values ('452',to_date('22/05/19','DD/MM/RR'),'9','2','20190522147012136437',to_date('22/05/19','DD/MM/RR'),'N','1','3','080010226001',null,'PACIENTE MASCULINO, 3 AÃ‘OS 1 MES DE EDAD. PESO ACTUAL 10KG, TALLA 89CM. TALLA EDAD 2,28DS. PESO TALLA 2,86. ANTECEDENTE DE PARALISIS CEREBRAL Y MICROCEFALEA SEC','1','060720191214',to_date('06/07/19','DD/MM/RR'),'2019-07-06','RC','1130277763','080010226001');
Insert into OASIS4.WEBSERV_JUNTA_PROFESIONAL (ID_JUPR,REPO_PERIODO,REPO_SERV_ID,REPO_TIRE_ID,NOPRESCRIPCION,FPRESCRIPCION,TIPOTECNOLOGIA,CONSECUTIVO,ESTJM,CODENTPROC,OBSERVACIONES,JUSTIFICACIONTECNICA,MODALIDAD,NOACTA,FECHAACTA,FPROCESO,TIPOIDPACIENTE,NROIDPACIENTE,CODENTJM) values ('453',to_date('22/05/19','DD/MM/RR'),'9','2','20190522149012136460',to_date('22/05/19','DD/MM/RR'),'N','1','2',null,null,null,null,null,to_date('01/01/70','DD/MM/RR'),null,'CC','1004307976','475550016701');
Insert into OASIS4.WEBSERV_JUNTA_PROFESIONAL (ID_JUPR,REPO_PERIODO,REPO_SERV_ID,REPO_TIRE_ID,NOPRESCRIPCION,FPRESCRIPCION,TIPOTECNOLOGIA,CONSECUTIVO,ESTJM,CODENTPROC,OBSERVACIONES,JUSTIFICACIONTECNICA,MODALIDAD,NOACTA,FECHAACTA,FPROCESO,TIPOIDPACIENTE,NROIDPACIENTE,CODENTJM) values ('454',to_date('22/05/19','DD/MM/RR'),'9','2','20190522159012140179',to_date('22/05/19','DD/MM/RR'),'N','1','3','080010445406',null,'Paciente femenina de 78 aÃ±os, con Dx mÃ©dico de Osteoporosis, artritis, pÃ©rdida del apetito, y Dx nutricional de delgadez, requiere complemento nutricional','2','48',to_date('22/05/19','DD/MM/RR'),'2019-05-22','CC','32605040','080010445406');
Insert into OASIS4.WEBSERV_JUNTA_PROFESIONAL (ID_JUPR,REPO_PERIODO,REPO_SERV_ID,REPO_TIRE_ID,NOPRESCRIPCION,FPRESCRIPCION,TIPOTECNOLOGIA,CONSECUTIVO,ESTJM,CODENTPROC,OBSERVACIONES,JUSTIFICACIONTECNICA,MODALIDAD,NOACTA,FECHAACTA,FPROCESO,TIPOIDPACIENTE,NROIDPACIENTE,CODENTJM) values ('455',to_date('22/05/19','DD/MM/RR'),'9','2','20190522113012147610',to_date('22/05/19','DD/MM/RR'),'N','1','2',null,null,null,null,null,to_date('01/01/70','DD/MM/RR'),null,'TI','1050460083','134300049201');
Insert into OASIS4.WEBSERV_JUNTA_PROFESIONAL (ID_JUPR,REPO_PERIODO,REPO_SERV_ID,REPO_TIRE_ID,NOPRESCRIPCION,FPRESCRIPCION,TIPOTECNOLOGIA,CONSECUTIVO,ESTJM,CODENTPROC,OBSERVACIONES,JUSTIFICACIONTECNICA,MODALIDAD,NOACTA,FECHAACTA,FPROCESO,TIPOIDPACIENTE,NROIDPACIENTE,CODENTJM) values ('456',to_date('22/05/19','DD/MM/RR'),'9','2','20190522153012149879',to_date('22/05/19','DD/MM/RR'),'N','1','2',null,null,null,null,null,to_date('01/01/70','DD/MM/RR'),null,'CC','31413537','761470067210');
Insert into OASIS4.WEBSERV_JUNTA_PROFESIONAL (ID_JUPR,REPO_PERIODO,REPO_SERV_ID,REPO_TIRE_ID,NOPRESCRIPCION,FPRESCRIPCION,TIPOTECNOLOGIA,CONSECUTIVO,ESTJM,CODENTPROC,OBSERVACIONES,JUSTIFICACIONTECNICA,MODALIDAD,NOACTA,FECHAACTA,FPROCESO,TIPOIDPACIENTE,NROIDPACIENTE,CODENTJM) values ('457',to_date('23/05/19','DD/MM/RR'),'9','2','20190523133012176900',to_date('23/05/19','DD/MM/RR'),'M','1','3','760010379901',null,'ASOCIACIÃ“N MUTUAL BARRIOS UNIDOS DE QUIBDÃ“','1','0322-19',to_date('28/05/19','DD/MM/RR'),'2019-05-31','TI','1006385299','760010379901');
Insert into OASIS4.WEBSERV_JUNTA_PROFESIONAL (ID_JUPR,REPO_PERIODO,REPO_SERV_ID,REPO_TIRE_ID,NOPRESCRIPCION,FPRESCRIPCION,TIPOTECNOLOGIA,CONSECUTIVO,ESTJM,CODENTPROC,OBSERVACIONES,JUSTIFICACIONTECNICA,MODALIDAD,NOACTA,FECHAACTA,FPROCESO,TIPOIDPACIENTE,NROIDPACIENTE,CODENTJM) values ('458',to_date('23/05/19','DD/MM/RR'),'9','2','20190523127012157390',to_date('23/05/19','DD/MM/RR'),'N','1','2',null,null,null,null,null,to_date('01/01/70','DD/MM/RR'),null,'CC','29388015','ESS076');
Insert into OASIS4.WEBSERV_JUNTA_PROFESIONAL (ID_JUPR,REPO_PERIODO,REPO_SERV_ID,REPO_TIRE_ID,NOPRESCRIPCION,FPRESCRIPCION,TIPOTECNOLOGIA,CONSECUTIVO,ESTJM,CODENTPROC,OBSERVACIONES,JUSTIFICACIONTECNICA,MODALIDAD,NOACTA,FECHAACTA,FPROCESO,TIPOIDPACIENTE,NROIDPACIENTE,CODENTJM) values ('459',to_date('23/05/19','DD/MM/RR'),'9','2','20190523115012163028',to_date('23/05/19','DD/MM/RR'),'N','1','3','082960002101',null,'DESNUTRICION PROTEICO CALORICA MODERADA','1','0011',to_date('23/05/19','DD/MM/RR'),'2019-05-23','CC','32803693','082960002101');
Insert into OASIS4.WEBSERV_JUNTA_PROFESIONAL (ID_JUPR,REPO_PERIODO,REPO_SERV_ID,REPO_TIRE_ID,NOPRESCRIPCION,FPRESCRIPCION,TIPOTECNOLOGIA,CONSECUTIVO,ESTJM,CODENTPROC,OBSERVACIONES,JUSTIFICACIONTECNICA,MODALIDAD,NOACTA,FECHAACTA,FPROCESO,TIPOIDPACIENTE,NROIDPACIENTE,CODENTJM) values ('460',to_date('23/05/19','DD/MM/RR'),'9','2','20190523127012164891',to_date('23/05/19','DD/MM/RR'),'N','1','2',null,null,null,null,null,to_date('01/01/70','DD/MM/RR'),null,'CC','850437','080010054401');
Insert into OASIS4.WEBSERV_JUNTA_PROFESIONAL (ID_JUPR,REPO_PERIODO,REPO_SERV_ID,REPO_TIRE_ID,NOPRESCRIPCION,FPRESCRIPCION,TIPOTECNOLOGIA,CONSECUTIVO,ESTJM,CODENTPROC,OBSERVACIONES,JUSTIFICACIONTECNICA,MODALIDAD,NOACTA,FECHAACTA,FPROCESO,TIPOIDPACIENTE,NROIDPACIENTE,CODENTJM) values ('461',to_date('23/05/19','DD/MM/RR'),'9','2','20190523167012169634',to_date('23/05/19','DD/MM/RR'),'N','1','3','700010096901',null,'PACIENTE CON DESNUTRICION PROTEICOCALORICA SEVERA CON PATOLOGIA NEOPLASICA DEL SISTEMA INMUNE','1','1',to_date('24/05/19','DD/MM/RR'),'2019-06-06','CC','3918020','700010096901');
Insert into OASIS4.WEBSERV_JUNTA_PROFESIONAL (ID_JUPR,REPO_PERIODO,REPO_SERV_ID,REPO_TIRE_ID,NOPRESCRIPCION,FPRESCRIPCION,TIPOTECNOLOGIA,CONSECUTIVO,ESTJM,CODENTPROC,OBSERVACIONES,JUSTIFICACIONTECNICA,MODALIDAD,NOACTA,FECHAACTA,FPROCESO,TIPOIDPACIENTE,NROIDPACIENTE,CODENTJM) values ('462',to_date('23/05/19','DD/MM/RR'),'9','2','20190523117012170162',to_date('23/05/19','DD/MM/RR'),'N','1','3','130010178101',null,'SE ORDENA RÃ‰GIMEN ALIMENTARIO DE CONSISTENCIA BLANDA, MAS  PULMOCARE 2 VECES AL DÃ?A, 120 LATAS, POR 60 DÃ?AS, SE LE HACE EDUCACIÃ“N NUTRICIONAL, CITA EN 2 MESES. ','1','22',to_date('23/05/19','DD/MM/RR'),'2019-05-24','CC','967561','130010178101');
Insert into OASIS4.WEBSERV_JUNTA_PROFESIONAL (ID_JUPR,REPO_PERIODO,REPO_SERV_ID,REPO_TIRE_ID,NOPRESCRIPCION,FPRESCRIPCION,TIPOTECNOLOGIA,CONSECUTIVO,ESTJM,CODENTPROC,OBSERVACIONES,JUSTIFICACIONTECNICA,MODALIDAD,NOACTA,FECHAACTA,FPROCESO,TIPOIDPACIENTE,NROIDPACIENTE,CODENTJM) values ('463',to_date('23/05/19','DD/MM/RR'),'9','2','20190523115012171443',to_date('23/05/19','DD/MM/RR'),'N','1','3','130010178101',null,'SIGUE CON DÃ‰FICIT DE PESO, BAJÃ“ 5 KILOGRAMO DE PESO EN 2 MESES, MANIFIESTA FAMILIAR, QUE SU EPS, NO LE SUMINISTRARON, LOS SUPLEMENTOS NUTRICIONALES, POR LO QUE ','1','24',to_date('23/05/19','DD/MM/RR'),'2019-05-24','CC','3809959','130010178101');
Insert into OASIS4.WEBSERV_JUNTA_PROFESIONAL (ID_JUPR,REPO_PERIODO,REPO_SERV_ID,REPO_TIRE_ID,NOPRESCRIPCION,FPRESCRIPCION,TIPOTECNOLOGIA,CONSECUTIVO,ESTJM,CODENTPROC,OBSERVACIONES,JUSTIFICACIONTECNICA,MODALIDAD,NOACTA,FECHAACTA,FPROCESO,TIPOIDPACIENTE,NROIDPACIENTE,CODENTJM) values ('464',to_date('23/05/19','DD/MM/RR'),'9','2','20190523189012172143',to_date('23/05/19','DD/MM/RR'),'N','1','3','080010054401',null,'LA JUNTA MEDICA HA REVISADO SU CASO Y DECIDEN POR CONDICION CLINICA DEL PACIENTE SE AUTORIZA EL USO DE FORMULA NUTRICIONAL POLIMERICA NEPRO BP 237 ML ','1','0841',to_date('23/05/19','DD/MM/RR'),'2019-05-23','CC','850437','080010054401');
Insert into OASIS4.WEBSERV_JUNTA_PROFESIONAL (ID_JUPR,REPO_PERIODO,REPO_SERV_ID,REPO_TIRE_ID,NOPRESCRIPCION,FPRESCRIPCION,TIPOTECNOLOGIA,CONSECUTIVO,ESTJM,CODENTPROC,OBSERVACIONES,JUSTIFICACIONTECNICA,MODALIDAD,NOACTA,FECHAACTA,FPROCESO,TIPOIDPACIENTE,NROIDPACIENTE,CODENTJM) values ('465',to_date('23/05/19','DD/MM/RR'),'9','2','20190523157012172315',to_date('23/05/19','DD/MM/RR'),'N','1','4','761470067210',null,'no se aprueba debe pasar de nuevo por consulta medica ','1','22',to_date('27/06/19','DD/MM/RR'),'2019-06-27','CC','29365663','761470067210');
Insert into OASIS4.WEBSERV_JUNTA_PROFESIONAL (ID_JUPR,REPO_PERIODO,REPO_SERV_ID,REPO_TIRE_ID,NOPRESCRIPCION,FPRESCRIPCION,TIPOTECNOLOGIA,CONSECUTIVO,ESTJM,CODENTPROC,OBSERVACIONES,JUSTIFICACIONTECNICA,MODALIDAD,NOACTA,FECHAACTA,FPROCESO,TIPOIDPACIENTE,NROIDPACIENTE,CODENTJM) values ('466',to_date('23/05/19','DD/MM/RR'),'9','2','20190523165012176069',to_date('23/05/19','DD/MM/RR'),'N','1','3','761470851601',null,' quien requiere COMPLEMENTAR SU NUTRICIÃ“N con alimento en polvo con carbohidratos de digestiÃ³n lenta que favorece el control de la GLUCEMIA, Ã¡cidos grasos','1','MP0081',to_date('24/05/19','DD/MM/RR'),'2019-05-27','CC','29368732','761470851601');
Insert into OASIS4.WEBSERV_JUNTA_PROFESIONAL (ID_JUPR,REPO_PERIODO,REPO_SERV_ID,REPO_TIRE_ID,NOPRESCRIPCION,FPRESCRIPCION,TIPOTECNOLOGIA,CONSECUTIVO,ESTJM,CODENTPROC,OBSERVACIONES,JUSTIFICACIONTECNICA,MODALIDAD,NOACTA,FECHAACTA,FPROCESO,TIPOIDPACIENTE,NROIDPACIENTE,CODENTJM) values ('467',to_date('23/05/19','DD/MM/RR'),'9','2','20190523170012180758',to_date('23/05/19','DD/MM/RR'),'N','1','2',null,null,null,null,null,to_date('01/01/70','DD/MM/RR'),null,'CC','22491063','086380074501');
Insert into OASIS4.WEBSERV_JUNTA_PROFESIONAL (ID_JUPR,REPO_PERIODO,REPO_SERV_ID,REPO_TIRE_ID,NOPRESCRIPCION,FPRESCRIPCION,TIPOTECNOLOGIA,CONSECUTIVO,ESTJM,CODENTPROC,OBSERVACIONES,JUSTIFICACIONTECNICA,MODALIDAD,NOACTA,FECHAACTA,FPROCESO,TIPOIDPACIENTE,NROIDPACIENTE,CODENTJM) values ('468',to_date('23/05/19','DD/MM/RR'),'9','2','20190523168012180859',to_date('23/05/19','DD/MM/RR'),'N','1','2',null,null,null,null,null,to_date('01/01/70','DD/MM/RR'),null,'CC','7429531','086380074501');
Insert into OASIS4.WEBSERV_JUNTA_PROFESIONAL (ID_JUPR,REPO_PERIODO,REPO_SERV_ID,REPO_TIRE_ID,NOPRESCRIPCION,FPRESCRIPCION,TIPOTECNOLOGIA,CONSECUTIVO,ESTJM,CODENTPROC,OBSERVACIONES,JUSTIFICACIONTECNICA,MODALIDAD,NOACTA,FECHAACTA,FPROCESO,TIPOIDPACIENTE,NROIDPACIENTE,CODENTJM) values ('469',to_date('23/05/19','DD/MM/RR'),'9','2','20190523172012154070',to_date('23/05/19','DD/MM/RR'),'S','1','3','080010349401',null,'PACIENTE POSTRADA EN CAMA, CON CUADRIPARESIA ESPASTICA, MUTISMO, SOMNOLIENTA, NO OBEDECE ORDENES, CON INCONTINENCIA URINARIA Y FECAL.','2','006',to_date('24/05/19','DD/MM/RR'),'2019-05-24','CC','57171175','080010349401');
Insert into OASIS4.WEBSERV_JUNTA_PROFESIONAL (ID_JUPR,REPO_PERIODO,REPO_SERV_ID,REPO_TIRE_ID,NOPRESCRIPCION,FPRESCRIPCION,TIPOTECNOLOGIA,CONSECUTIVO,ESTJM,CODENTPROC,OBSERVACIONES,JUSTIFICACIONTECNICA,MODALIDAD,NOACTA,FECHAACTA,FPROCESO,TIPOIDPACIENTE,NROIDPACIENTE,CODENTJM) values ('470',to_date('23/05/19','DD/MM/RR'),'9','2','20190523130012154090',to_date('23/05/19','DD/MM/RR'),'S','1','3','080010349401',null,'. PACIENTE CON INCONTINENCIA DE ESFINTERES POR LO CUAL SE ORDENAN PAÃ‘ALES DESECHABLES PARA OPTIMIZAR CONDICIONES DE HIGIENE','2','005',to_date('23/05/19','DD/MM/RR'),'2019-05-23','CC','22313902','080010349401');
Insert into OASIS4.WEBSERV_JUNTA_PROFESIONAL (ID_JUPR,REPO_PERIODO,REPO_SERV_ID,REPO_TIRE_ID,NOPRESCRIPCION,FPRESCRIPCION,TIPOTECNOLOGIA,CONSECUTIVO,ESTJM,CODENTPROC,OBSERVACIONES,JUSTIFICACIONTECNICA,MODALIDAD,NOACTA,FECHAACTA,FPROCESO,TIPOIDPACIENTE,NROIDPACIENTE,CODENTJM) values ('471',to_date('23/05/19','DD/MM/RR'),'9','2','20190523129012156131',to_date('23/05/19','DD/MM/RR'),'S','1','2',null,null,null,null,null,to_date('01/01/70','DD/MM/RR'),null,'CC','32583828','084330205401');
Insert into OASIS4.WEBSERV_JUNTA_PROFESIONAL (ID_JUPR,REPO_PERIODO,REPO_SERV_ID,REPO_TIRE_ID,NOPRESCRIPCION,FPRESCRIPCION,TIPOTECNOLOGIA,CONSECUTIVO,ESTJM,CODENTPROC,OBSERVACIONES,JUSTIFICACIONTECNICA,MODALIDAD,NOACTA,FECHAACTA,FPROCESO,TIPOIDPACIENTE,NROIDPACIENTE,CODENTJM) values ('472',to_date('23/05/19','DD/MM/RR'),'9','2','20190523123012179432',to_date('23/05/19','DD/MM/RR'),'S','1','2',null,null,null,null,null,to_date('01/01/70','DD/MM/RR'),null,'CC','22284351','084330205401');
Insert into OASIS4.WEBSERV_JUNTA_PROFESIONAL (ID_JUPR,REPO_PERIODO,REPO_SERV_ID,REPO_TIRE_ID,NOPRESCRIPCION,FPRESCRIPCION,TIPOTECNOLOGIA,CONSECUTIVO,ESTJM,CODENTPROC,OBSERVACIONES,JUSTIFICACIONTECNICA,MODALIDAD,NOACTA,FECHAACTA,FPROCESO,TIPOIDPACIENTE,NROIDPACIENTE,CODENTJM) values ('473',to_date('23/05/19','DD/MM/RR'),'9','2','20190523181012179600',to_date('23/05/19','DD/MM/RR'),'S','1','2',null,null,null,null,null,to_date('01/01/70','DD/MM/RR'),null,'CC','22284351','084330205401');
Insert into OASIS4.WEBSERV_JUNTA_PROFESIONAL (ID_JUPR,REPO_PERIODO,REPO_SERV_ID,REPO_TIRE_ID,NOPRESCRIPCION,FPRESCRIPCION,TIPOTECNOLOGIA,CONSECUTIVO,ESTJM,CODENTPROC,OBSERVACIONES,JUSTIFICACIONTECNICA,MODALIDAD,NOACTA,FECHAACTA,FPROCESO,TIPOIDPACIENTE,NROIDPACIENTE,CODENTJM) values ('474',to_date('24/05/19','DD/MM/RR'),'9','2','20190524146012200513',to_date('24/05/19','DD/MM/RR'),'M','1','2',null,null,null,null,null,to_date('01/01/70','DD/MM/RR'),null,'CC','1052947079','134300049201');
Insert into OASIS4.WEBSERV_JUNTA_PROFESIONAL (ID_JUPR,REPO_PERIODO,REPO_SERV_ID,REPO_TIRE_ID,NOPRESCRIPCION,FPRESCRIPCION,TIPOTECNOLOGIA,CONSECUTIVO,ESTJM,CODENTPROC,OBSERVACIONES,JUSTIFICACIONTECNICA,MODALIDAD,NOACTA,FECHAACTA,FPROCESO,TIPOIDPACIENTE,NROIDPACIENTE,CODENTJM) values ('475',to_date('24/05/19','DD/MM/RR'),'9','2','20190524117012183463',to_date('24/05/19','DD/MM/RR'),'N','1','2',null,null,null,null,null,to_date('01/01/70','DD/MM/RR'),null,'TI','1050460083','134300049201');
Insert into OASIS4.WEBSERV_JUNTA_PROFESIONAL (ID_JUPR,REPO_PERIODO,REPO_SERV_ID,REPO_TIRE_ID,NOPRESCRIPCION,FPRESCRIPCION,TIPOTECNOLOGIA,CONSECUTIVO,ESTJM,CODENTPROC,OBSERVACIONES,JUSTIFICACIONTECNICA,MODALIDAD,NOACTA,FECHAACTA,FPROCESO,TIPOIDPACIENTE,NROIDPACIENTE,CODENTJM) values ('476',to_date('24/05/19','DD/MM/RR'),'9','2','20190524162012197978',to_date('24/05/19','DD/MM/RR'),'N','1','3','134300290801',null,'DESNUTRICIÃ“N PROTEICOCALORICA SEVERA NO ESPECIFICADA ','1','24',to_date('14/06/19','DD/MM/RR'),'2019-06-14','TI','1050726174','134300290801');
Insert into OASIS4.WEBSERV_JUNTA_PROFESIONAL (ID_JUPR,REPO_PERIODO,REPO_SERV_ID,REPO_TIRE_ID,NOPRESCRIPCION,FPRESCRIPCION,TIPOTECNOLOGIA,CONSECUTIVO,ESTJM,CODENTPROC,OBSERVACIONES,JUSTIFICACIONTECNICA,MODALIDAD,NOACTA,FECHAACTA,FPROCESO,TIPOIDPACIENTE,NROIDPACIENTE,CODENTJM) values ('477',to_date('24/05/19','DD/MM/RR'),'9','2','20190524122012198625',to_date('24/05/19','DD/MM/RR'),'N','1','3','080010445438',null,'PACIENTE FEMENINO DE 81 AÃ‘OS CON DX MEDICO DE HIPERTENSIÃ“N, HIPOTIROIDISMO, ALZHEIMER, EN SILLA DE RUEDAS Y CON BAJO PESO, REQUIERE COMPLEMENTO NUTRICIONAL.','2','65',to_date('25/05/19','DD/MM/RR'),'2019-05-25','CC','22313902','080010445438');
Insert into OASIS4.WEBSERV_JUNTA_PROFESIONAL (ID_JUPR,REPO_PERIODO,REPO_SERV_ID,REPO_TIRE_ID,NOPRESCRIPCION,FPRESCRIPCION,TIPOTECNOLOGIA,CONSECUTIVO,ESTJM,CODENTPROC,OBSERVACIONES,JUSTIFICACIONTECNICA,MODALIDAD,NOACTA,FECHAACTA,FPROCESO,TIPOIDPACIENTE,NROIDPACIENTE,CODENTJM) values ('478',to_date('24/05/19','DD/MM/RR'),'9','2','20190524180012201126',to_date('24/05/19','DD/MM/RR'),'N','1','3','134300290801',null,'ATROFIA CEREBRAL CIRCUNSCRITA','1','013',to_date('04/06/19','DD/MM/RR'),'2019-06-04','CC','1052975559','134300290801');
Insert into OASIS4.WEBSERV_JUNTA_PROFESIONAL (ID_JUPR,REPO_PERIODO,REPO_SERV_ID,REPO_TIRE_ID,NOPRESCRIPCION,FPRESCRIPCION,TIPOTECNOLOGIA,CONSECUTIVO,ESTJM,CODENTPROC,OBSERVACIONES,JUSTIFICACIONTECNICA,MODALIDAD,NOACTA,FECHAACTA,FPROCESO,TIPOIDPACIENTE,NROIDPACIENTE,CODENTJM) values ('479',to_date('24/05/19','DD/MM/RR'),'9','2','20190524185012201171',to_date('24/05/19','DD/MM/RR'),'N','1','3','087580106601',null,'PACIENTE ASMATICO CON RIESGO DE DESNUTRICION AGUDA  PESO 12 KG TALLA 91 CM  IMC 14','1','00002',to_date('05/06/19','DD/MM/RR'),'2019-06-05','RC','1158466208','087580106601');
Insert into OASIS4.WEBSERV_JUNTA_PROFESIONAL (ID_JUPR,REPO_PERIODO,REPO_SERV_ID,REPO_TIRE_ID,NOPRESCRIPCION,FPRESCRIPCION,TIPOTECNOLOGIA,CONSECUTIVO,ESTJM,CODENTPROC,OBSERVACIONES,JUSTIFICACIONTECNICA,MODALIDAD,NOACTA,FECHAACTA,FPROCESO,TIPOIDPACIENTE,NROIDPACIENTE,CODENTJM) values ('480',to_date('24/05/19','DD/MM/RR'),'9','2','20190524139012187809',to_date('24/05/19','DD/MM/RR'),'S','1','2',null,null,null,null,null,to_date('01/01/70','DD/MM/RR'),null,'CC','1002130857','080010003601');
Insert into OASIS4.WEBSERV_JUNTA_PROFESIONAL (ID_JUPR,REPO_PERIODO,REPO_SERV_ID,REPO_TIRE_ID,NOPRESCRIPCION,FPRESCRIPCION,TIPOTECNOLOGIA,CONSECUTIVO,ESTJM,CODENTPROC,OBSERVACIONES,JUSTIFICACIONTECNICA,MODALIDAD,NOACTA,FECHAACTA,FPROCESO,TIPOIDPACIENTE,NROIDPACIENTE,CODENTJM) values ('481',to_date('24/05/19','DD/MM/RR'),'9','2','20190524134012187852',to_date('24/05/19','DD/MM/RR'),'S','1','3','050010217501',null,'60 AÃ‘, CANC TIROIDES METASTASI, NEOPLAS ENDOTRAQUEAL OBSTRUC CASI TOTAL, SIN RESERVA FUNCIONAL PARA ACTIVIDADES BASICA, DIFICULTAD RESPIRA, REQ TRASPORT A CASA.','1','1058',to_date('27/05/19','DD/MM/RR'),'2019-05-27','CC','4820234','050010217501');
Insert into OASIS4.WEBSERV_JUNTA_PROFESIONAL (ID_JUPR,REPO_PERIODO,REPO_SERV_ID,REPO_TIRE_ID,NOPRESCRIPCION,FPRESCRIPCION,TIPOTECNOLOGIA,CONSECUTIVO,ESTJM,CODENTPROC,OBSERVACIONES,JUSTIFICACIONTECNICA,MODALIDAD,NOACTA,FECHAACTA,FPROCESO,TIPOIDPACIENTE,NROIDPACIENTE,CODENTJM) values ('482',to_date('24/05/19','DD/MM/RR'),'9','2','20190524191012188126',to_date('24/05/19','DD/MM/RR'),'S','1','3','080010003601',null,'SE INDICA LENTE DE CONTACTO COMO PRIMER NIVEL TERAPÃ‰UTICO DEL QUERATOCONO','1','001',to_date('24/05/19','DD/MM/RR'),'2019-05-24','CC','1002130857','080010003601');
Insert into OASIS4.WEBSERV_JUNTA_PROFESIONAL (ID_JUPR,REPO_PERIODO,REPO_SERV_ID,REPO_TIRE_ID,NOPRESCRIPCION,FPRESCRIPCION,TIPOTECNOLOGIA,CONSECUTIVO,ESTJM,CODENTPROC,OBSERVACIONES,JUSTIFICACIONTECNICA,MODALIDAD,NOACTA,FECHAACTA,FPROCESO,TIPOIDPACIENTE,NROIDPACIENTE,CODENTJM) values ('483',to_date('27/05/19','DD/MM/RR'),'9','2','20190527148012216262',to_date('27/05/19','DD/MM/RR'),'M','1','2',null,null,null,null,null,to_date('01/01/70','DD/MM/RR'),null,'CC','22964206','134300077501');
Insert into OASIS4.WEBSERV_JUNTA_PROFESIONAL (ID_JUPR,REPO_PERIODO,REPO_SERV_ID,REPO_TIRE_ID,NOPRESCRIPCION,FPRESCRIPCION,TIPOTECNOLOGIA,CONSECUTIVO,ESTJM,CODENTPROC,OBSERVACIONES,JUSTIFICACIONTECNICA,MODALIDAD,NOACTA,FECHAACTA,FPROCESO,TIPOIDPACIENTE,NROIDPACIENTE,CODENTJM) values ('484',to_date('27/05/19','DD/MM/RR'),'9','2','20190527142012218785',to_date('27/05/19','DD/MM/RR'),'N','1','3','761470851601',null,'quien requiere complementar su NUTRICIÃ“N con alimento completo y balanceado a base de proteÃ­na 15% VCT, vitaminas y minerales,','1','MP0084',to_date('27/05/19','DD/MM/RR'),'2019-05-27','CC','1114399390','761470851601');
Insert into OASIS4.WEBSERV_JUNTA_PROFESIONAL (ID_JUPR,REPO_PERIODO,REPO_SERV_ID,REPO_TIRE_ID,NOPRESCRIPCION,FPRESCRIPCION,TIPOTECNOLOGIA,CONSECUTIVO,ESTJM,CODENTPROC,OBSERVACIONES,JUSTIFICACIONTECNICA,MODALIDAD,NOACTA,FECHAACTA,FPROCESO,TIPOIDPACIENTE,NROIDPACIENTE,CODENTJM) values ('485',to_date('27/05/19','DD/MM/RR'),'9','2','20190527148012219328',to_date('27/05/19','DD/MM/RR'),'N','1','3','761470851601',null,'QUIEN REQUIERE COMPLEMENTAR SU NUTRICIÃ“N CON ALIMENTO COMPLETO Y BALANCEADO A BASE DE PROTEÃ?NA 15% VCT, VITAMINAS Y MINERALES.','1','MP0085',to_date('27/05/19','DD/MM/RR'),'2019-05-27','CC','1114399389','761470851601');
Insert into OASIS4.WEBSERV_JUNTA_PROFESIONAL (ID_JUPR,REPO_PERIODO,REPO_SERV_ID,REPO_TIRE_ID,NOPRESCRIPCION,FPRESCRIPCION,TIPOTECNOLOGIA,CONSECUTIVO,ESTJM,CODENTPROC,OBSERVACIONES,JUSTIFICACIONTECNICA,MODALIDAD,NOACTA,FECHAACTA,FPROCESO,TIPOIDPACIENTE,NROIDPACIENTE,CODENTJM) values ('486',to_date('27/05/19','DD/MM/RR'),'9','2','20190527199012219885',to_date('27/05/19','DD/MM/RR'),'N','1','3','470580002301',null,'ANTECEDENTE DE PARKINSON, ECV CON PARALISI, CON IMC 18.5 DIAGNOSTICO DE DESNUTRICION PROTEICO CALORICA','1','011',to_date('09/08/19','DD/MM/RR'),'2019-08-09','CC','5071357','470580002301');
Insert into OASIS4.WEBSERV_JUNTA_PROFESIONAL (ID_JUPR,REPO_PERIODO,REPO_SERV_ID,REPO_TIRE_ID,NOPRESCRIPCION,FPRESCRIPCION,TIPOTECNOLOGIA,CONSECUTIVO,ESTJM,CODENTPROC,OBSERVACIONES,JUSTIFICACIONTECNICA,MODALIDAD,NOACTA,FECHAACTA,FPROCESO,TIPOIDPACIENTE,NROIDPACIENTE,CODENTJM) values ('487',to_date('27/05/19','DD/MM/RR'),'9','2','20190527156012222379',to_date('27/05/19','DD/MM/RR'),'N','1','3','086340010501',null,'PACIENTE DE 10 MESES 21 DÃ?AS DE EDAD CON PESO DE 8,2KG TALLA DE 72 CM DIAGNOSTICO NUTRICIONAL DE RIESGO DE DESNUTRICIÃ“N SE REQUIERE DEL COMPLEMENTO PARA MEJORA','1','18',to_date('27/05/19','DD/MM/RR'),'2019-05-27','RC','1042358319','086340010501');
Insert into OASIS4.WEBSERV_JUNTA_PROFESIONAL (ID_JUPR,REPO_PERIODO,REPO_SERV_ID,REPO_TIRE_ID,NOPRESCRIPCION,FPRESCRIPCION,TIPOTECNOLOGIA,CONSECUTIVO,ESTJM,CODENTPROC,OBSERVACIONES,JUSTIFICACIONTECNICA,MODALIDAD,NOACTA,FECHAACTA,FPROCESO,TIPOIDPACIENTE,NROIDPACIENTE,CODENTJM) values ('488',to_date('27/05/19','DD/MM/RR'),'9','2','20190527149012226019',to_date('27/05/19','DD/MM/RR'),'N','1','3','130010210201',null,'REQUIERE RECUPERAR  ESTADO NUTRICIONAL DE LA  MATERNA  PARA PREVENIR EL ALTO RIESGO DE NEONATO DE BAJO PESO AL NACER','2','7',to_date('27/05/19','DD/MM/RR'),'2019-05-27','TI','1052732794','130010210201');
Insert into OASIS4.WEBSERV_JUNTA_PROFESIONAL (ID_JUPR,REPO_PERIODO,REPO_SERV_ID,REPO_TIRE_ID,NOPRESCRIPCION,FPRESCRIPCION,TIPOTECNOLOGIA,CONSECUTIVO,ESTJM,CODENTPROC,OBSERVACIONES,JUSTIFICACIONTECNICA,MODALIDAD,NOACTA,FECHAACTA,FPROCESO,TIPOIDPACIENTE,NROIDPACIENTE,CODENTJM) values ('489',to_date('27/05/19','DD/MM/RR'),'9','2','20190527157012230202',to_date('27/05/19','DD/MM/RR'),'N','1','3','080010054401',null,'LA JUNTA MEDICA HA REVISADO SU CASO Y DECIDEN POR CONDICION CLINICA DEL PACIENTE SE AUTORIZA EL USO DE FORMULA NUTRICIONAL POLIMERICA ENSURE POLVO/LATA 400 GR','1','0844',to_date('27/05/19','DD/MM/RR'),'2019-05-27','CC','3966618','080010054401');
Insert into OASIS4.WEBSERV_JUNTA_PROFESIONAL (ID_JUPR,REPO_PERIODO,REPO_SERV_ID,REPO_TIRE_ID,NOPRESCRIPCION,FPRESCRIPCION,TIPOTECNOLOGIA,CONSECUTIVO,ESTJM,CODENTPROC,OBSERVACIONES,JUSTIFICACIONTECNICA,MODALIDAD,NOACTA,FECHAACTA,FPROCESO,TIPOIDPACIENTE,NROIDPACIENTE,CODENTJM) values ('490',to_date('27/05/19','DD/MM/RR'),'9','2','20190527111012235470',to_date('27/05/19','DD/MM/RR'),'N','1','3','130010178101',null,'ANEMIA NUTRICIONAL, PERDIDA DE PESO, INAPETENCIA, GASTRITIS CRONICA, gastropatÃ­a. ARTRITIS REUMATOIDE. MAREO- DESVANECIMIENTO POR LO QUE SE REQUIERE COMPLETAR ','1','25',to_date('28/05/19','DD/MM/RR'),'2019-05-28','CC','22805297','130010178101');
Insert into OASIS4.WEBSERV_JUNTA_PROFESIONAL (ID_JUPR,REPO_PERIODO,REPO_SERV_ID,REPO_TIRE_ID,NOPRESCRIPCION,FPRESCRIPCION,TIPOTECNOLOGIA,CONSECUTIVO,ESTJM,CODENTPROC,OBSERVACIONES,JUSTIFICACIONTECNICA,MODALIDAD,NOACTA,FECHAACTA,FPROCESO,TIPOIDPACIENTE,NROIDPACIENTE,CODENTJM) values ('491',to_date('27/05/19','DD/MM/RR'),'9','2','20190527146012239135',to_date('27/05/19','DD/MM/RR'),'N','1','3','080010380001',null,'DESNUTRICION PROTEICO CALORICA SEVERA SECUNDARIO A INAPETENCIA POR TRATAMIENTO ANTITUBERCULOSO RECIDIVANTE Y REFRACTARIO A TRATAMIENTO.','1','001',to_date('02/07/19','DD/MM/RR'),'2019-07-02','CC','1082915773','080010380001');
Insert into OASIS4.WEBSERV_JUNTA_PROFESIONAL (ID_JUPR,REPO_PERIODO,REPO_SERV_ID,REPO_TIRE_ID,NOPRESCRIPCION,FPRESCRIPCION,TIPOTECNOLOGIA,CONSECUTIVO,ESTJM,CODENTPROC,OBSERVACIONES,JUSTIFICACIONTECNICA,MODALIDAD,NOACTA,FECHAACTA,FPROCESO,TIPOIDPACIENTE,NROIDPACIENTE,CODENTJM) values ('492',to_date('27/05/19','DD/MM/RR'),'9','2','20190527140012241820',to_date('27/05/19','DD/MM/RR'),'N','1','2',null,null,null,null,null,to_date('01/01/70','DD/MM/RR'),null,'CC','33277632','134300074601');
Insert into OASIS4.WEBSERV_JUNTA_PROFESIONAL (ID_JUPR,REPO_PERIODO,REPO_SERV_ID,REPO_TIRE_ID,NOPRESCRIPCION,FPRESCRIPCION,TIPOTECNOLOGIA,CONSECUTIVO,ESTJM,CODENTPROC,OBSERVACIONES,JUSTIFICACIONTECNICA,MODALIDAD,NOACTA,FECHAACTA,FPROCESO,TIPOIDPACIENTE,NROIDPACIENTE,CODENTJM) values ('493',to_date('27/05/19','DD/MM/RR'),'9','2','20190527185012242450',to_date('27/05/19','DD/MM/RR'),'N','1','2',null,null,null,null,null,to_date('01/01/70','DD/MM/RR'),null,'CC','22923285','134300290801');
Insert into OASIS4.WEBSERV_JUNTA_PROFESIONAL (ID_JUPR,REPO_PERIODO,REPO_SERV_ID,REPO_TIRE_ID,NOPRESCRIPCION,FPRESCRIPCION,TIPOTECNOLOGIA,CONSECUTIVO,ESTJM,CODENTPROC,OBSERVACIONES,JUSTIFICACIONTECNICA,MODALIDAD,NOACTA,FECHAACTA,FPROCESO,TIPOIDPACIENTE,NROIDPACIENTE,CODENTJM) values ('494',to_date('27/05/19','DD/MM/RR'),'9','2','20190527190012240045',to_date('27/05/19','DD/MM/RR'),'S','1','2',null,null,null,null,null,to_date('01/01/70','DD/MM/RR'),null,'CC','40792011','080010003601');
Insert into OASIS4.WEBSERV_JUNTA_PROFESIONAL (ID_JUPR,REPO_PERIODO,REPO_SERV_ID,REPO_TIRE_ID,NOPRESCRIPCION,FPRESCRIPCION,TIPOTECNOLOGIA,CONSECUTIVO,ESTJM,CODENTPROC,OBSERVACIONES,JUSTIFICACIONTECNICA,MODALIDAD,NOACTA,FECHAACTA,FPROCESO,TIPOIDPACIENTE,NROIDPACIENTE,CODENTJM) values ('495',to_date('27/05/19','DD/MM/RR'),'9','2','20190527187012240522',to_date('27/05/19','DD/MM/RR'),'S','1','2',null,null,null,null,null,to_date('01/01/70','DD/MM/RR'),null,'CC','6791130','200010205401');
Insert into OASIS4.WEBSERV_JUNTA_PROFESIONAL (ID_JUPR,REPO_PERIODO,REPO_SERV_ID,REPO_TIRE_ID,NOPRESCRIPCION,FPRESCRIPCION,TIPOTECNOLOGIA,CONSECUTIVO,ESTJM,CODENTPROC,OBSERVACIONES,JUSTIFICACIONTECNICA,MODALIDAD,NOACTA,FECHAACTA,FPROCESO,TIPOIDPACIENTE,NROIDPACIENTE,CODENTJM) values ('496',to_date('27/05/19','DD/MM/RR'),'9','2','20190527187012240522',to_date('27/05/19','DD/MM/RR'),'S','2','2',null,null,null,null,null,to_date('01/01/70','DD/MM/RR'),null,'CC','6791130','200010205401');
Insert into OASIS4.WEBSERV_JUNTA_PROFESIONAL (ID_JUPR,REPO_PERIODO,REPO_SERV_ID,REPO_TIRE_ID,NOPRESCRIPCION,FPRESCRIPCION,TIPOTECNOLOGIA,CONSECUTIVO,ESTJM,CODENTPROC,OBSERVACIONES,JUSTIFICACIONTECNICA,MODALIDAD,NOACTA,FECHAACTA,FPROCESO,TIPOIDPACIENTE,NROIDPACIENTE,CODENTJM) values ('497',to_date('27/05/19','DD/MM/RR'),'9','2','20190527126012240823',to_date('27/05/19','DD/MM/RR'),'S','2','2',null,null,null,null,null,to_date('01/01/70','DD/MM/RR'),null,'CC','3820074','200010205401');
Insert into OASIS4.WEBSERV_JUNTA_PROFESIONAL (ID_JUPR,REPO_PERIODO,REPO_SERV_ID,REPO_TIRE_ID,NOPRESCRIPCION,FPRESCRIPCION,TIPOTECNOLOGIA,CONSECUTIVO,ESTJM,CODENTPROC,OBSERVACIONES,JUSTIFICACIONTECNICA,MODALIDAD,NOACTA,FECHAACTA,FPROCESO,TIPOIDPACIENTE,NROIDPACIENTE,CODENTJM) values ('498',to_date('28/05/19','DD/MM/RR'),'9','2','20190528152012254959',to_date('28/05/19','DD/MM/RR'),'M','1','4','080010226001',null,'no aprobado extemporaneo ','1','201923071236',to_date('23/07/19','DD/MM/RR'),'2019-07-23','TI','1043585420','080010226001');
Insert into OASIS4.WEBSERV_JUNTA_PROFESIONAL (ID_JUPR,REPO_PERIODO,REPO_SERV_ID,REPO_TIRE_ID,NOPRESCRIPCION,FPRESCRIPCION,TIPOTECNOLOGIA,CONSECUTIVO,ESTJM,CODENTPROC,OBSERVACIONES,JUSTIFICACIONTECNICA,MODALIDAD,NOACTA,FECHAACTA,FPROCESO,TIPOIDPACIENTE,NROIDPACIENTE,CODENTJM) values ('499',to_date('28/05/19','DD/MM/RR'),'9','2','20190528131012247641',to_date('28/05/19','DD/MM/RR'),'N','1','2',null,null,null,null,null,to_date('01/01/70','DD/MM/RR'),null,'CC','1151187478','475550016701');
Insert into OASIS4.WEBSERV_JUNTA_PROFESIONAL (ID_JUPR,REPO_PERIODO,REPO_SERV_ID,REPO_TIRE_ID,NOPRESCRIPCION,FPRESCRIPCION,TIPOTECNOLOGIA,CONSECUTIVO,ESTJM,CODENTPROC,OBSERVACIONES,JUSTIFICACIONTECNICA,MODALIDAD,NOACTA,FECHAACTA,FPROCESO,TIPOIDPACIENTE,NROIDPACIENTE,CODENTJM) values ('500',to_date('28/05/19','DD/MM/RR'),'9','2','20190528138012253905',to_date('28/05/19','DD/MM/RR'),'N','1','3','130010210201',null,'MEJORAR ESTADO NUTRICIONAL Y GARANTIZAR BIODISPONIBILIDAD DEL MEDICAMENTO ANTICONVULSIVO','2','9',to_date('28/05/19','DD/MM/RR'),'2019-05-28','TI','1051442485','130010210201');
Insert into OASIS4.WEBSERV_JUNTA_PROFESIONAL (ID_JUPR,REPO_PERIODO,REPO_SERV_ID,REPO_TIRE_ID,NOPRESCRIPCION,FPRESCRIPCION,TIPOTECNOLOGIA,CONSECUTIVO,ESTJM,CODENTPROC,OBSERVACIONES,JUSTIFICACIONTECNICA,MODALIDAD,NOACTA,FECHAACTA,FPROCESO,TIPOIDPACIENTE,NROIDPACIENTE,CODENTJM) values ('501',to_date('28/05/19','DD/MM/RR'),'9','2','20190528112012254622',to_date('28/05/19','DD/MM/RR'),'N','1','2',null,null,null,null,null,to_date('01/01/70','DD/MM/RR'),null,'CC','23143404','130010181302');
Insert into OASIS4.WEBSERV_JUNTA_PROFESIONAL (ID_JUPR,REPO_PERIODO,REPO_SERV_ID,REPO_TIRE_ID,NOPRESCRIPCION,FPRESCRIPCION,TIPOTECNOLOGIA,CONSECUTIVO,ESTJM,CODENTPROC,OBSERVACIONES,JUSTIFICACIONTECNICA,MODALIDAD,NOACTA,FECHAACTA,FPROCESO,TIPOIDPACIENTE,NROIDPACIENTE,CODENTJM) values ('502',to_date('28/05/19','DD/MM/RR'),'9','2','20190528152012257726',to_date('28/05/19','DD/MM/RR'),'N','1','3','132440049301',null,'PACIENTE CON BAJO PESO PARA LA EDAD, QUE AMERITA ALIMENTACION COMPLEMENTARIA ','1','006',to_date('29/05/19','DD/MM/RR'),'2019-05-29','RC','1052097486','132440049301');
Insert into OASIS4.WEBSERV_JUNTA_PROFESIONAL (ID_JUPR,REPO_PERIODO,REPO_SERV_ID,REPO_TIRE_ID,NOPRESCRIPCION,FPRESCRIPCION,TIPOTECNOLOGIA,CONSECUTIVO,ESTJM,CODENTPROC,OBSERVACIONES,JUSTIFICACIONTECNICA,MODALIDAD,NOACTA,FECHAACTA,FPROCESO,TIPOIDPACIENTE,NROIDPACIENTE,CODENTJM) values ('503',to_date('28/05/19','DD/MM/RR'),'9','2','20190528162012261006',to_date('28/05/19','DD/MM/RR'),'S','1','3','080010349401',null,'Pte FEMENINA DE 97 AÃ‘OS CON DIAGNOSTICOs HIPERTENSIÃ“N ARTERIAL CRÃ“NICA SECUELAS DE ACCIDENTE CEREBROVASCULAR ISQUÃ‰MICO, POSTRADA EN CAMA, CON dependencia total','2','008',to_date('29/05/19','DD/MM/RR'),'2019-05-29','CC','55224988','080010349401');
Insert into OASIS4.WEBSERV_JUNTA_PROFESIONAL (ID_JUPR,REPO_PERIODO,REPO_SERV_ID,REPO_TIRE_ID,NOPRESCRIPCION,FPRESCRIPCION,TIPOTECNOLOGIA,CONSECUTIVO,ESTJM,CODENTPROC,OBSERVACIONES,JUSTIFICACIONTECNICA,MODALIDAD,NOACTA,FECHAACTA,FPROCESO,TIPOIDPACIENTE,NROIDPACIENTE,CODENTJM) values ('504',to_date('29/05/19','DD/MM/RR'),'9','2','20190529143012284015',to_date('29/05/19','DD/MM/RR'),'M','1','4','080010226001',null,'extemporÃ¡neo. no se aprueba junta medica','1','201904100726',to_date('04/10/19','DD/MM/RR'),'2019-10-04','TI','1043456724','080010226001');
Insert into OASIS4.WEBSERV_JUNTA_PROFESIONAL (ID_JUPR,REPO_PERIODO,REPO_SERV_ID,REPO_TIRE_ID,NOPRESCRIPCION,FPRESCRIPCION,TIPOTECNOLOGIA,CONSECUTIVO,ESTJM,CODENTPROC,OBSERVACIONES,JUSTIFICACIONTECNICA,MODALIDAD,NOACTA,FECHAACTA,FPROCESO,TIPOIDPACIENTE,NROIDPACIENTE,CODENTJM) values ('505',to_date('29/05/19','DD/MM/RR'),'9','2','20190529186012289745',to_date('29/05/19','DD/MM/RR'),'M','1','3','760010379901',null,'ASOCIACIÃ“N MUTUAL BARRIOS UNIDOS DE QUIBDÃ“ ','1','0355-19',to_date('05/06/19','DD/MM/RR'),'2019-06-07','CC','66752789','760010379901');
Insert into OASIS4.WEBSERV_JUNTA_PROFESIONAL (ID_JUPR,REPO_PERIODO,REPO_SERV_ID,REPO_TIRE_ID,NOPRESCRIPCION,FPRESCRIPCION,TIPOTECNOLOGIA,CONSECUTIVO,ESTJM,CODENTPROC,OBSERVACIONES,JUSTIFICACIONTECNICA,MODALIDAD,NOACTA,FECHAACTA,FPROCESO,TIPOIDPACIENTE,NROIDPACIENTE,CODENTJM) values ('506',to_date('29/05/19','DD/MM/RR'),'9','2','20190529162012271754',to_date('29/05/19','DD/MM/RR'),'N','1','2',null,null,null,null,null,to_date('01/01/70','DD/MM/RR'),null,'RC','1113868803','761470067210');
Insert into OASIS4.WEBSERV_JUNTA_PROFESIONAL (ID_JUPR,REPO_PERIODO,REPO_SERV_ID,REPO_TIRE_ID,NOPRESCRIPCION,FPRESCRIPCION,TIPOTECNOLOGIA,CONSECUTIVO,ESTJM,CODENTPROC,OBSERVACIONES,JUSTIFICACIONTECNICA,MODALIDAD,NOACTA,FECHAACTA,FPROCESO,TIPOIDPACIENTE,NROIDPACIENTE,CODENTJM) values ('507',to_date('29/05/19','DD/MM/RR'),'9','2','20190529192012274864',to_date('29/05/19','DD/MM/RR'),'N','1','2',null,null,null,null,null,to_date('01/01/70','DD/MM/RR'),null,'CC','24699541','080010409201');
Insert into OASIS4.WEBSERV_JUNTA_PROFESIONAL (ID_JUPR,REPO_PERIODO,REPO_SERV_ID,REPO_TIRE_ID,NOPRESCRIPCION,FPRESCRIPCION,TIPOTECNOLOGIA,CONSECUTIVO,ESTJM,CODENTPROC,OBSERVACIONES,JUSTIFICACIONTECNICA,MODALIDAD,NOACTA,FECHAACTA,FPROCESO,TIPOIDPACIENTE,NROIDPACIENTE,CODENTJM) values ('508',to_date('29/05/19','DD/MM/RR'),'9','2','20190529166012278636',to_date('29/05/19','DD/MM/RR'),'N','1','3','761470067210',null,'se aprueba soporte nutricional.','1','17',to_date('26/06/19','DD/MM/RR'),'2019-06-26','CC','1112789570','761470067210');
Insert into OASIS4.WEBSERV_JUNTA_PROFESIONAL (ID_JUPR,REPO_PERIODO,REPO_SERV_ID,REPO_TIRE_ID,NOPRESCRIPCION,FPRESCRIPCION,TIPOTECNOLOGIA,CONSECUTIVO,ESTJM,CODENTPROC,OBSERVACIONES,JUSTIFICACIONTECNICA,MODALIDAD,NOACTA,FECHAACTA,FPROCESO,TIPOIDPACIENTE,NROIDPACIENTE,CODENTJM) values ('509',to_date('29/05/19','DD/MM/RR'),'9','2','20190529167012279911',to_date('29/05/19','DD/MM/RR'),'N','1','3','080010380001',null,'PACIENTE DE 74 AÃ‘OS DE EDAD CON BAJO PESO 32 Kg, IMC: 15.65 PARA UNA DESNUTRICION PROTEICOCALORICA SEVERA CON DIFICULTAD PARA LA DEGLUCIÃ“N. JUNTA APRUEBA.','1','09',to_date('05/06/19','DD/MM/RR'),'2019-06-05','CC','22371306','080010380001');
Insert into OASIS4.WEBSERV_JUNTA_PROFESIONAL (ID_JUPR,REPO_PERIODO,REPO_SERV_ID,REPO_TIRE_ID,NOPRESCRIPCION,FPRESCRIPCION,TIPOTECNOLOGIA,CONSECUTIVO,ESTJM,CODENTPROC,OBSERVACIONES,JUSTIFICACIONTECNICA,MODALIDAD,NOACTA,FECHAACTA,FPROCESO,TIPOIDPACIENTE,NROIDPACIENTE,CODENTJM) values ('510',to_date('29/05/19','DD/MM/RR'),'9','2','20190529163012282048',to_date('29/05/19','DD/MM/RR'),'N','1','3','080010409201',null,'PACIENTE REQUIERE DE SUPLEMENTACION ESPECIAL ','2','SILOE 1235',to_date('30/08/19','DD/MM/RR'),'2019-09-30','CC','22272559','080010409201');
Insert into OASIS4.WEBSERV_JUNTA_PROFESIONAL (ID_JUPR,REPO_PERIODO,REPO_SERV_ID,REPO_TIRE_ID,NOPRESCRIPCION,FPRESCRIPCION,TIPOTECNOLOGIA,CONSECUTIVO,ESTJM,CODENTPROC,OBSERVACIONES,JUSTIFICACIONTECNICA,MODALIDAD,NOACTA,FECHAACTA,FPROCESO,TIPOIDPACIENTE,NROIDPACIENTE,CODENTJM) values ('511',to_date('29/05/19','DD/MM/RR'),'9','2','20190529145012282268',to_date('29/05/19','DD/MM/RR'),'N','1','3','080010380001',null,'PACIENTE FEMENINA DE 30 AÃ‘OS DE EDAD CON DIAGNÃ“STICO DE DESNUTRICIÃ“N PROTEICOCALORICA MODERADA CON IMC 16.98, REQUIERE ALIMENTACIÃ“N COMPLEMENTARIA.','1','02',to_date('29/05/19','DD/MM/RR'),'2019-05-29','CC','1143240102','080010380001');
Insert into OASIS4.WEBSERV_JUNTA_PROFESIONAL (ID_JUPR,REPO_PERIODO,REPO_SERV_ID,REPO_TIRE_ID,NOPRESCRIPCION,FPRESCRIPCION,TIPOTECNOLOGIA,CONSECUTIVO,ESTJM,CODENTPROC,OBSERVACIONES,JUSTIFICACIONTECNICA,MODALIDAD,NOACTA,FECHAACTA,FPROCESO,TIPOIDPACIENTE,NROIDPACIENTE,CODENTJM) values ('512',to_date('29/05/19','DD/MM/RR'),'9','2','20190529149012282911',to_date('29/05/19','DD/MM/RR'),'N','1','3','080010409201',null,'PACIENTE QUE PRESENTA RIESGO DE TALLA BAJA CON CARENCIAS\nNUTRICIONALES DEBIDO A LA ALIMENTACION INSUFICIENTE CON EMACIACION\nPOR LO CUAL SE INICIA TRATAMIENTO','2','SILOE-006',to_date('06/08/19','DD/MM/RR'),'2019-08-06','TI','1065138927','080010409201');
Insert into OASIS4.WEBSERV_JUNTA_PROFESIONAL (ID_JUPR,REPO_PERIODO,REPO_SERV_ID,REPO_TIRE_ID,NOPRESCRIPCION,FPRESCRIPCION,TIPOTECNOLOGIA,CONSECUTIVO,ESTJM,CODENTPROC,OBSERVACIONES,JUSTIFICACIONTECNICA,MODALIDAD,NOACTA,FECHAACTA,FPROCESO,TIPOIDPACIENTE,NROIDPACIENTE,CODENTJM) values ('513',to_date('29/05/19','DD/MM/RR'),'9','2','20190529103012283727',to_date('29/05/19','DD/MM/RR'),'N','1','2',null,null,null,null,null,to_date('01/01/70','DD/MM/RR'),null,'RC','1158465814','080010409201');
Insert into OASIS4.WEBSERV_JUNTA_PROFESIONAL (ID_JUPR,REPO_PERIODO,REPO_SERV_ID,REPO_TIRE_ID,NOPRESCRIPCION,FPRESCRIPCION,TIPOTECNOLOGIA,CONSECUTIVO,ESTJM,CODENTPROC,OBSERVACIONES,JUSTIFICACIONTECNICA,MODALIDAD,NOACTA,FECHAACTA,FPROCESO,TIPOIDPACIENTE,NROIDPACIENTE,CODENTJM) values ('514',to_date('29/05/19','DD/MM/RR'),'9','2','20190529120012284127',to_date('29/05/19','DD/MM/RR'),'N','1','3','087580106601',null,'LACTANTE DE 4 MESES DE EDAD, QUIEN PRESENTA DEPOSICIONES LIQUIDAS QUE SE ACENTUAN CON LA INGESTA DE LECHE MATERNA Y LECHE DE FORMULA. PESO 7.4 TALLA 66 CM ','1','00001',to_date('05/06/19','DD/MM/RR'),'2019-06-05','RC','1041871257','087580106601');
Insert into OASIS4.WEBSERV_JUNTA_PROFESIONAL (ID_JUPR,REPO_PERIODO,REPO_SERV_ID,REPO_TIRE_ID,NOPRESCRIPCION,FPRESCRIPCION,TIPOTECNOLOGIA,CONSECUTIVO,ESTJM,CODENTPROC,OBSERVACIONES,JUSTIFICACIONTECNICA,MODALIDAD,NOACTA,FECHAACTA,FPROCESO,TIPOIDPACIENTE,NROIDPACIENTE,CODENTJM) values ('515',to_date('29/05/19','DD/MM/RR'),'9','2','20190529195012284452',to_date('29/05/19','DD/MM/RR'),'N','1','2',null,null,null,null,null,to_date('01/01/70','DD/MM/RR'),null,'RC','1045721765','080010409201');
Insert into OASIS4.WEBSERV_JUNTA_PROFESIONAL (ID_JUPR,REPO_PERIODO,REPO_SERV_ID,REPO_TIRE_ID,NOPRESCRIPCION,FPRESCRIPCION,TIPOTECNOLOGIA,CONSECUTIVO,ESTJM,CODENTPROC,OBSERVACIONES,JUSTIFICACIONTECNICA,MODALIDAD,NOACTA,FECHAACTA,FPROCESO,TIPOIDPACIENTE,NROIDPACIENTE,CODENTJM) values ('516',to_date('29/05/19','DD/MM/RR'),'9','2','20190529134012284978',to_date('29/05/19','DD/MM/RR'),'N','1','2',null,null,null,null,null,to_date('01/01/70','DD/MM/RR'),null,'CC','26652976','080010409201');
Insert into OASIS4.WEBSERV_JUNTA_PROFESIONAL (ID_JUPR,REPO_PERIODO,REPO_SERV_ID,REPO_TIRE_ID,NOPRESCRIPCION,FPRESCRIPCION,TIPOTECNOLOGIA,CONSECUTIVO,ESTJM,CODENTPROC,OBSERVACIONES,JUSTIFICACIONTECNICA,MODALIDAD,NOACTA,FECHAACTA,FPROCESO,TIPOIDPACIENTE,NROIDPACIENTE,CODENTJM) values ('517',to_date('29/05/19','DD/MM/RR'),'9','2','20190529161012286198',to_date('29/05/19','DD/MM/RR'),'N','1','3','130010178101',null,'tumor maligno de estomago,PRESENTA INDICE DE MASA CORPORAL BAJO,  EN EXAMEN FÃ?SICO, PRESENTA DEPLESIÃ“N NUTRICIONAL, ACTUALMENTE CONSUME LOS ALIMENTOS EN PEQUEÃ‘A','1','27',to_date('29/05/19','DD/MM/RR'),'2019-05-29','CC','73431062','130010178101');
Insert into OASIS4.WEBSERV_JUNTA_PROFESIONAL (ID_JUPR,REPO_PERIODO,REPO_SERV_ID,REPO_TIRE_ID,NOPRESCRIPCION,FPRESCRIPCION,TIPOTECNOLOGIA,CONSECUTIVO,ESTJM,CODENTPROC,OBSERVACIONES,JUSTIFICACIONTECNICA,MODALIDAD,NOACTA,FECHAACTA,FPROCESO,TIPOIDPACIENTE,NROIDPACIENTE,CODENTJM) values ('518',to_date('29/05/19','DD/MM/RR'),'9','2','20190529113012287359',to_date('29/05/19','DD/MM/RR'),'N','1','2',null,null,null,null,null,to_date('01/01/70','DD/MM/RR'),null,'CC','29000658','768230220101');
Insert into OASIS4.WEBSERV_JUNTA_PROFESIONAL (ID_JUPR,REPO_PERIODO,REPO_SERV_ID,REPO_TIRE_ID,NOPRESCRIPCION,FPRESCRIPCION,TIPOTECNOLOGIA,CONSECUTIVO,ESTJM,CODENTPROC,OBSERVACIONES,JUSTIFICACIONTECNICA,MODALIDAD,NOACTA,FECHAACTA,FPROCESO,TIPOIDPACIENTE,NROIDPACIENTE,CODENTJM) values ('519',to_date('29/05/19','DD/MM/RR'),'9','2','20190529162012278274',to_date('29/05/19','DD/MM/RR'),'S','1','3','200010001801',null,'adulto mayor pop osteosintesis femur que requiere traslado ambulancia basica ant limitacion de movilidad riesgo de refractura domicilio alejado municipio pelaya','1','03',to_date('29/05/19','DD/MM/RR'),'2019-05-29','CC','49651834','200010001801');
Insert into OASIS4.WEBSERV_JUNTA_PROFESIONAL (ID_JUPR,REPO_PERIODO,REPO_SERV_ID,REPO_TIRE_ID,NOPRESCRIPCION,FPRESCRIPCION,TIPOTECNOLOGIA,CONSECUTIVO,ESTJM,CODENTPROC,OBSERVACIONES,JUSTIFICACIONTECNICA,MODALIDAD,NOACTA,FECHAACTA,FPROCESO,TIPOIDPACIENTE,NROIDPACIENTE,CODENTJM) values ('520',to_date('30/05/19','DD/MM/RR'),'9','2','20190530117012297316',to_date('30/05/19','DD/MM/RR'),'M','1','3','080010349401',null,'PACIENTE FEMENINA DE 91 AÃ‘OS DE EDAD CON DIAGNOSTICO DE ENFERMEDAD DE ALZHEIMER EN SEGUIMIENTO POR NEUROLOGÃ?A Y RECIBIENDO MANEJO CON QUETIAPINA.','2','009',to_date('30/05/19','DD/MM/RR'),'2019-05-30','CC','22341487','080010349401');
Insert into OASIS4.WEBSERV_JUNTA_PROFESIONAL (ID_JUPR,REPO_PERIODO,REPO_SERV_ID,REPO_TIRE_ID,NOPRESCRIPCION,FPRESCRIPCION,TIPOTECNOLOGIA,CONSECUTIVO,ESTJM,CODENTPROC,OBSERVACIONES,JUSTIFICACIONTECNICA,MODALIDAD,NOACTA,FECHAACTA,FPROCESO,TIPOIDPACIENTE,NROIDPACIENTE,CODENTJM) values ('521',to_date('30/05/19','DD/MM/RR'),'9','2','20190530170012310192',to_date('30/05/19','DD/MM/RR'),'M','1','2',null,null,null,null,null,to_date('01/01/70','DD/MM/RR'),null,'CC','26895995','200010205401');
Insert into OASIS4.WEBSERV_JUNTA_PROFESIONAL (ID_JUPR,REPO_PERIODO,REPO_SERV_ID,REPO_TIRE_ID,NOPRESCRIPCION,FPRESCRIPCION,TIPOTECNOLOGIA,CONSECUTIVO,ESTJM,CODENTPROC,OBSERVACIONES,JUSTIFICACIONTECNICA,MODALIDAD,NOACTA,FECHAACTA,FPROCESO,TIPOIDPACIENTE,NROIDPACIENTE,CODENTJM) values ('522',to_date('30/05/19','DD/MM/RR'),'9','2','20190530173012300741',to_date('30/05/19','DD/MM/RR'),'N','1','2',null,null,null,null,null,to_date('01/01/70','DD/MM/RR'),null,'CC','29132180','ESS076');
Insert into OASIS4.WEBSERV_JUNTA_PROFESIONAL (ID_JUPR,REPO_PERIODO,REPO_SERV_ID,REPO_TIRE_ID,NOPRESCRIPCION,FPRESCRIPCION,TIPOTECNOLOGIA,CONSECUTIVO,ESTJM,CODENTPROC,OBSERVACIONES,JUSTIFICACIONTECNICA,MODALIDAD,NOACTA,FECHAACTA,FPROCESO,TIPOIDPACIENTE,NROIDPACIENTE,CODENTJM) values ('523',to_date('30/05/19','DD/MM/RR'),'9','2','20190530180012304205',to_date('30/05/19','DD/MM/RR'),'N','1','3','200110057201',null,'necesario para aporte diaria nutricinal ','1','011',to_date('25/06/19','DD/MM/RR'),'2019-06-25','RC','1052189053','200110057201');
Insert into OASIS4.WEBSERV_JUNTA_PROFESIONAL (ID_JUPR,REPO_PERIODO,REPO_SERV_ID,REPO_TIRE_ID,NOPRESCRIPCION,FPRESCRIPCION,TIPOTECNOLOGIA,CONSECUTIVO,ESTJM,CODENTPROC,OBSERVACIONES,JUSTIFICACIONTECNICA,MODALIDAD,NOACTA,FECHAACTA,FPROCESO,TIPOIDPACIENTE,NROIDPACIENTE,CODENTJM) values ('524',to_date('30/05/19','DD/MM/RR'),'9','2','20190530134012316684',to_date('30/05/19','DD/MM/RR'),'N','1','3','760010379901',null,'ASOCIACIÃ“N MUTUAL BARRIOS UNIDOS DE QUIBDÃ“','1','0366-19',to_date('07/06/19','DD/MM/RR'),'2019-06-10','CC','16248006','760010379901');
Insert into OASIS4.WEBSERV_JUNTA_PROFESIONAL (ID_JUPR,REPO_PERIODO,REPO_SERV_ID,REPO_TIRE_ID,NOPRESCRIPCION,FPRESCRIPCION,TIPOTECNOLOGIA,CONSECUTIVO,ESTJM,CODENTPROC,OBSERVACIONES,JUSTIFICACIONTECNICA,MODALIDAD,NOACTA,FECHAACTA,FPROCESO,TIPOIDPACIENTE,NROIDPACIENTE,CODENTJM) values ('525',to_date('30/05/19','DD/MM/RR'),'9','2','20190530159012320216',to_date('30/05/19','DD/MM/RR'),'N','1','3','761470851601',null,'quien requiere complementar su nutricion, con alimento para propÃ³sitos mÃ©dicos especiales en pacientes con enfermedad pulmonar crÃ³nica','1','MP0087',to_date('31/05/19','DD/MM/RR'),'2019-06-05','CC','29839444','761470851601');
Insert into OASIS4.WEBSERV_JUNTA_PROFESIONAL (ID_JUPR,REPO_PERIODO,REPO_SERV_ID,REPO_TIRE_ID,NOPRESCRIPCION,FPRESCRIPCION,TIPOTECNOLOGIA,CONSECUTIVO,ESTJM,CODENTPROC,OBSERVACIONES,JUSTIFICACIONTECNICA,MODALIDAD,NOACTA,FECHAACTA,FPROCESO,TIPOIDPACIENTE,NROIDPACIENTE,CODENTJM) values ('526',to_date('30/05/19','DD/MM/RR'),'9','2','20190530146012297903',to_date('30/05/19','DD/MM/RR'),'S','1','3','080010349401',null,'PACIENTE REQUIERE PAÃ‘ALES DESECHABLES PORQUE PRESENTA INCONTINENCIA FECAL Y URINARIA','2','012',to_date('13/06/19','DD/MM/RR'),'2019-06-13','CC','22312588','080010349401');
Insert into OASIS4.WEBSERV_JUNTA_PROFESIONAL (ID_JUPR,REPO_PERIODO,REPO_SERV_ID,REPO_TIRE_ID,NOPRESCRIPCION,FPRESCRIPCION,TIPOTECNOLOGIA,CONSECUTIVO,ESTJM,CODENTPROC,OBSERVACIONES,JUSTIFICACIONTECNICA,MODALIDAD,NOACTA,FECHAACTA,FPROCESO,TIPOIDPACIENTE,NROIDPACIENTE,CODENTJM) values ('527',to_date('30/05/19','DD/MM/RR'),'9','2','20190530136012316242',to_date('30/05/19','DD/MM/RR'),'S','1','2',null,null,null,null,null,to_date('01/01/70','DD/MM/RR'),null,'CC','42486073','200010205401');
Insert into OASIS4.WEBSERV_JUNTA_PROFESIONAL (ID_JUPR,REPO_PERIODO,REPO_SERV_ID,REPO_TIRE_ID,NOPRESCRIPCION,FPRESCRIPCION,TIPOTECNOLOGIA,CONSECUTIVO,ESTJM,CODENTPROC,OBSERVACIONES,JUSTIFICACIONTECNICA,MODALIDAD,NOACTA,FECHAACTA,FPROCESO,TIPOIDPACIENTE,NROIDPACIENTE,CODENTJM) values ('528',to_date('30/05/19','DD/MM/RR'),'9','2','20190530157012316748',to_date('30/05/19','DD/MM/RR'),'S','1','2',null,null,null,null,null,to_date('01/01/70','DD/MM/RR'),null,'CC','32635308','080010122401');
Insert into OASIS4.WEBSERV_JUNTA_PROFESIONAL (ID_JUPR,REPO_PERIODO,REPO_SERV_ID,REPO_TIRE_ID,NOPRESCRIPCION,FPRESCRIPCION,TIPOTECNOLOGIA,CONSECUTIVO,ESTJM,CODENTPROC,OBSERVACIONES,JUSTIFICACIONTECNICA,MODALIDAD,NOACTA,FECHAACTA,FPROCESO,TIPOIDPACIENTE,NROIDPACIENTE,CODENTJM) values ('529',to_date('30/05/19','DD/MM/RR'),'9','2','20190530129012318062',to_date('30/05/19','DD/MM/RR'),'S','1','3','080010445433',null,'paciente femenina de 9 aÃ±os de edad con dx medico: PARÃ?LISIS cerebral, MICROCEFALIA y SÃ?NDROME de west','2','80',to_date('31/05/19','DD/MM/RR'),'2019-05-31','TI','1046402424','080010445433');
Insert into OASIS4.WEBSERV_JUNTA_PROFESIONAL (ID_JUPR,REPO_PERIODO,REPO_SERV_ID,REPO_TIRE_ID,NOPRESCRIPCION,FPRESCRIPCION,TIPOTECNOLOGIA,CONSECUTIVO,ESTJM,CODENTPROC,OBSERVACIONES,JUSTIFICACIONTECNICA,MODALIDAD,NOACTA,FECHAACTA,FPROCESO,TIPOIDPACIENTE,NROIDPACIENTE,CODENTJM) values ('530',to_date('31/05/19','DD/MM/RR'),'9','2','20190531149012324145',to_date('31/05/19','DD/MM/RR'),'N','1','3','761470851601',null,'FÃ³rmulas especiales para niÃ±os (lactantes, niÃ±os de corta edad y niÃ±os)','1','MP0086',to_date('31/05/19','DD/MM/RR'),'2019-06-05','RC','1089635136','761470851601');
Insert into OASIS4.WEBSERV_JUNTA_PROFESIONAL (ID_JUPR,REPO_PERIODO,REPO_SERV_ID,REPO_TIRE_ID,NOPRESCRIPCION,FPRESCRIPCION,TIPOTECNOLOGIA,CONSECUTIVO,ESTJM,CODENTPROC,OBSERVACIONES,JUSTIFICACIONTECNICA,MODALIDAD,NOACTA,FECHAACTA,FPROCESO,TIPOIDPACIENTE,NROIDPACIENTE,CODENTJM) values ('531',to_date('31/05/19','DD/MM/RR'),'9','2','20190531134012325097',to_date('31/05/19','DD/MM/RR'),'N','1','3','080010380001',null,'paciente masculino de 70 aÃ±os de edad con DIAGNÃ“STICOS de insuficiencia renal CRÃ“NICA - PREDIÃ?LISIS actualmente en estado de desnutricion PROTEICOCALORICA','1','03',to_date('31/05/19','DD/MM/RR'),'2019-05-31','CC','40789136','080010380001');
Insert into OASIS4.WEBSERV_JUNTA_PROFESIONAL (ID_JUPR,REPO_PERIODO,REPO_SERV_ID,REPO_TIRE_ID,NOPRESCRIPCION,FPRESCRIPCION,TIPOTECNOLOGIA,CONSECUTIVO,ESTJM,CODENTPROC,OBSERVACIONES,JUSTIFICACIONTECNICA,MODALIDAD,NOACTA,FECHAACTA,FPROCESO,TIPOIDPACIENTE,NROIDPACIENTE,CODENTJM) values ('532',to_date('31/05/19','DD/MM/RR'),'9','2','20190531190012327167',to_date('31/05/19','DD/MM/RR'),'N','1','3','080010380001',null,'paciente masculino de 46 aÃ±os de edad con cuadro de anorexia y DESNUTRICIÃ“N leve por riesgo de DESCOMPENSACIÃ“N requiere de suplemento dietario.','1','04',to_date('04/06/19','DD/MM/RR'),'2019-06-04','CC','1143231166','080010380001');
Insert into OASIS4.WEBSERV_JUNTA_PROFESIONAL (ID_JUPR,REPO_PERIODO,REPO_SERV_ID,REPO_TIRE_ID,NOPRESCRIPCION,FPRESCRIPCION,TIPOTECNOLOGIA,CONSECUTIVO,ESTJM,CODENTPROC,OBSERVACIONES,JUSTIFICACIONTECNICA,MODALIDAD,NOACTA,FECHAACTA,FPROCESO,TIPOIDPACIENTE,NROIDPACIENTE,CODENTJM) values ('533',to_date('31/05/19','DD/MM/RR'),'9','2','20190531197012327234',to_date('31/05/19','DD/MM/RR'),'N','1','3','082960002101',null,'DETENCION DEL CRECIMIENTO EPIFISIARIO','1','016',to_date('04/06/19','DD/MM/RR'),'2019-06-04','TI','1047219452','082960002101');
Insert into OASIS4.WEBSERV_JUNTA_PROFESIONAL (ID_JUPR,REPO_PERIODO,REPO_SERV_ID,REPO_TIRE_ID,NOPRESCRIPCION,FPRESCRIPCION,TIPOTECNOLOGIA,CONSECUTIVO,ESTJM,CODENTPROC,OBSERVACIONES,JUSTIFICACIONTECNICA,MODALIDAD,NOACTA,FECHAACTA,FPROCESO,TIPOIDPACIENTE,NROIDPACIENTE,CODENTJM) values ('534',to_date('31/05/19','DD/MM/RR'),'9','2','20190531125012328099',to_date('31/05/19','DD/MM/RR'),'N','1','3','080010380001',null,'paciente masculino discapacitado por trauma raquimedular con desnutricion proteico calorica importante requiere de soporte nutricional con suplemento indicado.','1','05',to_date('04/06/19','DD/MM/RR'),'2019-06-04','CC','91280331','080010380001');
Insert into OASIS4.WEBSERV_JUNTA_PROFESIONAL (ID_JUPR,REPO_PERIODO,REPO_SERV_ID,REPO_TIRE_ID,NOPRESCRIPCION,FPRESCRIPCION,TIPOTECNOLOGIA,CONSECUTIVO,ESTJM,CODENTPROC,OBSERVACIONES,JUSTIFICACIONTECNICA,MODALIDAD,NOACTA,FECHAACTA,FPROCESO,TIPOIDPACIENTE,NROIDPACIENTE,CODENTJM) values ('535',to_date('31/05/19','DD/MM/RR'),'9','2','20190531197012328172',to_date('31/05/19','DD/MM/RR'),'N','1','3','130010210201',null,'MEJORAR ESTADO NUTRICIONAL  GRUPO EDAD VULNERABLE COMPLEMETAR APORTES CALORICOS','2','10',to_date('31/05/19','DD/MM/RR'),'2019-05-31','CC','4008125','130010210201');
Insert into OASIS4.WEBSERV_JUNTA_PROFESIONAL (ID_JUPR,REPO_PERIODO,REPO_SERV_ID,REPO_TIRE_ID,NOPRESCRIPCION,FPRESCRIPCION,TIPOTECNOLOGIA,CONSECUTIVO,ESTJM,CODENTPROC,OBSERVACIONES,JUSTIFICACIONTECNICA,MODALIDAD,NOACTA,FECHAACTA,FPROCESO,TIPOIDPACIENTE,NROIDPACIENTE,CODENTJM) values ('536',to_date('31/05/19','DD/MM/RR'),'9','2','20190531163012329423',to_date('31/05/19','DD/MM/RR'),'N','1','3','080010380001',null,'Adolescente de 13 aÃ±os de edad con DIAGNÃ“STICO de DESNUTRICIÃ“N severa con 27 kG imc: 13.7 REQUIERE de ALIMENTACIÃ“N complementaria y SEGUIMIENTO por nutricion.','1','08',to_date('05/06/19','DD/MM/RR'),'2019-06-05','TI','1044611847','080010380001');
Insert into OASIS4.WEBSERV_JUNTA_PROFESIONAL (ID_JUPR,REPO_PERIODO,REPO_SERV_ID,REPO_TIRE_ID,NOPRESCRIPCION,FPRESCRIPCION,TIPOTECNOLOGIA,CONSECUTIVO,ESTJM,CODENTPROC,OBSERVACIONES,JUSTIFICACIONTECNICA,MODALIDAD,NOACTA,FECHAACTA,FPROCESO,TIPOIDPACIENTE,NROIDPACIENTE,CODENTJM) values ('537',to_date('31/05/19','DD/MM/RR'),'9','2','20190531182012330226',to_date('31/05/19','DD/MM/RR'),'N','1','2',null,null,null,null,null,to_date('01/01/70','DD/MM/RR'),null,'CC','1004307976','470580002301');
Insert into OASIS4.WEBSERV_JUNTA_PROFESIONAL (ID_JUPR,REPO_PERIODO,REPO_SERV_ID,REPO_TIRE_ID,NOPRESCRIPCION,FPRESCRIPCION,TIPOTECNOLOGIA,CONSECUTIVO,ESTJM,CODENTPROC,OBSERVACIONES,JUSTIFICACIONTECNICA,MODALIDAD,NOACTA,FECHAACTA,FPROCESO,TIPOIDPACIENTE,NROIDPACIENTE,CODENTJM) values ('538',to_date('31/05/19','DD/MM/RR'),'9','2','20190531199012332514',to_date('31/05/19','DD/MM/RR'),'N','1','3','080010380001',null,'PACIENTE MASCULINO DE 70 AÃ‘OS DE EDAD CON ANTECEDENTE DE DESNUTRICIÃ“N PROTEICOCALORICA, REQUIERE DE SUPLEMENTO ACTUALMENTE CON PESO DE 44 Kg E IMC: DE 16.5.','1','07',to_date('04/06/19','DD/MM/RR'),'2019-06-04','CC','19505294','080010380001');
Insert into OASIS4.WEBSERV_JUNTA_PROFESIONAL (ID_JUPR,REPO_PERIODO,REPO_SERV_ID,REPO_TIRE_ID,NOPRESCRIPCION,FPRESCRIPCION,TIPOTECNOLOGIA,CONSECUTIVO,ESTJM,CODENTPROC,OBSERVACIONES,JUSTIFICACIONTECNICA,MODALIDAD,NOACTA,FECHAACTA,FPROCESO,TIPOIDPACIENTE,NROIDPACIENTE,CODENTJM) values ('539',to_date('31/05/19','DD/MM/RR'),'9','2','20190531127012335331',to_date('31/05/19','DD/MM/RR'),'N','1','3','080010380001',null,'PACIENTE FEMENINA DE 80 AÃ‘OS DE EDAD CON DESNUTRICIÃ“N PROTEICOCALORICA SEVERA CON PESO DE 30.5 KG E IMC: 13.56, JUNTA APRUEBA USO DE SUPLEMENTO DIETARIO.','1','06',to_date('04/06/19','DD/MM/RR'),'2019-06-04','CC','22329482','080010380001');
Insert into OASIS4.WEBSERV_JUNTA_PROFESIONAL (ID_JUPR,REPO_PERIODO,REPO_SERV_ID,REPO_TIRE_ID,NOPRESCRIPCION,FPRESCRIPCION,TIPOTECNOLOGIA,CONSECUTIVO,ESTJM,CODENTPROC,OBSERVACIONES,JUSTIFICACIONTECNICA,MODALIDAD,NOACTA,FECHAACTA,FPROCESO,TIPOIDPACIENTE,NROIDPACIENTE,CODENTJM) values ('540',to_date('31/05/19','DD/MM/RR'),'9','2','20190531148012336822',to_date('31/05/19','DD/MM/RR'),'N','1','3','134300290801',null,'DESNUTRICIÃ“N PROTEICOCALORICA ','1','03',to_date('04/06/19','DD/MM/RR'),'2019-06-04','CC','33201997','134300290801');
Insert into OASIS4.WEBSERV_JUNTA_PROFESIONAL (ID_JUPR,REPO_PERIODO,REPO_SERV_ID,REPO_TIRE_ID,NOPRESCRIPCION,FPRESCRIPCION,TIPOTECNOLOGIA,CONSECUTIVO,ESTJM,CODENTPROC,OBSERVACIONES,JUSTIFICACIONTECNICA,MODALIDAD,NOACTA,FECHAACTA,FPROCESO,TIPOIDPACIENTE,NROIDPACIENTE,CODENTJM) values ('541',to_date('31/05/19','DD/MM/RR'),'9','2','20190531120012337939',to_date('31/05/19','DD/MM/RR'),'N','1','3','080010445408',null,'PACIENTE MASCULINO DE 9 AÃ‘OS CON DX NUTRICIONAL DE DESNUTRICIÃ“N LEVE, CONTROL POR NUTRICIÃ“N SIN GANANCIA DE PESO, INAPETENTE, REQUIERE SUPLEMENTO.','2','99',to_date('06/06/19','DD/MM/RR'),'2019-06-06','TI','1149439712','080010445408');
Insert into OASIS4.WEBSERV_JUNTA_PROFESIONAL (ID_JUPR,REPO_PERIODO,REPO_SERV_ID,REPO_TIRE_ID,NOPRESCRIPCION,FPRESCRIPCION,TIPOTECNOLOGIA,CONSECUTIVO,ESTJM,CODENTPROC,OBSERVACIONES,JUSTIFICACIONTECNICA,MODALIDAD,NOACTA,FECHAACTA,FPROCESO,TIPOIDPACIENTE,NROIDPACIENTE,CODENTJM) values ('542',to_date('31/05/19','DD/MM/RR'),'9','2','20190531126012342090',to_date('31/05/19','DD/MM/RR'),'N','1','2',null,null,null,null,null,to_date('01/01/70','DD/MM/RR'),null,'TI','1082248169','470580002301');
Insert into OASIS4.WEBSERV_JUNTA_PROFESIONAL (ID_JUPR,REPO_PERIODO,REPO_SERV_ID,REPO_TIRE_ID,NOPRESCRIPCION,FPRESCRIPCION,TIPOTECNOLOGIA,CONSECUTIVO,ESTJM,CODENTPROC,OBSERVACIONES,JUSTIFICACIONTECNICA,MODALIDAD,NOACTA,FECHAACTA,FPROCESO,TIPOIDPACIENTE,NROIDPACIENTE,CODENTJM) values ('543',to_date('31/05/19','DD/MM/RR'),'9','2','20190531110012342618',to_date('31/05/19','DD/MM/RR'),'N','1','3','134300290801',null,'DESNUTRICION PROTEICOCALORICA SEVERA, NO ESPECIFICADA \n','1','020',to_date('10/06/19','DD/MM/RR'),'2019-06-10','CC','9131330','134300290801');
Insert into OASIS4.WEBSERV_JUNTA_PROFESIONAL (ID_JUPR,REPO_PERIODO,REPO_SERV_ID,REPO_TIRE_ID,NOPRESCRIPCION,FPRESCRIPCION,TIPOTECNOLOGIA,CONSECUTIVO,ESTJM,CODENTPROC,OBSERVACIONES,JUSTIFICACIONTECNICA,MODALIDAD,NOACTA,FECHAACTA,FPROCESO,TIPOIDPACIENTE,NROIDPACIENTE,CODENTJM) values ('544',to_date('31/05/19','DD/MM/RR'),'9','2','20190531189012342733',to_date('31/05/19','DD/MM/RR'),'S','1','2',null,null,null,null,null,to_date('01/01/70','DD/MM/RR'),null,'TI','1043141962','084330205401');
Insert into OASIS4.WEBSERV_JUNTA_PROFESIONAL (ID_JUPR,REPO_PERIODO,REPO_SERV_ID,REPO_TIRE_ID,NOPRESCRIPCION,FPRESCRIPCION,TIPOTECNOLOGIA,CONSECUTIVO,ESTJM,CODENTPROC,OBSERVACIONES,JUSTIFICACIONTECNICA,MODALIDAD,NOACTA,FECHAACTA,FPROCESO,TIPOIDPACIENTE,NROIDPACIENTE,CODENTJM) values ('545',to_date('03/06/19','DD/MM/RR'),'9','2','20190603197012356754',to_date('03/06/19','DD/MM/RR'),'N','1','2',null,null,null,null,null,to_date('01/01/70','DD/MM/RR'),null,'CC','35601953','084330205401');
Insert into OASIS4.WEBSERV_JUNTA_PROFESIONAL (ID_JUPR,REPO_PERIODO,REPO_SERV_ID,REPO_TIRE_ID,NOPRESCRIPCION,FPRESCRIPCION,TIPOTECNOLOGIA,CONSECUTIVO,ESTJM,CODENTPROC,OBSERVACIONES,JUSTIFICACIONTECNICA,MODALIDAD,NOACTA,FECHAACTA,FPROCESO,TIPOIDPACIENTE,NROIDPACIENTE,CODENTJM) values ('546',to_date('03/06/19','DD/MM/RR'),'9','2','20190603160012356989',to_date('03/06/19','DD/MM/RR'),'N','1','2',null,null,null,null,null,to_date('01/01/70','DD/MM/RR'),null,'RC','1078466579','084330205401');
Insert into OASIS4.WEBSERV_JUNTA_PROFESIONAL (ID_JUPR,REPO_PERIODO,REPO_SERV_ID,REPO_TIRE_ID,NOPRESCRIPCION,FPRESCRIPCION,TIPOTECNOLOGIA,CONSECUTIVO,ESTJM,CODENTPROC,OBSERVACIONES,JUSTIFICACIONTECNICA,MODALIDAD,NOACTA,FECHAACTA,FPROCESO,TIPOIDPACIENTE,NROIDPACIENTE,CODENTJM) values ('547',to_date('03/06/19','DD/MM/RR'),'9','2','20190603192012357289',to_date('03/06/19','DD/MM/RR'),'N','1','2',null,null,null,null,null,to_date('01/01/70','DD/MM/RR'),null,'CC','4819162','084330205401');
Insert into OASIS4.WEBSERV_JUNTA_PROFESIONAL (ID_JUPR,REPO_PERIODO,REPO_SERV_ID,REPO_TIRE_ID,NOPRESCRIPCION,FPRESCRIPCION,TIPOTECNOLOGIA,CONSECUTIVO,ESTJM,CODENTPROC,OBSERVACIONES,JUSTIFICACIONTECNICA,MODALIDAD,NOACTA,FECHAACTA,FPROCESO,TIPOIDPACIENTE,NROIDPACIENTE,CODENTJM) values ('548',to_date('03/06/19','DD/MM/RR'),'9','2','20190603154012356428',to_date('03/06/19','DD/MM/RR'),'S','2','2',null,null,null,null,null,to_date('01/01/70','DD/MM/RR'),null,'CC','4819162','084330205401');
Insert into OASIS4.WEBSERV_JUNTA_PROFESIONAL (ID_JUPR,REPO_PERIODO,REPO_SERV_ID,REPO_TIRE_ID,NOPRESCRIPCION,FPRESCRIPCION,TIPOTECNOLOGIA,CONSECUTIVO,ESTJM,CODENTPROC,OBSERVACIONES,JUSTIFICACIONTECNICA,MODALIDAD,NOACTA,FECHAACTA,FPROCESO,TIPOIDPACIENTE,NROIDPACIENTE,CODENTJM) values ('549',to_date('03/06/19','DD/MM/RR'),'9','2','20190603154012356428',to_date('03/06/19','DD/MM/RR'),'S','3','2',null,null,null,null,null,to_date('01/01/70','DD/MM/RR'),null,'CC','4819162','084330205401');
Insert into OASIS4.WEBSERV_JUNTA_PROFESIONAL (ID_JUPR,REPO_PERIODO,REPO_SERV_ID,REPO_TIRE_ID,NOPRESCRIPCION,FPRESCRIPCION,TIPOTECNOLOGIA,CONSECUTIVO,ESTJM,CODENTPROC,OBSERVACIONES,JUSTIFICACIONTECNICA,MODALIDAD,NOACTA,FECHAACTA,FPROCESO,TIPOIDPACIENTE,NROIDPACIENTE,CODENTJM) values ('550',to_date('03/06/19','DD/MM/RR'),'9','2','20190603153012356471',to_date('03/06/19','DD/MM/RR'),'S','1','2',null,null,null,null,null,to_date('01/01/70','DD/MM/RR'),null,'CC','26283081','084330205401');
Insert into OASIS4.WEBSERV_JUNTA_PROFESIONAL (ID_JUPR,REPO_PERIODO,REPO_SERV_ID,REPO_TIRE_ID,NOPRESCRIPCION,FPRESCRIPCION,TIPOTECNOLOGIA,CONSECUTIVO,ESTJM,CODENTPROC,OBSERVACIONES,JUSTIFICACIONTECNICA,MODALIDAD,NOACTA,FECHAACTA,FPROCESO,TIPOIDPACIENTE,NROIDPACIENTE,CODENTJM) values ('551',to_date('03/06/19','DD/MM/RR'),'9','2','20190603153012356471',to_date('03/06/19','DD/MM/RR'),'S','3','2',null,null,null,null,null,to_date('01/01/70','DD/MM/RR'),null,'CC','26283081','084330205401');
Insert into OASIS4.WEBSERV_JUNTA_PROFESIONAL (ID_JUPR,REPO_PERIODO,REPO_SERV_ID,REPO_TIRE_ID,NOPRESCRIPCION,FPRESCRIPCION,TIPOTECNOLOGIA,CONSECUTIVO,ESTJM,CODENTPROC,OBSERVACIONES,JUSTIFICACIONTECNICA,MODALIDAD,NOACTA,FECHAACTA,FPROCESO,TIPOIDPACIENTE,NROIDPACIENTE,CODENTJM) values ('552',to_date('03/06/19','DD/MM/RR'),'9','2','20190603137012356495',to_date('03/06/19','DD/MM/RR'),'S','3','2',null,null,null,null,null,to_date('01/01/70','DD/MM/RR'),null,'CC','4813029','084330205401');
Insert into OASIS4.WEBSERV_JUNTA_PROFESIONAL (ID_JUPR,REPO_PERIODO,REPO_SERV_ID,REPO_TIRE_ID,NOPRESCRIPCION,FPRESCRIPCION,TIPOTECNOLOGIA,CONSECUTIVO,ESTJM,CODENTPROC,OBSERVACIONES,JUSTIFICACIONTECNICA,MODALIDAD,NOACTA,FECHAACTA,FPROCESO,TIPOIDPACIENTE,NROIDPACIENTE,CODENTJM) values ('553',to_date('03/06/19','DD/MM/RR'),'9','2','20190603155012356549',to_date('03/06/19','DD/MM/RR'),'S','3','2',null,null,null,null,null,to_date('01/01/70','DD/MM/RR'),null,'CC','1003930939','084330205401');
Insert into OASIS4.WEBSERV_JUNTA_PROFESIONAL (ID_JUPR,REPO_PERIODO,REPO_SERV_ID,REPO_TIRE_ID,NOPRESCRIPCION,FPRESCRIPCION,TIPOTECNOLOGIA,CONSECUTIVO,ESTJM,CODENTPROC,OBSERVACIONES,JUSTIFICACIONTECNICA,MODALIDAD,NOACTA,FECHAACTA,FPROCESO,TIPOIDPACIENTE,NROIDPACIENTE,CODENTJM) values ('554',to_date('03/06/19','DD/MM/RR'),'9','2','20190603168012356608',to_date('03/06/19','DD/MM/RR'),'S','3','2',null,null,null,null,null,to_date('01/01/70','DD/MM/RR'),null,'CC','11789766','084330205401');
Insert into OASIS4.WEBSERV_JUNTA_PROFESIONAL (ID_JUPR,REPO_PERIODO,REPO_SERV_ID,REPO_TIRE_ID,NOPRESCRIPCION,FPRESCRIPCION,TIPOTECNOLOGIA,CONSECUTIVO,ESTJM,CODENTPROC,OBSERVACIONES,JUSTIFICACIONTECNICA,MODALIDAD,NOACTA,FECHAACTA,FPROCESO,TIPOIDPACIENTE,NROIDPACIENTE,CODENTJM) values ('555',to_date('03/06/19','DD/MM/RR'),'9','2','20190603133012356664',to_date('03/06/19','DD/MM/RR'),'S','2','2',null,null,null,null,null,to_date('01/01/70','DD/MM/RR'),null,'CC','35601953','084330205401');
Insert into OASIS4.WEBSERV_JUNTA_PROFESIONAL (ID_JUPR,REPO_PERIODO,REPO_SERV_ID,REPO_TIRE_ID,NOPRESCRIPCION,FPRESCRIPCION,TIPOTECNOLOGIA,CONSECUTIVO,ESTJM,CODENTPROC,OBSERVACIONES,JUSTIFICACIONTECNICA,MODALIDAD,NOACTA,FECHAACTA,FPROCESO,TIPOIDPACIENTE,NROIDPACIENTE,CODENTJM) values ('556',to_date('03/06/19','DD/MM/RR'),'9','2','20190603133012356664',to_date('03/06/19','DD/MM/RR'),'S','3','2',null,null,null,null,null,to_date('01/01/70','DD/MM/RR'),null,'CC','35601953','084330205401');
Insert into OASIS4.WEBSERV_JUNTA_PROFESIONAL (ID_JUPR,REPO_PERIODO,REPO_SERV_ID,REPO_TIRE_ID,NOPRESCRIPCION,FPRESCRIPCION,TIPOTECNOLOGIA,CONSECUTIVO,ESTJM,CODENTPROC,OBSERVACIONES,JUSTIFICACIONTECNICA,MODALIDAD,NOACTA,FECHAACTA,FPROCESO,TIPOIDPACIENTE,NROIDPACIENTE,CODENTJM) values ('557',to_date('03/06/19','DD/MM/RR'),'9','2','20190603197012356754',to_date('03/06/19','DD/MM/RR'),'S','1','2',null,null,null,null,null,to_date('01/01/70','DD/MM/RR'),null,'CC','35601953','084330205401');
Insert into OASIS4.WEBSERV_JUNTA_PROFESIONAL (ID_JUPR,REPO_PERIODO,REPO_SERV_ID,REPO_TIRE_ID,NOPRESCRIPCION,FPRESCRIPCION,TIPOTECNOLOGIA,CONSECUTIVO,ESTJM,CODENTPROC,OBSERVACIONES,JUSTIFICACIONTECNICA,MODALIDAD,NOACTA,FECHAACTA,FPROCESO,TIPOIDPACIENTE,NROIDPACIENTE,CODENTJM) values ('558',to_date('03/06/19','DD/MM/RR'),'9','2','20190603197012356754',to_date('03/06/19','DD/MM/RR'),'S','3','2',null,null,null,null,null,to_date('01/01/70','DD/MM/RR'),null,'CC','35601953','084330205401');
Insert into OASIS4.WEBSERV_JUNTA_PROFESIONAL (ID_JUPR,REPO_PERIODO,REPO_SERV_ID,REPO_TIRE_ID,NOPRESCRIPCION,FPRESCRIPCION,TIPOTECNOLOGIA,CONSECUTIVO,ESTJM,CODENTPROC,OBSERVACIONES,JUSTIFICACIONTECNICA,MODALIDAD,NOACTA,FECHAACTA,FPROCESO,TIPOIDPACIENTE,NROIDPACIENTE,CODENTJM) values ('559',to_date('03/06/19','DD/MM/RR'),'9','2','20190603197012356754',to_date('03/06/19','DD/MM/RR'),'S','4','2',null,null,null,null,null,to_date('01/01/70','DD/MM/RR'),null,'CC','35601953','084330205401');
Insert into OASIS4.WEBSERV_JUNTA_PROFESIONAL (ID_JUPR,REPO_PERIODO,REPO_SERV_ID,REPO_TIRE_ID,NOPRESCRIPCION,FPRESCRIPCION,TIPOTECNOLOGIA,CONSECUTIVO,ESTJM,CODENTPROC,OBSERVACIONES,JUSTIFICACIONTECNICA,MODALIDAD,NOACTA,FECHAACTA,FPROCESO,TIPOIDPACIENTE,NROIDPACIENTE,CODENTJM) values ('560',to_date('03/06/19','DD/MM/RR'),'9','2','20190603187012356802',to_date('03/06/19','DD/MM/RR'),'S','3','2',null,null,null,null,null,to_date('01/01/70','DD/MM/RR'),null,'CC','1586714','084330205401');
Insert into OASIS4.WEBSERV_JUNTA_PROFESIONAL (ID_JUPR,REPO_PERIODO,REPO_SERV_ID,REPO_TIRE_ID,NOPRESCRIPCION,FPRESCRIPCION,TIPOTECNOLOGIA,CONSECUTIVO,ESTJM,CODENTPROC,OBSERVACIONES,JUSTIFICACIONTECNICA,MODALIDAD,NOACTA,FECHAACTA,FPROCESO,TIPOIDPACIENTE,NROIDPACIENTE,CODENTJM) values ('561',to_date('03/06/19','DD/MM/RR'),'9','2','20190603148012356926',to_date('03/06/19','DD/MM/RR'),'S','3','2',null,null,null,null,null,to_date('01/01/70','DD/MM/RR'),null,'RC','1077473725','084330205401');
Insert into OASIS4.WEBSERV_JUNTA_PROFESIONAL (ID_JUPR,REPO_PERIODO,REPO_SERV_ID,REPO_TIRE_ID,NOPRESCRIPCION,FPRESCRIPCION,TIPOTECNOLOGIA,CONSECUTIVO,ESTJM,CODENTPROC,OBSERVACIONES,JUSTIFICACIONTECNICA,MODALIDAD,NOACTA,FECHAACTA,FPROCESO,TIPOIDPACIENTE,NROIDPACIENTE,CODENTJM) values ('562',to_date('03/06/19','DD/MM/RR'),'9','2','20190603160012356989',to_date('03/06/19','DD/MM/RR'),'S','2','2',null,null,null,null,null,to_date('01/01/70','DD/MM/RR'),null,'RC','1078466579','084330205401');
Insert into OASIS4.WEBSERV_JUNTA_PROFESIONAL (ID_JUPR,REPO_PERIODO,REPO_SERV_ID,REPO_TIRE_ID,NOPRESCRIPCION,FPRESCRIPCION,TIPOTECNOLOGIA,CONSECUTIVO,ESTJM,CODENTPROC,OBSERVACIONES,JUSTIFICACIONTECNICA,MODALIDAD,NOACTA,FECHAACTA,FPROCESO,TIPOIDPACIENTE,NROIDPACIENTE,CODENTJM) values ('563',to_date('03/06/19','DD/MM/RR'),'9','2','20190603160012356989',to_date('03/06/19','DD/MM/RR'),'S','3','2',null,null,null,null,null,to_date('01/01/70','DD/MM/RR'),null,'RC','1078466579','084330205401');
Insert into OASIS4.WEBSERV_JUNTA_PROFESIONAL (ID_JUPR,REPO_PERIODO,REPO_SERV_ID,REPO_TIRE_ID,NOPRESCRIPCION,FPRESCRIPCION,TIPOTECNOLOGIA,CONSECUTIVO,ESTJM,CODENTPROC,OBSERVACIONES,JUSTIFICACIONTECNICA,MODALIDAD,NOACTA,FECHAACTA,FPROCESO,TIPOIDPACIENTE,NROIDPACIENTE,CODENTJM) values ('564',to_date('03/06/19','DD/MM/RR'),'9','2','20190603168012357034',to_date('03/06/19','DD/MM/RR'),'S','1','2',null,null,null,null,null,to_date('01/01/70','DD/MM/RR'),null,'CC','26300689','084330205401');
Insert into OASIS4.WEBSERV_JUNTA_PROFESIONAL (ID_JUPR,REPO_PERIODO,REPO_SERV_ID,REPO_TIRE_ID,NOPRESCRIPCION,FPRESCRIPCION,TIPOTECNOLOGIA,CONSECUTIVO,ESTJM,CODENTPROC,OBSERVACIONES,JUSTIFICACIONTECNICA,MODALIDAD,NOACTA,FECHAACTA,FPROCESO,TIPOIDPACIENTE,NROIDPACIENTE,CODENTJM) values ('565',to_date('03/06/19','DD/MM/RR'),'9','2','20190603168012357034',to_date('03/06/19','DD/MM/RR'),'S','3','2',null,null,null,null,null,to_date('01/01/70','DD/MM/RR'),null,'CC','26300689','084330205401');
Insert into OASIS4.WEBSERV_JUNTA_PROFESIONAL (ID_JUPR,REPO_PERIODO,REPO_SERV_ID,REPO_TIRE_ID,NOPRESCRIPCION,FPRESCRIPCION,TIPOTECNOLOGIA,CONSECUTIVO,ESTJM,CODENTPROC,OBSERVACIONES,JUSTIFICACIONTECNICA,MODALIDAD,NOACTA,FECHAACTA,FPROCESO,TIPOIDPACIENTE,NROIDPACIENTE,CODENTJM) values ('566',to_date('03/06/19','DD/MM/RR'),'9','2','20190603142012357072',to_date('03/06/19','DD/MM/RR'),'S','3','2',null,null,null,null,null,to_date('01/01/70','DD/MM/RR'),null,'CC','4821242','084330205401');
Insert into OASIS4.WEBSERV_JUNTA_PROFESIONAL (ID_JUPR,REPO_PERIODO,REPO_SERV_ID,REPO_TIRE_ID,NOPRESCRIPCION,FPRESCRIPCION,TIPOTECNOLOGIA,CONSECUTIVO,ESTJM,CODENTPROC,OBSERVACIONES,JUSTIFICACIONTECNICA,MODALIDAD,NOACTA,FECHAACTA,FPROCESO,TIPOIDPACIENTE,NROIDPACIENTE,CODENTJM) values ('567',to_date('03/06/19','DD/MM/RR'),'9','2','20190603188012357120',to_date('03/06/19','DD/MM/RR'),'S','3','2',null,null,null,null,null,to_date('01/01/70','DD/MM/RR'),null,'CC','26262025','084330205401');
Insert into OASIS4.WEBSERV_JUNTA_PROFESIONAL (ID_JUPR,REPO_PERIODO,REPO_SERV_ID,REPO_TIRE_ID,NOPRESCRIPCION,FPRESCRIPCION,TIPOTECNOLOGIA,CONSECUTIVO,ESTJM,CODENTPROC,OBSERVACIONES,JUSTIFICACIONTECNICA,MODALIDAD,NOACTA,FECHAACTA,FPROCESO,TIPOIDPACIENTE,NROIDPACIENTE,CODENTJM) values ('568',to_date('03/06/19','DD/MM/RR'),'9','2','20190603192012357289',to_date('03/06/19','DD/MM/RR'),'S','2','2',null,null,null,null,null,to_date('01/01/70','DD/MM/RR'),null,'CC','4819162','084330205401');
Insert into OASIS4.WEBSERV_JUNTA_PROFESIONAL (ID_JUPR,REPO_PERIODO,REPO_SERV_ID,REPO_TIRE_ID,NOPRESCRIPCION,FPRESCRIPCION,TIPOTECNOLOGIA,CONSECUTIVO,ESTJM,CODENTPROC,OBSERVACIONES,JUSTIFICACIONTECNICA,MODALIDAD,NOACTA,FECHAACTA,FPROCESO,TIPOIDPACIENTE,NROIDPACIENTE,CODENTJM) values ('569',to_date('03/06/19','DD/MM/RR'),'9','2','20190603192012357289',to_date('03/06/19','DD/MM/RR'),'S','4','2',null,null,null,null,null,to_date('01/01/70','DD/MM/RR'),null,'CC','4819162','084330205401');
Insert into OASIS4.WEBSERV_JUNTA_PROFESIONAL (ID_JUPR,REPO_PERIODO,REPO_SERV_ID,REPO_TIRE_ID,NOPRESCRIPCION,FPRESCRIPCION,TIPOTECNOLOGIA,CONSECUTIVO,ESTJM,CODENTPROC,OBSERVACIONES,JUSTIFICACIONTECNICA,MODALIDAD,NOACTA,FECHAACTA,FPROCESO,TIPOIDPACIENTE,NROIDPACIENTE,CODENTJM) values ('570',to_date('03/06/19','DD/MM/RR'),'9','2','20190603152012357356',to_date('03/06/19','DD/MM/RR'),'S','1','2',null,null,null,null,null,to_date('01/01/70','DD/MM/RR'),null,'CC','26283081','084330205401');
Insert into OASIS4.WEBSERV_JUNTA_PROFESIONAL (ID_JUPR,REPO_PERIODO,REPO_SERV_ID,REPO_TIRE_ID,NOPRESCRIPCION,FPRESCRIPCION,TIPOTECNOLOGIA,CONSECUTIVO,ESTJM,CODENTPROC,OBSERVACIONES,JUSTIFICACIONTECNICA,MODALIDAD,NOACTA,FECHAACTA,FPROCESO,TIPOIDPACIENTE,NROIDPACIENTE,CODENTJM) values ('571',to_date('03/06/19','DD/MM/RR'),'9','2','20190603152012357356',to_date('03/06/19','DD/MM/RR'),'S','3','2',null,null,null,null,null,to_date('01/01/70','DD/MM/RR'),null,'CC','26283081','084330205401');
Insert into OASIS4.WEBSERV_JUNTA_PROFESIONAL (ID_JUPR,REPO_PERIODO,REPO_SERV_ID,REPO_TIRE_ID,NOPRESCRIPCION,FPRESCRIPCION,TIPOTECNOLOGIA,CONSECUTIVO,ESTJM,CODENTPROC,OBSERVACIONES,JUSTIFICACIONTECNICA,MODALIDAD,NOACTA,FECHAACTA,FPROCESO,TIPOIDPACIENTE,NROIDPACIENTE,CODENTJM) values ('572',to_date('03/06/19','DD/MM/RR'),'9','2','20190603163012357401',to_date('03/06/19','DD/MM/RR'),'S','3','2',null,null,null,null,null,to_date('01/01/70','DD/MM/RR'),null,'CC','4813029','084330205401');
Insert into OASIS4.WEBSERV_JUNTA_PROFESIONAL (ID_JUPR,REPO_PERIODO,REPO_SERV_ID,REPO_TIRE_ID,NOPRESCRIPCION,FPRESCRIPCION,TIPOTECNOLOGIA,CONSECUTIVO,ESTJM,CODENTPROC,OBSERVACIONES,JUSTIFICACIONTECNICA,MODALIDAD,NOACTA,FECHAACTA,FPROCESO,TIPOIDPACIENTE,NROIDPACIENTE,CODENTJM) values ('573',to_date('03/06/19','DD/MM/RR'),'9','2','20190603163012357457',to_date('03/06/19','DD/MM/RR'),'S','3','2',null,null,null,null,null,to_date('01/01/70','DD/MM/RR'),null,'CC','1003930939','084330205401');
Insert into OASIS4.WEBSERV_JUNTA_PROFESIONAL (ID_JUPR,REPO_PERIODO,REPO_SERV_ID,REPO_TIRE_ID,NOPRESCRIPCION,FPRESCRIPCION,TIPOTECNOLOGIA,CONSECUTIVO,ESTJM,CODENTPROC,OBSERVACIONES,JUSTIFICACIONTECNICA,MODALIDAD,NOACTA,FECHAACTA,FPROCESO,TIPOIDPACIENTE,NROIDPACIENTE,CODENTJM) values ('574',to_date('03/06/19','DD/MM/RR'),'9','2','20190603159012357499',to_date('03/06/19','DD/MM/RR'),'S','1','2',null,null,null,null,null,to_date('01/01/70','DD/MM/RR'),null,'CC','11789766','084330205401');
Insert into OASIS4.WEBSERV_JUNTA_PROFESIONAL (ID_JUPR,REPO_PERIODO,REPO_SERV_ID,REPO_TIRE_ID,NOPRESCRIPCION,FPRESCRIPCION,TIPOTECNOLOGIA,CONSECUTIVO,ESTJM,CODENTPROC,OBSERVACIONES,JUSTIFICACIONTECNICA,MODALIDAD,NOACTA,FECHAACTA,FPROCESO,TIPOIDPACIENTE,NROIDPACIENTE,CODENTJM) values ('575',to_date('03/06/19','DD/MM/RR'),'9','2','20190603159012357499',to_date('03/06/19','DD/MM/RR'),'S','3','2',null,null,null,null,null,to_date('01/01/70','DD/MM/RR'),null,'CC','11789766','084330205401');
Insert into OASIS4.WEBSERV_JUNTA_PROFESIONAL (ID_JUPR,REPO_PERIODO,REPO_SERV_ID,REPO_TIRE_ID,NOPRESCRIPCION,FPRESCRIPCION,TIPOTECNOLOGIA,CONSECUTIVO,ESTJM,CODENTPROC,OBSERVACIONES,JUSTIFICACIONTECNICA,MODALIDAD,NOACTA,FECHAACTA,FPROCESO,TIPOIDPACIENTE,NROIDPACIENTE,CODENTJM) values ('576',to_date('04/06/19','DD/MM/RR'),'9','2','20190604133012371534',to_date('04/06/19','DD/MM/RR'),'M','1','2',null,null,null,null,null,to_date('01/01/70','DD/MM/RR'),null,'TI','1131314108','134300049201');
Insert into OASIS4.WEBSERV_JUNTA_PROFESIONAL (ID_JUPR,REPO_PERIODO,REPO_SERV_ID,REPO_TIRE_ID,NOPRESCRIPCION,FPRESCRIPCION,TIPOTECNOLOGIA,CONSECUTIVO,ESTJM,CODENTPROC,OBSERVACIONES,JUSTIFICACIONTECNICA,MODALIDAD,NOACTA,FECHAACTA,FPROCESO,TIPOIDPACIENTE,NROIDPACIENTE,CODENTJM) values ('577',to_date('04/06/19','DD/MM/RR'),'9','2','20190604129012371687',to_date('04/06/19','DD/MM/RR'),'M','1','2',null,null,null,null,null,to_date('01/01/70','DD/MM/RR'),null,'TI','1131314108','134300049201');
Insert into OASIS4.WEBSERV_JUNTA_PROFESIONAL (ID_JUPR,REPO_PERIODO,REPO_SERV_ID,REPO_TIRE_ID,NOPRESCRIPCION,FPRESCRIPCION,TIPOTECNOLOGIA,CONSECUTIVO,ESTJM,CODENTPROC,OBSERVACIONES,JUSTIFICACIONTECNICA,MODALIDAD,NOACTA,FECHAACTA,FPROCESO,TIPOIDPACIENTE,NROIDPACIENTE,CODENTJM) values ('578',to_date('04/06/19','DD/MM/RR'),'9','2','20190604197012364557',to_date('04/06/19','DD/MM/RR'),'N','1','2',null,null,null,null,null,to_date('01/01/70','DD/MM/RR'),null,'CC','22453179','080010133501');
Insert into OASIS4.WEBSERV_JUNTA_PROFESIONAL (ID_JUPR,REPO_PERIODO,REPO_SERV_ID,REPO_TIRE_ID,NOPRESCRIPCION,FPRESCRIPCION,TIPOTECNOLOGIA,CONSECUTIVO,ESTJM,CODENTPROC,OBSERVACIONES,JUSTIFICACIONTECNICA,MODALIDAD,NOACTA,FECHAACTA,FPROCESO,TIPOIDPACIENTE,NROIDPACIENTE,CODENTJM) values ('579',to_date('04/06/19','DD/MM/RR'),'9','2','20190604174012372610',to_date('04/06/19','DD/MM/RR'),'N','1','3','130010178101',null,'PACIENTE QUE SE OBSERVA EN MALAS CONDICIONES NUTRICIONALES, CONSUME LOS ALIMENTOS LICUADOS Y MOLIDOS, ALGUNAS VECES NO LE APETECE CONSUMIR LOS ALIMENTOS, PRESEN','1','31',to_date('05/06/19','DD/MM/RR'),'2019-06-06','CC','33133355','130010178101');
Insert into OASIS4.WEBSERV_JUNTA_PROFESIONAL (ID_JUPR,REPO_PERIODO,REPO_SERV_ID,REPO_TIRE_ID,NOPRESCRIPCION,FPRESCRIPCION,TIPOTECNOLOGIA,CONSECUTIVO,ESTJM,CODENTPROC,OBSERVACIONES,JUSTIFICACIONTECNICA,MODALIDAD,NOACTA,FECHAACTA,FPROCESO,TIPOIDPACIENTE,NROIDPACIENTE,CODENTJM) values ('580',to_date('04/06/19','DD/MM/RR'),'9','2','20190604132012376648',to_date('04/06/19','DD/MM/RR'),'N','1','2',null,null,null,null,null,to_date('01/01/70','DD/MM/RR'),null,'RC','1048332402','084330015101');
Insert into OASIS4.WEBSERV_JUNTA_PROFESIONAL (ID_JUPR,REPO_PERIODO,REPO_SERV_ID,REPO_TIRE_ID,NOPRESCRIPCION,FPRESCRIPCION,TIPOTECNOLOGIA,CONSECUTIVO,ESTJM,CODENTPROC,OBSERVACIONES,JUSTIFICACIONTECNICA,MODALIDAD,NOACTA,FECHAACTA,FPROCESO,TIPOIDPACIENTE,NROIDPACIENTE,CODENTJM) values ('581',to_date('04/06/19','DD/MM/RR'),'9','2','20190604110012380666',to_date('04/06/19','DD/MM/RR'),'N','1','2',null,null,null,null,null,to_date('01/01/70','DD/MM/RR'),null,'TI','1193228141','700010001801');
Insert into OASIS4.WEBSERV_JUNTA_PROFESIONAL (ID_JUPR,REPO_PERIODO,REPO_SERV_ID,REPO_TIRE_ID,NOPRESCRIPCION,FPRESCRIPCION,TIPOTECNOLOGIA,CONSECUTIVO,ESTJM,CODENTPROC,OBSERVACIONES,JUSTIFICACIONTECNICA,MODALIDAD,NOACTA,FECHAACTA,FPROCESO,TIPOIDPACIENTE,NROIDPACIENTE,CODENTJM) values ('582',to_date('04/06/19','DD/MM/RR'),'9','2','20190604120012359789',to_date('04/06/19','DD/MM/RR'),'S','1','2',null,null,null,null,null,to_date('01/01/70','DD/MM/RR'),null,'CC','1077482701','084330205401');
Insert into OASIS4.WEBSERV_JUNTA_PROFESIONAL (ID_JUPR,REPO_PERIODO,REPO_SERV_ID,REPO_TIRE_ID,NOPRESCRIPCION,FPRESCRIPCION,TIPOTECNOLOGIA,CONSECUTIVO,ESTJM,CODENTPROC,OBSERVACIONES,JUSTIFICACIONTECNICA,MODALIDAD,NOACTA,FECHAACTA,FPROCESO,TIPOIDPACIENTE,NROIDPACIENTE,CODENTJM) values ('583',to_date('04/06/19','DD/MM/RR'),'9','2','20190604120012359789',to_date('04/06/19','DD/MM/RR'),'S','3','2',null,null,null,null,null,to_date('01/01/70','DD/MM/RR'),null,'CC','1077482701','084330205401');
Insert into OASIS4.WEBSERV_JUNTA_PROFESIONAL (ID_JUPR,REPO_PERIODO,REPO_SERV_ID,REPO_TIRE_ID,NOPRESCRIPCION,FPRESCRIPCION,TIPOTECNOLOGIA,CONSECUTIVO,ESTJM,CODENTPROC,OBSERVACIONES,JUSTIFICACIONTECNICA,MODALIDAD,NOACTA,FECHAACTA,FPROCESO,TIPOIDPACIENTE,NROIDPACIENTE,CODENTJM) values ('584',to_date('04/06/19','DD/MM/RR'),'9','2','20190604119012367832',to_date('04/06/19','DD/MM/RR'),'S','1','3','470010001801',null,'PACIENTE CON RETARDO MIXTO DEL DESARROLLO, SECUELA DE ENCEFALOPATIA HIPOXICA ISQUEMICA, RETARDO DEL LENGUAJE','2','20190604119012367832',to_date('05/06/19','DD/MM/RR'),'2019-06-05','CC','1083047170','470010001801');
Insert into OASIS4.WEBSERV_JUNTA_PROFESIONAL (ID_JUPR,REPO_PERIODO,REPO_SERV_ID,REPO_TIRE_ID,NOPRESCRIPCION,FPRESCRIPCION,TIPOTECNOLOGIA,CONSECUTIVO,ESTJM,CODENTPROC,OBSERVACIONES,JUSTIFICACIONTECNICA,MODALIDAD,NOACTA,FECHAACTA,FPROCESO,TIPOIDPACIENTE,NROIDPACIENTE,CODENTJM) values ('585',to_date('04/06/19','DD/MM/RR'),'9','2','20190604133012378267',to_date('04/06/19','DD/MM/RR'),'S','1','3','080010003601',null,'SE INDICA LENTE DE CONTACTO COMO PRIMER NIVEL TERAPÃ‰UTICO DEL QUERATOCONO','1','001',to_date('05/06/19','DD/MM/RR'),'2019-06-05','CC','1143147363','080010003601');
Insert into OASIS4.WEBSERV_JUNTA_PROFESIONAL (ID_JUPR,REPO_PERIODO,REPO_SERV_ID,REPO_TIRE_ID,NOPRESCRIPCION,FPRESCRIPCION,TIPOTECNOLOGIA,CONSECUTIVO,ESTJM,CODENTPROC,OBSERVACIONES,JUSTIFICACIONTECNICA,MODALIDAD,NOACTA,FECHAACTA,FPROCESO,TIPOIDPACIENTE,NROIDPACIENTE,CODENTJM) values ('586',to_date('05/06/19','DD/MM/RR'),'9','2','20190605176012400445',to_date('05/06/19','DD/MM/RR'),'M','1','3','760010379901',null,'ASOCIACIÃ“N MUTUAL BARRIOS UNIDOS DE QUIBD','1','0398-19',to_date('11/06/19','DD/MM/RR'),'2019-06-13','CC','16248006','760010379901');
Insert into OASIS4.WEBSERV_JUNTA_PROFESIONAL (ID_JUPR,REPO_PERIODO,REPO_SERV_ID,REPO_TIRE_ID,NOPRESCRIPCION,FPRESCRIPCION,TIPOTECNOLOGIA,CONSECUTIVO,ESTJM,CODENTPROC,OBSERVACIONES,JUSTIFICACIONTECNICA,MODALIDAD,NOACTA,FECHAACTA,FPROCESO,TIPOIDPACIENTE,NROIDPACIENTE,CODENTJM) values ('587',to_date('05/06/19','DD/MM/RR'),'9','2','20190605167012386817',to_date('05/06/19','DD/MM/RR'),'N','1','4','132440049301',null,'PACIENTE QUE NO SE ENCUENTRA EN ESTADO DE DESNUTRICIÃ“N IMC: 22% Y TAMPOCO TIENE CUADRO ANÃ‰MICO CON HEMOGLOBINA EN 11MGR/DL','1','015',to_date('10/06/19','DD/MM/RR'),'2019-06-10','TI','1007620780','132440049301');
Insert into OASIS4.WEBSERV_JUNTA_PROFESIONAL (ID_JUPR,REPO_PERIODO,REPO_SERV_ID,REPO_TIRE_ID,NOPRESCRIPCION,FPRESCRIPCION,TIPOTECNOLOGIA,CONSECUTIVO,ESTJM,CODENTPROC,OBSERVACIONES,JUSTIFICACIONTECNICA,MODALIDAD,NOACTA,FECHAACTA,FPROCESO,TIPOIDPACIENTE,NROIDPACIENTE,CODENTJM) values ('588',to_date('05/06/19','DD/MM/RR'),'9','2','20190605174012388586',to_date('05/06/19','DD/MM/RR'),'N','1','3','080010380001',null,'LACTANTE MAYOR CON DESNUTRICIÃ“N PROTEICOCALORICA LEVE QUE POR PRESENTAR DIFICULTADES EN LA ADMINISTRACIÃ“N DE ALIMENTOS, REQUIERE DE NUTRICIÃ“N COMPLEMENTARIA.','1','10',to_date('05/06/19','DD/MM/RR'),'2019-06-05','RC','1046730351','080010380001');
Insert into OASIS4.WEBSERV_JUNTA_PROFESIONAL (ID_JUPR,REPO_PERIODO,REPO_SERV_ID,REPO_TIRE_ID,NOPRESCRIPCION,FPRESCRIPCION,TIPOTECNOLOGIA,CONSECUTIVO,ESTJM,CODENTPROC,OBSERVACIONES,JUSTIFICACIONTECNICA,MODALIDAD,NOACTA,FECHAACTA,FPROCESO,TIPOIDPACIENTE,NROIDPACIENTE,CODENTJM) values ('589',to_date('05/06/19','DD/MM/RR'),'9','2','20190605173012390134',to_date('05/06/19','DD/MM/RR'),'N','1','2',null,null,null,null,null,to_date('01/01/70','DD/MM/RR'),null,'CC','4819162','270010070801');
Insert into OASIS4.WEBSERV_JUNTA_PROFESIONAL (ID_JUPR,REPO_PERIODO,REPO_SERV_ID,REPO_TIRE_ID,NOPRESCRIPCION,FPRESCRIPCION,TIPOTECNOLOGIA,CONSECUTIVO,ESTJM,CODENTPROC,OBSERVACIONES,JUSTIFICACIONTECNICA,MODALIDAD,NOACTA,FECHAACTA,FPROCESO,TIPOIDPACIENTE,NROIDPACIENTE,CODENTJM) values ('590',to_date('05/06/19','DD/MM/RR'),'9','2','20190605197012390735',to_date('05/06/19','DD/MM/RR'),'N','1','3','134300290801',null,'artritis y poliartritis estreptococicas','1','017',to_date('05/06/19','DD/MM/RR'),'2019-06-05','CC','33193077','134300290801');
Insert into OASIS4.WEBSERV_JUNTA_PROFESIONAL (ID_JUPR,REPO_PERIODO,REPO_SERV_ID,REPO_TIRE_ID,NOPRESCRIPCION,FPRESCRIPCION,TIPOTECNOLOGIA,CONSECUTIVO,ESTJM,CODENTPROC,OBSERVACIONES,JUSTIFICACIONTECNICA,MODALIDAD,NOACTA,FECHAACTA,FPROCESO,TIPOIDPACIENTE,NROIDPACIENTE,CODENTJM) values ('591',to_date('05/06/19','DD/MM/RR'),'9','2','20190605153012392112',to_date('05/06/19','DD/MM/RR'),'N','1','2',null,null,null,null,null,to_date('01/01/70','DD/MM/RR'),null,'CC','4813029','270010070801');
Insert into OASIS4.WEBSERV_JUNTA_PROFESIONAL (ID_JUPR,REPO_PERIODO,REPO_SERV_ID,REPO_TIRE_ID,NOPRESCRIPCION,FPRESCRIPCION,TIPOTECNOLOGIA,CONSECUTIVO,ESTJM,CODENTPROC,OBSERVACIONES,JUSTIFICACIONTECNICA,MODALIDAD,NOACTA,FECHAACTA,FPROCESO,TIPOIDPACIENTE,NROIDPACIENTE,CODENTJM) values ('592',to_date('05/06/19','DD/MM/RR'),'9','2','20190605177012393503',to_date('05/06/19','DD/MM/RR'),'N','1','3','134300290801',null,'DESNUTRICIÃ“N PROTEICOCALORICA SEVERA NO ESPECIFICADA ','1','018',to_date('05/06/19','DD/MM/RR'),'2019-06-05','CC','22932007','134300290801');
Insert into OASIS4.WEBSERV_JUNTA_PROFESIONAL (ID_JUPR,REPO_PERIODO,REPO_SERV_ID,REPO_TIRE_ID,NOPRESCRIPCION,FPRESCRIPCION,TIPOTECNOLOGIA,CONSECUTIVO,ESTJM,CODENTPROC,OBSERVACIONES,JUSTIFICACIONTECNICA,MODALIDAD,NOACTA,FECHAACTA,FPROCESO,TIPOIDPACIENTE,NROIDPACIENTE,CODENTJM) values ('593',to_date('05/06/19','DD/MM/RR'),'9','2','20190605119012394284',to_date('05/06/19','DD/MM/RR'),'N','1','3','130010210201',null,'PACIENTE CON GRAN IMPACTO EN EL NEURODESARROLLO LOS DOS PRIMEROS AÃ‘OS DE VISA PESO 11.7 K  TALLA 92.5 CM REQUIERE  RECUPERARSE NUTRICIONALMENTE ANTES DE 5 AÃ‘OS','2','13',to_date('05/06/19','DD/MM/RR'),'2019-06-05','CC','25957681','130010210201');
Insert into OASIS4.WEBSERV_JUNTA_PROFESIONAL (ID_JUPR,REPO_PERIODO,REPO_SERV_ID,REPO_TIRE_ID,NOPRESCRIPCION,FPRESCRIPCION,TIPOTECNOLOGIA,CONSECUTIVO,ESTJM,CODENTPROC,OBSERVACIONES,JUSTIFICACIONTECNICA,MODALIDAD,NOACTA,FECHAACTA,FPROCESO,TIPOIDPACIENTE,NROIDPACIENTE,CODENTJM) values ('594',to_date('05/06/19','DD/MM/RR'),'9','2','20190605180012394679',to_date('05/06/19','DD/MM/RR'),'N','1','2',null,null,null,null,null,to_date('01/01/70','DD/MM/RR'),null,'CC','23195754','080010409201');
Insert into OASIS4.WEBSERV_JUNTA_PROFESIONAL (ID_JUPR,REPO_PERIODO,REPO_SERV_ID,REPO_TIRE_ID,NOPRESCRIPCION,FPRESCRIPCION,TIPOTECNOLOGIA,CONSECUTIVO,ESTJM,CODENTPROC,OBSERVACIONES,JUSTIFICACIONTECNICA,MODALIDAD,NOACTA,FECHAACTA,FPROCESO,TIPOIDPACIENTE,NROIDPACIENTE,CODENTJM) values ('595',to_date('05/06/19','DD/MM/RR'),'9','2','20190605136012395181',to_date('05/06/19','DD/MM/RR'),'N','1','2',null,null,null,null,null,to_date('01/01/70','DD/MM/RR'),null,'CC','1114402623','ESS076');
Insert into OASIS4.WEBSERV_JUNTA_PROFESIONAL (ID_JUPR,REPO_PERIODO,REPO_SERV_ID,REPO_TIRE_ID,NOPRESCRIPCION,FPRESCRIPCION,TIPOTECNOLOGIA,CONSECUTIVO,ESTJM,CODENTPROC,OBSERVACIONES,JUSTIFICACIONTECNICA,MODALIDAD,NOACTA,FECHAACTA,FPROCESO,TIPOIDPACIENTE,NROIDPACIENTE,CODENTJM) values ('596',to_date('05/06/19','DD/MM/RR'),'9','2','20190605141012405932',to_date('05/06/19','DD/MM/RR'),'N','1','3','761470067210',null,'se aprueba soporte nutricional ensure 12 latas para 90 dias, por condiciones de paciente.','1','20',to_date('27/06/19','DD/MM/RR'),'2019-06-27','CC','1112792517','761470067210');
Insert into OASIS4.WEBSERV_JUNTA_PROFESIONAL (ID_JUPR,REPO_PERIODO,REPO_SERV_ID,REPO_TIRE_ID,NOPRESCRIPCION,FPRESCRIPCION,TIPOTECNOLOGIA,CONSECUTIVO,ESTJM,CODENTPROC,OBSERVACIONES,JUSTIFICACIONTECNICA,MODALIDAD,NOACTA,FECHAACTA,FPROCESO,TIPOIDPACIENTE,NROIDPACIENTE,CODENTJM) values ('597',to_date('05/06/19','DD/MM/RR'),'9','2','20190605173012390134',to_date('05/06/19','DD/MM/RR'),'S','3','2',null,null,null,null,null,to_date('01/01/70','DD/MM/RR'),null,'CC','4819162','270010070801');
Insert into OASIS4.WEBSERV_JUNTA_PROFESIONAL (ID_JUPR,REPO_PERIODO,REPO_SERV_ID,REPO_TIRE_ID,NOPRESCRIPCION,FPRESCRIPCION,TIPOTECNOLOGIA,CONSECUTIVO,ESTJM,CODENTPROC,OBSERVACIONES,JUSTIFICACIONTECNICA,MODALIDAD,NOACTA,FECHAACTA,FPROCESO,TIPOIDPACIENTE,NROIDPACIENTE,CODENTJM) values ('598',to_date('05/06/19','DD/MM/RR'),'9','2','20190605186012390878',to_date('05/06/19','DD/MM/RR'),'S','3','2',null,null,null,null,null,to_date('01/01/70','DD/MM/RR'),null,'CC','26283081','270010070801');
Insert into OASIS4.WEBSERV_JUNTA_PROFESIONAL (ID_JUPR,REPO_PERIODO,REPO_SERV_ID,REPO_TIRE_ID,NOPRESCRIPCION,FPRESCRIPCION,TIPOTECNOLOGIA,CONSECUTIVO,ESTJM,CODENTPROC,OBSERVACIONES,JUSTIFICACIONTECNICA,MODALIDAD,NOACTA,FECHAACTA,FPROCESO,TIPOIDPACIENTE,NROIDPACIENTE,CODENTJM) values ('599',to_date('05/06/19','DD/MM/RR'),'9','2','20190605114012391486',to_date('05/06/19','DD/MM/RR'),'S','3','2',null,null,null,null,null,to_date('01/01/70','DD/MM/RR'),null,'CC','26253771','270010070801');
Insert into OASIS4.WEBSERV_JUNTA_PROFESIONAL (ID_JUPR,REPO_PERIODO,REPO_SERV_ID,REPO_TIRE_ID,NOPRESCRIPCION,FPRESCRIPCION,TIPOTECNOLOGIA,CONSECUTIVO,ESTJM,CODENTPROC,OBSERVACIONES,JUSTIFICACIONTECNICA,MODALIDAD,NOACTA,FECHAACTA,FPROCESO,TIPOIDPACIENTE,NROIDPACIENTE,CODENTJM) values ('600',to_date('05/06/19','DD/MM/RR'),'9','2','20190605153012392112',to_date('05/06/19','DD/MM/RR'),'S','3','2',null,null,null,null,null,to_date('01/01/70','DD/MM/RR'),null,'CC','4813029','270010070801');
Insert into OASIS4.WEBSERV_JUNTA_PROFESIONAL (ID_JUPR,REPO_PERIODO,REPO_SERV_ID,REPO_TIRE_ID,NOPRESCRIPCION,FPRESCRIPCION,TIPOTECNOLOGIA,CONSECUTIVO,ESTJM,CODENTPROC,OBSERVACIONES,JUSTIFICACIONTECNICA,MODALIDAD,NOACTA,FECHAACTA,FPROCESO,TIPOIDPACIENTE,NROIDPACIENTE,CODENTJM) values ('601',to_date('05/06/19','DD/MM/RR'),'9','2','20190605126012392568',to_date('05/06/19','DD/MM/RR'),'S','3','2',null,null,null,null,null,to_date('01/01/70','DD/MM/RR'),null,'CC','1003930939','270010070801');
Insert into OASIS4.WEBSERV_JUNTA_PROFESIONAL (ID_JUPR,REPO_PERIODO,REPO_SERV_ID,REPO_TIRE_ID,NOPRESCRIPCION,FPRESCRIPCION,TIPOTECNOLOGIA,CONSECUTIVO,ESTJM,CODENTPROC,OBSERVACIONES,JUSTIFICACIONTECNICA,MODALIDAD,NOACTA,FECHAACTA,FPROCESO,TIPOIDPACIENTE,NROIDPACIENTE,CODENTJM) values ('602',to_date('05/06/19','DD/MM/RR'),'9','2','20190605167012393169',to_date('05/06/19','DD/MM/RR'),'S','3','2',null,null,null,null,null,to_date('01/01/70','DD/MM/RR'),null,'CC','11789766','270010070801');
Insert into OASIS4.WEBSERV_JUNTA_PROFESIONAL (ID_JUPR,REPO_PERIODO,REPO_SERV_ID,REPO_TIRE_ID,NOPRESCRIPCION,FPRESCRIPCION,TIPOTECNOLOGIA,CONSECUTIVO,ESTJM,CODENTPROC,OBSERVACIONES,JUSTIFICACIONTECNICA,MODALIDAD,NOACTA,FECHAACTA,FPROCESO,TIPOIDPACIENTE,NROIDPACIENTE,CODENTJM) values ('603',to_date('05/06/19','DD/MM/RR'),'9','2','20190605186012394032',to_date('05/06/19','DD/MM/RR'),'S','3','2',null,null,null,null,null,to_date('01/01/70','DD/MM/RR'),null,'CC','1586714','270010070801');
Insert into OASIS4.WEBSERV_JUNTA_PROFESIONAL (ID_JUPR,REPO_PERIODO,REPO_SERV_ID,REPO_TIRE_ID,NOPRESCRIPCION,FPRESCRIPCION,TIPOTECNOLOGIA,CONSECUTIVO,ESTJM,CODENTPROC,OBSERVACIONES,JUSTIFICACIONTECNICA,MODALIDAD,NOACTA,FECHAACTA,FPROCESO,TIPOIDPACIENTE,NROIDPACIENTE,CODENTJM) values ('604',to_date('05/06/19','DD/MM/RR'),'9','2','20190605154012395155',to_date('05/06/19','DD/MM/RR'),'S','3','2',null,null,null,null,null,to_date('01/01/70','DD/MM/RR'),null,'RC','1077473725','270010070801');
Insert into OASIS4.WEBSERV_JUNTA_PROFESIONAL (ID_JUPR,REPO_PERIODO,REPO_SERV_ID,REPO_TIRE_ID,NOPRESCRIPCION,FPRESCRIPCION,TIPOTECNOLOGIA,CONSECUTIVO,ESTJM,CODENTPROC,OBSERVACIONES,JUSTIFICACIONTECNICA,MODALIDAD,NOACTA,FECHAACTA,FPROCESO,TIPOIDPACIENTE,NROIDPACIENTE,CODENTJM) values ('605',to_date('05/06/19','DD/MM/RR'),'9','2','20190605122012395531',to_date('05/06/19','DD/MM/RR'),'S','2','2',null,null,null,null,null,to_date('01/01/70','DD/MM/RR'),null,'CC','29183547','761000252401');
Insert into OASIS4.WEBSERV_JUNTA_PROFESIONAL (ID_JUPR,REPO_PERIODO,REPO_SERV_ID,REPO_TIRE_ID,NOPRESCRIPCION,FPRESCRIPCION,TIPOTECNOLOGIA,CONSECUTIVO,ESTJM,CODENTPROC,OBSERVACIONES,JUSTIFICACIONTECNICA,MODALIDAD,NOACTA,FECHAACTA,FPROCESO,TIPOIDPACIENTE,NROIDPACIENTE,CODENTJM) values ('606',to_date('05/06/19','DD/MM/RR'),'9','2','20190605167012399398',to_date('05/06/19','DD/MM/RR'),'S','1','2',null,null,null,null,null,to_date('01/01/70','DD/MM/RR'),null,'CC','8645934','084330205401');
Insert into OASIS4.WEBSERV_JUNTA_PROFESIONAL (ID_JUPR,REPO_PERIODO,REPO_SERV_ID,REPO_TIRE_ID,NOPRESCRIPCION,FPRESCRIPCION,TIPOTECNOLOGIA,CONSECUTIVO,ESTJM,CODENTPROC,OBSERVACIONES,JUSTIFICACIONTECNICA,MODALIDAD,NOACTA,FECHAACTA,FPROCESO,TIPOIDPACIENTE,NROIDPACIENTE,CODENTJM) values ('607',to_date('05/06/19','DD/MM/RR'),'9','2','20190605176012401427',to_date('05/06/19','DD/MM/RR'),'S','3','2',null,null,null,null,null,to_date('01/01/70','DD/MM/RR'),null,'RC','1078466579','270010070801');
Insert into OASIS4.WEBSERV_JUNTA_PROFESIONAL (ID_JUPR,REPO_PERIODO,REPO_SERV_ID,REPO_TIRE_ID,NOPRESCRIPCION,FPRESCRIPCION,TIPOTECNOLOGIA,CONSECUTIVO,ESTJM,CODENTPROC,OBSERVACIONES,JUSTIFICACIONTECNICA,MODALIDAD,NOACTA,FECHAACTA,FPROCESO,TIPOIDPACIENTE,NROIDPACIENTE,CODENTJM) values ('608',to_date('05/06/19','DD/MM/RR'),'9','2','20190605168012401994',to_date('05/06/19','DD/MM/RR'),'S','3','2',null,null,null,null,null,to_date('01/01/70','DD/MM/RR'),null,'CC','26300689','270010070801');
Insert into OASIS4.WEBSERV_JUNTA_PROFESIONAL (ID_JUPR,REPO_PERIODO,REPO_SERV_ID,REPO_TIRE_ID,NOPRESCRIPCION,FPRESCRIPCION,TIPOTECNOLOGIA,CONSECUTIVO,ESTJM,CODENTPROC,OBSERVACIONES,JUSTIFICACIONTECNICA,MODALIDAD,NOACTA,FECHAACTA,FPROCESO,TIPOIDPACIENTE,NROIDPACIENTE,CODENTJM) values ('609',to_date('05/06/19','DD/MM/RR'),'9','2','20190605183012402280',to_date('05/06/19','DD/MM/RR'),'S','3','2',null,null,null,null,null,to_date('01/01/70','DD/MM/RR'),null,'CC','4821242','270010070801');
Insert into OASIS4.WEBSERV_JUNTA_PROFESIONAL (ID_JUPR,REPO_PERIODO,REPO_SERV_ID,REPO_TIRE_ID,NOPRESCRIPCION,FPRESCRIPCION,TIPOTECNOLOGIA,CONSECUTIVO,ESTJM,CODENTPROC,OBSERVACIONES,JUSTIFICACIONTECNICA,MODALIDAD,NOACTA,FECHAACTA,FPROCESO,TIPOIDPACIENTE,NROIDPACIENTE,CODENTJM) values ('610',to_date('05/06/19','DD/MM/RR'),'9','2','20190605177012402615',to_date('05/06/19','DD/MM/RR'),'S','3','2',null,null,null,null,null,to_date('01/01/70','DD/MM/RR'),null,'CC','26262025','270010070801');
Insert into OASIS4.WEBSERV_JUNTA_PROFESIONAL (ID_JUPR,REPO_PERIODO,REPO_SERV_ID,REPO_TIRE_ID,NOPRESCRIPCION,FPRESCRIPCION,TIPOTECNOLOGIA,CONSECUTIVO,ESTJM,CODENTPROC,OBSERVACIONES,JUSTIFICACIONTECNICA,MODALIDAD,NOACTA,FECHAACTA,FPROCESO,TIPOIDPACIENTE,NROIDPACIENTE,CODENTJM) values ('611',to_date('05/06/19','DD/MM/RR'),'9','2','20190605145012403073',to_date('05/06/19','DD/MM/RR'),'S','3','2',null,null,null,null,null,to_date('01/01/70','DD/MM/RR'),null,'CC','1077482701','270010070801');
Insert into OASIS4.WEBSERV_JUNTA_PROFESIONAL (ID_JUPR,REPO_PERIODO,REPO_SERV_ID,REPO_TIRE_ID,NOPRESCRIPCION,FPRESCRIPCION,TIPOTECNOLOGIA,CONSECUTIVO,ESTJM,CODENTPROC,OBSERVACIONES,JUSTIFICACIONTECNICA,MODALIDAD,NOACTA,FECHAACTA,FPROCESO,TIPOIDPACIENTE,NROIDPACIENTE,CODENTJM) values ('612',to_date('05/06/19','DD/MM/RR'),'9','2','20190605167012403641',to_date('05/06/19','DD/MM/RR'),'S','3','2',null,null,null,null,null,to_date('01/01/70','DD/MM/RR'),null,'CC','26268094','270010070801');
Insert into OASIS4.WEBSERV_JUNTA_PROFESIONAL (ID_JUPR,REPO_PERIODO,REPO_SERV_ID,REPO_TIRE_ID,NOPRESCRIPCION,FPRESCRIPCION,TIPOTECNOLOGIA,CONSECUTIVO,ESTJM,CODENTPROC,OBSERVACIONES,JUSTIFICACIONTECNICA,MODALIDAD,NOACTA,FECHAACTA,FPROCESO,TIPOIDPACIENTE,NROIDPACIENTE,CODENTJM) values ('613',to_date('06/06/19','DD/MM/RR'),'9','2','20190606186012418584',to_date('06/06/19','DD/MM/RR'),'N','1','4','132440049301',null,'PACIENTE CON PERCENTILES ADECUADOS PARA LA EDAD DE ACUERDO A RESOL 2465, NO ESTA EN RIESGO DE DESNUTRICION, p:T/E: peso adecuado T/E: TALLA ADECUADA','1','013',to_date('10/06/19','DD/MM/RR'),'2019-06-10','RC','1050284885','132440049301');
Insert into OASIS4.WEBSERV_JUNTA_PROFESIONAL (ID_JUPR,REPO_PERIODO,REPO_SERV_ID,REPO_TIRE_ID,NOPRESCRIPCION,FPRESCRIPCION,TIPOTECNOLOGIA,CONSECUTIVO,ESTJM,CODENTPROC,OBSERVACIONES,JUSTIFICACIONTECNICA,MODALIDAD,NOACTA,FECHAACTA,FPROCESO,TIPOIDPACIENTE,NROIDPACIENTE,CODENTJM) values ('265',to_date('25/04/19','DD/MM/RR'),'9','2','20190425128011601108',to_date('25/04/19','DD/MM/RR'),'N','1','3','761470851601',null,'PACIENTE QUIEN REQUIERE COMPLEMENTAR SU ALIMENTACIÃ“N CON SOPORTE NUTRICIONAL LISTO PARA EL CONSUMO CON EL FIN DE BRINDAR UNA NUTRICIÃ“N COMPLETA Y BALANCEADA','1','MP0070',to_date('25/04/19','DD/MM/RR'),'2019-04-25','RC','1118259384','761470851601');
Insert into OASIS4.WEBSERV_JUNTA_PROFESIONAL (ID_JUPR,REPO_PERIODO,REPO_SERV_ID,REPO_TIRE_ID,NOPRESCRIPCION,FPRESCRIPCION,TIPOTECNOLOGIA,CONSECUTIVO,ESTJM,CODENTPROC,OBSERVACIONES,JUSTIFICACIONTECNICA,MODALIDAD,NOACTA,FECHAACTA,FPROCESO,TIPOIDPACIENTE,NROIDPACIENTE,CODENTJM) values ('266',to_date('25/04/19','DD/MM/RR'),'9','2','20190425122011601859',to_date('25/04/19','DD/MM/RR'),'N','1','2',null,null,null,null,null,to_date('01/01/70','DD/MM/RR'),null,'TI','1051888261','130010210201');
Insert into OASIS4.WEBSERV_JUNTA_PROFESIONAL (ID_JUPR,REPO_PERIODO,REPO_SERV_ID,REPO_TIRE_ID,NOPRESCRIPCION,FPRESCRIPCION,TIPOTECNOLOGIA,CONSECUTIVO,ESTJM,CODENTPROC,OBSERVACIONES,JUSTIFICACIONTECNICA,MODALIDAD,NOACTA,FECHAACTA,FPROCESO,TIPOIDPACIENTE,NROIDPACIENTE,CODENTJM) values ('267',to_date('25/04/19','DD/MM/RR'),'9','2','20190425172011607457',to_date('25/04/19','DD/MM/RR'),'N','1','2',null,null,null,null,null,to_date('01/01/70','DD/MM/RR'),null,'CC','32995005','134300290801');
Insert into OASIS4.WEBSERV_JUNTA_PROFESIONAL (ID_JUPR,REPO_PERIODO,REPO_SERV_ID,REPO_TIRE_ID,NOPRESCRIPCION,FPRESCRIPCION,TIPOTECNOLOGIA,CONSECUTIVO,ESTJM,CODENTPROC,OBSERVACIONES,JUSTIFICACIONTECNICA,MODALIDAD,NOACTA,FECHAACTA,FPROCESO,TIPOIDPACIENTE,NROIDPACIENTE,CODENTJM) values ('268',to_date('25/04/19','DD/MM/RR'),'9','2','20190425146011608760',to_date('25/04/19','DD/MM/RR'),'N','1','2',null,null,null,null,null,to_date('01/01/70','DD/MM/RR'),null,'CC','22927481','134300290801');
Insert into OASIS4.WEBSERV_JUNTA_PROFESIONAL (ID_JUPR,REPO_PERIODO,REPO_SERV_ID,REPO_TIRE_ID,NOPRESCRIPCION,FPRESCRIPCION,TIPOTECNOLOGIA,CONSECUTIVO,ESTJM,CODENTPROC,OBSERVACIONES,JUSTIFICACIONTECNICA,MODALIDAD,NOACTA,FECHAACTA,FPROCESO,TIPOIDPACIENTE,NROIDPACIENTE,CODENTJM) values ('269',to_date('25/04/19','DD/MM/RR'),'9','2','20190425162011610520',to_date('25/04/19','DD/MM/RR'),'N','1','2',null,null,null,null,null,to_date('01/01/70','DD/MM/RR'),null,'CC','33310377','134300290801');
Insert into OASIS4.WEBSERV_JUNTA_PROFESIONAL (ID_JUPR,REPO_PERIODO,REPO_SERV_ID,REPO_TIRE_ID,NOPRESCRIPCION,FPRESCRIPCION,TIPOTECNOLOGIA,CONSECUTIVO,ESTJM,CODENTPROC,OBSERVACIONES,JUSTIFICACIONTECNICA,MODALIDAD,NOACTA,FECHAACTA,FPROCESO,TIPOIDPACIENTE,NROIDPACIENTE,CODENTJM) values ('270',to_date('25/04/19','DD/MM/RR'),'9','2','20190425110011611198',to_date('25/04/19','DD/MM/RR'),'N','1','2',null,null,null,null,null,to_date('01/01/70','DD/MM/RR'),null,'CC','29621377','761470067210');
Insert into OASIS4.WEBSERV_JUNTA_PROFESIONAL (ID_JUPR,REPO_PERIODO,REPO_SERV_ID,REPO_TIRE_ID,NOPRESCRIPCION,FPRESCRIPCION,TIPOTECNOLOGIA,CONSECUTIVO,ESTJM,CODENTPROC,OBSERVACIONES,JUSTIFICACIONTECNICA,MODALIDAD,NOACTA,FECHAACTA,FPROCESO,TIPOIDPACIENTE,NROIDPACIENTE,CODENTJM) values ('271',to_date('25/04/19','DD/MM/RR'),'9','2','20190425172011611929',to_date('25/04/19','DD/MM/RR'),'N','1','2',null,null,null,null,null,to_date('01/01/70','DD/MM/RR'),null,'TI','1051888261','130010210201');
Insert into OASIS4.WEBSERV_JUNTA_PROFESIONAL (ID_JUPR,REPO_PERIODO,REPO_SERV_ID,REPO_TIRE_ID,NOPRESCRIPCION,FPRESCRIPCION,TIPOTECNOLOGIA,CONSECUTIVO,ESTJM,CODENTPROC,OBSERVACIONES,JUSTIFICACIONTECNICA,MODALIDAD,NOACTA,FECHAACTA,FPROCESO,TIPOIDPACIENTE,NROIDPACIENTE,CODENTJM) values ('272',to_date('25/04/19','DD/MM/RR'),'9','2','20190425145011612597',to_date('25/04/19','DD/MM/RR'),'N','1','2',null,null,null,null,null,to_date('01/01/70','DD/MM/RR'),null,'TI','1050726174','134300290801');
Insert into OASIS4.WEBSERV_JUNTA_PROFESIONAL (ID_JUPR,REPO_PERIODO,REPO_SERV_ID,REPO_TIRE_ID,NOPRESCRIPCION,FPRESCRIPCION,TIPOTECNOLOGIA,CONSECUTIVO,ESTJM,CODENTPROC,OBSERVACIONES,JUSTIFICACIONTECNICA,MODALIDAD,NOACTA,FECHAACTA,FPROCESO,TIPOIDPACIENTE,NROIDPACIENTE,CODENTJM) values ('273',to_date('25/04/19','DD/MM/RR'),'9','2','20190425186011616645',to_date('25/04/19','DD/MM/RR'),'N','1','2',null,null,null,null,null,to_date('01/01/70','DD/MM/RR'),null,'CC','7429531','086380074501');
Insert into OASIS4.WEBSERV_JUNTA_PROFESIONAL (ID_JUPR,REPO_PERIODO,REPO_SERV_ID,REPO_TIRE_ID,NOPRESCRIPCION,FPRESCRIPCION,TIPOTECNOLOGIA,CONSECUTIVO,ESTJM,CODENTPROC,OBSERVACIONES,JUSTIFICACIONTECNICA,MODALIDAD,NOACTA,FECHAACTA,FPROCESO,TIPOIDPACIENTE,NROIDPACIENTE,CODENTJM) values ('274',to_date('25/04/19','DD/MM/RR'),'9','2','20190425178011601396',to_date('25/04/19','DD/MM/RR'),'S','1','2',null,null,null,null,null,to_date('01/01/70','DD/MM/RR'),null,'CC','22390467','080010003601');
Insert into OASIS4.WEBSERV_JUNTA_PROFESIONAL (ID_JUPR,REPO_PERIODO,REPO_SERV_ID,REPO_TIRE_ID,NOPRESCRIPCION,FPRESCRIPCION,TIPOTECNOLOGIA,CONSECUTIVO,ESTJM,CODENTPROC,OBSERVACIONES,JUSTIFICACIONTECNICA,MODALIDAD,NOACTA,FECHAACTA,FPROCESO,TIPOIDPACIENTE,NROIDPACIENTE,CODENTJM) values ('275',to_date('25/04/19','DD/MM/RR'),'9','2','20190425129011602649',to_date('25/04/19','DD/MM/RR'),'S','1','2',null,null,null,null,null,to_date('01/01/70','DD/MM/RR'),null,'TI','1102814765','080010330401');
Insert into OASIS4.WEBSERV_JUNTA_PROFESIONAL (ID_JUPR,REPO_PERIODO,REPO_SERV_ID,REPO_TIRE_ID,NOPRESCRIPCION,FPRESCRIPCION,TIPOTECNOLOGIA,CONSECUTIVO,ESTJM,CODENTPROC,OBSERVACIONES,JUSTIFICACIONTECNICA,MODALIDAD,NOACTA,FECHAACTA,FPROCESO,TIPOIDPACIENTE,NROIDPACIENTE,CODENTJM) values ('276',to_date('25/04/19','DD/MM/RR'),'9','2','20190425183011613939',to_date('25/04/19','DD/MM/RR'),'S','1','2',null,null,null,null,null,to_date('01/01/70','DD/MM/RR'),null,'CC','2787298','230010011601');
Insert into OASIS4.WEBSERV_JUNTA_PROFESIONAL (ID_JUPR,REPO_PERIODO,REPO_SERV_ID,REPO_TIRE_ID,NOPRESCRIPCION,FPRESCRIPCION,TIPOTECNOLOGIA,CONSECUTIVO,ESTJM,CODENTPROC,OBSERVACIONES,JUSTIFICACIONTECNICA,MODALIDAD,NOACTA,FECHAACTA,FPROCESO,TIPOIDPACIENTE,NROIDPACIENTE,CODENTJM) values ('277',to_date('26/04/19','DD/MM/RR'),'9','2','20190426143011623903',to_date('26/04/19','DD/MM/RR'),'N','1','3','761470851601',null,'quien requiere COMPLEMENTAR SU NUTRICIÃ“N, con alimento lÃ­quido completo y balanceado con HMB (ÃŸ-hidroxi-ÃŸ-metilbutirato), ','1','MP0071',to_date('26/04/19','DD/MM/RR'),'2019-05-08','CC','6238582','761470851601');
Insert into OASIS4.WEBSERV_JUNTA_PROFESIONAL (ID_JUPR,REPO_PERIODO,REPO_SERV_ID,REPO_TIRE_ID,NOPRESCRIPCION,FPRESCRIPCION,TIPOTECNOLOGIA,CONSECUTIVO,ESTJM,CODENTPROC,OBSERVACIONES,JUSTIFICACIONTECNICA,MODALIDAD,NOACTA,FECHAACTA,FPROCESO,TIPOIDPACIENTE,NROIDPACIENTE,CODENTJM) values ('278',to_date('26/04/19','DD/MM/RR'),'9','2','20190426119011625943',to_date('26/04/19','DD/MM/RR'),'N','1','2',null,null,null,null,null,to_date('01/01/70','DD/MM/RR'),null,'CC','24612631','ESS076');
Insert into OASIS4.WEBSERV_JUNTA_PROFESIONAL (ID_JUPR,REPO_PERIODO,REPO_SERV_ID,REPO_TIRE_ID,NOPRESCRIPCION,FPRESCRIPCION,TIPOTECNOLOGIA,CONSECUTIVO,ESTJM,CODENTPROC,OBSERVACIONES,JUSTIFICACIONTECNICA,MODALIDAD,NOACTA,FECHAACTA,FPROCESO,TIPOIDPACIENTE,NROIDPACIENTE,CODENTJM) values ('279',to_date('26/04/19','DD/MM/RR'),'9','2','20190426175011632122',to_date('26/04/19','DD/MM/RR'),'N','1','3','087580016101',null,'se solicita alimento liquido completo y balanceado con proteinas vitaminas y minerales para recuperar estado nutricional del paciente.','1','00008',to_date('15/06/19','DD/MM/RR'),'2019-06-17','CC','22265837','087580016101');
Insert into OASIS4.WEBSERV_JUNTA_PROFESIONAL (ID_JUPR,REPO_PERIODO,REPO_SERV_ID,REPO_TIRE_ID,NOPRESCRIPCION,FPRESCRIPCION,TIPOTECNOLOGIA,CONSECUTIVO,ESTJM,CODENTPROC,OBSERVACIONES,JUSTIFICACIONTECNICA,MODALIDAD,NOACTA,FECHAACTA,FPROCESO,TIPOIDPACIENTE,NROIDPACIENTE,CODENTJM) values ('280',to_date('27/04/19','DD/MM/RR'),'9','2','20190427130011645867',to_date('27/04/19','DD/MM/RR'),'M','1','2',null,null,null,null,null,to_date('01/01/70','DD/MM/RR'),null,'TI','1050839739','134300049201');
Insert into OASIS4.WEBSERV_JUNTA_PROFESIONAL (ID_JUPR,REPO_PERIODO,REPO_SERV_ID,REPO_TIRE_ID,NOPRESCRIPCION,FPRESCRIPCION,TIPOTECNOLOGIA,CONSECUTIVO,ESTJM,CODENTPROC,OBSERVACIONES,JUSTIFICACIONTECNICA,MODALIDAD,NOACTA,FECHAACTA,FPROCESO,TIPOIDPACIENTE,NROIDPACIENTE,CODENTJM) values ('281',to_date('27/04/19','DD/MM/RR'),'9','2','20190427125011643959',to_date('27/04/19','DD/MM/RR'),'N','1','2',null,null,null,null,null,to_date('01/01/70','DD/MM/RR'),null,'CC','22160163','134300290801');
Insert into OASIS4.WEBSERV_JUNTA_PROFESIONAL (ID_JUPR,REPO_PERIODO,REPO_SERV_ID,REPO_TIRE_ID,NOPRESCRIPCION,FPRESCRIPCION,TIPOTECNOLOGIA,CONSECUTIVO,ESTJM,CODENTPROC,OBSERVACIONES,JUSTIFICACIONTECNICA,MODALIDAD,NOACTA,FECHAACTA,FPROCESO,TIPOIDPACIENTE,NROIDPACIENTE,CODENTJM) values ('282',to_date('27/04/19','DD/MM/RR'),'9','2','20190427172011646764',to_date('27/04/19','DD/MM/RR'),'N','1','2',null,null,null,null,null,to_date('01/01/70','DD/MM/RR'),null,'CC','1052975559','134300290801');
Insert into OASIS4.WEBSERV_JUNTA_PROFESIONAL (ID_JUPR,REPO_PERIODO,REPO_SERV_ID,REPO_TIRE_ID,NOPRESCRIPCION,FPRESCRIPCION,TIPOTECNOLOGIA,CONSECUTIVO,ESTJM,CODENTPROC,OBSERVACIONES,JUSTIFICACIONTECNICA,MODALIDAD,NOACTA,FECHAACTA,FPROCESO,TIPOIDPACIENTE,NROIDPACIENTE,CODENTJM) values ('283',to_date('28/04/19','DD/MM/RR'),'9','2','20190428160011650750',to_date('28/04/19','DD/MM/RR'),'N','1','3','134300049201',null,'\nPACIENTE SE REALIZA ANAMNESIS ALIMENTARIA CON NULA INGESTA DE ALIMENTOS, SIN DIFICULTAD PARA DEGLUTIR,CON DEFICIENCIADEPLACA\nDENTARIA, PACIENTE CON AVERSIONES','1','048',to_date('28/04/19','DD/MM/RR'),'2019-05-02','CC','3903055','134300049201');
Insert into OASIS4.WEBSERV_JUNTA_PROFESIONAL (ID_JUPR,REPO_PERIODO,REPO_SERV_ID,REPO_TIRE_ID,NOPRESCRIPCION,FPRESCRIPCION,TIPOTECNOLOGIA,CONSECUTIVO,ESTJM,CODENTPROC,OBSERVACIONES,JUSTIFICACIONTECNICA,MODALIDAD,NOACTA,FECHAACTA,FPROCESO,TIPOIDPACIENTE,NROIDPACIENTE,CODENTJM) values ('284',to_date('29/04/19','DD/MM/RR'),'9','2','20190429128011662380',to_date('29/04/19','DD/MM/RR'),'N','1','2',null,null,null,null,null,to_date('01/01/70','DD/MM/RR'),null,'CC','26911258','080010112201');
Insert into OASIS4.WEBSERV_JUNTA_PROFESIONAL (ID_JUPR,REPO_PERIODO,REPO_SERV_ID,REPO_TIRE_ID,NOPRESCRIPCION,FPRESCRIPCION,TIPOTECNOLOGIA,CONSECUTIVO,ESTJM,CODENTPROC,OBSERVACIONES,JUSTIFICACIONTECNICA,MODALIDAD,NOACTA,FECHAACTA,FPROCESO,TIPOIDPACIENTE,NROIDPACIENTE,CODENTJM) values ('285',to_date('29/04/19','DD/MM/RR'),'9','2','20190429144011678275',to_date('29/04/19','DD/MM/RR'),'N','1','3','087580106601',null,'PACIENTE CON DELGADEZ EXTREMAY TALLA BAJA CON POBRE GANANCIA DE PESO SE ENCUENTRA CON PESO 23 KG TALLA 135 IMC 12.2 < -2 TALLA/EDAD PESO EDAD<-2','1','0000170',to_date('06/05/19','DD/MM/RR'),'2019-05-06','TI','1043129808','087580106601');
Insert into OASIS4.WEBSERV_JUNTA_PROFESIONAL (ID_JUPR,REPO_PERIODO,REPO_SERV_ID,REPO_TIRE_ID,NOPRESCRIPCION,FPRESCRIPCION,TIPOTECNOLOGIA,CONSECUTIVO,ESTJM,CODENTPROC,OBSERVACIONES,JUSTIFICACIONTECNICA,MODALIDAD,NOACTA,FECHAACTA,FPROCESO,TIPOIDPACIENTE,NROIDPACIENTE,CODENTJM) values ('286',to_date('29/04/19','DD/MM/RR'),'9','2','20190429154011662841',to_date('29/04/19','DD/MM/RR'),'S','2','2',null,null,null,null,null,to_date('01/01/70','DD/MM/RR'),null,'CC','29841082','768230220101');
Insert into OASIS4.WEBSERV_JUNTA_PROFESIONAL (ID_JUPR,REPO_PERIODO,REPO_SERV_ID,REPO_TIRE_ID,NOPRESCRIPCION,FPRESCRIPCION,TIPOTECNOLOGIA,CONSECUTIVO,ESTJM,CODENTPROC,OBSERVACIONES,JUSTIFICACIONTECNICA,MODALIDAD,NOACTA,FECHAACTA,FPROCESO,TIPOIDPACIENTE,NROIDPACIENTE,CODENTJM) values ('287',to_date('29/04/19','DD/MM/RR'),'9','2','20190429111011671841',to_date('29/04/19','DD/MM/RR'),'S','2','2',null,null,null,null,null,to_date('01/01/70','DD/MM/RR'),null,'CC','27703501','200010205401');
Insert into OASIS4.WEBSERV_JUNTA_PROFESIONAL (ID_JUPR,REPO_PERIODO,REPO_SERV_ID,REPO_TIRE_ID,NOPRESCRIPCION,FPRESCRIPCION,TIPOTECNOLOGIA,CONSECUTIVO,ESTJM,CODENTPROC,OBSERVACIONES,JUSTIFICACIONTECNICA,MODALIDAD,NOACTA,FECHAACTA,FPROCESO,TIPOIDPACIENTE,NROIDPACIENTE,CODENTJM) values ('288',to_date('29/04/19','DD/MM/RR'),'9','2','20190429111011671841',to_date('29/04/19','DD/MM/RR'),'S','3','2',null,null,null,null,null,to_date('01/01/70','DD/MM/RR'),null,'CC','27703501','200010205401');
Insert into OASIS4.WEBSERV_JUNTA_PROFESIONAL (ID_JUPR,REPO_PERIODO,REPO_SERV_ID,REPO_TIRE_ID,NOPRESCRIPCION,FPRESCRIPCION,TIPOTECNOLOGIA,CONSECUTIVO,ESTJM,CODENTPROC,OBSERVACIONES,JUSTIFICACIONTECNICA,MODALIDAD,NOACTA,FECHAACTA,FPROCESO,TIPOIDPACIENTE,NROIDPACIENTE,CODENTJM) values ('289',to_date('29/04/19','DD/MM/RR'),'9','2','20190429162011671990',to_date('29/04/19','DD/MM/RR'),'S','1','2',null,null,null,null,null,to_date('01/01/70','DD/MM/RR'),null,'CC','27703501','200010205401');
Insert into OASIS4.WEBSERV_JUNTA_PROFESIONAL (ID_JUPR,REPO_PERIODO,REPO_SERV_ID,REPO_TIRE_ID,NOPRESCRIPCION,FPRESCRIPCION,TIPOTECNOLOGIA,CONSECUTIVO,ESTJM,CODENTPROC,OBSERVACIONES,JUSTIFICACIONTECNICA,MODALIDAD,NOACTA,FECHAACTA,FPROCESO,TIPOIDPACIENTE,NROIDPACIENTE,CODENTJM) values ('290',to_date('29/04/19','DD/MM/RR'),'9','2','20190429145011672085',to_date('29/04/19','DD/MM/RR'),'S','1','2',null,null,null,null,null,to_date('01/01/70','DD/MM/RR'),null,'CC','27703501','200010205401');
Insert into OASIS4.WEBSERV_JUNTA_PROFESIONAL (ID_JUPR,REPO_PERIODO,REPO_SERV_ID,REPO_TIRE_ID,NOPRESCRIPCION,FPRESCRIPCION,TIPOTECNOLOGIA,CONSECUTIVO,ESTJM,CODENTPROC,OBSERVACIONES,JUSTIFICACIONTECNICA,MODALIDAD,NOACTA,FECHAACTA,FPROCESO,TIPOIDPACIENTE,NROIDPACIENTE,CODENTJM) values ('291',to_date('29/04/19','DD/MM/RR'),'9','2','20190429162011672172',to_date('29/04/19','DD/MM/RR'),'S','1','2',null,null,null,null,null,to_date('01/01/70','DD/MM/RR'),null,'CC','27703501','200010205401');
Insert into OASIS4.WEBSERV_JUNTA_PROFESIONAL (ID_JUPR,REPO_PERIODO,REPO_SERV_ID,REPO_TIRE_ID,NOPRESCRIPCION,FPRESCRIPCION,TIPOTECNOLOGIA,CONSECUTIVO,ESTJM,CODENTPROC,OBSERVACIONES,JUSTIFICACIONTECNICA,MODALIDAD,NOACTA,FECHAACTA,FPROCESO,TIPOIDPACIENTE,NROIDPACIENTE,CODENTJM) values ('292',to_date('30/04/19','DD/MM/RR'),'9','2','20190430198011683243',to_date('30/04/19','DD/MM/RR'),'N','1','3','087580106601',null,'PCTE CON BEJO PESO Y TALLA EN RIESGO DE DESNUTRICION MODERADA PESO 14KG TALLA 100 IMC 14 DX E440 REQUIERE SOPORTE NUTRICIONAL COMPLEMENTARIO','1','0000169',to_date('06/05/19','DD/MM/RR'),'2019-05-06','RC','1042354901','087580106601');
Insert into OASIS4.WEBSERV_JUNTA_PROFESIONAL (ID_JUPR,REPO_PERIODO,REPO_SERV_ID,REPO_TIRE_ID,NOPRESCRIPCION,FPRESCRIPCION,TIPOTECNOLOGIA,CONSECUTIVO,ESTJM,CODENTPROC,OBSERVACIONES,JUSTIFICACIONTECNICA,MODALIDAD,NOACTA,FECHAACTA,FPROCESO,TIPOIDPACIENTE,NROIDPACIENTE,CODENTJM) values ('293',to_date('30/04/19','DD/MM/RR'),'9','2','20190430161011686540',to_date('30/04/19','DD/MM/RR'),'N','1','3','087580106601',null,'PCTE CON BAJO PESO DX DUODENITIS CON DIFICULTAD INGESTA DE ALIMENTOS Y GANANCIA DE PESO DEFICIENTE HB GLICOSILADA 4.4 GLICEMIA 66.8 INSULINA 19','1','00003',to_date('05/06/19','DD/MM/RR'),'2019-06-05','TI','1043673938','087580106601');
Insert into OASIS4.WEBSERV_JUNTA_PROFESIONAL (ID_JUPR,REPO_PERIODO,REPO_SERV_ID,REPO_TIRE_ID,NOPRESCRIPCION,FPRESCRIPCION,TIPOTECNOLOGIA,CONSECUTIVO,ESTJM,CODENTPROC,OBSERVACIONES,JUSTIFICACIONTECNICA,MODALIDAD,NOACTA,FECHAACTA,FPROCESO,TIPOIDPACIENTE,NROIDPACIENTE,CODENTJM) values ('294',to_date('30/04/19','DD/MM/RR'),'9','2','20190430161011687510',to_date('30/04/19','DD/MM/RR'),'N','1','3','087580106601',null,' curvas de crecimiento en talla 142 y peso\t26 KG  PT/T<2 paciente con DUODENITIS Q DIFICULTA INGESTA DE GANANCIA Y PESO EN RIESGO DE DESNUTRICION ','1','0000180',to_date('09/05/19','DD/MM/RR'),'2019-05-09','TI','1043673938','087580106601');
Insert into OASIS4.WEBSERV_JUNTA_PROFESIONAL (ID_JUPR,REPO_PERIODO,REPO_SERV_ID,REPO_TIRE_ID,NOPRESCRIPCION,FPRESCRIPCION,TIPOTECNOLOGIA,CONSECUTIVO,ESTJM,CODENTPROC,OBSERVACIONES,JUSTIFICACIONTECNICA,MODALIDAD,NOACTA,FECHAACTA,FPROCESO,TIPOIDPACIENTE,NROIDPACIENTE,CODENTJM) values ('295',to_date('30/04/19','DD/MM/RR'),'9','2','20190430183011688391',to_date('30/04/19','DD/MM/RR'),'N','1','2',null,null,null,null,null,to_date('01/01/70','DD/MM/RR'),null,'CC','22995018','134300290801');
Insert into OASIS4.WEBSERV_JUNTA_PROFESIONAL (ID_JUPR,REPO_PERIODO,REPO_SERV_ID,REPO_TIRE_ID,NOPRESCRIPCION,FPRESCRIPCION,TIPOTECNOLOGIA,CONSECUTIVO,ESTJM,CODENTPROC,OBSERVACIONES,JUSTIFICACIONTECNICA,MODALIDAD,NOACTA,FECHAACTA,FPROCESO,TIPOIDPACIENTE,NROIDPACIENTE,CODENTJM) values ('296',to_date('30/04/19','DD/MM/RR'),'9','2','20190430133011690101',to_date('30/04/19','DD/MM/RR'),'N','1','3','082960002101',null,'DESNUTRICION PROTEICOCALORICA','1','0009',to_date('08/05/19','DD/MM/RR'),'2019-05-08','RC','1041851763','082960002101');
Insert into OASIS4.WEBSERV_JUNTA_PROFESIONAL (ID_JUPR,REPO_PERIODO,REPO_SERV_ID,REPO_TIRE_ID,NOPRESCRIPCION,FPRESCRIPCION,TIPOTECNOLOGIA,CONSECUTIVO,ESTJM,CODENTPROC,OBSERVACIONES,JUSTIFICACIONTECNICA,MODALIDAD,NOACTA,FECHAACTA,FPROCESO,TIPOIDPACIENTE,NROIDPACIENTE,CODENTJM) values ('297',to_date('30/04/19','DD/MM/RR'),'9','2','20190430145011694769',to_date('30/04/19','DD/MM/RR'),'N','1','2',null,null,null,null,null,to_date('01/01/70','DD/MM/RR'),null,'CC','9131372','134300290801');
Insert into OASIS4.WEBSERV_JUNTA_PROFESIONAL (ID_JUPR,REPO_PERIODO,REPO_SERV_ID,REPO_TIRE_ID,NOPRESCRIPCION,FPRESCRIPCION,TIPOTECNOLOGIA,CONSECUTIVO,ESTJM,CODENTPROC,OBSERVACIONES,JUSTIFICACIONTECNICA,MODALIDAD,NOACTA,FECHAACTA,FPROCESO,TIPOIDPACIENTE,NROIDPACIENTE,CODENTJM) values ('298',to_date('30/04/19','DD/MM/RR'),'9','2','20190430163011695018',to_date('30/04/19','DD/MM/RR'),'N','1','3','087580106601',null,'PACIENTE CON  PARALIS CEREBRAL CUADRIPARESIA ESPASTICA,HIDROCEFALIA  CON GASTROSTOMIA Y DESNUTRICION PROTEICO CALORICA PESO 18 KG TALLA 105 IMC 16 ','1','0000166',to_date('04/05/19','DD/MM/RR'),'2019-05-04','TI','1042260914','087580106601');
Insert into OASIS4.WEBSERV_JUNTA_PROFESIONAL (ID_JUPR,REPO_PERIODO,REPO_SERV_ID,REPO_TIRE_ID,NOPRESCRIPCION,FPRESCRIPCION,TIPOTECNOLOGIA,CONSECUTIVO,ESTJM,CODENTPROC,OBSERVACIONES,JUSTIFICACIONTECNICA,MODALIDAD,NOACTA,FECHAACTA,FPROCESO,TIPOIDPACIENTE,NROIDPACIENTE,CODENTJM) values ('299',to_date('30/04/19','DD/MM/RR'),'9','2','20190430100011696709',to_date('30/04/19','DD/MM/RR'),'N','1','3','130010178101',null,'DESNUTRICIÃ“N/PROTEICO CALORICA MODERADA, ACTUALMENTE CONSUME LOS ALIMENTOS DE ACUERDO AL MENÃš PROGRAMADO DIARIO Y LO QUE LE APETECE DE CONSISTENCIA BLANDA, ALG','1','008',to_date('30/04/19','DD/MM/RR'),'2019-05-02','CC','73077165','130010178101');
Insert into OASIS4.WEBSERV_JUNTA_PROFESIONAL (ID_JUPR,REPO_PERIODO,REPO_SERV_ID,REPO_TIRE_ID,NOPRESCRIPCION,FPRESCRIPCION,TIPOTECNOLOGIA,CONSECUTIVO,ESTJM,CODENTPROC,OBSERVACIONES,JUSTIFICACIONTECNICA,MODALIDAD,NOACTA,FECHAACTA,FPROCESO,TIPOIDPACIENTE,NROIDPACIENTE,CODENTJM) values ('300',to_date('30/04/19','DD/MM/RR'),'9','2','20190430132011701781',to_date('30/04/19','DD/MM/RR'),'N','1','3','086340010501',null,'PACIENTE DE 1 AÃ‘O 7 MESES CON PESO DE 9 KG TALLA 82  CM DIAGNOSTICO NUTRICIONAL DE RIESGO DE DESNUTRICIÃ“N CON RETARDO DE INCREMENTO QUE REQUIERE DE SOPORTE NUTR','1','15',to_date('30/04/19','DD/MM/RR'),'2019-04-30','RC','1042357769','086340010501');
Insert into OASIS4.WEBSERV_JUNTA_PROFESIONAL (ID_JUPR,REPO_PERIODO,REPO_SERV_ID,REPO_TIRE_ID,NOPRESCRIPCION,FPRESCRIPCION,TIPOTECNOLOGIA,CONSECUTIVO,ESTJM,CODENTPROC,OBSERVACIONES,JUSTIFICACIONTECNICA,MODALIDAD,NOACTA,FECHAACTA,FPROCESO,TIPOIDPACIENTE,NROIDPACIENTE,CODENTJM) values ('301',to_date('30/04/19','DD/MM/RR'),'9','2','20190430151011703755',to_date('30/04/19','DD/MM/RR'),'N','1','3','134300074601',null,'PACIENTE CON  TUMOR PONTOCEREBELOSO Y MESENCEFALICO 2. DESNUTRICION PROTEICOLORICA MODERADA 3. SINDROME DE INMOVILIDAD QUIEN REQUIERE SUPLEMENTO NUTRICIONAL','2','MG300419-1',to_date('30/04/19','DD/MM/RR'),'2019-04-30','CC','8865211','134300074601');
Insert into OASIS4.WEBSERV_JUNTA_PROFESIONAL (ID_JUPR,REPO_PERIODO,REPO_SERV_ID,REPO_TIRE_ID,NOPRESCRIPCION,FPRESCRIPCION,TIPOTECNOLOGIA,CONSECUTIVO,ESTJM,CODENTPROC,OBSERVACIONES,JUSTIFICACIONTECNICA,MODALIDAD,NOACTA,FECHAACTA,FPROCESO,TIPOIDPACIENTE,NROIDPACIENTE,CODENTJM) values ('302',to_date('30/04/19','DD/MM/RR'),'9','2','20190430110011689364',to_date('30/04/19','DD/MM/RR'),'S','1','2',null,null,null,null,null,to_date('01/01/70','DD/MM/RR'),null,'CC','22413314','700010096901');
Insert into OASIS4.WEBSERV_JUNTA_PROFESIONAL (ID_JUPR,REPO_PERIODO,REPO_SERV_ID,REPO_TIRE_ID,NOPRESCRIPCION,FPRESCRIPCION,TIPOTECNOLOGIA,CONSECUTIVO,ESTJM,CODENTPROC,OBSERVACIONES,JUSTIFICACIONTECNICA,MODALIDAD,NOACTA,FECHAACTA,FPROCESO,TIPOIDPACIENTE,NROIDPACIENTE,CODENTJM) values ('303',to_date('30/04/19','DD/MM/RR'),'9','2','20190430184011696952',to_date('30/04/19','DD/MM/RR'),'S','1','2',null,null,null,null,null,to_date('01/01/70','DD/MM/RR'),null,'CC','23237341','130010178101');
Insert into OASIS4.WEBSERV_JUNTA_PROFESIONAL (ID_JUPR,REPO_PERIODO,REPO_SERV_ID,REPO_TIRE_ID,NOPRESCRIPCION,FPRESCRIPCION,TIPOTECNOLOGIA,CONSECUTIVO,ESTJM,CODENTPROC,OBSERVACIONES,JUSTIFICACIONTECNICA,MODALIDAD,NOACTA,FECHAACTA,FPROCESO,TIPOIDPACIENTE,NROIDPACIENTE,CODENTJM) values ('304',to_date('01/05/19','DD/MM/RR'),'9','2','20190501127011711754',to_date('01/05/19','DD/MM/RR'),'N','1','2',null,null,null,null,null,to_date('01/01/70','DD/MM/RR'),null,'CC','1776058','087580016101');
Insert into OASIS4.WEBSERV_JUNTA_PROFESIONAL (ID_JUPR,REPO_PERIODO,REPO_SERV_ID,REPO_TIRE_ID,NOPRESCRIPCION,FPRESCRIPCION,TIPOTECNOLOGIA,CONSECUTIVO,ESTJM,CODENTPROC,OBSERVACIONES,JUSTIFICACIONTECNICA,MODALIDAD,NOACTA,FECHAACTA,FPROCESO,TIPOIDPACIENTE,NROIDPACIENTE,CODENTJM) values ('305',to_date('01/05/19','DD/MM/RR'),'9','2','20190501122011711115',to_date('01/05/19','DD/MM/RR'),'S','1','2',null,null,null,null,null,to_date('01/01/70','DD/MM/RR'),null,'TI','1043141962','084330205401');
Insert into OASIS4.WEBSERV_JUNTA_PROFESIONAL (ID_JUPR,REPO_PERIODO,REPO_SERV_ID,REPO_TIRE_ID,NOPRESCRIPCION,FPRESCRIPCION,TIPOTECNOLOGIA,CONSECUTIVO,ESTJM,CODENTPROC,OBSERVACIONES,JUSTIFICACIONTECNICA,MODALIDAD,NOACTA,FECHAACTA,FPROCESO,TIPOIDPACIENTE,NROIDPACIENTE,CODENTJM) values ('306',to_date('01/05/19','DD/MM/RR'),'9','2','20190501116011711345',to_date('01/05/19','DD/MM/RR'),'S','1','2',null,null,null,null,null,to_date('01/01/70','DD/MM/RR'),null,'RC','1140904733','084330205401');
Insert into OASIS4.WEBSERV_JUNTA_PROFESIONAL (ID_JUPR,REPO_PERIODO,REPO_SERV_ID,REPO_TIRE_ID,NOPRESCRIPCION,FPRESCRIPCION,TIPOTECNOLOGIA,CONSECUTIVO,ESTJM,CODENTPROC,OBSERVACIONES,JUSTIFICACIONTECNICA,MODALIDAD,NOACTA,FECHAACTA,FPROCESO,TIPOIDPACIENTE,NROIDPACIENTE,CODENTJM) values ('307',to_date('02/05/19','DD/MM/RR'),'9','2','20190502184011727127',to_date('02/05/19','DD/MM/RR'),'M','1','3','660010078501',null,'*PB:CACABEZ&CUELL_OTROS\n*NO-INVIMA \n*49AÃ‘_ADENOCAESTÃ“MAGO_EC:IV(CARCINOMATOSIS2019)_TTO:PALIATIVO_DCF:CISPLAT+PACLIT+5FU(SS:1CICLO/3)\n*UNIRS:CAGÃ?STRICO','1','439',to_date('04/05/19','DD/MM/RR'),'2019-05-04','CC','38901733','660010078501');
Insert into OASIS4.WEBSERV_JUNTA_PROFESIONAL (ID_JUPR,REPO_PERIODO,REPO_SERV_ID,REPO_TIRE_ID,NOPRESCRIPCION,FPRESCRIPCION,TIPOTECNOLOGIA,CONSECUTIVO,ESTJM,CODENTPROC,OBSERVACIONES,JUSTIFICACIONTECNICA,MODALIDAD,NOACTA,FECHAACTA,FPROCESO,TIPOIDPACIENTE,NROIDPACIENTE,CODENTJM) values ('308',to_date('02/05/19','DD/MM/RR'),'9','2','20190502140011713988',to_date('02/05/19','DD/MM/RR'),'N','1','3','082960002101',null,'RETARDO EN EL DESARROLLO POR DESNUTRICION PROTEICOCALORICA','1','0013',to_date('08/05/19','DD/MM/RR'),'2019-05-08','RC','1047239128','082960002101');
Insert into OASIS4.WEBSERV_JUNTA_PROFESIONAL (ID_JUPR,REPO_PERIODO,REPO_SERV_ID,REPO_TIRE_ID,NOPRESCRIPCION,FPRESCRIPCION,TIPOTECNOLOGIA,CONSECUTIVO,ESTJM,CODENTPROC,OBSERVACIONES,JUSTIFICACIONTECNICA,MODALIDAD,NOACTA,FECHAACTA,FPROCESO,TIPOIDPACIENTE,NROIDPACIENTE,CODENTJM) values ('309',to_date('02/05/19','DD/MM/RR'),'9','2','20190502131011716290',to_date('02/05/19','DD/MM/RR'),'N','1','2',null,null,null,null,null,to_date('01/01/70','DD/MM/RR'),null,'TI','1114150682','ESS076');
Insert into OASIS4.WEBSERV_JUNTA_PROFESIONAL (ID_JUPR,REPO_PERIODO,REPO_SERV_ID,REPO_TIRE_ID,NOPRESCRIPCION,FPRESCRIPCION,TIPOTECNOLOGIA,CONSECUTIVO,ESTJM,CODENTPROC,OBSERVACIONES,JUSTIFICACIONTECNICA,MODALIDAD,NOACTA,FECHAACTA,FPROCESO,TIPOIDPACIENTE,NROIDPACIENTE,CODENTJM) values ('310',to_date('02/05/19','DD/MM/RR'),'9','2','20190502186011716470',to_date('02/05/19','DD/MM/RR'),'N','1','2',null,null,null,null,null,to_date('01/01/70','DD/MM/RR'),null,'TI','1114150682','ESS076');
Insert into OASIS4.WEBSERV_JUNTA_PROFESIONAL (ID_JUPR,REPO_PERIODO,REPO_SERV_ID,REPO_TIRE_ID,NOPRESCRIPCION,FPRESCRIPCION,TIPOTECNOLOGIA,CONSECUTIVO,ESTJM,CODENTPROC,OBSERVACIONES,JUSTIFICACIONTECNICA,MODALIDAD,NOACTA,FECHAACTA,FPROCESO,TIPOIDPACIENTE,NROIDPACIENTE,CODENTJM) values ('311',to_date('02/05/19','DD/MM/RR'),'9','2','20190502130011724911',to_date('02/05/19','DD/MM/RR'),'N','1','3','080010003716',null,'PACIENTE  CON DX DE CANCER DE COLON METASTASICO EN MANEJO PALIATIVO CURSA CON DESNUTRICION PROTEICOCALORICA SEVERA Y IMC 13.8, PROCESO DEPLETORIO CAQUEXICO.','1','40',to_date('04/05/19','DD/MM/RR'),'2019-05-04','CE','302008','080010003716');
Insert into OASIS4.WEBSERV_JUNTA_PROFESIONAL (ID_JUPR,REPO_PERIODO,REPO_SERV_ID,REPO_TIRE_ID,NOPRESCRIPCION,FPRESCRIPCION,TIPOTECNOLOGIA,CONSECUTIVO,ESTJM,CODENTPROC,OBSERVACIONES,JUSTIFICACIONTECNICA,MODALIDAD,NOACTA,FECHAACTA,FPROCESO,TIPOIDPACIENTE,NROIDPACIENTE,CODENTJM) values ('312',to_date('02/05/19','DD/MM/RR'),'9','2','20190502142011729031',to_date('02/05/19','DD/MM/RR'),'N','1','2',null,null,null,null,null,to_date('01/01/70','DD/MM/RR'),null,'RC','1073824913','087580016101');
Insert into OASIS4.WEBSERV_JUNTA_PROFESIONAL (ID_JUPR,REPO_PERIODO,REPO_SERV_ID,REPO_TIRE_ID,NOPRESCRIPCION,FPRESCRIPCION,TIPOTECNOLOGIA,CONSECUTIVO,ESTJM,CODENTPROC,OBSERVACIONES,JUSTIFICACIONTECNICA,MODALIDAD,NOACTA,FECHAACTA,FPROCESO,TIPOIDPACIENTE,NROIDPACIENTE,CODENTJM) values ('313',to_date('02/05/19','DD/MM/RR'),'9','2','20190502187011729171',to_date('02/05/19','DD/MM/RR'),'N','1','2',null,null,null,null,null,to_date('01/01/70','DD/MM/RR'),null,'TI','1073819636','087580016101');
Insert into OASIS4.WEBSERV_JUNTA_PROFESIONAL (ID_JUPR,REPO_PERIODO,REPO_SERV_ID,REPO_TIRE_ID,NOPRESCRIPCION,FPRESCRIPCION,TIPOTECNOLOGIA,CONSECUTIVO,ESTJM,CODENTPROC,OBSERVACIONES,JUSTIFICACIONTECNICA,MODALIDAD,NOACTA,FECHAACTA,FPROCESO,TIPOIDPACIENTE,NROIDPACIENTE,CODENTJM) values ('314',to_date('02/05/19','DD/MM/RR'),'9','2','20190502159011729438',to_date('02/05/19','DD/MM/RR'),'N','1','2',null,null,null,null,null,to_date('01/01/70','DD/MM/RR'),null,'TI','1073821899','087580016101');
Insert into OASIS4.WEBSERV_JUNTA_PROFESIONAL (ID_JUPR,REPO_PERIODO,REPO_SERV_ID,REPO_TIRE_ID,NOPRESCRIPCION,FPRESCRIPCION,TIPOTECNOLOGIA,CONSECUTIVO,ESTJM,CODENTPROC,OBSERVACIONES,JUSTIFICACIONTECNICA,MODALIDAD,NOACTA,FECHAACTA,FPROCESO,TIPOIDPACIENTE,NROIDPACIENTE,CODENTJM) values ('315',to_date('02/05/19','DD/MM/RR'),'9','2','20190502111011732229',to_date('02/05/19','DD/MM/RR'),'N','1','2',null,null,null,null,null,to_date('01/01/70','DD/MM/RR'),null,'RC','1043187898','087580016101');
Insert into OASIS4.WEBSERV_JUNTA_PROFESIONAL (ID_JUPR,REPO_PERIODO,REPO_SERV_ID,REPO_TIRE_ID,NOPRESCRIPCION,FPRESCRIPCION,TIPOTECNOLOGIA,CONSECUTIVO,ESTJM,CODENTPROC,OBSERVACIONES,JUSTIFICACIONTECNICA,MODALIDAD,NOACTA,FECHAACTA,FPROCESO,TIPOIDPACIENTE,NROIDPACIENTE,CODENTJM) values ('316',to_date('02/05/19','DD/MM/RR'),'9','2','20190502186011736649',to_date('02/05/19','DD/MM/RR'),'N','1','3','087580016101',null,'se solicita alimento liquido completo y balanceado con proteinas vitaminas y minerales para niÃ±os para recuperar estado nutricional del paciente.','1','00004',to_date('15/06/19','DD/MM/RR'),'2019-06-15','TI','1044625182','087580016101');
Insert into OASIS4.WEBSERV_JUNTA_PROFESIONAL (ID_JUPR,REPO_PERIODO,REPO_SERV_ID,REPO_TIRE_ID,NOPRESCRIPCION,FPRESCRIPCION,TIPOTECNOLOGIA,CONSECUTIVO,ESTJM,CODENTPROC,OBSERVACIONES,JUSTIFICACIONTECNICA,MODALIDAD,NOACTA,FECHAACTA,FPROCESO,TIPOIDPACIENTE,NROIDPACIENTE,CODENTJM) values ('317',to_date('03/05/19','DD/MM/RR'),'9','2','20190503146011742752',to_date('03/05/19','DD/MM/RR'),'M','1','2',null,null,null,null,null,to_date('01/01/70','DD/MM/RR'),null,'CC','7574311','200010043101');
Insert into OASIS4.WEBSERV_JUNTA_PROFESIONAL (ID_JUPR,REPO_PERIODO,REPO_SERV_ID,REPO_TIRE_ID,NOPRESCRIPCION,FPRESCRIPCION,TIPOTECNOLOGIA,CONSECUTIVO,ESTJM,CODENTPROC,OBSERVACIONES,JUSTIFICACIONTECNICA,MODALIDAD,NOACTA,FECHAACTA,FPROCESO,TIPOIDPACIENTE,NROIDPACIENTE,CODENTJM) values ('318',to_date('03/05/19','DD/MM/RR'),'9','2','20190503186011749939',to_date('03/05/19','DD/MM/RR'),'N','1','2',null,null,null,null,null,to_date('01/01/70','DD/MM/RR'),null,'CC','14630011','768230220101');
Insert into OASIS4.WEBSERV_JUNTA_PROFESIONAL (ID_JUPR,REPO_PERIODO,REPO_SERV_ID,REPO_TIRE_ID,NOPRESCRIPCION,FPRESCRIPCION,TIPOTECNOLOGIA,CONSECUTIVO,ESTJM,CODENTPROC,OBSERVACIONES,JUSTIFICACIONTECNICA,MODALIDAD,NOACTA,FECHAACTA,FPROCESO,TIPOIDPACIENTE,NROIDPACIENTE,CODENTJM) values ('319',to_date('03/05/19','DD/MM/RR'),'9','2','20190503181011751372',to_date('03/05/19','DD/MM/RR'),'N','1','3','134300049201',null,'PACIENTE CON CA DE LARINGE, Y NEUMONIA BASAL DERECHA, HEMODINAMICAMENTE ESTABLE,CON ADECUADA EVOLUCION CLINICA, SIN\nDIFICULTAD RESPIRATORIA, SIRS MODULADO','1','054',to_date('20/05/19','DD/MM/RR'),'2019-05-20','CC','22994135','134300049201');
Insert into OASIS4.WEBSERV_JUNTA_PROFESIONAL (ID_JUPR,REPO_PERIODO,REPO_SERV_ID,REPO_TIRE_ID,NOPRESCRIPCION,FPRESCRIPCION,TIPOTECNOLOGIA,CONSECUTIVO,ESTJM,CODENTPROC,OBSERVACIONES,JUSTIFICACIONTECNICA,MODALIDAD,NOACTA,FECHAACTA,FPROCESO,TIPOIDPACIENTE,NROIDPACIENTE,CODENTJM) values ('320',to_date('03/05/19','DD/MM/RR'),'9','2','20190503186011752347',to_date('03/05/19','DD/MM/RR'),'N','1','3','134300049201',null,'PACIENTECONNEUMONIATRATADAASOCIADOAFALLACARDIACACOMPENSADA,RESOLUCIONDEEDEMAPULMONAR','1','055',to_date('21/05/19','DD/MM/RR'),'2019-05-21','CC','22925676','134300049201');
Insert into OASIS4.WEBSERV_JUNTA_PROFESIONAL (ID_JUPR,REPO_PERIODO,REPO_SERV_ID,REPO_TIRE_ID,NOPRESCRIPCION,FPRESCRIPCION,TIPOTECNOLOGIA,CONSECUTIVO,ESTJM,CODENTPROC,OBSERVACIONES,JUSTIFICACIONTECNICA,MODALIDAD,NOACTA,FECHAACTA,FPROCESO,TIPOIDPACIENTE,NROIDPACIENTE,CODENTJM) values ('321',to_date('03/05/19','DD/MM/RR'),'9','2','20190503140011758485',to_date('03/05/19','DD/MM/RR'),'N','1','3','761470851601',null,'quien requiere complementar su ALIMENTACIÃ“N con NUTRICIÃ“N enteral con el fin de brindar una nutriciÃ³n completa y balanceada','1','MP0072',to_date('03/05/19','DD/MM/RR'),'2019-05-08','RC','1112632193','761470851601');
Insert into OASIS4.WEBSERV_JUNTA_PROFESIONAL (ID_JUPR,REPO_PERIODO,REPO_SERV_ID,REPO_TIRE_ID,NOPRESCRIPCION,FPRESCRIPCION,TIPOTECNOLOGIA,CONSECUTIVO,ESTJM,CODENTPROC,OBSERVACIONES,JUSTIFICACIONTECNICA,MODALIDAD,NOACTA,FECHAACTA,FPROCESO,TIPOIDPACIENTE,NROIDPACIENTE,CODENTJM) values ('322',to_date('03/05/19','DD/MM/RR'),'9','2','20190503173011758813',to_date('03/05/19','DD/MM/RR'),'N','1','3','080010445401',null,'PACIENTE FEMENINA DE 78 AÃ‘OS CON DX MEDICO Alzaimer, INCONTINENCIA urinaria y fecaL, hiporexia. PERDIDA PROGRESIVA DE PESO. REQUIERE SUPLEMENTO. \n','1','183',to_date('13/06/19','DD/MM/RR'),'2019-06-13','CC','22886105','080010445401');
Insert into OASIS4.WEBSERV_JUNTA_PROFESIONAL (ID_JUPR,REPO_PERIODO,REPO_SERV_ID,REPO_TIRE_ID,NOPRESCRIPCION,FPRESCRIPCION,TIPOTECNOLOGIA,CONSECUTIVO,ESTJM,CODENTPROC,OBSERVACIONES,JUSTIFICACIONTECNICA,MODALIDAD,NOACTA,FECHAACTA,FPROCESO,TIPOIDPACIENTE,NROIDPACIENTE,CODENTJM) values ('323',to_date('03/05/19','DD/MM/RR'),'9','2','20190503194011761716',to_date('03/05/19','DD/MM/RR'),'N','1','3','080010027801',null,'PORTADORA DE GASTROSTOMÃ?A POR ECV CON FALLA RENAL POR LO QUE REQUIERE SOPORTE NUTRICIONAL CON FORMULA DE FACIL DIGESTIÃ“N CAPAZ DE SUPLIR SU REQUERIMIENTO BASAL','1','030/12',to_date('18/12/19','DD/MM/RR'),'2019-12-18','CC','22981168','080010027801');
Insert into OASIS4.WEBSERV_JUNTA_PROFESIONAL (ID_JUPR,REPO_PERIODO,REPO_SERV_ID,REPO_TIRE_ID,NOPRESCRIPCION,FPRESCRIPCION,TIPOTECNOLOGIA,CONSECUTIVO,ESTJM,CODENTPROC,OBSERVACIONES,JUSTIFICACIONTECNICA,MODALIDAD,NOACTA,FECHAACTA,FPROCESO,TIPOIDPACIENTE,NROIDPACIENTE,CODENTJM) values ('324',to_date('03/05/19','DD/MM/RR'),'9','2','20190503191011751342',to_date('03/05/19','DD/MM/RR'),'S','1','2',null,null,null,null,null,to_date('01/01/70','DD/MM/RR'),null,'CC','2586297','ESS076');
Insert into OASIS4.WEBSERV_JUNTA_PROFESIONAL (ID_JUPR,REPO_PERIODO,REPO_SERV_ID,REPO_TIRE_ID,NOPRESCRIPCION,FPRESCRIPCION,TIPOTECNOLOGIA,CONSECUTIVO,ESTJM,CODENTPROC,OBSERVACIONES,JUSTIFICACIONTECNICA,MODALIDAD,NOACTA,FECHAACTA,FPROCESO,TIPOIDPACIENTE,NROIDPACIENTE,CODENTJM) values ('325',to_date('04/05/19','DD/MM/RR'),'9','2','20190504192011765319',to_date('04/05/19','DD/MM/RR'),'N','1','3','087580106601',null,'PACTE CON DESNUTRICION PROTEICO CALORICA LEVE EN RIESGO DESN AGUDA Y TALLA BAJA PARA LA EDAD PESO 11KG  TALLA 90 CMS  IMC 13.5','1','0000167',to_date('04/05/19','DD/MM/RR'),'2019-05-04','RC','1140898253','087580106601');
Insert into OASIS4.WEBSERV_JUNTA_PROFESIONAL (ID_JUPR,REPO_PERIODO,REPO_SERV_ID,REPO_TIRE_ID,NOPRESCRIPCION,FPRESCRIPCION,TIPOTECNOLOGIA,CONSECUTIVO,ESTJM,CODENTPROC,OBSERVACIONES,JUSTIFICACIONTECNICA,MODALIDAD,NOACTA,FECHAACTA,FPROCESO,TIPOIDPACIENTE,NROIDPACIENTE,CODENTJM) values ('326',to_date('04/05/19','DD/MM/RR'),'9','2','20190504188011765338',to_date('04/05/19','DD/MM/RR'),'N','1','3','134300290801',null,'pcte con desnutricon se ordena alimentacion complementaria especial hipercalorica ','1','25',to_date('20/06/19','DD/MM/RR'),'2019-06-20','TI','1052944625','134300290801');
Insert into OASIS4.WEBSERV_JUNTA_PROFESIONAL (ID_JUPR,REPO_PERIODO,REPO_SERV_ID,REPO_TIRE_ID,NOPRESCRIPCION,FPRESCRIPCION,TIPOTECNOLOGIA,CONSECUTIVO,ESTJM,CODENTPROC,OBSERVACIONES,JUSTIFICACIONTECNICA,MODALIDAD,NOACTA,FECHAACTA,FPROCESO,TIPOIDPACIENTE,NROIDPACIENTE,CODENTJM) values ('327',to_date('04/05/19','DD/MM/RR'),'9','2','20190504165011766314',to_date('04/05/19','DD/MM/RR'),'N','1','3','080010445401',null,'PACIENTE FEMENINO DE 88 AÃ‘OS CON DX NUTRICIONAL DE DESNUTRICIÃ“N severa, dificultar para DEGLUCIÃ“N, artrosis DEGENERATIVA. REQUIERE SUPLEMENTO.  \n','1','176',to_date('13/06/19','DD/MM/RR'),'2019-06-13','CC','22940419','080010445401');
Insert into OASIS4.WEBSERV_JUNTA_PROFESIONAL (ID_JUPR,REPO_PERIODO,REPO_SERV_ID,REPO_TIRE_ID,NOPRESCRIPCION,FPRESCRIPCION,TIPOTECNOLOGIA,CONSECUTIVO,ESTJM,CODENTPROC,OBSERVACIONES,JUSTIFICACIONTECNICA,MODALIDAD,NOACTA,FECHAACTA,FPROCESO,TIPOIDPACIENTE,NROIDPACIENTE,CODENTJM) values ('328',to_date('04/05/19','DD/MM/RR'),'9','2','20190504184011766505',to_date('04/05/19','DD/MM/RR'),'N','1','2',null,null,null,null,null,to_date('01/01/70','DD/MM/RR'),null,'CC','33201997','134300290801');
Insert into OASIS4.WEBSERV_JUNTA_PROFESIONAL (ID_JUPR,REPO_PERIODO,REPO_SERV_ID,REPO_TIRE_ID,NOPRESCRIPCION,FPRESCRIPCION,TIPOTECNOLOGIA,CONSECUTIVO,ESTJM,CODENTPROC,OBSERVACIONES,JUSTIFICACIONTECNICA,MODALIDAD,NOACTA,FECHAACTA,FPROCESO,TIPOIDPACIENTE,NROIDPACIENTE,CODENTJM) values ('329',to_date('04/05/19','DD/MM/RR'),'9','2','20190504191011767192',to_date('04/05/19','DD/MM/RR'),'N','1','3','134300290801',null,'enfermedad cardioVASCULAR, no especifica, requerimiento de SUPLEMENTOS alimentarios  ','1','08',to_date('04/06/19','DD/MM/RR'),'2019-06-04','TI','1050722043','134300290801');
Insert into OASIS4.WEBSERV_JUNTA_PROFESIONAL (ID_JUPR,REPO_PERIODO,REPO_SERV_ID,REPO_TIRE_ID,NOPRESCRIPCION,FPRESCRIPCION,TIPOTECNOLOGIA,CONSECUTIVO,ESTJM,CODENTPROC,OBSERVACIONES,JUSTIFICACIONTECNICA,MODALIDAD,NOACTA,FECHAACTA,FPROCESO,TIPOIDPACIENTE,NROIDPACIENTE,CODENTJM) values ('330',to_date('04/05/19','DD/MM/RR'),'9','2','20190504130011767998',to_date('04/05/19','DD/MM/RR'),'N','1','2',null,null,null,null,null,to_date('01/01/70','DD/MM/RR'),null,'TI','1047045188','134300290801');
Insert into OASIS4.WEBSERV_JUNTA_PROFESIONAL (ID_JUPR,REPO_PERIODO,REPO_SERV_ID,REPO_TIRE_ID,NOPRESCRIPCION,FPRESCRIPCION,TIPOTECNOLOGIA,CONSECUTIVO,ESTJM,CODENTPROC,OBSERVACIONES,JUSTIFICACIONTECNICA,MODALIDAD,NOACTA,FECHAACTA,FPROCESO,TIPOIDPACIENTE,NROIDPACIENTE,CODENTJM) values ('331',to_date('06/05/19','DD/MM/RR'),'9','2','20190506187011792469',to_date('06/05/19','DD/MM/RR'),'M','1','2',null,null,null,null,null,to_date('01/01/70','DD/MM/RR'),null,'CC','36570661','080010133501');
Insert into OASIS4.WEBSERV_JUNTA_PROFESIONAL (ID_JUPR,REPO_PERIODO,REPO_SERV_ID,REPO_TIRE_ID,NOPRESCRIPCION,FPRESCRIPCION,TIPOTECNOLOGIA,CONSECUTIVO,ESTJM,CODENTPROC,OBSERVACIONES,JUSTIFICACIONTECNICA,MODALIDAD,NOACTA,FECHAACTA,FPROCESO,TIPOIDPACIENTE,NROIDPACIENTE,CODENTJM) values ('332',to_date('06/05/19','DD/MM/RR'),'9','2','20190506147011792448',to_date('06/05/19','DD/MM/RR'),'N','1','2',null,null,null,null,null,to_date('01/01/70','DD/MM/RR'),null,'RC','1043184248','087580016101');
Insert into OASIS4.WEBSERV_JUNTA_PROFESIONAL (ID_JUPR,REPO_PERIODO,REPO_SERV_ID,REPO_TIRE_ID,NOPRESCRIPCION,FPRESCRIPCION,TIPOTECNOLOGIA,CONSECUTIVO,ESTJM,CODENTPROC,OBSERVACIONES,JUSTIFICACIONTECNICA,MODALIDAD,NOACTA,FECHAACTA,FPROCESO,TIPOIDPACIENTE,NROIDPACIENTE,CODENTJM) values ('333',to_date('06/05/19','DD/MM/RR'),'9','2','20190506173011793468',to_date('06/05/19','DD/MM/RR'),'N','1','2',null,null,null,null,null,to_date('01/01/70','DD/MM/RR'),null,'CC','1776058','087580016101');
Insert into OASIS4.WEBSERV_JUNTA_PROFESIONAL (ID_JUPR,REPO_PERIODO,REPO_SERV_ID,REPO_TIRE_ID,NOPRESCRIPCION,FPRESCRIPCION,TIPOTECNOLOGIA,CONSECUTIVO,ESTJM,CODENTPROC,OBSERVACIONES,JUSTIFICACIONTECNICA,MODALIDAD,NOACTA,FECHAACTA,FPROCESO,TIPOIDPACIENTE,NROIDPACIENTE,CODENTJM) values ('334',to_date('06/05/19','DD/MM/RR'),'9','2','20190506114011784597',to_date('06/05/19','DD/MM/RR'),'S','1','2',null,null,null,null,null,to_date('01/01/70','DD/MM/RR'),null,'TI','1114398423','ESS076');
Insert into OASIS4.WEBSERV_JUNTA_PROFESIONAL (ID_JUPR,REPO_PERIODO,REPO_SERV_ID,REPO_TIRE_ID,NOPRESCRIPCION,FPRESCRIPCION,TIPOTECNOLOGIA,CONSECUTIVO,ESTJM,CODENTPROC,OBSERVACIONES,JUSTIFICACIONTECNICA,MODALIDAD,NOACTA,FECHAACTA,FPROCESO,TIPOIDPACIENTE,NROIDPACIENTE,CODENTJM) values ('335',to_date('07/05/19','DD/MM/RR'),'9','2','20190507114011814781',to_date('07/05/19','DD/MM/RR'),'N','1','2',null,null,null,null,null,to_date('01/01/70','DD/MM/RR'),null,'CC','1118236233','ESS076');
Insert into OASIS4.WEBSERV_JUNTA_PROFESIONAL (ID_JUPR,REPO_PERIODO,REPO_SERV_ID,REPO_TIRE_ID,NOPRESCRIPCION,FPRESCRIPCION,TIPOTECNOLOGIA,CONSECUTIVO,ESTJM,CODENTPROC,OBSERVACIONES,JUSTIFICACIONTECNICA,MODALIDAD,NOACTA,FECHAACTA,FPROCESO,TIPOIDPACIENTE,NROIDPACIENTE,CODENTJM) values ('336',to_date('07/05/19','DD/MM/RR'),'9','2','20190507129011815033',to_date('07/05/19','DD/MM/RR'),'N','1','3','761470851601',null,'quien requiere complementar su NUTRICIÃ“N, con alimento para propÃ³sitos mÃ©dicos especiales en pacientes con enfermedad pulmonar crÃ³nica','1','MP0074',to_date('07/05/19','DD/MM/RR'),'2019-05-08','CC','14455254','761470851601');
Insert into OASIS4.WEBSERV_JUNTA_PROFESIONAL (ID_JUPR,REPO_PERIODO,REPO_SERV_ID,REPO_TIRE_ID,NOPRESCRIPCION,FPRESCRIPCION,TIPOTECNOLOGIA,CONSECUTIVO,ESTJM,CODENTPROC,OBSERVACIONES,JUSTIFICACIONTECNICA,MODALIDAD,NOACTA,FECHAACTA,FPROCESO,TIPOIDPACIENTE,NROIDPACIENTE,CODENTJM) values ('337',to_date('07/05/19','DD/MM/RR'),'9','2','20190507132011817865',to_date('07/05/19','DD/MM/RR'),'N','1','3','134300049201',null,'PACIENTE DE 84 AÃ‘OS DE EDAD CON DX:\nECV ISQUEMICO INICIA \nNUTRICION CON GLUCERNA 1,0KCAL, CON ADECUADA TOLERANCIA, PESO SUBJETIVO 65 KGR, TALLA: 160 CM IMC; 25,','1','057',to_date('27/05/19','DD/MM/RR'),'2019-05-27','CC','21989157','134300049201');
Insert into OASIS4.WEBSERV_JUNTA_PROFESIONAL (ID_JUPR,REPO_PERIODO,REPO_SERV_ID,REPO_TIRE_ID,NOPRESCRIPCION,FPRESCRIPCION,TIPOTECNOLOGIA,CONSECUTIVO,ESTJM,CODENTPROC,OBSERVACIONES,JUSTIFICACIONTECNICA,MODALIDAD,NOACTA,FECHAACTA,FPROCESO,TIPOIDPACIENTE,NROIDPACIENTE,CODENTJM) values ('338',to_date('07/05/19','DD/MM/RR'),'9','2','20190507132011819785',to_date('07/05/19','DD/MM/RR'),'N','1','2',null,null,null,null,null,to_date('01/01/70','DD/MM/RR'),null,'TI','1007605453','ESS076');
Insert into OASIS4.WEBSERV_JUNTA_PROFESIONAL (ID_JUPR,REPO_PERIODO,REPO_SERV_ID,REPO_TIRE_ID,NOPRESCRIPCION,FPRESCRIPCION,TIPOTECNOLOGIA,CONSECUTIVO,ESTJM,CODENTPROC,OBSERVACIONES,JUSTIFICACIONTECNICA,MODALIDAD,NOACTA,FECHAACTA,FPROCESO,TIPOIDPACIENTE,NROIDPACIENTE,CODENTJM) values ('339',to_date('08/05/19','DD/MM/RR'),'9','2','20190508148011849236',to_date('08/05/19','DD/MM/RR'),'N','1','2',null,null,null,null,null,to_date('01/01/70','DD/MM/RR'),null,'RC','1043181150','087580016101');
Insert into OASIS4.WEBSERV_JUNTA_PROFESIONAL (ID_JUPR,REPO_PERIODO,REPO_SERV_ID,REPO_TIRE_ID,NOPRESCRIPCION,FPRESCRIPCION,TIPOTECNOLOGIA,CONSECUTIVO,ESTJM,CODENTPROC,OBSERVACIONES,JUSTIFICACIONTECNICA,MODALIDAD,NOACTA,FECHAACTA,FPROCESO,TIPOIDPACIENTE,NROIDPACIENTE,CODENTJM) values ('340',to_date('08/05/19','DD/MM/RR'),'9','2','20190508161011833609',to_date('08/05/19','DD/MM/RR'),'S','1','2',null,null,null,null,null,to_date('01/01/70','DD/MM/RR'),null,'CC','32617036','ESS076');
Insert into OASIS4.WEBSERV_JUNTA_PROFESIONAL (ID_JUPR,REPO_PERIODO,REPO_SERV_ID,REPO_TIRE_ID,NOPRESCRIPCION,FPRESCRIPCION,TIPOTECNOLOGIA,CONSECUTIVO,ESTJM,CODENTPROC,OBSERVACIONES,JUSTIFICACIONTECNICA,MODALIDAD,NOACTA,FECHAACTA,FPROCESO,TIPOIDPACIENTE,NROIDPACIENTE,CODENTJM) values ('341',to_date('08/05/19','DD/MM/RR'),'9','2','20190508143011853174',to_date('08/05/19','DD/MM/RR'),'S','1','2',null,null,null,null,null,to_date('01/01/70','DD/MM/RR'),null,'CC','25180194','ESS076');
Insert into OASIS4.WEBSERV_JUNTA_PROFESIONAL (ID_JUPR,REPO_PERIODO,REPO_SERV_ID,REPO_TIRE_ID,NOPRESCRIPCION,FPRESCRIPCION,TIPOTECNOLOGIA,CONSECUTIVO,ESTJM,CODENTPROC,OBSERVACIONES,JUSTIFICACIONTECNICA,MODALIDAD,NOACTA,FECHAACTA,FPROCESO,TIPOIDPACIENTE,NROIDPACIENTE,CODENTJM) values ('342',to_date('09/05/19','DD/MM/RR'),'9','2','20190509178011866767',to_date('09/05/19','DD/MM/RR'),'M','1','3','130010202201',null,'PACIENTE CON INDICE DE OXIGENACION MAYOR DE 25 Y POR ECOCARDIO CONFIRMACION DE HIPERTENSION PULMONAR PRIMARIA.','1','7802',to_date('09/05/19','DD/MM/RR'),'2019-05-09','RC','1062542698','130010202201');
Insert into OASIS4.WEBSERV_JUNTA_PROFESIONAL (ID_JUPR,REPO_PERIODO,REPO_SERV_ID,REPO_TIRE_ID,NOPRESCRIPCION,FPRESCRIPCION,TIPOTECNOLOGIA,CONSECUTIVO,ESTJM,CODENTPROC,OBSERVACIONES,JUSTIFICACIONTECNICA,MODALIDAD,NOACTA,FECHAACTA,FPROCESO,TIPOIDPACIENTE,NROIDPACIENTE,CODENTJM) values ('343',to_date('09/05/19','DD/MM/RR'),'9','2','20190509146011883503',to_date('09/05/19','DD/MM/RR'),'M','1','3','761470851601',null,'OPTIMIZACION DE TRATAMIENTO Y MEJORAR SU CALIDAD DE VIDA','1','MP0076',to_date('09/05/19','DD/MM/RR'),'2019-05-14','TI','1006334675','761470851601');
Insert into OASIS4.WEBSERV_JUNTA_PROFESIONAL (ID_JUPR,REPO_PERIODO,REPO_SERV_ID,REPO_TIRE_ID,NOPRESCRIPCION,FPRESCRIPCION,TIPOTECNOLOGIA,CONSECUTIVO,ESTJM,CODENTPROC,OBSERVACIONES,JUSTIFICACIONTECNICA,MODALIDAD,NOACTA,FECHAACTA,FPROCESO,TIPOIDPACIENTE,NROIDPACIENTE,CODENTJM) values ('344',to_date('09/05/19','DD/MM/RR'),'9','2','20190509132011865776',to_date('09/05/19','DD/MM/RR'),'N','1','3','761470067210',null,'SE APRUEBA ENTEREX 90 BOTELLAS POR 90 DÃ?AS POR MANEJO ADECUADO PARA LA PATOLOGÃ?A.','1','26',to_date('08/07/19','DD/MM/RR'),'2019-07-08','CC','31199808','761470067210');
Insert into OASIS4.WEBSERV_JUNTA_PROFESIONAL (ID_JUPR,REPO_PERIODO,REPO_SERV_ID,REPO_TIRE_ID,NOPRESCRIPCION,FPRESCRIPCION,TIPOTECNOLOGIA,CONSECUTIVO,ESTJM,CODENTPROC,OBSERVACIONES,JUSTIFICACIONTECNICA,MODALIDAD,NOACTA,FECHAACTA,FPROCESO,TIPOIDPACIENTE,NROIDPACIENTE,CODENTJM) values ('345',to_date('09/05/19','DD/MM/RR'),'9','2','20190509186011877771',to_date('09/05/19','DD/MM/RR'),'N','1','2',null,null,null,null,null,to_date('01/01/70','DD/MM/RR'),null,'CC','950472','087580016101');
Insert into OASIS4.WEBSERV_JUNTA_PROFESIONAL (ID_JUPR,REPO_PERIODO,REPO_SERV_ID,REPO_TIRE_ID,NOPRESCRIPCION,FPRESCRIPCION,TIPOTECNOLOGIA,CONSECUTIVO,ESTJM,CODENTPROC,OBSERVACIONES,JUSTIFICACIONTECNICA,MODALIDAD,NOACTA,FECHAACTA,FPROCESO,TIPOIDPACIENTE,NROIDPACIENTE,CODENTJM) values ('346',to_date('09/05/19','DD/MM/RR'),'9','2','20190509190011879630',to_date('09/05/19','DD/MM/RR'),'N','1','3','761470067210',null,'SE APRUEBA ENSURE DE UNA CANTIDAD DE 5 LATAS POR PATOLOGÃ?A.','1','27',to_date('08/07/19','DD/MM/RR'),'2019-07-08','CC','1010096042','761470067210');
Insert into OASIS4.WEBSERV_JUNTA_PROFESIONAL (ID_JUPR,REPO_PERIODO,REPO_SERV_ID,REPO_TIRE_ID,NOPRESCRIPCION,FPRESCRIPCION,TIPOTECNOLOGIA,CONSECUTIVO,ESTJM,CODENTPROC,OBSERVACIONES,JUSTIFICACIONTECNICA,MODALIDAD,NOACTA,FECHAACTA,FPROCESO,TIPOIDPACIENTE,NROIDPACIENTE,CODENTJM) values ('347',to_date('09/05/19','DD/MM/RR'),'9','2','20190509123011879827',to_date('09/05/19','DD/MM/RR'),'N','1','3','087580016101',null,'SE SOLICITA ALIMENTO LIQUIDO COMPLETO Y BALANCEADO CON PROTEINAS, VITAMINA D, HMB PARA RECUPERAR ESTADO NUTRICIONAL DEL PACIENTE.','1','0011',to_date('27/06/19','DD/MM/RR'),'2019-06-27','CC','22266197','087580016101');
Insert into OASIS4.WEBSERV_JUNTA_PROFESIONAL (ID_JUPR,REPO_PERIODO,REPO_SERV_ID,REPO_TIRE_ID,NOPRESCRIPCION,FPRESCRIPCION,TIPOTECNOLOGIA,CONSECUTIVO,ESTJM,CODENTPROC,OBSERVACIONES,JUSTIFICACIONTECNICA,MODALIDAD,NOACTA,FECHAACTA,FPROCESO,TIPOIDPACIENTE,NROIDPACIENTE,CODENTJM) values ('348',to_date('09/05/19','DD/MM/RR'),'9','2','20190509199011885685',to_date('09/05/19','DD/MM/RR'),'N','1','3','761470851601',null,'quien requiere COMPLEMENTAR SU ALIMENTACIÃ“N, con alimento para propÃ³sitos mÃ©dicos especiales en pacientes con enfermedad pulmonar crÃ³nica','1','MP0074',to_date('14/05/19','DD/MM/RR'),'2019-05-14','CC','15895370','761470851601');
Insert into OASIS4.WEBSERV_JUNTA_PROFESIONAL (ID_JUPR,REPO_PERIODO,REPO_SERV_ID,REPO_TIRE_ID,NOPRESCRIPCION,FPRESCRIPCION,TIPOTECNOLOGIA,CONSECUTIVO,ESTJM,CODENTPROC,OBSERVACIONES,JUSTIFICACIONTECNICA,MODALIDAD,NOACTA,FECHAACTA,FPROCESO,TIPOIDPACIENTE,NROIDPACIENTE,CODENTJM) values ('349',to_date('09/05/19','DD/MM/RR'),'9','2','20190509156011887647',to_date('09/05/19','DD/MM/RR'),'N','1','2',null,null,null,null,null,to_date('01/01/70','DD/MM/RR'),null,'CC','23023516','134300074601');
Insert into OASIS4.WEBSERV_JUNTA_PROFESIONAL (ID_JUPR,REPO_PERIODO,REPO_SERV_ID,REPO_TIRE_ID,NOPRESCRIPCION,FPRESCRIPCION,TIPOTECNOLOGIA,CONSECUTIVO,ESTJM,CODENTPROC,OBSERVACIONES,JUSTIFICACIONTECNICA,MODALIDAD,NOACTA,FECHAACTA,FPROCESO,TIPOIDPACIENTE,NROIDPACIENTE,CODENTJM) values ('350',to_date('09/05/19','DD/MM/RR'),'9','2','20190509131011887665',to_date('09/05/19','DD/MM/RR'),'N','1','2',null,null,null,null,null,to_date('01/01/70','DD/MM/RR'),null,'CC','22900811','134300074601');
Insert into OASIS4.WEBSERV_JUNTA_PROFESIONAL (ID_JUPR,REPO_PERIODO,REPO_SERV_ID,REPO_TIRE_ID,NOPRESCRIPCION,FPRESCRIPCION,TIPOTECNOLOGIA,CONSECUTIVO,ESTJM,CODENTPROC,OBSERVACIONES,JUSTIFICACIONTECNICA,MODALIDAD,NOACTA,FECHAACTA,FPROCESO,TIPOIDPACIENTE,NROIDPACIENTE,CODENTJM) values ('351',to_date('09/05/19','DD/MM/RR'),'9','2','20190509146011863690',to_date('09/05/19','DD/MM/RR'),'S','1','3','080010349401',null,'PACIENTE CON DESNUTRICIÃ“N PROTEICO CALORICA SEVERA, QUIEN REQUIERE SUPLEMENTO NUTRICIONAL TIPO PULMOCARE, TENIENDO EN CUENTA ANTECEDENTE PULMONAR. ADEMAS SE FO','2','002',to_date('20/05/19','DD/MM/RR'),'2019-05-20','CC','4313856','080010349401');
Insert into OASIS4.WEBSERV_JUNTA_PROFESIONAL (ID_JUPR,REPO_PERIODO,REPO_SERV_ID,REPO_TIRE_ID,NOPRESCRIPCION,FPRESCRIPCION,TIPOTECNOLOGIA,CONSECUTIVO,ESTJM,CODENTPROC,OBSERVACIONES,JUSTIFICACIONTECNICA,MODALIDAD,NOACTA,FECHAACTA,FPROCESO,TIPOIDPACIENTE,NROIDPACIENTE,CODENTJM) values ('681',to_date('13/06/19','DD/MM/RR'),'9','2','20190613165012574197',to_date('13/06/19','DD/MM/RR'),'N','1','3','080010380001',null,'paciente con diagnostico de bajo peso y baja talla, por este motivo se le indica  suplemento, niÃ±o sin apetito ','1','00004',to_date('13/06/19','DD/MM/RR'),'2019-06-13','RC','1130280138','080010380001');
Insert into OASIS4.WEBSERV_JUNTA_PROFESIONAL (ID_JUPR,REPO_PERIODO,REPO_SERV_ID,REPO_TIRE_ID,NOPRESCRIPCION,FPRESCRIPCION,TIPOTECNOLOGIA,CONSECUTIVO,ESTJM,CODENTPROC,OBSERVACIONES,JUSTIFICACIONTECNICA,MODALIDAD,NOACTA,FECHAACTA,FPROCESO,TIPOIDPACIENTE,NROIDPACIENTE,CODENTJM) values ('682',to_date('13/06/19','DD/MM/RR'),'9','2','20190613169012574390',to_date('13/06/19','DD/MM/RR'),'N','1','3','130010178101',null,'PRESENTA OBESIDAD GRADO 1,  ACTUALMENTE CONSUME LOS ALIMENTOS DE ACUERDO A TOLERANCIA Y LO QUE LE APETECE,  MANIFIESTA QUE NO TOLERA, LAS PROTEÃ?NAS, PRESENTA NA','1','40',to_date('17/06/19','DD/MM/RR'),'2019-06-17','CC','32941695','130010178101');
Insert into OASIS4.WEBSERV_JUNTA_PROFESIONAL (ID_JUPR,REPO_PERIODO,REPO_SERV_ID,REPO_TIRE_ID,NOPRESCRIPCION,FPRESCRIPCION,TIPOTECNOLOGIA,CONSECUTIVO,ESTJM,CODENTPROC,OBSERVACIONES,JUSTIFICACIONTECNICA,MODALIDAD,NOACTA,FECHAACTA,FPROCESO,TIPOIDPACIENTE,NROIDPACIENTE,CODENTJM) values ('683',to_date('13/06/19','DD/MM/RR'),'9','2','20190613126012575461',to_date('13/06/19','DD/MM/RR'),'N','1','3','130010210201',null,'REQUIERE SOPORTE NUTRICIONAL COMPLEMENTARIO PARA MEJORAR O RECUPERAR ESTADO NUTRICIONAL PREVENIR NEONATO DE BAJO PESO AL NACER IMC -18.3 POR CIENTO','1','23',to_date('13/06/19','DD/MM/RR'),'2019-06-13','TI','1049825345','130010210201');
Insert into OASIS4.WEBSERV_JUNTA_PROFESIONAL (ID_JUPR,REPO_PERIODO,REPO_SERV_ID,REPO_TIRE_ID,NOPRESCRIPCION,FPRESCRIPCION,TIPOTECNOLOGIA,CONSECUTIVO,ESTJM,CODENTPROC,OBSERVACIONES,JUSTIFICACIONTECNICA,MODALIDAD,NOACTA,FECHAACTA,FPROCESO,TIPOIDPACIENTE,NROIDPACIENTE,CODENTJM) values ('684',to_date('13/06/19','DD/MM/RR'),'9','2','20190613132012576342',to_date('13/06/19','DD/MM/RR'),'N','1','2',null,null,null,null,null,to_date('01/01/70','DD/MM/RR'),null,'CC','22520836','080010112201');
Insert into OASIS4.WEBSERV_JUNTA_PROFESIONAL (ID_JUPR,REPO_PERIODO,REPO_SERV_ID,REPO_TIRE_ID,NOPRESCRIPCION,FPRESCRIPCION,TIPOTECNOLOGIA,CONSECUTIVO,ESTJM,CODENTPROC,OBSERVACIONES,JUSTIFICACIONTECNICA,MODALIDAD,NOACTA,FECHAACTA,FPROCESO,TIPOIDPACIENTE,NROIDPACIENTE,CODENTJM) values ('685',to_date('13/06/19','DD/MM/RR'),'9','2','20190613179012576900',to_date('13/06/19','DD/MM/RR'),'N','1','3','086340010501',null,'PACIENTE DE 91 AÃ‘OS DE ESDAD CON PESO DE 37KG TALLA 1548 DIAGNOSTICO DIAGNOSTICO NUTRICIONAL DE DELGADEZ LO CUAL REQUIERE DE COMPLEMENTO N','1','22',to_date('13/06/19','DD/MM/RR'),'2019-06-13','CC','28023395','086340010501');
Insert into OASIS4.WEBSERV_JUNTA_PROFESIONAL (ID_JUPR,REPO_PERIODO,REPO_SERV_ID,REPO_TIRE_ID,NOPRESCRIPCION,FPRESCRIPCION,TIPOTECNOLOGIA,CONSECUTIVO,ESTJM,CODENTPROC,OBSERVACIONES,JUSTIFICACIONTECNICA,MODALIDAD,NOACTA,FECHAACTA,FPROCESO,TIPOIDPACIENTE,NROIDPACIENTE,CODENTJM) values ('686',to_date('13/06/19','DD/MM/RR'),'9','2','20190613183012580148',to_date('13/06/19','DD/MM/RR'),'N','1','3','080010380001',null,'PACIENTE CON DIAGNOSTICO DE DESNUTRICIÃ“N MODERADA REQUIERE ALIMENTACIÃ“N COMPLEMENTARIA CON PESO DE 32 KILOS TALLA 1.38 IMC 16.8','1','000006',to_date('20/06/19','DD/MM/RR'),'2019-06-20','CC','22681954','080010380001');
Insert into OASIS4.WEBSERV_JUNTA_PROFESIONAL (ID_JUPR,REPO_PERIODO,REPO_SERV_ID,REPO_TIRE_ID,NOPRESCRIPCION,FPRESCRIPCION,TIPOTECNOLOGIA,CONSECUTIVO,ESTJM,CODENTPROC,OBSERVACIONES,JUSTIFICACIONTECNICA,MODALIDAD,NOACTA,FECHAACTA,FPROCESO,TIPOIDPACIENTE,NROIDPACIENTE,CODENTJM) values ('687',to_date('13/06/19','DD/MM/RR'),'9','2','20190613192012582632',to_date('13/06/19','DD/MM/RR'),'N','1','2',null,null,null,null,null,to_date('01/01/70','DD/MM/RR'),null,'CC','16203216','761260170301');
Insert into OASIS4.WEBSERV_JUNTA_PROFESIONAL (ID_JUPR,REPO_PERIODO,REPO_SERV_ID,REPO_TIRE_ID,NOPRESCRIPCION,FPRESCRIPCION,TIPOTECNOLOGIA,CONSECUTIVO,ESTJM,CODENTPROC,OBSERVACIONES,JUSTIFICACIONTECNICA,MODALIDAD,NOACTA,FECHAACTA,FPROCESO,TIPOIDPACIENTE,NROIDPACIENTE,CODENTJM) values ('688',to_date('13/06/19','DD/MM/RR'),'9','2','20190613129012558975',to_date('13/06/19','DD/MM/RR'),'S','1','3','080010349401',null,'PACIENTE CON DIAGNOSTICO DE INCONTINENCIA DE ESFINTERES POR LO QUE REQUIERE PAÃ‘ALES DESCHABLES PARA OPTIMIZAR CONDICIONES DE HIGIENE','2','011',to_date('13/06/19','DD/MM/RR'),'2019-06-13','CC','22673362','080010349401');
Insert into OASIS4.WEBSERV_JUNTA_PROFESIONAL (ID_JUPR,REPO_PERIODO,REPO_SERV_ID,REPO_TIRE_ID,NOPRESCRIPCION,FPRESCRIPCION,TIPOTECNOLOGIA,CONSECUTIVO,ESTJM,CODENTPROC,OBSERVACIONES,JUSTIFICACIONTECNICA,MODALIDAD,NOACTA,FECHAACTA,FPROCESO,TIPOIDPACIENTE,NROIDPACIENTE,CODENTJM) values ('689',to_date('13/06/19','DD/MM/RR'),'9','2','20190613163012577027',to_date('13/06/19','DD/MM/RR'),'S','1','2',null,null,null,null,null,to_date('01/01/70','DD/MM/RR'),null,'CC','1129539285','470010065001');
Insert into OASIS4.WEBSERV_JUNTA_PROFESIONAL (ID_JUPR,REPO_PERIODO,REPO_SERV_ID,REPO_TIRE_ID,NOPRESCRIPCION,FPRESCRIPCION,TIPOTECNOLOGIA,CONSECUTIVO,ESTJM,CODENTPROC,OBSERVACIONES,JUSTIFICACIONTECNICA,MODALIDAD,NOACTA,FECHAACTA,FPROCESO,TIPOIDPACIENTE,NROIDPACIENTE,CODENTJM) values ('690',to_date('14/06/19','DD/MM/RR'),'9','2','20190614171012598103',to_date('14/06/19','DD/MM/RR'),'M','1','3','760010379901',null,'EMSSANAR','1','0455-19',to_date('17/06/19','DD/MM/RR'),'2019-06-19','CC','31401481','760010379901');
Insert into OASIS4.WEBSERV_JUNTA_PROFESIONAL (ID_JUPR,REPO_PERIODO,REPO_SERV_ID,REPO_TIRE_ID,NOPRESCRIPCION,FPRESCRIPCION,TIPOTECNOLOGIA,CONSECUTIVO,ESTJM,CODENTPROC,OBSERVACIONES,JUSTIFICACIONTECNICA,MODALIDAD,NOACTA,FECHAACTA,FPROCESO,TIPOIDPACIENTE,NROIDPACIENTE,CODENTJM) values ('691',to_date('14/06/19','DD/MM/RR'),'9','2','20190614158012588358',to_date('14/06/19','DD/MM/RR'),'N','1','2',null,null,null,null,null,to_date('01/01/70','DD/MM/RR'),null,'TI','1061278188','ESS076');
Insert into OASIS4.WEBSERV_JUNTA_PROFESIONAL (ID_JUPR,REPO_PERIODO,REPO_SERV_ID,REPO_TIRE_ID,NOPRESCRIPCION,FPRESCRIPCION,TIPOTECNOLOGIA,CONSECUTIVO,ESTJM,CODENTPROC,OBSERVACIONES,JUSTIFICACIONTECNICA,MODALIDAD,NOACTA,FECHAACTA,FPROCESO,TIPOIDPACIENTE,NROIDPACIENTE,CODENTJM) values ('692',to_date('14/06/19','DD/MM/RR'),'9','2','20190614111012593027',to_date('14/06/19','DD/MM/RR'),'N','1','3','080010380001',null,'PACIENTE FEMENINA DE 77 AÃ‘OS DE EDAD CON DESNUTRICIÃ“N PROTEICOCALORICA SEVERA CON PESO DE 32 Kg, TALLA: 1.47 IMC: 15.27, CON PROBLEMAS DE ANOREXIA Y ABANDONO.','1','13',to_date('14/06/19','DD/MM/RR'),'2019-06-14','CC','22344367','080010380001');
Insert into OASIS4.WEBSERV_JUNTA_PROFESIONAL (ID_JUPR,REPO_PERIODO,REPO_SERV_ID,REPO_TIRE_ID,NOPRESCRIPCION,FPRESCRIPCION,TIPOTECNOLOGIA,CONSECUTIVO,ESTJM,CODENTPROC,OBSERVACIONES,JUSTIFICACIONTECNICA,MODALIDAD,NOACTA,FECHAACTA,FPROCESO,TIPOIDPACIENTE,NROIDPACIENTE,CODENTJM) values ('693',to_date('14/06/19','DD/MM/RR'),'9','2','20190614159012599949',to_date('14/06/19','DD/MM/RR'),'N','1','3','080010380001',null,'PACIENTE FEMENINA DE 75 AÃ‘OS DE EDAD CON DESNUTRICIÃ“N PROTEICOCALORICA SEVERA, REQUIERE DE SUPLEMENTO PARA AUMENTAR MASA MUSCULAR Y FORTALECER HUESOS.','1','15',to_date('17/06/19','DD/MM/RR'),'2019-06-17','CC','32620784','080010380001');
Insert into OASIS4.WEBSERV_JUNTA_PROFESIONAL (ID_JUPR,REPO_PERIODO,REPO_SERV_ID,REPO_TIRE_ID,NOPRESCRIPCION,FPRESCRIPCION,TIPOTECNOLOGIA,CONSECUTIVO,ESTJM,CODENTPROC,OBSERVACIONES,JUSTIFICACIONTECNICA,MODALIDAD,NOACTA,FECHAACTA,FPROCESO,TIPOIDPACIENTE,NROIDPACIENTE,CODENTJM) values ('694',to_date('14/06/19','DD/MM/RR'),'9','2','20190614136012602098',to_date('14/06/19','DD/MM/RR'),'N','1','3','130010178101',null,'INDIC DE MASA CORPORAL BAJO, PESO 40KG,CONSUME LOS ALIMENTOS DE ACUERDO AL MENÃš PROGRAMADO DIARIO, LICUADO Y MOLIDO, SE CONSIDERA INICIAR SUPLEMNTO NUTRICIONAL,','1','39',to_date('17/06/19','DD/MM/RR'),'2019-06-17','CC','23135305','130010178101');
Insert into OASIS4.WEBSERV_JUNTA_PROFESIONAL (ID_JUPR,REPO_PERIODO,REPO_SERV_ID,REPO_TIRE_ID,NOPRESCRIPCION,FPRESCRIPCION,TIPOTECNOLOGIA,CONSECUTIVO,ESTJM,CODENTPROC,OBSERVACIONES,JUSTIFICACIONTECNICA,MODALIDAD,NOACTA,FECHAACTA,FPROCESO,TIPOIDPACIENTE,NROIDPACIENTE,CODENTJM) values ('695',to_date('14/06/19','DD/MM/RR'),'9','2','20190614183012607106',to_date('14/06/19','DD/MM/RR'),'N','1','3','760010379901',null,'ASOCIACIÃ“N MUTUAL BARRIOS UNIDOS DE QUIBDÃ“','1','0462-19',to_date('18/06/19','DD/MM/RR'),'2019-06-20','CC','16248006','760010379901');
Insert into OASIS4.WEBSERV_JUNTA_PROFESIONAL (ID_JUPR,REPO_PERIODO,REPO_SERV_ID,REPO_TIRE_ID,NOPRESCRIPCION,FPRESCRIPCION,TIPOTECNOLOGIA,CONSECUTIVO,ESTJM,CODENTPROC,OBSERVACIONES,JUSTIFICACIONTECNICA,MODALIDAD,NOACTA,FECHAACTA,FPROCESO,TIPOIDPACIENTE,NROIDPACIENTE,CODENTJM) values ('696',to_date('14/06/19','DD/MM/RR'),'9','2','20190614195012608570',to_date('14/06/19','DD/MM/RR'),'N','1','3','761470851601',null,'paciente con paralisis cerebral tiene desnutricion cronica moderada y trastorno de deglucion, requiere suplencia con formula polimerica: 3 frascos dia ','1','MP0091',to_date('17/06/19','DD/MM/RR'),'2019-06-18','RC','1114161521','761470851601');
Insert into OASIS4.WEBSERV_JUNTA_PROFESIONAL (ID_JUPR,REPO_PERIODO,REPO_SERV_ID,REPO_TIRE_ID,NOPRESCRIPCION,FPRESCRIPCION,TIPOTECNOLOGIA,CONSECUTIVO,ESTJM,CODENTPROC,OBSERVACIONES,JUSTIFICACIONTECNICA,MODALIDAD,NOACTA,FECHAACTA,FPROCESO,TIPOIDPACIENTE,NROIDPACIENTE,CODENTJM) values ('697',to_date('14/06/19','DD/MM/RR'),'9','2','20190614149012592076',to_date('14/06/19','DD/MM/RR'),'S','1','2',null,null,null,null,null,to_date('01/01/70','DD/MM/RR'),null,'CC','1114120893','761000252401');
Insert into OASIS4.WEBSERV_JUNTA_PROFESIONAL (ID_JUPR,REPO_PERIODO,REPO_SERV_ID,REPO_TIRE_ID,NOPRESCRIPCION,FPRESCRIPCION,TIPOTECNOLOGIA,CONSECUTIVO,ESTJM,CODENTPROC,OBSERVACIONES,JUSTIFICACIONTECNICA,MODALIDAD,NOACTA,FECHAACTA,FPROCESO,TIPOIDPACIENTE,NROIDPACIENTE,CODENTJM) values ('698',to_date('14/06/19','DD/MM/RR'),'9','2','20190614147012594973',to_date('14/06/19','DD/MM/RR'),'S','1','3','761470067210',null,'Se aprueban 150 paÃ±ales para 30 DÃ?AS a paciente por PATOLOGÃ?AS.','1','55',to_date('19/07/19','DD/MM/RR'),'2019-07-19','CC','1401885','761470067210');
Insert into OASIS4.WEBSERV_JUNTA_PROFESIONAL (ID_JUPR,REPO_PERIODO,REPO_SERV_ID,REPO_TIRE_ID,NOPRESCRIPCION,FPRESCRIPCION,TIPOTECNOLOGIA,CONSECUTIVO,ESTJM,CODENTPROC,OBSERVACIONES,JUSTIFICACIONTECNICA,MODALIDAD,NOACTA,FECHAACTA,FPROCESO,TIPOIDPACIENTE,NROIDPACIENTE,CODENTJM) values ('699',to_date('14/06/19','DD/MM/RR'),'9','2','20190614186012598886',to_date('14/06/19','DD/MM/RR'),'S','1','2',null,null,null,null,null,to_date('01/01/70','DD/MM/RR'),null,'CC','22171768','272450001401');
Insert into OASIS4.WEBSERV_JUNTA_PROFESIONAL (ID_JUPR,REPO_PERIODO,REPO_SERV_ID,REPO_TIRE_ID,NOPRESCRIPCION,FPRESCRIPCION,TIPOTECNOLOGIA,CONSECUTIVO,ESTJM,CODENTPROC,OBSERVACIONES,JUSTIFICACIONTECNICA,MODALIDAD,NOACTA,FECHAACTA,FPROCESO,TIPOIDPACIENTE,NROIDPACIENTE,CODENTJM) values ('700',to_date('14/06/19','DD/MM/RR'),'9','2','20190614130012602763',to_date('14/06/19','DD/MM/RR'),'S','1','2',null,null,null,null,null,to_date('01/01/70','DD/MM/RR'),null,'CC','1129539285','470010065001');
Insert into OASIS4.WEBSERV_JUNTA_PROFESIONAL (ID_JUPR,REPO_PERIODO,REPO_SERV_ID,REPO_TIRE_ID,NOPRESCRIPCION,FPRESCRIPCION,TIPOTECNOLOGIA,CONSECUTIVO,ESTJM,CODENTPROC,OBSERVACIONES,JUSTIFICACIONTECNICA,MODALIDAD,NOACTA,FECHAACTA,FPROCESO,TIPOIDPACIENTE,NROIDPACIENTE,CODENTJM) values ('701',to_date('15/06/19','DD/MM/RR'),'9','2','20190615137012612129',to_date('15/06/19','DD/MM/RR'),'N','1','3','134300290801',null,'pcte con diabtes, requeriminete de alimentacion suplementaria con dieta baja en hidratados de carbono','1','23',to_date('17/06/19','DD/MM/RR'),'2019-06-17','CC','22938046','134300290801');
Insert into OASIS4.WEBSERV_JUNTA_PROFESIONAL (ID_JUPR,REPO_PERIODO,REPO_SERV_ID,REPO_TIRE_ID,NOPRESCRIPCION,FPRESCRIPCION,TIPOTECNOLOGIA,CONSECUTIVO,ESTJM,CODENTPROC,OBSERVACIONES,JUSTIFICACIONTECNICA,MODALIDAD,NOACTA,FECHAACTA,FPROCESO,TIPOIDPACIENTE,NROIDPACIENTE,CODENTJM) values ('702',to_date('15/06/19','DD/MM/RR'),'9','2','20190615179012614382',to_date('15/06/19','DD/MM/RR'),'N','1','2',null,null,null,null,null,to_date('01/01/70','DD/MM/RR'),null,'CC','26308898','270010009301');
Insert into OASIS4.WEBSERV_JUNTA_PROFESIONAL (ID_JUPR,REPO_PERIODO,REPO_SERV_ID,REPO_TIRE_ID,NOPRESCRIPCION,FPRESCRIPCION,TIPOTECNOLOGIA,CONSECUTIVO,ESTJM,CODENTPROC,OBSERVACIONES,JUSTIFICACIONTECNICA,MODALIDAD,NOACTA,FECHAACTA,FPROCESO,TIPOIDPACIENTE,NROIDPACIENTE,CODENTJM) values ('703',to_date('15/06/19','DD/MM/RR'),'9','2','20190615125012616582',to_date('15/06/19','DD/MM/RR'),'N','1','3','134300290801',null,'DESNUTRICION PROTEICOCALORICA SEVERA, NO ESPECIFICADA','1','24',to_date('17/06/19','DD/MM/RR'),'2019-06-17','CC','1917767','134300290801');
Insert into OASIS4.WEBSERV_JUNTA_PROFESIONAL (ID_JUPR,REPO_PERIODO,REPO_SERV_ID,REPO_TIRE_ID,NOPRESCRIPCION,FPRESCRIPCION,TIPOTECNOLOGIA,CONSECUTIVO,ESTJM,CODENTPROC,OBSERVACIONES,JUSTIFICACIONTECNICA,MODALIDAD,NOACTA,FECHAACTA,FPROCESO,TIPOIDPACIENTE,NROIDPACIENTE,CODENTJM) values ('704',to_date('17/06/19','DD/MM/RR'),'9','2','20190617159012641791',to_date('17/06/19','DD/MM/RR'),'M','1','2',null,null,null,null,null,to_date('01/01/70','DD/MM/RR'),null,'TI','1143244590','080010054401');
Insert into OASIS4.WEBSERV_JUNTA_PROFESIONAL (ID_JUPR,REPO_PERIODO,REPO_SERV_ID,REPO_TIRE_ID,NOPRESCRIPCION,FPRESCRIPCION,TIPOTECNOLOGIA,CONSECUTIVO,ESTJM,CODENTPROC,OBSERVACIONES,JUSTIFICACIONTECNICA,MODALIDAD,NOACTA,FECHAACTA,FPROCESO,TIPOIDPACIENTE,NROIDPACIENTE,CODENTJM) values ('705',to_date('17/06/19','DD/MM/RR'),'9','2','20190617184012625811',to_date('17/06/19','DD/MM/RR'),'N','1','3','080010003716',null,'PACIENTE CON CA DE PROSTATA , DIAGNOSTICO NUTRICIONAL DESNUTRICION PROTEICO CALORICA GRADO 3 , PROCESO DEPLETORIO GRAVE , SE OBSERVA  BAJA INGESTA CALORICA','1','48',to_date('17/06/19','DD/MM/RR'),'2019-06-17','CC','3695546','080010003716');
Insert into OASIS4.WEBSERV_JUNTA_PROFESIONAL (ID_JUPR,REPO_PERIODO,REPO_SERV_ID,REPO_TIRE_ID,NOPRESCRIPCION,FPRESCRIPCION,TIPOTECNOLOGIA,CONSECUTIVO,ESTJM,CODENTPROC,OBSERVACIONES,JUSTIFICACIONTECNICA,MODALIDAD,NOACTA,FECHAACTA,FPROCESO,TIPOIDPACIENTE,NROIDPACIENTE,CODENTJM) values ('706',to_date('17/06/19','DD/MM/RR'),'9','2','20190617178012628330',to_date('17/06/19','DD/MM/RR'),'N','1','3','130010210201',null,'PRODUCTO DE MADRE CON DESNUTRICION  Y EL BAJO PESO AL NACER  RIESGO PREVIO 904 POR CIENTO- TIENE ANEMIA REQUIERE SOPORTE NUTRICIONAL QUE GARANTIZE DESARROLLO','1','26',to_date('17/06/19','DD/MM/RR'),'2019-06-17','RC','1052740707','130010210201');
Insert into OASIS4.WEBSERV_JUNTA_PROFESIONAL (ID_JUPR,REPO_PERIODO,REPO_SERV_ID,REPO_TIRE_ID,NOPRESCRIPCION,FPRESCRIPCION,TIPOTECNOLOGIA,CONSECUTIVO,ESTJM,CODENTPROC,OBSERVACIONES,JUSTIFICACIONTECNICA,MODALIDAD,NOACTA,FECHAACTA,FPROCESO,TIPOIDPACIENTE,NROIDPACIENTE,CODENTJM) values ('707',to_date('17/06/19','DD/MM/RR'),'9','2','20190617166012630988',to_date('17/06/19','DD/MM/RR'),'N','1','3','761470067210',null,'se aprueba soporte nutricional glucerna 5 latas por 30 dias, debido a las condiciones del paciente.','1','10',to_date('21/06/19','DD/MM/RR'),'2019-06-21','CC','9892187','761470067210');
Insert into OASIS4.WEBSERV_JUNTA_PROFESIONAL (ID_JUPR,REPO_PERIODO,REPO_SERV_ID,REPO_TIRE_ID,NOPRESCRIPCION,FPRESCRIPCION,TIPOTECNOLOGIA,CONSECUTIVO,ESTJM,CODENTPROC,OBSERVACIONES,JUSTIFICACIONTECNICA,MODALIDAD,NOACTA,FECHAACTA,FPROCESO,TIPOIDPACIENTE,NROIDPACIENTE,CODENTJM) values ('708',to_date('17/06/19','DD/MM/RR'),'9','2','20190617113012631952',to_date('17/06/19','DD/MM/RR'),'N','1','3','086380074501',null,'paciente con  dx  medico enfermedad alzheimer, epilepsia,  enfermedad  de  parkinson ,  hta,  incontinencia  fecal, dificultad  para  deglutir, dx  nut:moderada','1','17',to_date('24/11/19','DD/MM/RR'),'2019-12-10','CC','22460429','086380074501');
Insert into OASIS4.WEBSERV_JUNTA_PROFESIONAL (ID_JUPR,REPO_PERIODO,REPO_SERV_ID,REPO_TIRE_ID,NOPRESCRIPCION,FPRESCRIPCION,TIPOTECNOLOGIA,CONSECUTIVO,ESTJM,CODENTPROC,OBSERVACIONES,JUSTIFICACIONTECNICA,MODALIDAD,NOACTA,FECHAACTA,FPROCESO,TIPOIDPACIENTE,NROIDPACIENTE,CODENTJM) values ('709',to_date('17/06/19','DD/MM/RR'),'9','2','20190617177012632000',to_date('17/06/19','DD/MM/RR'),'N','1','2',null,null,null,null,null,to_date('01/01/70','DD/MM/RR'),null,'CC','22319819','086850011001');
Insert into OASIS4.WEBSERV_JUNTA_PROFESIONAL (ID_JUPR,REPO_PERIODO,REPO_SERV_ID,REPO_TIRE_ID,NOPRESCRIPCION,FPRESCRIPCION,TIPOTECNOLOGIA,CONSECUTIVO,ESTJM,CODENTPROC,OBSERVACIONES,JUSTIFICACIONTECNICA,MODALIDAD,NOACTA,FECHAACTA,FPROCESO,TIPOIDPACIENTE,NROIDPACIENTE,CODENTJM) values ('710',to_date('17/06/19','DD/MM/RR'),'9','2','20190617110012637610',to_date('17/06/19','DD/MM/RR'),'N','1','3','130010178101',null,'PACIENTE, QUE PRESENTA UN INDICE DE MASA CORPORAL MUY BAJO, NO LE FUE POSIBLE SUMINISTRARLE, LOS SUPLEMENTO NUTRICIONALES,SU EPS,  NO LOS AUTORIZÃ“, MANIFIESTA Q','1','36',to_date('17/06/19','DD/MM/RR'),'2019-06-17','CC','3676269','130010178101');
Insert into OASIS4.WEBSERV_JUNTA_PROFESIONAL (ID_JUPR,REPO_PERIODO,REPO_SERV_ID,REPO_TIRE_ID,NOPRESCRIPCION,FPRESCRIPCION,TIPOTECNOLOGIA,CONSECUTIVO,ESTJM,CODENTPROC,OBSERVACIONES,JUSTIFICACIONTECNICA,MODALIDAD,NOACTA,FECHAACTA,FPROCESO,TIPOIDPACIENTE,NROIDPACIENTE,CODENTJM) values ('711',to_date('17/06/19','DD/MM/RR'),'9','2','20190617144012644096',to_date('17/06/19','DD/MM/RR'),'N','1','2',null,null,null,null,null,to_date('01/01/70','DD/MM/RR'),null,'CC','36547640','080010133501');
Insert into OASIS4.WEBSERV_JUNTA_PROFESIONAL (ID_JUPR,REPO_PERIODO,REPO_SERV_ID,REPO_TIRE_ID,NOPRESCRIPCION,FPRESCRIPCION,TIPOTECNOLOGIA,CONSECUTIVO,ESTJM,CODENTPROC,OBSERVACIONES,JUSTIFICACIONTECNICA,MODALIDAD,NOACTA,FECHAACTA,FPROCESO,TIPOIDPACIENTE,NROIDPACIENTE,CODENTJM) values ('712',to_date('18/06/19','DD/MM/RR'),'9','2','20190618183012662936',to_date('18/06/19','DD/MM/RR'),'N','1','2',null,null,null,null,null,to_date('01/01/70','DD/MM/RR'),null,'CC','3755209','086380015401');
Insert into OASIS4.WEBSERV_JUNTA_PROFESIONAL (ID_JUPR,REPO_PERIODO,REPO_SERV_ID,REPO_TIRE_ID,NOPRESCRIPCION,FPRESCRIPCION,TIPOTECNOLOGIA,CONSECUTIVO,ESTJM,CODENTPROC,OBSERVACIONES,JUSTIFICACIONTECNICA,MODALIDAD,NOACTA,FECHAACTA,FPROCESO,TIPOIDPACIENTE,NROIDPACIENTE,CODENTJM) values ('713',to_date('18/06/19','DD/MM/RR'),'9','2','20190618168012665002',to_date('18/06/19','DD/MM/RR'),'N','1','2',null,null,null,null,null,to_date('01/01/70','DD/MM/RR'),null,'CC','29171009','760410406501');
Insert into OASIS4.WEBSERV_JUNTA_PROFESIONAL (ID_JUPR,REPO_PERIODO,REPO_SERV_ID,REPO_TIRE_ID,NOPRESCRIPCION,FPRESCRIPCION,TIPOTECNOLOGIA,CONSECUTIVO,ESTJM,CODENTPROC,OBSERVACIONES,JUSTIFICACIONTECNICA,MODALIDAD,NOACTA,FECHAACTA,FPROCESO,TIPOIDPACIENTE,NROIDPACIENTE,CODENTJM) values ('714',to_date('18/06/19','DD/MM/RR'),'9','2','20190618164012666657',to_date('18/06/19','DD/MM/RR'),'N','1','3','087580016101',null,'se solicita alimento completo y balanceado para adulto mayor que presenta inapetencia y perdida progresiva de peso, y evitar asi la desnutricion. ','1','00009',to_date('18/06/19','DD/MM/RR'),'2019-06-18','CC','22260519','087580016101');
Insert into OASIS4.WEBSERV_JUNTA_PROFESIONAL (ID_JUPR,REPO_PERIODO,REPO_SERV_ID,REPO_TIRE_ID,NOPRESCRIPCION,FPRESCRIPCION,TIPOTECNOLOGIA,CONSECUTIVO,ESTJM,CODENTPROC,OBSERVACIONES,JUSTIFICACIONTECNICA,MODALIDAD,NOACTA,FECHAACTA,FPROCESO,TIPOIDPACIENTE,NROIDPACIENTE,CODENTJM) values ('715',to_date('18/06/19','DD/MM/RR'),'9','2','20190618175012669266',to_date('18/06/19','DD/MM/RR'),'N','1','2',null,null,null,null,null,to_date('01/01/70','DD/MM/RR'),null,'CC','22680258','080010122401');
Insert into OASIS4.WEBSERV_JUNTA_PROFESIONAL (ID_JUPR,REPO_PERIODO,REPO_SERV_ID,REPO_TIRE_ID,NOPRESCRIPCION,FPRESCRIPCION,TIPOTECNOLOGIA,CONSECUTIVO,ESTJM,CODENTPROC,OBSERVACIONES,JUSTIFICACIONTECNICA,MODALIDAD,NOACTA,FECHAACTA,FPROCESO,TIPOIDPACIENTE,NROIDPACIENTE,CODENTJM) values ('716',to_date('18/06/19','DD/MM/RR'),'9','2','20190618197012677878',to_date('18/06/19','DD/MM/RR'),'S','1','2',null,null,null,null,null,to_date('01/01/70','DD/MM/RR'),null,'CC','3783311','130010178101');
Insert into OASIS4.WEBSERV_JUNTA_PROFESIONAL (ID_JUPR,REPO_PERIODO,REPO_SERV_ID,REPO_TIRE_ID,NOPRESCRIPCION,FPRESCRIPCION,TIPOTECNOLOGIA,CONSECUTIVO,ESTJM,CODENTPROC,OBSERVACIONES,JUSTIFICACIONTECNICA,MODALIDAD,NOACTA,FECHAACTA,FPROCESO,TIPOIDPACIENTE,NROIDPACIENTE,CODENTJM) values ('717',to_date('19/06/19','DD/MM/RR'),'9','2','20190619152012681024',to_date('19/06/19','DD/MM/RR'),'N','1','3','080010226001',null,'\tPACIENTE MASCULINO, 1 AÃ‘O 6 MESES DE EDAD. PESO 8GK, TALLA 78CM. PESO EDAD MENOS 2,86DS, TALLA EDAD MENOS 1,70DA, PESO TALLA MENOS 2,9DS. REQUIERE SUPLEMENTO N','1','060720191031',to_date('06/07/19','DD/MM/RR'),'2019-07-06','RC','1130281920','080010226001');
Insert into OASIS4.WEBSERV_JUNTA_PROFESIONAL (ID_JUPR,REPO_PERIODO,REPO_SERV_ID,REPO_TIRE_ID,NOPRESCRIPCION,FPRESCRIPCION,TIPOTECNOLOGIA,CONSECUTIVO,ESTJM,CODENTPROC,OBSERVACIONES,JUSTIFICACIONTECNICA,MODALIDAD,NOACTA,FECHAACTA,FPROCESO,TIPOIDPACIENTE,NROIDPACIENTE,CODENTJM) values ('718',to_date('19/06/19','DD/MM/RR'),'9','2','20190619116012683041',to_date('19/06/19','DD/MM/RR'),'N','1','3','761470851601',null,'desnutricion en manejo interdisciplinario ha bajado de peso. se requiere soporte nutricional . en estudio de patologia subyacente','1','MP0092',to_date('19/06/19','DD/MM/RR'),'2019-06-19','RC','1113595766','761470851601');
Insert into OASIS4.WEBSERV_JUNTA_PROFESIONAL (ID_JUPR,REPO_PERIODO,REPO_SERV_ID,REPO_TIRE_ID,NOPRESCRIPCION,FPRESCRIPCION,TIPOTECNOLOGIA,CONSECUTIVO,ESTJM,CODENTPROC,OBSERVACIONES,JUSTIFICACIONTECNICA,MODALIDAD,NOACTA,FECHAACTA,FPROCESO,TIPOIDPACIENTE,NROIDPACIENTE,CODENTJM) values ('719',to_date('19/06/19','DD/MM/RR'),'9','2','20190619194012684191',to_date('19/06/19','DD/MM/RR'),'N','1','2',null,null,null,null,null,to_date('01/01/70','DD/MM/RR'),null,'TI','1064314259','230010011601');
Insert into OASIS4.WEBSERV_JUNTA_PROFESIONAL (ID_JUPR,REPO_PERIODO,REPO_SERV_ID,REPO_TIRE_ID,NOPRESCRIPCION,FPRESCRIPCION,TIPOTECNOLOGIA,CONSECUTIVO,ESTJM,CODENTPROC,OBSERVACIONES,JUSTIFICACIONTECNICA,MODALIDAD,NOACTA,FECHAACTA,FPROCESO,TIPOIDPACIENTE,NROIDPACIENTE,CODENTJM) values ('720',to_date('19/06/19','DD/MM/RR'),'9','2','20190619155012684237',to_date('19/06/19','DD/MM/RR'),'N','1','3','080010226001',null,'a\tPACIENTE MASCULINO, 3 AÃ‘OS 4 MESES DE EDAD. PESO 10KG, TALLA 93CM. TALLA EAD MENOS 1, 57DS, PESO TALLA MENOS 3,93DS. CON POBRE GANANCIA DE PESO. REQUIERE SUPL','1','201923071208',to_date('23/07/19','DD/MM/RR'),'2019-07-23','RC','1234888800','080010226001');
Insert into OASIS4.WEBSERV_JUNTA_PROFESIONAL (ID_JUPR,REPO_PERIODO,REPO_SERV_ID,REPO_TIRE_ID,NOPRESCRIPCION,FPRESCRIPCION,TIPOTECNOLOGIA,CONSECUTIVO,ESTJM,CODENTPROC,OBSERVACIONES,JUSTIFICACIONTECNICA,MODALIDAD,NOACTA,FECHAACTA,FPROCESO,TIPOIDPACIENTE,NROIDPACIENTE,CODENTJM) values ('721',to_date('19/06/19','DD/MM/RR'),'9','2','20190619168012685863',to_date('19/06/19','DD/MM/RR'),'N','1','2',null,null,null,null,null,to_date('01/01/70','DD/MM/RR'),null,'CC','18461765','ESS076');
Insert into OASIS4.WEBSERV_JUNTA_PROFESIONAL (ID_JUPR,REPO_PERIODO,REPO_SERV_ID,REPO_TIRE_ID,NOPRESCRIPCION,FPRESCRIPCION,TIPOTECNOLOGIA,CONSECUTIVO,ESTJM,CODENTPROC,OBSERVACIONES,JUSTIFICACIONTECNICA,MODALIDAD,NOACTA,FECHAACTA,FPROCESO,TIPOIDPACIENTE,NROIDPACIENTE,CODENTJM) values ('722',to_date('19/06/19','DD/MM/RR'),'9','2','20190619111012687294',to_date('19/06/19','DD/MM/RR'),'N','1','3','760010379901',null,' AMBUQ','1','0484-19',to_date('11/07/19','DD/MM/RR'),'2019-07-11','CC','14630011','760010379901');
Insert into OASIS4.WEBSERV_JUNTA_PROFESIONAL (ID_JUPR,REPO_PERIODO,REPO_SERV_ID,REPO_TIRE_ID,NOPRESCRIPCION,FPRESCRIPCION,TIPOTECNOLOGIA,CONSECUTIVO,ESTJM,CODENTPROC,OBSERVACIONES,JUSTIFICACIONTECNICA,MODALIDAD,NOACTA,FECHAACTA,FPROCESO,TIPOIDPACIENTE,NROIDPACIENTE,CODENTJM) values ('723',to_date('19/06/19','DD/MM/RR'),'9','2','20190619186012687693',to_date('19/06/19','DD/MM/RR'),'N','1','2',null,null,null,null,null,to_date('01/01/70','DD/MM/RR'),null,'CC','1099964595','700010096901');
Insert into OASIS4.WEBSERV_JUNTA_PROFESIONAL (ID_JUPR,REPO_PERIODO,REPO_SERV_ID,REPO_TIRE_ID,NOPRESCRIPCION,FPRESCRIPCION,TIPOTECNOLOGIA,CONSECUTIVO,ESTJM,CODENTPROC,OBSERVACIONES,JUSTIFICACIONTECNICA,MODALIDAD,NOACTA,FECHAACTA,FPROCESO,TIPOIDPACIENTE,NROIDPACIENTE,CODENTJM) values ('724',to_date('19/06/19','DD/MM/RR'),'9','2','20190619168012690644',to_date('19/06/19','DD/MM/RR'),'N','1','3','080010380001',null,'PACIENTE FEMENINA DE 47 AÃ‘OS DE EDAD EN SITUACIÃ“N DE VULNERABILIDAD CON DIAGNÃ“STICO DE ANEMIA POR DÃ‰FICIT NUTRICIONAL, ANOREXIA Y ESTADO DE ABANDONO.','1','17',to_date('21/06/19','DD/MM/RR'),'2019-06-21','CC','22589808','080010380001');
Insert into OASIS4.WEBSERV_JUNTA_PROFESIONAL (ID_JUPR,REPO_PERIODO,REPO_SERV_ID,REPO_TIRE_ID,NOPRESCRIPCION,FPRESCRIPCION,TIPOTECNOLOGIA,CONSECUTIVO,ESTJM,CODENTPROC,OBSERVACIONES,JUSTIFICACIONTECNICA,MODALIDAD,NOACTA,FECHAACTA,FPROCESO,TIPOIDPACIENTE,NROIDPACIENTE,CODENTJM) values ('725',to_date('19/06/19','DD/MM/RR'),'9','2','20190619167012691271',to_date('19/06/19','DD/MM/RR'),'N','1','3','080010380001',null,'PACIENTE MASCULINO DE 60 AÃ‘OS DE EDAD CON ANTECEDENTE DE ALZHEIMER Y DESNUTRICION REQUIERE DE SUPLEMENTO DIETARIA PARA EVITAR DESCOMPENSACION.','1','17',to_date('09/07/19','DD/MM/RR'),'2019-07-09','CC','8704945','080010380001');
Insert into OASIS4.WEBSERV_JUNTA_PROFESIONAL (ID_JUPR,REPO_PERIODO,REPO_SERV_ID,REPO_TIRE_ID,NOPRESCRIPCION,FPRESCRIPCION,TIPOTECNOLOGIA,CONSECUTIVO,ESTJM,CODENTPROC,OBSERVACIONES,JUSTIFICACIONTECNICA,MODALIDAD,NOACTA,FECHAACTA,FPROCESO,TIPOIDPACIENTE,NROIDPACIENTE,CODENTJM) values ('726',to_date('19/06/19','DD/MM/RR'),'9','2','20190619168012685863',to_date('19/06/19','DD/MM/RR'),'S','2','2',null,null,null,null,null,to_date('01/01/70','DD/MM/RR'),null,'CC','18461765','ESS076');
Insert into OASIS4.WEBSERV_JUNTA_PROFESIONAL (ID_JUPR,REPO_PERIODO,REPO_SERV_ID,REPO_TIRE_ID,NOPRESCRIPCION,FPRESCRIPCION,TIPOTECNOLOGIA,CONSECUTIVO,ESTJM,CODENTPROC,OBSERVACIONES,JUSTIFICACIONTECNICA,MODALIDAD,NOACTA,FECHAACTA,FPROCESO,TIPOIDPACIENTE,NROIDPACIENTE,CODENTJM) values ('727',to_date('19/06/19','DD/MM/RR'),'9','2','20190619107012693684',to_date('19/06/19','DD/MM/RR'),'S','1','3','761470067210',null,'Se aprueba 450 paÃ±ales para 90 DÃ?AS a paciente por PATOLOGÃ?AS.','1','60',to_date('22/07/19','DD/MM/RR'),'2019-07-22','CC','29368494','761470067210');
Insert into OASIS4.WEBSERV_JUNTA_PROFESIONAL (ID_JUPR,REPO_PERIODO,REPO_SERV_ID,REPO_TIRE_ID,NOPRESCRIPCION,FPRESCRIPCION,TIPOTECNOLOGIA,CONSECUTIVO,ESTJM,CODENTPROC,OBSERVACIONES,JUSTIFICACIONTECNICA,MODALIDAD,NOACTA,FECHAACTA,FPROCESO,TIPOIDPACIENTE,NROIDPACIENTE,CODENTJM) values ('728',to_date('19/06/19','DD/MM/RR'),'9','2','20190619132012700369',to_date('19/06/19','DD/MM/RR'),'S','1','2',null,null,null,null,null,to_date('01/01/70','DD/MM/RR'),null,'RC','1050844712','134300049201');
Insert into OASIS4.WEBSERV_JUNTA_PROFESIONAL (ID_JUPR,REPO_PERIODO,REPO_SERV_ID,REPO_TIRE_ID,NOPRESCRIPCION,FPRESCRIPCION,TIPOTECNOLOGIA,CONSECUTIVO,ESTJM,CODENTPROC,OBSERVACIONES,JUSTIFICACIONTECNICA,MODALIDAD,NOACTA,FECHAACTA,FPROCESO,TIPOIDPACIENTE,NROIDPACIENTE,CODENTJM) values ('729',to_date('20/06/19','DD/MM/RR'),'9','2','20190620155012710697',to_date('20/06/19','DD/MM/RR'),'N','1','2',null,null,null,null,null,to_date('01/01/70','DD/MM/RR'),null,'TI','1114399767','ESS076');
Insert into OASIS4.WEBSERV_JUNTA_PROFESIONAL (ID_JUPR,REPO_PERIODO,REPO_SERV_ID,REPO_TIRE_ID,NOPRESCRIPCION,FPRESCRIPCION,TIPOTECNOLOGIA,CONSECUTIVO,ESTJM,CODENTPROC,OBSERVACIONES,JUSTIFICACIONTECNICA,MODALIDAD,NOACTA,FECHAACTA,FPROCESO,TIPOIDPACIENTE,NROIDPACIENTE,CODENTJM) values ('730',to_date('20/06/19','DD/MM/RR'),'9','2','20190620140012711224',to_date('20/06/19','DD/MM/RR'),'N','1','3','470580002301',null,'MENOR DE 2 AÃ‘OS DE EDAD, CON DESNUTRICIÃ“N PROTEICO CALORICA MODERADA CON PESO/TALLA PARA LA EDAD EN MENOS 2 DESVIACIONES STAND AR SEGÃšN RESOLUCIÃ“N 5406 DE 2015','1','002',to_date('24/06/19','DD/MM/RR'),'2019-06-25','RC','1068391590','470580002301');
Insert into OASIS4.WEBSERV_JUNTA_PROFESIONAL (ID_JUPR,REPO_PERIODO,REPO_SERV_ID,REPO_TIRE_ID,NOPRESCRIPCION,FPRESCRIPCION,TIPOTECNOLOGIA,CONSECUTIVO,ESTJM,CODENTPROC,OBSERVACIONES,JUSTIFICACIONTECNICA,MODALIDAD,NOACTA,FECHAACTA,FPROCESO,TIPOIDPACIENTE,NROIDPACIENTE,CODENTJM) values ('731',to_date('20/06/19','DD/MM/RR'),'9','2','20190620161012712366',to_date('20/06/19','DD/MM/RR'),'N','1','3','080010380001',null,'PACIENTE CON PESO DE 36.5 Y TALLA 1.47MTS IMC 1689 CON DIAGNOSTICO DE DESNUTRICIÃ“N MODERADA POR LO QUE ES PERTINENTE EL SUPLEMENTO ALIMENTICIO ','1','0004',to_date('20/06/19','DD/MM/RR'),'2019-06-20','CC','57455576','080010380001');
Insert into OASIS4.WEBSERV_JUNTA_PROFESIONAL (ID_JUPR,REPO_PERIODO,REPO_SERV_ID,REPO_TIRE_ID,NOPRESCRIPCION,FPRESCRIPCION,TIPOTECNOLOGIA,CONSECUTIVO,ESTJM,CODENTPROC,OBSERVACIONES,JUSTIFICACIONTECNICA,MODALIDAD,NOACTA,FECHAACTA,FPROCESO,TIPOIDPACIENTE,NROIDPACIENTE,CODENTJM) values ('732',to_date('20/06/19','DD/MM/RR'),'9','2','20190620196012714479',to_date('20/06/19','DD/MM/RR'),'N','1','3','080010380001',null,'PACIENTE CON IMC DE 16.8 PESO DE 36.5 Y TALLA 147 POR LO QUE ES NECESARIO SUPLEMENTOS ALIMENTICIOS PARA QUE RECUPERE SU CONDICIÃ“N FÃ?SICA Y MASA CORPORAL ','1','00005',to_date('20/06/19','DD/MM/RR'),'2019-06-20','CC','22687090','080010380001');
Insert into OASIS4.WEBSERV_JUNTA_PROFESIONAL (ID_JUPR,REPO_PERIODO,REPO_SERV_ID,REPO_TIRE_ID,NOPRESCRIPCION,FPRESCRIPCION,TIPOTECNOLOGIA,CONSECUTIVO,ESTJM,CODENTPROC,OBSERVACIONES,JUSTIFICACIONTECNICA,MODALIDAD,NOACTA,FECHAACTA,FPROCESO,TIPOIDPACIENTE,NROIDPACIENTE,CODENTJM) values ('733',to_date('20/06/19','DD/MM/RR'),'9','2','20190620168012715283',to_date('20/06/19','DD/MM/RR'),'N','1','3','086340010501',null,'PACIENTE DE 84 AÃ‘OS DE EDAD CON DIAGNOSTICO MEDICO HTA DIABETES MELLITUS  ARRITMIA CARDÃ?ACA Y DELGADEZ, PROBLEMAS PARA DEGLUTIR Y PERDIDAS NOTABLE DE PESO ','1','24',to_date('20/06/19','DD/MM/RR'),'2019-06-20','CC','858798','086340010501');
Insert into OASIS4.WEBSERV_JUNTA_PROFESIONAL (ID_JUPR,REPO_PERIODO,REPO_SERV_ID,REPO_TIRE_ID,NOPRESCRIPCION,FPRESCRIPCION,TIPOTECNOLOGIA,CONSECUTIVO,ESTJM,CODENTPROC,OBSERVACIONES,JUSTIFICACIONTECNICA,MODALIDAD,NOACTA,FECHAACTA,FPROCESO,TIPOIDPACIENTE,NROIDPACIENTE,CODENTJM) values ('734',to_date('20/06/19','DD/MM/RR'),'9','2','20190620177012715664',to_date('20/06/19','DD/MM/RR'),'N','1','3','760010379901',null,' AMBUQ','1','0493-19',to_date('11/07/19','DD/MM/RR'),'2019-07-11','CC','29842145','760010379901');
Insert into OASIS4.WEBSERV_JUNTA_PROFESIONAL (ID_JUPR,REPO_PERIODO,REPO_SERV_ID,REPO_TIRE_ID,NOPRESCRIPCION,FPRESCRIPCION,TIPOTECNOLOGIA,CONSECUTIVO,ESTJM,CODENTPROC,OBSERVACIONES,JUSTIFICACIONTECNICA,MODALIDAD,NOACTA,FECHAACTA,FPROCESO,TIPOIDPACIENTE,NROIDPACIENTE,CODENTJM) values ('735',to_date('20/06/19','DD/MM/RR'),'9','2','20190620111012716050',to_date('20/06/19','DD/MM/RR'),'N','1','3','760010379901',null,'AMBUQ','1','0494-19',to_date('11/07/19','DD/MM/RR'),'2019-07-11','TI','1006320379','760010379901');
Insert into OASIS4.WEBSERV_JUNTA_PROFESIONAL (ID_JUPR,REPO_PERIODO,REPO_SERV_ID,REPO_TIRE_ID,NOPRESCRIPCION,FPRESCRIPCION,TIPOTECNOLOGIA,CONSECUTIVO,ESTJM,CODENTPROC,OBSERVACIONES,JUSTIFICACIONTECNICA,MODALIDAD,NOACTA,FECHAACTA,FPROCESO,TIPOIDPACIENTE,NROIDPACIENTE,CODENTJM) values ('736',to_date('20/06/19','DD/MM/RR'),'9','2','20190620155012717142',to_date('20/06/19','DD/MM/RR'),'N','1','3','080010380001',null,'PACIENTE DIABÃ‰TICO, CON ALIMENTACIÃ“N LIQUIDA OPERADO DE CORAZÃ“N ABIERTO, CON HEMOGLOBINA BAJA POR LO QUE SE INDICA ALIMENTACIÃ“N COMPLEMENTARIA ','1','000007',to_date('20/06/19','DD/MM/RR'),'2019-06-20','CC','8764427','080010380001');
Insert into OASIS4.WEBSERV_JUNTA_PROFESIONAL (ID_JUPR,REPO_PERIODO,REPO_SERV_ID,REPO_TIRE_ID,NOPRESCRIPCION,FPRESCRIPCION,TIPOTECNOLOGIA,CONSECUTIVO,ESTJM,CODENTPROC,OBSERVACIONES,JUSTIFICACIONTECNICA,MODALIDAD,NOACTA,FECHAACTA,FPROCESO,TIPOIDPACIENTE,NROIDPACIENTE,CODENTJM) values ('737',to_date('20/06/19','DD/MM/RR'),'9','2','20190620139012722035',to_date('20/06/19','DD/MM/RR'),'N','1','3','080010380001',null,'paciente que por su estado nutricional ha venido con suplemento de glucerna y se ha visto mejoria','1','000008',to_date('21/06/19','DD/MM/RR'),'2019-06-21','CC','22693257','080010380001');
Insert into OASIS4.WEBSERV_JUNTA_PROFESIONAL (ID_JUPR,REPO_PERIODO,REPO_SERV_ID,REPO_TIRE_ID,NOPRESCRIPCION,FPRESCRIPCION,TIPOTECNOLOGIA,CONSECUTIVO,ESTJM,CODENTPROC,OBSERVACIONES,JUSTIFICACIONTECNICA,MODALIDAD,NOACTA,FECHAACTA,FPROCESO,TIPOIDPACIENTE,NROIDPACIENTE,CODENTJM) values ('738',to_date('20/06/19','DD/MM/RR'),'9','2','20190620117012732069',to_date('20/06/19','DD/MM/RR'),'S','1','3','080010349401',null,'DA ORDEN DE PAÃ‘ALES YA QUE PACIENTE PRESENTA TOTAL ESTADO DE DEPENDENCIA POR ANTECEDENTES Y POR NO CONTROL DE ESFÃ?NTERES POR LO QUE SE SOLICITA 2 CAMBIOS DIARIO','2','014',to_date('21/06/19','DD/MM/RR'),'2019-06-21','CC','22268404','080010349401');
Insert into OASIS4.WEBSERV_JUNTA_PROFESIONAL (ID_JUPR,REPO_PERIODO,REPO_SERV_ID,REPO_TIRE_ID,NOPRESCRIPCION,FPRESCRIPCION,TIPOTECNOLOGIA,CONSECUTIVO,ESTJM,CODENTPROC,OBSERVACIONES,JUSTIFICACIONTECNICA,MODALIDAD,NOACTA,FECHAACTA,FPROCESO,TIPOIDPACIENTE,NROIDPACIENTE,CODENTJM) values ('739',to_date('21/06/19','DD/MM/RR'),'9','2','20190621118012734214',to_date('21/06/19','DD/MM/RR'),'N','1','3','082960002101',null,'PACIENTE ADULTA MAYOR, DIABETICO, CON BAJO PESO EN GRADO DESNUTRICIÃ“N QUE REQUIERE SOPORTE NUTRICIONAL PARA MEJORAR SU ESTADO NUTRICIONAL ','1','17',to_date('08/07/19','DD/MM/RR'),'2019-07-08','CC','22499159','082960002101');
Insert into OASIS4.WEBSERV_JUNTA_PROFESIONAL (ID_JUPR,REPO_PERIODO,REPO_SERV_ID,REPO_TIRE_ID,NOPRESCRIPCION,FPRESCRIPCION,TIPOTECNOLOGIA,CONSECUTIVO,ESTJM,CODENTPROC,OBSERVACIONES,JUSTIFICACIONTECNICA,MODALIDAD,NOACTA,FECHAACTA,FPROCESO,TIPOIDPACIENTE,NROIDPACIENTE,CODENTJM) values ('740',to_date('21/06/19','DD/MM/RR'),'9','2','20190621151012735510',to_date('21/06/19','DD/MM/RR'),'N','1','2',null,null,null,null,null,to_date('01/01/70','DD/MM/RR'),null,'CC','33209608','134300290801');
Insert into OASIS4.WEBSERV_JUNTA_PROFESIONAL (ID_JUPR,REPO_PERIODO,REPO_SERV_ID,REPO_TIRE_ID,NOPRESCRIPCION,FPRESCRIPCION,TIPOTECNOLOGIA,CONSECUTIVO,ESTJM,CODENTPROC,OBSERVACIONES,JUSTIFICACIONTECNICA,MODALIDAD,NOACTA,FECHAACTA,FPROCESO,TIPOIDPACIENTE,NROIDPACIENTE,CODENTJM) values ('741',to_date('21/06/19','DD/MM/RR'),'9','2','20190621150012737269',to_date('21/06/19','DD/MM/RR'),'N','1','3','080010380001',null,'paciente de 57 aÃ±os de edad con antecedente de reseccion de tumor en colon transverso y colostomia, requiere de nutricion complementaria.','1','20',to_date('10/07/19','DD/MM/RR'),'2019-07-10','CC','8758656','080010380001');
Insert into OASIS4.WEBSERV_JUNTA_PROFESIONAL (ID_JUPR,REPO_PERIODO,REPO_SERV_ID,REPO_TIRE_ID,NOPRESCRIPCION,FPRESCRIPCION,TIPOTECNOLOGIA,CONSECUTIVO,ESTJM,CODENTPROC,OBSERVACIONES,JUSTIFICACIONTECNICA,MODALIDAD,NOACTA,FECHAACTA,FPROCESO,TIPOIDPACIENTE,NROIDPACIENTE,CODENTJM) values ('742',to_date('21/06/19','DD/MM/RR'),'9','2','20190621148012742358',to_date('21/06/19','DD/MM/RR'),'N','1','3','085580015701',null,'paciente de 2Ã±os 6 meses de edad con peso de 9.4kg talla 84cm con diagnostico nutricional de desnutricion aguda moderada que requiere de ftlc','1','01',to_date('21/06/19','DD/MM/RR'),'2019-06-21','RC','1046817972','085580015701');
Insert into OASIS4.WEBSERV_JUNTA_PROFESIONAL (ID_JUPR,REPO_PERIODO,REPO_SERV_ID,REPO_TIRE_ID,NOPRESCRIPCION,FPRESCRIPCION,TIPOTECNOLOGIA,CONSECUTIVO,ESTJM,CODENTPROC,OBSERVACIONES,JUSTIFICACIONTECNICA,MODALIDAD,NOACTA,FECHAACTA,FPROCESO,TIPOIDPACIENTE,NROIDPACIENTE,CODENTJM) values ('743',to_date('21/06/19','DD/MM/RR'),'9','2','20190621184012744937',to_date('21/06/19','DD/MM/RR'),'N','1','3','087580001301',null,'paciente con epilepsia y sindromes epilepticos deficiencia nutricional se inicia soporte nutricional oral, ya que presenta dificultad para ingerir alimentos .','1','076-2019',to_date('28/06/19','DD/MM/RR'),'2019-07-02','TI','1048277196','087580001301');
Insert into OASIS4.WEBSERV_JUNTA_PROFESIONAL (ID_JUPR,REPO_PERIODO,REPO_SERV_ID,REPO_TIRE_ID,NOPRESCRIPCION,FPRESCRIPCION,TIPOTECNOLOGIA,CONSECUTIVO,ESTJM,CODENTPROC,OBSERVACIONES,JUSTIFICACIONTECNICA,MODALIDAD,NOACTA,FECHAACTA,FPROCESO,TIPOIDPACIENTE,NROIDPACIENTE,CODENTJM) values ('744',to_date('21/06/19','DD/MM/RR'),'9','2','20190621177012745862',to_date('21/06/19','DD/MM/RR'),'N','1','3','134300290801',null,'pcte con desnutricion y cardiomiopatia isquemica, presencia de stado hipercatabolico, se inidica alimentacion hiperproteica ','1','26',to_date('25/06/19','DD/MM/RR'),'2019-06-25','CC','9125104','134300290801');
Insert into OASIS4.WEBSERV_JUNTA_PROFESIONAL (ID_JUPR,REPO_PERIODO,REPO_SERV_ID,REPO_TIRE_ID,NOPRESCRIPCION,FPRESCRIPCION,TIPOTECNOLOGIA,CONSECUTIVO,ESTJM,CODENTPROC,OBSERVACIONES,JUSTIFICACIONTECNICA,MODALIDAD,NOACTA,FECHAACTA,FPROCESO,TIPOIDPACIENTE,NROIDPACIENTE,CODENTJM) values ('745',to_date('21/06/19','DD/MM/RR'),'9','2','20190621147012746172',to_date('21/06/19','DD/MM/RR'),'N','1','2',null,null,null,null,null,to_date('01/01/70','DD/MM/RR'),null,'CC','8633218','086380074501');
Insert into OASIS4.WEBSERV_JUNTA_PROFESIONAL (ID_JUPR,REPO_PERIODO,REPO_SERV_ID,REPO_TIRE_ID,NOPRESCRIPCION,FPRESCRIPCION,TIPOTECNOLOGIA,CONSECUTIVO,ESTJM,CODENTPROC,OBSERVACIONES,JUSTIFICACIONTECNICA,MODALIDAD,NOACTA,FECHAACTA,FPROCESO,TIPOIDPACIENTE,NROIDPACIENTE,CODENTJM) values ('746',to_date('21/06/19','DD/MM/RR'),'9','2','20190621171012750638',to_date('21/06/19','DD/MM/RR'),'N','1','2',null,null,null,null,null,to_date('01/01/70','DD/MM/RR'),null,'CC','22302827','080010445402');
Insert into OASIS4.WEBSERV_JUNTA_PROFESIONAL (ID_JUPR,REPO_PERIODO,REPO_SERV_ID,REPO_TIRE_ID,NOPRESCRIPCION,FPRESCRIPCION,TIPOTECNOLOGIA,CONSECUTIVO,ESTJM,CODENTPROC,OBSERVACIONES,JUSTIFICACIONTECNICA,MODALIDAD,NOACTA,FECHAACTA,FPROCESO,TIPOIDPACIENTE,NROIDPACIENTE,CODENTJM) values ('747',to_date('21/06/19','DD/MM/RR'),'9','2','20190621175012750932',to_date('21/06/19','DD/MM/RR'),'N','1','3','080010380001',null,'PACIENTE PREESCOLAR CON DIFICULTAD EN LA ADMINISTRACION DE LOS ALIMIENTOS POR ANTECEDENTE DE DESNUTRICION MODERADA SE RECOMENDA REFORZAR DIETA CON SUPLEMENTO.','1','19',to_date('09/07/19','DD/MM/RR'),'2019-07-09','RC','1044661398','080010380001');
Insert into OASIS4.WEBSERV_JUNTA_PROFESIONAL (ID_JUPR,REPO_PERIODO,REPO_SERV_ID,REPO_TIRE_ID,NOPRESCRIPCION,FPRESCRIPCION,TIPOTECNOLOGIA,CONSECUTIVO,ESTJM,CODENTPROC,OBSERVACIONES,JUSTIFICACIONTECNICA,MODALIDAD,NOACTA,FECHAACTA,FPROCESO,TIPOIDPACIENTE,NROIDPACIENTE,CODENTJM) values ('748',to_date('21/06/19','DD/MM/RR'),'9','2','20190621144012739971',to_date('21/06/19','DD/MM/RR'),'S','1','3','470010096901',null,'PACIENTE PROSTADA EN CAMA DEPENDIENTE CON SECUELAS DE ENFERMEDAD CEREBRO VASCULAR QUE AMERITA TRASLADO EN AMBULANCIA YA QUE POR SUS CONDICIONES NO SE PUEDE TRA','1','896',to_date('21/06/19','DD/MM/RR'),'2019-06-21','CC','27002016','470010096901');
Insert into OASIS4.WEBSERV_JUNTA_PROFESIONAL (ID_JUPR,REPO_PERIODO,REPO_SERV_ID,REPO_TIRE_ID,NOPRESCRIPCION,FPRESCRIPCION,TIPOTECNOLOGIA,CONSECUTIVO,ESTJM,CODENTPROC,OBSERVACIONES,JUSTIFICACIONTECNICA,MODALIDAD,NOACTA,FECHAACTA,FPROCESO,TIPOIDPACIENTE,NROIDPACIENTE,CODENTJM) values ('749',to_date('21/06/19','DD/MM/RR'),'9','2','20190621122012741836',to_date('21/06/19','DD/MM/RR'),'S','1','3','470010096901',null,'PACIENTE PROSTADA EN CAMA DEPENDIENTE CON SECUELAS DE ENFERMEDAD DE ALZHEIMER ADEMAS DE ULCERAS SOBREINFECTADAS QUE AMERITA TRASLADO EN AMBULANCIA YA QUE POR S','1','897',to_date('21/06/19','DD/MM/RR'),'2019-06-21','CC','42486073','470010096901');
Insert into OASIS4.WEBSERV_JUNTA_PROFESIONAL (ID_JUPR,REPO_PERIODO,REPO_SERV_ID,REPO_TIRE_ID,NOPRESCRIPCION,FPRESCRIPCION,TIPOTECNOLOGIA,CONSECUTIVO,ESTJM,CODENTPROC,OBSERVACIONES,JUSTIFICACIONTECNICA,MODALIDAD,NOACTA,FECHAACTA,FPROCESO,TIPOIDPACIENTE,NROIDPACIENTE,CODENTJM) values ('750',to_date('22/06/19','DD/MM/RR'),'9','2','20190622165012762286',to_date('22/06/19','DD/MM/RR'),'N','1','3','080010054401',null,'LA JUNTA MEDICA HA REVISADO SU CASO Y DECIDEN POR CONDICION CLINICA DEL PACIENTE SE AUTORIZA EL USO DE FORMULA NUTRICIONAL POLIMERICA ENSURE 900 GR ','1','0878',to_date('22/06/19','DD/MM/RR'),'2019-06-22','CC','1048270750','080010054401');
Insert into OASIS4.WEBSERV_JUNTA_PROFESIONAL (ID_JUPR,REPO_PERIODO,REPO_SERV_ID,REPO_TIRE_ID,NOPRESCRIPCION,FPRESCRIPCION,TIPOTECNOLOGIA,CONSECUTIVO,ESTJM,CODENTPROC,OBSERVACIONES,JUSTIFICACIONTECNICA,MODALIDAD,NOACTA,FECHAACTA,FPROCESO,TIPOIDPACIENTE,NROIDPACIENTE,CODENTJM) values ('751',to_date('22/06/19','DD/MM/RR'),'9','2','20190622183012762935',to_date('22/06/19','DD/MM/RR'),'N','1','3','080010134801',null,'PACIENTE CUMPLE CON LAS CARACTERISTICAS PATOLOGICAS CRONICAS PARA LA APROBACION DEL INSUMO','2','155',to_date('25/06/19','DD/MM/RR'),'2019-06-25','CC','22309635','080010134801');
Insert into OASIS4.WEBSERV_JUNTA_PROFESIONAL (ID_JUPR,REPO_PERIODO,REPO_SERV_ID,REPO_TIRE_ID,NOPRESCRIPCION,FPRESCRIPCION,TIPOTECNOLOGIA,CONSECUTIVO,ESTJM,CODENTPROC,OBSERVACIONES,JUSTIFICACIONTECNICA,MODALIDAD,NOACTA,FECHAACTA,FPROCESO,TIPOIDPACIENTE,NROIDPACIENTE,CODENTJM) values ('752',to_date('24/06/19','DD/MM/RR'),'9','2','20190624113012769654',to_date('24/06/19','DD/MM/RR'),'N','1','3','761470851601',null,'PACIENTE POSTRADA CON DX DE VARIAS MORBILIDADES ENTRE ELLAS LA DNT DE TIPO CRÃ“NICO Y CON EPOC CON O2 REQUIRENTE','1','MP0094',to_date('25/06/19','DD/MM/RR'),'2019-06-25','CC','31036141','761470851601');
Insert into OASIS4.WEBSERV_JUNTA_PROFESIONAL (ID_JUPR,REPO_PERIODO,REPO_SERV_ID,REPO_TIRE_ID,NOPRESCRIPCION,FPRESCRIPCION,TIPOTECNOLOGIA,CONSECUTIVO,ESTJM,CODENTPROC,OBSERVACIONES,JUSTIFICACIONTECNICA,MODALIDAD,NOACTA,FECHAACTA,FPROCESO,TIPOIDPACIENTE,NROIDPACIENTE,CODENTJM) values ('753',to_date('25/06/19','DD/MM/RR'),'9','2','20190625192012770608',to_date('25/06/19','DD/MM/RR'),'N','1','2',null,null,null,null,null,to_date('01/01/70','DD/MM/RR'),null,'RC','1041851763','082960002101');
Insert into OASIS4.WEBSERV_JUNTA_PROFESIONAL (ID_JUPR,REPO_PERIODO,REPO_SERV_ID,REPO_TIRE_ID,NOPRESCRIPCION,FPRESCRIPCION,TIPOTECNOLOGIA,CONSECUTIVO,ESTJM,CODENTPROC,OBSERVACIONES,JUSTIFICACIONTECNICA,MODALIDAD,NOACTA,FECHAACTA,FPROCESO,TIPOIDPACIENTE,NROIDPACIENTE,CODENTJM) values ('754',to_date('25/06/19','DD/MM/RR'),'9','2','20190625177012770807',to_date('25/06/19','DD/MM/RR'),'N','1','3','082960002101',null,'DESNUTRICION PROTEICOCALORICA','1','022',to_date('26/06/19','DD/MM/RR'),'2019-06-26','RC','1041851763','082960002101');
Insert into OASIS4.WEBSERV_JUNTA_PROFESIONAL (ID_JUPR,REPO_PERIODO,REPO_SERV_ID,REPO_TIRE_ID,NOPRESCRIPCION,FPRESCRIPCION,TIPOTECNOLOGIA,CONSECUTIVO,ESTJM,CODENTPROC,OBSERVACIONES,JUSTIFICACIONTECNICA,MODALIDAD,NOACTA,FECHAACTA,FPROCESO,TIPOIDPACIENTE,NROIDPACIENTE,CODENTJM) values ('755',to_date('25/06/19','DD/MM/RR'),'9','2','20190625134012772332',to_date('25/06/19','DD/MM/RR'),'N','1','3','082960002101',null,'NIÃ‘A CON RIESGO DE DESNUTRICION AGUDA, DIFICULTADES Y MALA ADMINISTRACION DE LA ALIMENTACION ','1','29',to_date('08/07/19','DD/MM/RR'),'2019-07-08','RC','1047239700','082960002101');
Insert into OASIS4.WEBSERV_JUNTA_PROFESIONAL (ID_JUPR,REPO_PERIODO,REPO_SERV_ID,REPO_TIRE_ID,NOPRESCRIPCION,FPRESCRIPCION,TIPOTECNOLOGIA,CONSECUTIVO,ESTJM,CODENTPROC,OBSERVACIONES,JUSTIFICACIONTECNICA,MODALIDAD,NOACTA,FECHAACTA,FPROCESO,TIPOIDPACIENTE,NROIDPACIENTE,CODENTJM) values ('756',to_date('25/06/19','DD/MM/RR'),'9','2','20190625148012772724',to_date('25/06/19','DD/MM/RR'),'N','1','3','082960002101',null,'NIÃ‘A CON RIESGO DE DESNUTRICION, DIFICULTADES Y MALA ADMINISTRACIÃ“N DE LA ALIMENTACIÃ“N.','1','28',to_date('08/07/19','DD/MM/RR'),'2019-07-08','RC','1047239701','082960002101');
Insert into OASIS4.WEBSERV_JUNTA_PROFESIONAL (ID_JUPR,REPO_PERIODO,REPO_SERV_ID,REPO_TIRE_ID,NOPRESCRIPCION,FPRESCRIPCION,TIPOTECNOLOGIA,CONSECUTIVO,ESTJM,CODENTPROC,OBSERVACIONES,JUSTIFICACIONTECNICA,MODALIDAD,NOACTA,FECHAACTA,FPROCESO,TIPOIDPACIENTE,NROIDPACIENTE,CODENTJM) values ('757',to_date('25/06/19','DD/MM/RR'),'9','2','20190625193012776072',to_date('25/06/19','DD/MM/RR'),'N','1','3','761470851601',null,'quien requiere complementar su nutricion, con alimento en polvo, completo y balanceado, con HMB (ÃŸ-hidroxiÃŸ-metilbutirato), proteÃ­na y vitamina D, vÃ­a oral','1','MP0093',to_date('25/06/19','DD/MM/RR'),'2019-06-25','CC','29388015','761470851601');
Insert into OASIS4.WEBSERV_JUNTA_PROFESIONAL (ID_JUPR,REPO_PERIODO,REPO_SERV_ID,REPO_TIRE_ID,NOPRESCRIPCION,FPRESCRIPCION,TIPOTECNOLOGIA,CONSECUTIVO,ESTJM,CODENTPROC,OBSERVACIONES,JUSTIFICACIONTECNICA,MODALIDAD,NOACTA,FECHAACTA,FPROCESO,TIPOIDPACIENTE,NROIDPACIENTE,CODENTJM) values ('758',to_date('25/06/19','DD/MM/RR'),'9','2','20190625194012777799',to_date('25/06/19','DD/MM/RR'),'N','1','2',null,null,null,null,null,to_date('01/01/70','DD/MM/RR'),null,'CC','22371059','200010043101');
Insert into OASIS4.WEBSERV_JUNTA_PROFESIONAL (ID_JUPR,REPO_PERIODO,REPO_SERV_ID,REPO_TIRE_ID,NOPRESCRIPCION,FPRESCRIPCION,TIPOTECNOLOGIA,CONSECUTIVO,ESTJM,CODENTPROC,OBSERVACIONES,JUSTIFICACIONTECNICA,MODALIDAD,NOACTA,FECHAACTA,FPROCESO,TIPOIDPACIENTE,NROIDPACIENTE,CODENTJM) values ('759',to_date('25/06/19','DD/MM/RR'),'9','2','20190625141012778397',to_date('25/06/19','DD/MM/RR'),'N','1','3','470580002301',null,'FEMENINA DE 27 AÃ‘OS DE EDAD CON TRASTORNOS DEL HABLA Y DEL COMPORTAMIENTO CON DESNUTRICIÃ“N  PROTEICO CALORICA SEVERA CON IMC 13 QUE NO HA RESPONDIDO A  DIETA','1','003',to_date('25/06/19','DD/MM/RR'),'2019-06-25','CC','1151187478','470580002301');
Insert into OASIS4.WEBSERV_JUNTA_PROFESIONAL (ID_JUPR,REPO_PERIODO,REPO_SERV_ID,REPO_TIRE_ID,NOPRESCRIPCION,FPRESCRIPCION,TIPOTECNOLOGIA,CONSECUTIVO,ESTJM,CODENTPROC,OBSERVACIONES,JUSTIFICACIONTECNICA,MODALIDAD,NOACTA,FECHAACTA,FPROCESO,TIPOIDPACIENTE,NROIDPACIENTE,CODENTJM) values ('760',to_date('25/06/19','DD/MM/RR'),'9','2','20190625171012782228',to_date('25/06/19','DD/MM/RR'),'N','1','3','087580106601',null,'PACIENTE QUE AMERITA FORMULA  hipercalorica POR PRESENTAR deficit de peso y talla, ','1','00007',to_date('29/06/19','DD/MM/RR'),'2019-06-29','RC','1130283909','087580106601');
Insert into OASIS4.WEBSERV_JUNTA_PROFESIONAL (ID_JUPR,REPO_PERIODO,REPO_SERV_ID,REPO_TIRE_ID,NOPRESCRIPCION,FPRESCRIPCION,TIPOTECNOLOGIA,CONSECUTIVO,ESTJM,CODENTPROC,OBSERVACIONES,JUSTIFICACIONTECNICA,MODALIDAD,NOACTA,FECHAACTA,FPROCESO,TIPOIDPACIENTE,NROIDPACIENTE,CODENTJM) values ('761',to_date('25/06/19','DD/MM/RR'),'9','2','20190625174012782536',to_date('25/06/19','DD/MM/RR'),'N','1','3','130010210201',null,'EL REQUERIMIENTO DEL BUEN ESTADO NUTRICIONAL Y DEL SOPORTE DE APORTE CALORICO PARA GARANTIZAR PROCEDIMIENTO QUIRURGICO PESO 19 KG-','1','34',to_date('25/06/19','DD/MM/RR'),'2019-06-25','RC','1048607219','130010210201');
Insert into OASIS4.WEBSERV_JUNTA_PROFESIONAL (ID_JUPR,REPO_PERIODO,REPO_SERV_ID,REPO_TIRE_ID,NOPRESCRIPCION,FPRESCRIPCION,TIPOTECNOLOGIA,CONSECUTIVO,ESTJM,CODENTPROC,OBSERVACIONES,JUSTIFICACIONTECNICA,MODALIDAD,NOACTA,FECHAACTA,FPROCESO,TIPOIDPACIENTE,NROIDPACIENTE,CODENTJM) values ('762',to_date('25/06/19','DD/MM/RR'),'9','2','20190625194012786044',to_date('25/06/19','DD/MM/RR'),'N','1','3','130010178101',null,'paciente de 47 kgSIGUE CON DÃ‰FICIT DE PESO,ACTUALMENTE CONSUME LOS ALIMENTOS, QUE LE APETECEN Y LO QUE LOGRA CONSEGUIR, CON FRECUENCIA SUFRE DE ASMA, DEBILIDAD ','1','44',to_date('26/06/19','DD/MM/RR'),'2019-06-26','CC','73077165','130010178101');
Insert into OASIS4.WEBSERV_JUNTA_PROFESIONAL (ID_JUPR,REPO_PERIODO,REPO_SERV_ID,REPO_TIRE_ID,NOPRESCRIPCION,FPRESCRIPCION,TIPOTECNOLOGIA,CONSECUTIVO,ESTJM,CODENTPROC,OBSERVACIONES,JUSTIFICACIONTECNICA,MODALIDAD,NOACTA,FECHAACTA,FPROCESO,TIPOIDPACIENTE,NROIDPACIENTE,CODENTJM) values ('763',to_date('25/06/19','DD/MM/RR'),'9','2','20190625153012793305',to_date('25/06/19','DD/MM/RR'),'N','1','3','087580053302',null,'PACIENTE CON DX ALZHEIMER, CON DEFICIT ALIMENTARIO, PESO 30 KG, TALLA 157 IMC 12.1','1','0000200',to_date('29/06/19','DD/MM/RR'),'2019-06-29','CC','22943202','087580053302');
Insert into OASIS4.WEBSERV_JUNTA_PROFESIONAL (ID_JUPR,REPO_PERIODO,REPO_SERV_ID,REPO_TIRE_ID,NOPRESCRIPCION,FPRESCRIPCION,TIPOTECNOLOGIA,CONSECUTIVO,ESTJM,CODENTPROC,OBSERVACIONES,JUSTIFICACIONTECNICA,MODALIDAD,NOACTA,FECHAACTA,FPROCESO,TIPOIDPACIENTE,NROIDPACIENTE,CODENTJM) values ('764',to_date('26/06/19','DD/MM/RR'),'9','2','20190626194012804125',to_date('26/06/19','DD/MM/RR'),'N','1','3','082960002101',null,'NIÃ‘A CON SIDROME DE MARFAN, DESNUTRICIÃ“N PROTEICO CALORICA, QUE REQUIERE SOPORTE NUTRICIONAL PARA MEJORAR SUS CONDICIONES NUTRICIONALES ','1','21',to_date('08/07/19','DD/MM/RR'),'2019-07-08','TI','1047225829','082960002101');
Insert into OASIS4.WEBSERV_JUNTA_PROFESIONAL (ID_JUPR,REPO_PERIODO,REPO_SERV_ID,REPO_TIRE_ID,NOPRESCRIPCION,FPRESCRIPCION,TIPOTECNOLOGIA,CONSECUTIVO,ESTJM,CODENTPROC,OBSERVACIONES,JUSTIFICACIONTECNICA,MODALIDAD,NOACTA,FECHAACTA,FPROCESO,TIPOIDPACIENTE,NROIDPACIENTE,CODENTJM) values ('765',to_date('26/06/19','DD/MM/RR'),'9','2','20190626170012807885',to_date('26/06/19','DD/MM/RR'),'N','1','3','082960002101',null,'ADULTA MAYOR CON SINDROME DE ALZHEIMER, PERDIDA DE MASA CORPORAL INAPETENTE, QUE REQUIERE COMPLEMENTO PARA AYUDAR A MEJORAR SUS CONDICIONES ALIMENTARIAS.','1','18',to_date('08/07/19','DD/MM/RR'),'2019-07-08','CC','32620995','082960002101');
Insert into OASIS4.WEBSERV_JUNTA_PROFESIONAL (ID_JUPR,REPO_PERIODO,REPO_SERV_ID,REPO_TIRE_ID,NOPRESCRIPCION,FPRESCRIPCION,TIPOTECNOLOGIA,CONSECUTIVO,ESTJM,CODENTPROC,OBSERVACIONES,JUSTIFICACIONTECNICA,MODALIDAD,NOACTA,FECHAACTA,FPROCESO,TIPOIDPACIENTE,NROIDPACIENTE,CODENTJM) values ('766',to_date('26/06/19','DD/MM/RR'),'9','2','20190626121012808432',to_date('26/06/19','DD/MM/RR'),'N','1','3','080010380001',null,'PACIENTE CON DIAGNOSTICO DE DESNUTRICION SEVERA PASO DE 38 A 36 Kg PARA PREVENIR DESCOMPENSACION SE ENVIA SUPLEMENTO DIETARIO POR 3 MESES.','1','22',to_date('10/07/19','DD/MM/RR'),'2019-07-10','CC','22455110','080010380001');
Insert into OASIS4.WEBSERV_JUNTA_PROFESIONAL (ID_JUPR,REPO_PERIODO,REPO_SERV_ID,REPO_TIRE_ID,NOPRESCRIPCION,FPRESCRIPCION,TIPOTECNOLOGIA,CONSECUTIVO,ESTJM,CODENTPROC,OBSERVACIONES,JUSTIFICACIONTECNICA,MODALIDAD,NOACTA,FECHAACTA,FPROCESO,TIPOIDPACIENTE,NROIDPACIENTE,CODENTJM) values ('767',to_date('26/06/19','DD/MM/RR'),'9','2','20190626127012808789',to_date('26/06/19','DD/MM/RR'),'N','1','3','080010380001',null,'paciente de 79 aÃ±os de edad con antecedente de desnutricion leve y reciente neumonia, requiere de alimentacion complementaria para prevenir descompensacion.','1','23',to_date('10/07/19','DD/MM/RR'),'2019-07-10','CC','7399360','080010380001');
Insert into OASIS4.WEBSERV_JUNTA_PROFESIONAL (ID_JUPR,REPO_PERIODO,REPO_SERV_ID,REPO_TIRE_ID,NOPRESCRIPCION,FPRESCRIPCION,TIPOTECNOLOGIA,CONSECUTIVO,ESTJM,CODENTPROC,OBSERVACIONES,JUSTIFICACIONTECNICA,MODALIDAD,NOACTA,FECHAACTA,FPROCESO,TIPOIDPACIENTE,NROIDPACIENTE,CODENTJM) values ('768',to_date('26/06/19','DD/MM/RR'),'9','2','20190626190012809163',to_date('26/06/19','DD/MM/RR'),'N','1','3','080010380001',null,'paciente de 72 aÃ±os de edad con antecedente de diabetes mellitus insulinodependiente con cifras glucometricas siempre fuera de las metas, requiere de glucerna.','1','21',to_date('10/07/19','DD/MM/RR'),'2019-07-10','CC','10068469','080010380001');
Insert into OASIS4.WEBSERV_JUNTA_PROFESIONAL (ID_JUPR,REPO_PERIODO,REPO_SERV_ID,REPO_TIRE_ID,NOPRESCRIPCION,FPRESCRIPCION,TIPOTECNOLOGIA,CONSECUTIVO,ESTJM,CODENTPROC,OBSERVACIONES,JUSTIFICACIONTECNICA,MODALIDAD,NOACTA,FECHAACTA,FPROCESO,TIPOIDPACIENTE,NROIDPACIENTE,CODENTJM) values ('769',to_date('26/06/19','DD/MM/RR'),'9','2','20190626165012812239',to_date('26/06/19','DD/MM/RR'),'N','1','3','130010210201',null,'LA DESNUTRICION SEVERA PREDISPONE AL RIESGO DE  NEONATO DE BAJO PESO AL NACER DE 2 A 5 VECES PESO 38 KGS INICIO EMBARAZO REQUIERE GARANTIA DE APORTES CALORICOS','1','37',to_date('26/06/19','DD/MM/RR'),'2019-06-26','CC','1001967628','130010210201');
Insert into OASIS4.WEBSERV_JUNTA_PROFESIONAL (ID_JUPR,REPO_PERIODO,REPO_SERV_ID,REPO_TIRE_ID,NOPRESCRIPCION,FPRESCRIPCION,TIPOTECNOLOGIA,CONSECUTIVO,ESTJM,CODENTPROC,OBSERVACIONES,JUSTIFICACIONTECNICA,MODALIDAD,NOACTA,FECHAACTA,FPROCESO,TIPOIDPACIENTE,NROIDPACIENTE,CODENTJM) values ('770',to_date('26/06/19','DD/MM/RR'),'9','2','20190626116012813587',to_date('26/06/19','DD/MM/RR'),'N','1','3','130010210201',null,'GRAN IMPACTO NUTRICIONAL SEVERO LAS PATOLOGIAS BASES QUE EXACERBAN Y EL IMC EN 14.2 POR CIENTO REQUIERE COMPLEMENTAR SOPORTE NUTRICIONAL GARANTIZADO','1','38',to_date('26/06/19','DD/MM/RR'),'2019-06-26','CC','1052738088','130010210201');
Insert into OASIS4.WEBSERV_JUNTA_PROFESIONAL (ID_JUPR,REPO_PERIODO,REPO_SERV_ID,REPO_TIRE_ID,NOPRESCRIPCION,FPRESCRIPCION,TIPOTECNOLOGIA,CONSECUTIVO,ESTJM,CODENTPROC,OBSERVACIONES,JUSTIFICACIONTECNICA,MODALIDAD,NOACTA,FECHAACTA,FPROCESO,TIPOIDPACIENTE,NROIDPACIENTE,CODENTJM) values ('771',to_date('26/06/19','DD/MM/RR'),'9','2','20190626186012816659',to_date('26/06/19','DD/MM/RR'),'N','1','3','130010178101',null,'PRESENTA INDICE DE MASA CORPORAL BAJO, MANIFIESTA FAMILIAR, QUE ALGUNAS VECES, NO LE APETECE CONSUMIR LOS ALIMENTOS, PRESENTANDO DIFICULTAD, PARA MASTICAR Y DEG','1','46',to_date('26/06/19','DD/MM/RR'),'2019-06-26','CC','23197478','130010178101');
Insert into OASIS4.WEBSERV_JUNTA_PROFESIONAL (ID_JUPR,REPO_PERIODO,REPO_SERV_ID,REPO_TIRE_ID,NOPRESCRIPCION,FPRESCRIPCION,TIPOTECNOLOGIA,CONSECUTIVO,ESTJM,CODENTPROC,OBSERVACIONES,JUSTIFICACIONTECNICA,MODALIDAD,NOACTA,FECHAACTA,FPROCESO,TIPOIDPACIENTE,NROIDPACIENTE,CODENTJM) values ('772',to_date('26/06/19','DD/MM/RR'),'9','2','20190626126012817853',to_date('26/06/19','DD/MM/RR'),'N','1','2',null,null,null,null,null,to_date('01/01/70','DD/MM/RR'),null,'CC','1006246252','760410406501');
Insert into OASIS4.WEBSERV_JUNTA_PROFESIONAL (ID_JUPR,REPO_PERIODO,REPO_SERV_ID,REPO_TIRE_ID,NOPRESCRIPCION,FPRESCRIPCION,TIPOTECNOLOGIA,CONSECUTIVO,ESTJM,CODENTPROC,OBSERVACIONES,JUSTIFICACIONTECNICA,MODALIDAD,NOACTA,FECHAACTA,FPROCESO,TIPOIDPACIENTE,NROIDPACIENTE,CODENTJM) values ('773',to_date('26/06/19','DD/MM/RR'),'9','2','20190626181012823015',to_date('26/06/19','DD/MM/RR'),'N','1','2',null,null,null,null,null,to_date('01/01/70','DD/MM/RR'),null,'CC','1201217923','132440082603');
Insert into OASIS4.WEBSERV_JUNTA_PROFESIONAL (ID_JUPR,REPO_PERIODO,REPO_SERV_ID,REPO_TIRE_ID,NOPRESCRIPCION,FPRESCRIPCION,TIPOTECNOLOGIA,CONSECUTIVO,ESTJM,CODENTPROC,OBSERVACIONES,JUSTIFICACIONTECNICA,MODALIDAD,NOACTA,FECHAACTA,FPROCESO,TIPOIDPACIENTE,NROIDPACIENTE,CODENTJM) values ('774',to_date('26/06/19','DD/MM/RR'),'9','2','20190626126012817853',to_date('26/06/19','DD/MM/RR'),'S','1','2',null,null,null,null,null,to_date('01/01/70','DD/MM/RR'),null,'CC','1006246252','760410406501');
Insert into OASIS4.WEBSERV_JUNTA_PROFESIONAL (ID_JUPR,REPO_PERIODO,REPO_SERV_ID,REPO_TIRE_ID,NOPRESCRIPCION,FPRESCRIPCION,TIPOTECNOLOGIA,CONSECUTIVO,ESTJM,CODENTPROC,OBSERVACIONES,JUSTIFICACIONTECNICA,MODALIDAD,NOACTA,FECHAACTA,FPROCESO,TIPOIDPACIENTE,NROIDPACIENTE,CODENTJM) values ('775',to_date('26/06/19','DD/MM/RR'),'9','2','20190626198012818136',to_date('26/06/19','DD/MM/RR'),'S','1','2',null,null,null,null,null,to_date('01/01/70','DD/MM/RR'),null,'CC','38935018','764000165501');
Insert into OASIS4.WEBSERV_JUNTA_PROFESIONAL (ID_JUPR,REPO_PERIODO,REPO_SERV_ID,REPO_TIRE_ID,NOPRESCRIPCION,FPRESCRIPCION,TIPOTECNOLOGIA,CONSECUTIVO,ESTJM,CODENTPROC,OBSERVACIONES,JUSTIFICACIONTECNICA,MODALIDAD,NOACTA,FECHAACTA,FPROCESO,TIPOIDPACIENTE,NROIDPACIENTE,CODENTJM) values ('776',to_date('27/06/19','DD/MM/RR'),'9','2','20190627146012831387',to_date('27/06/19','DD/MM/RR'),'N','1','3','086340010501',null,'PACIENTE FEMENINA CON PATOLOGÃ?A DE OSTEOGNESIS IMPERFECTA QUE ASISTE AL CONTROL Y ES VALORADA NUTRICIONALMENTE CON PESO DE 14 KG TALLA 119 CM Y CON DIAGNOSTICO ','1','26',to_date('27/06/19','DD/MM/RR'),'2019-06-27','TI','1042352363','086340010501');
Insert into OASIS4.WEBSERV_JUNTA_PROFESIONAL (ID_JUPR,REPO_PERIODO,REPO_SERV_ID,REPO_TIRE_ID,NOPRESCRIPCION,FPRESCRIPCION,TIPOTECNOLOGIA,CONSECUTIVO,ESTJM,CODENTPROC,OBSERVACIONES,JUSTIFICACIONTECNICA,MODALIDAD,NOACTA,FECHAACTA,FPROCESO,TIPOIDPACIENTE,NROIDPACIENTE,CODENTJM) values ('777',to_date('27/06/19','DD/MM/RR'),'9','2','20190627176012831775',to_date('27/06/19','DD/MM/RR'),'N','1','3','134300290801',null,'desnutricion proteico calorica severa','1','27',to_date('27/06/19','DD/MM/RR'),'2019-06-27','RC','1128329441','134300290801');
Insert into OASIS4.WEBSERV_JUNTA_PROFESIONAL (ID_JUPR,REPO_PERIODO,REPO_SERV_ID,REPO_TIRE_ID,NOPRESCRIPCION,FPRESCRIPCION,TIPOTECNOLOGIA,CONSECUTIVO,ESTJM,CODENTPROC,OBSERVACIONES,JUSTIFICACIONTECNICA,MODALIDAD,NOACTA,FECHAACTA,FPROCESO,TIPOIDPACIENTE,NROIDPACIENTE,CODENTJM) values ('778',to_date('27/06/19','DD/MM/RR'),'9','2','20190627116012832924',to_date('27/06/19','DD/MM/RR'),'N','1','2',null,null,null,null,null,to_date('01/01/70','DD/MM/RR'),null,'TI','1051662988','134300049201');
Insert into OASIS4.WEBSERV_JUNTA_PROFESIONAL (ID_JUPR,REPO_PERIODO,REPO_SERV_ID,REPO_TIRE_ID,NOPRESCRIPCION,FPRESCRIPCION,TIPOTECNOLOGIA,CONSECUTIVO,ESTJM,CODENTPROC,OBSERVACIONES,JUSTIFICACIONTECNICA,MODALIDAD,NOACTA,FECHAACTA,FPROCESO,TIPOIDPACIENTE,NROIDPACIENTE,CODENTJM) values ('779',to_date('27/06/19','DD/MM/RR'),'9','2','20190627181012834766',to_date('27/06/19','DD/MM/RR'),'N','1','3','087580016101',null,'NOS REUNIMOS LOS PRESENTES CON EL FIN DE EVALUAR EL CASO DEL PACIENTE EN MENCION ENCONTRANDO INDICACION DE LA UTILIZACION DEL SUSTITUTO ALIMENTICIO. ','1','004',to_date('09/07/19','DD/MM/RR'),'2019-07-09','CC','22900844','087580016101');
Insert into OASIS4.WEBSERV_JUNTA_PROFESIONAL (ID_JUPR,REPO_PERIODO,REPO_SERV_ID,REPO_TIRE_ID,NOPRESCRIPCION,FPRESCRIPCION,TIPOTECNOLOGIA,CONSECUTIVO,ESTJM,CODENTPROC,OBSERVACIONES,JUSTIFICACIONTECNICA,MODALIDAD,NOACTA,FECHAACTA,FPROCESO,TIPOIDPACIENTE,NROIDPACIENTE,CODENTJM) values ('780',to_date('27/06/19','DD/MM/RR'),'9','2','20190627135012838687',to_date('27/06/19','DD/MM/RR'),'N','1','3','080010380001',null,'paciente que necesita ALIMENTACIÃ“N complementaria  para mejorar su estado FÃ?SICO y estado nutricional   ','1','0007',to_date('02/07/19','DD/MM/RR'),'2019-07-02','TI','1043124085','080010380001');
Insert into OASIS4.WEBSERV_JUNTA_PROFESIONAL (ID_JUPR,REPO_PERIODO,REPO_SERV_ID,REPO_TIRE_ID,NOPRESCRIPCION,FPRESCRIPCION,TIPOTECNOLOGIA,CONSECUTIVO,ESTJM,CODENTPROC,OBSERVACIONES,JUSTIFICACIONTECNICA,MODALIDAD,NOACTA,FECHAACTA,FPROCESO,TIPOIDPACIENTE,NROIDPACIENTE,CODENTJM) values ('781',to_date('27/06/19','DD/MM/RR'),'9','2','20190627117012838697',to_date('27/06/19','DD/MM/RR'),'N','1','3','080010380001',null,'PACIENTE FEMENINA DE 108 AÃ‘OS DE EDAD CON CUADRO CLÃ?NICO DE INAPETENCIA Y PÃ‰RDIDA PROGRESIVA DE PESO CON POCA MASA MUSCULAR Y DEGRADACIÃ“N DE CAPA LIPÃ?DICA.','1','18',to_date('27/06/19','DD/MM/RR'),'2019-06-27','CC','26661225','080010380001');
Insert into OASIS4.WEBSERV_JUNTA_PROFESIONAL (ID_JUPR,REPO_PERIODO,REPO_SERV_ID,REPO_TIRE_ID,NOPRESCRIPCION,FPRESCRIPCION,TIPOTECNOLOGIA,CONSECUTIVO,ESTJM,CODENTPROC,OBSERVACIONES,JUSTIFICACIONTECNICA,MODALIDAD,NOACTA,FECHAACTA,FPROCESO,TIPOIDPACIENTE,NROIDPACIENTE,CODENTJM) values ('782',to_date('27/06/19','DD/MM/RR'),'9','2','20190627110012840346',to_date('27/06/19','DD/MM/RR'),'N','1','3','130010178101',null,'SU INDICE DE MASA CORPORAL, SE ENCUENTRA DENTRO DE LOS PARÃ?METROS NORMALES, PERO  PRESENTA DÃ‰FICIT DE PESO, MANIFIESTA LA HIJA QUE ALGUNAS VECES, NO LE APETECE ','1','52',to_date('03/07/19','DD/MM/RR'),'2019-07-03','CC','22902388','130010178101');
Insert into OASIS4.WEBSERV_JUNTA_PROFESIONAL (ID_JUPR,REPO_PERIODO,REPO_SERV_ID,REPO_TIRE_ID,NOPRESCRIPCION,FPRESCRIPCION,TIPOTECNOLOGIA,CONSECUTIVO,ESTJM,CODENTPROC,OBSERVACIONES,JUSTIFICACIONTECNICA,MODALIDAD,NOACTA,FECHAACTA,FPROCESO,TIPOIDPACIENTE,NROIDPACIENTE,CODENTJM) values ('783',to_date('27/06/19','DD/MM/RR'),'9','2','20190627160012840963',to_date('27/06/19','DD/MM/RR'),'N','1','3','080010380001',null,'paciente diAbetica con diagnostico de DESNUTRICIÃ“N severA REQUIERE ALIMENTACIÃ“N COMPLEMENTARIA PARA MEJORAR SU ESTADO DE SALUD ','1','00008',to_date('02/07/19','DD/MM/RR'),'2019-07-02','CC','1042451923','080010380001');
Insert into OASIS4.WEBSERV_JUNTA_PROFESIONAL (ID_JUPR,REPO_PERIODO,REPO_SERV_ID,REPO_TIRE_ID,NOPRESCRIPCION,FPRESCRIPCION,TIPOTECNOLOGIA,CONSECUTIVO,ESTJM,CODENTPROC,OBSERVACIONES,JUSTIFICACIONTECNICA,MODALIDAD,NOACTA,FECHAACTA,FPROCESO,TIPOIDPACIENTE,NROIDPACIENTE,CODENTJM) values ('784',to_date('27/06/19','DD/MM/RR'),'9','2','20190627118012842989',to_date('27/06/19','DD/MM/RR'),'N','1','3','080010380001',null,'PACIENTE CON DIAGNOSTICO DE DESNUTRICIÃ“N LEVE, QUE NECESITA SUPLEMENTO ALIMENTICIO PARA MEJORAR SU ESTADO DE SALUD Y SU ESTADO ALIMENTICIO  ','1','000010',to_date('02/07/19','DD/MM/RR'),'2019-07-02','CC','32858821','080010380001');
Insert into OASIS4.WEBSERV_JUNTA_PROFESIONAL (ID_JUPR,REPO_PERIODO,REPO_SERV_ID,REPO_TIRE_ID,NOPRESCRIPCION,FPRESCRIPCION,TIPOTECNOLOGIA,CONSECUTIVO,ESTJM,CODENTPROC,OBSERVACIONES,JUSTIFICACIONTECNICA,MODALIDAD,NOACTA,FECHAACTA,FPROCESO,TIPOIDPACIENTE,NROIDPACIENTE,CODENTJM) values ('785',to_date('27/06/19','DD/MM/RR'),'9','2','20190627186012834823',to_date('27/06/19','DD/MM/RR'),'S','1','3','470010060602',null,'PACIENTE CON LES QUE REQUIERE USO DE PROTECTOR SOLAR PARA EVITAR DAÃ‘O SOLAR  SECUNDARIO','1','02033',to_date('09/07/19','DD/MM/RR'),'2019-07-09','CC','1004501255','470010060602');
Insert into OASIS4.WEBSERV_JUNTA_PROFESIONAL (ID_JUPR,REPO_PERIODO,REPO_SERV_ID,REPO_TIRE_ID,NOPRESCRIPCION,FPRESCRIPCION,TIPOTECNOLOGIA,CONSECUTIVO,ESTJM,CODENTPROC,OBSERVACIONES,JUSTIFICACIONTECNICA,MODALIDAD,NOACTA,FECHAACTA,FPROCESO,TIPOIDPACIENTE,NROIDPACIENTE,CODENTJM) values ('786',to_date('27/06/19','DD/MM/RR'),'9','2','20190627197012839950',to_date('27/06/19','DD/MM/RR'),'S','1','3','761470067210',null,'debe estar valorado por fisiatria.','1','32',to_date('10/07/19','DD/MM/RR'),'2019-07-10','CC','31413465','761470067210');
Insert into OASIS4.WEBSERV_JUNTA_PROFESIONAL (ID_JUPR,REPO_PERIODO,REPO_SERV_ID,REPO_TIRE_ID,NOPRESCRIPCION,FPRESCRIPCION,TIPOTECNOLOGIA,CONSECUTIVO,ESTJM,CODENTPROC,OBSERVACIONES,JUSTIFICACIONTECNICA,MODALIDAD,NOACTA,FECHAACTA,FPROCESO,TIPOIDPACIENTE,NROIDPACIENTE,CODENTJM) values ('787',to_date('27/06/19','DD/MM/RR'),'9','2','20190627116012842448',to_date('27/06/19','DD/MM/RR'),'S','1','2',null,null,null,null,null,to_date('01/01/70','DD/MM/RR'),null,'CC','42201234','700010003801');
Insert into OASIS4.WEBSERV_JUNTA_PROFESIONAL (ID_JUPR,REPO_PERIODO,REPO_SERV_ID,REPO_TIRE_ID,NOPRESCRIPCION,FPRESCRIPCION,TIPOTECNOLOGIA,CONSECUTIVO,ESTJM,CODENTPROC,OBSERVACIONES,JUSTIFICACIONTECNICA,MODALIDAD,NOACTA,FECHAACTA,FPROCESO,TIPOIDPACIENTE,NROIDPACIENTE,CODENTJM) values ('788',to_date('27/06/19','DD/MM/RR'),'9','2','20190627110012849738',to_date('27/06/19','DD/MM/RR'),'S','1','3','080010134801',null,'PACIENTE CUMPLE CON LAS CARACTERISTICAS PATOLOGICAS CRONICAS PARA LA APROBACION DEL INSUMO','2','218',to_date('08/07/19','DD/MM/RR'),'2019-07-08','CC','1143162027','080010134801');
Insert into OASIS4.WEBSERV_JUNTA_PROFESIONAL (ID_JUPR,REPO_PERIODO,REPO_SERV_ID,REPO_TIRE_ID,NOPRESCRIPCION,FPRESCRIPCION,TIPOTECNOLOGIA,CONSECUTIVO,ESTJM,CODENTPROC,OBSERVACIONES,JUSTIFICACIONTECNICA,MODALIDAD,NOACTA,FECHAACTA,FPROCESO,TIPOIDPACIENTE,NROIDPACIENTE,CODENTJM) values ('789',to_date('28/06/19','DD/MM/RR'),'9','2','20190628100012855844',to_date('28/06/19','DD/MM/RR'),'N','1','2',null,null,null,null,null,to_date('01/01/70','DD/MM/RR'),null,'CC','6616163','707080033101');
Insert into OASIS4.WEBSERV_JUNTA_PROFESIONAL (ID_JUPR,REPO_PERIODO,REPO_SERV_ID,REPO_TIRE_ID,NOPRESCRIPCION,FPRESCRIPCION,TIPOTECNOLOGIA,CONSECUTIVO,ESTJM,CODENTPROC,OBSERVACIONES,JUSTIFICACIONTECNICA,MODALIDAD,NOACTA,FECHAACTA,FPROCESO,TIPOIDPACIENTE,NROIDPACIENTE,CODENTJM) values ('790',to_date('28/06/19','DD/MM/RR'),'9','2','20190628152012859090',to_date('28/06/19','DD/MM/RR'),'N','1','3','130010210201',null,'EVITAR  PERDIDA DE PESO Y  REFORZAR COBERTURA DE MICRONUTRIENTES ESENCIALES  EN LA FALLA RENAL CRONICA- IMC -22.7 POR CIENTO','1','42',to_date('28/06/19','DD/MM/RR'),'2019-06-28','CC','22760157','130010210201');
Insert into OASIS4.WEBSERV_JUNTA_PROFESIONAL (ID_JUPR,REPO_PERIODO,REPO_SERV_ID,REPO_TIRE_ID,NOPRESCRIPCION,FPRESCRIPCION,TIPOTECNOLOGIA,CONSECUTIVO,ESTJM,CODENTPROC,OBSERVACIONES,JUSTIFICACIONTECNICA,MODALIDAD,NOACTA,FECHAACTA,FPROCESO,TIPOIDPACIENTE,NROIDPACIENTE,CODENTJM) values ('791',to_date('28/06/19','DD/MM/RR'),'9','2','20190628199012859530',to_date('28/06/19','DD/MM/RR'),'N','1','3','087580001301',null,'PACIENTE QUE ASISTE A CITA DE CONTROL POR NUTRICION POR SEGUNDA VEZ , REMITIDA DEL SERVICIO DE PEDIATRIA , PACIENTE CON RIESGO DE DESNUTRICION AGUDA , RETRASO .','1','074-2019',to_date('28/06/19','DD/MM/RR'),'2019-07-01','RC','1047236224','087580001301');
Insert into OASIS4.WEBSERV_JUNTA_PROFESIONAL (ID_JUPR,REPO_PERIODO,REPO_SERV_ID,REPO_TIRE_ID,NOPRESCRIPCION,FPRESCRIPCION,TIPOTECNOLOGIA,CONSECUTIVO,ESTJM,CODENTPROC,OBSERVACIONES,JUSTIFICACIONTECNICA,MODALIDAD,NOACTA,FECHAACTA,FPROCESO,TIPOIDPACIENTE,NROIDPACIENTE,CODENTJM) values ('792',to_date('28/06/19','DD/MM/RR'),'9','2','20190628140012866225',to_date('28/06/19','DD/MM/RR'),'N','1','3','085580015701',null,'PACIENTE FEMENINA DE 71 AÃ‘OS DE EDAD CON DIAGNOSTICO MEDICO PENSARTE Y DIABETES SE LE REALIZA VALORACIÃ“N NUTRICIONAL CON PESO 49KG TALLA 160CM ','1','3',to_date('28/06/19','DD/MM/RR'),'2019-06-28','CC','22567158','085580015701');
Insert into OASIS4.WEBSERV_JUNTA_PROFESIONAL (ID_JUPR,REPO_PERIODO,REPO_SERV_ID,REPO_TIRE_ID,NOPRESCRIPCION,FPRESCRIPCION,TIPOTECNOLOGIA,CONSECUTIVO,ESTJM,CODENTPROC,OBSERVACIONES,JUSTIFICACIONTECNICA,MODALIDAD,NOACTA,FECHAACTA,FPROCESO,TIPOIDPACIENTE,NROIDPACIENTE,CODENTJM) values ('793',to_date('28/06/19','DD/MM/RR'),'9','2','20190628125012866279',to_date('28/06/19','DD/MM/RR'),'N','1','4','761470067210',null,'SEGÃšN IMC EL PACIENTE NO PRESENTA DESNUTRICIÃ“N, DEBE SER VALORADO POR NUTRICIONISTA.','1','30',to_date('10/07/19','DD/MM/RR'),'2019-07-10','CC','29358032','761470067210');
Insert into OASIS4.WEBSERV_JUNTA_PROFESIONAL (ID_JUPR,REPO_PERIODO,REPO_SERV_ID,REPO_TIRE_ID,NOPRESCRIPCION,FPRESCRIPCION,TIPOTECNOLOGIA,CONSECUTIVO,ESTJM,CODENTPROC,OBSERVACIONES,JUSTIFICACIONTECNICA,MODALIDAD,NOACTA,FECHAACTA,FPROCESO,TIPOIDPACIENTE,NROIDPACIENTE,CODENTJM) values ('794',to_date('28/06/19','DD/MM/RR'),'9','2','20190628190012866790',to_date('28/06/19','DD/MM/RR'),'N','1','4','761470851601',null,'NO SE APRUEBA ORDENAMIENTO PORQUE EL PACIENTE REQUIERE VALORACIÃ“N POR NUTRICIÃ“N PARA DEFINIR MANEJO SEGUN ESTADO NUTRICIONAL DEL PACIENTE.','1','MP0097',to_date('03/07/19','DD/MM/RR'),'2019-07-04','CC','1088272953','761470851601');
Insert into OASIS4.WEBSERV_JUNTA_PROFESIONAL (ID_JUPR,REPO_PERIODO,REPO_SERV_ID,REPO_TIRE_ID,NOPRESCRIPCION,FPRESCRIPCION,TIPOTECNOLOGIA,CONSECUTIVO,ESTJM,CODENTPROC,OBSERVACIONES,JUSTIFICACIONTECNICA,MODALIDAD,NOACTA,FECHAACTA,FPROCESO,TIPOIDPACIENTE,NROIDPACIENTE,CODENTJM) values ('795',to_date('28/06/19','DD/MM/RR'),'9','2','20190628145012861340',to_date('28/06/19','DD/MM/RR'),'S','1','3','080010380001',null,'PACIENTE DE 71 AÃ‘OS DE EDAD CON ANTECEDENTE DE ULCERA VARICOSA EN MIEMBRO INFERIOR DERECHO REQUIERE DE TRATAMIENTO CON CREMA CICATRIZANTE FITOESTIMULINA.','1','18',to_date('09/07/19','DD/MM/RR'),'2019-07-09','CC','8696484','080010380001');
Insert into OASIS4.WEBSERV_JUNTA_PROFESIONAL (ID_JUPR,REPO_PERIODO,REPO_SERV_ID,REPO_TIRE_ID,NOPRESCRIPCION,FPRESCRIPCION,TIPOTECNOLOGIA,CONSECUTIVO,ESTJM,CODENTPROC,OBSERVACIONES,JUSTIFICACIONTECNICA,MODALIDAD,NOACTA,FECHAACTA,FPROCESO,TIPOIDPACIENTE,NROIDPACIENTE,CODENTJM) values ('796',to_date('28/06/19','DD/MM/RR'),'9','2','20190628115012868458',to_date('28/06/19','DD/MM/RR'),'S','1','3','761470067210',null,'SE APRUEBA 450 PAÃ‘ALES PARA 3 MESES PARA PTE POR PATOLOGÃ?AS.','1','33',to_date('10/07/19','DD/MM/RR'),'2019-07-10','CC','29393285','761470067210');
Insert into OASIS4.WEBSERV_JUNTA_PROFESIONAL (ID_JUPR,REPO_PERIODO,REPO_SERV_ID,REPO_TIRE_ID,NOPRESCRIPCION,FPRESCRIPCION,TIPOTECNOLOGIA,CONSECUTIVO,ESTJM,CODENTPROC,OBSERVACIONES,JUSTIFICACIONTECNICA,MODALIDAD,NOACTA,FECHAACTA,FPROCESO,TIPOIDPACIENTE,NROIDPACIENTE,CODENTJM) values ('797',to_date('28/06/19','DD/MM/RR'),'9','2','20190628147012869169',to_date('28/06/19','DD/MM/RR'),'S','1','3','470010096901',null,'TRASLADO REDONDO EN AMBULANCIA CITA DIA 5 JULIO 2019 HORA:3 PM CARRERA 45 # 84-153 BARRANQUILLA - DIRECCIÃ“N DOMICILIO TRANVERSAL 26 #20-35 FUNDADORES VALLEDUPAR','1','900',to_date('28/06/19','DD/MM/RR'),'2019-06-28','RC','1044225939','470010096901');
Insert into OASIS4.WEBSERV_JUNTA_PROFESIONAL (ID_JUPR,REPO_PERIODO,REPO_SERV_ID,REPO_TIRE_ID,NOPRESCRIPCION,FPRESCRIPCION,TIPOTECNOLOGIA,CONSECUTIVO,ESTJM,CODENTPROC,OBSERVACIONES,JUSTIFICACIONTECNICA,MODALIDAD,NOACTA,FECHAACTA,FPROCESO,TIPOIDPACIENTE,NROIDPACIENTE,CODENTJM) values ('798',to_date('29/06/19','DD/MM/RR'),'9','2','20190629192012879754',to_date('29/06/19','DD/MM/RR'),'N','1','2',null,null,null,null,null,to_date('01/01/70','DD/MM/RR'),null,'RC','1051678464','134300049201');
Insert into OASIS4.WEBSERV_JUNTA_PROFESIONAL (ID_JUPR,REPO_PERIODO,REPO_SERV_ID,REPO_TIRE_ID,NOPRESCRIPCION,FPRESCRIPCION,TIPOTECNOLOGIA,CONSECUTIVO,ESTJM,CODENTPROC,OBSERVACIONES,JUSTIFICACIONTECNICA,MODALIDAD,NOACTA,FECHAACTA,FPROCESO,TIPOIDPACIENTE,NROIDPACIENTE,CODENTJM) values ('799',to_date('29/06/19','DD/MM/RR'),'9','2','20190629120012877863',to_date('29/06/19','DD/MM/RR'),'S','1','4','080010226001',null,'extemporÃ¡neo. no se aprueba junta medica','1','201904100730',to_date('04/10/19','DD/MM/RR'),'2019-10-04','TI','1082928028','080010226001');
Insert into OASIS4.WEBSERV_JUNTA_PROFESIONAL (ID_JUPR,REPO_PERIODO,REPO_SERV_ID,REPO_TIRE_ID,NOPRESCRIPCION,FPRESCRIPCION,TIPOTECNOLOGIA,CONSECUTIVO,ESTJM,CODENTPROC,OBSERVACIONES,JUSTIFICACIONTECNICA,MODALIDAD,NOACTA,FECHAACTA,FPROCESO,TIPOIDPACIENTE,NROIDPACIENTE,CODENTJM) values ('800',to_date('30/06/19','DD/MM/RR'),'9','2','20190630125012883391',to_date('30/06/19','DD/MM/RR'),'N','1','2',null,null,null,null,null,to_date('01/01/70','DD/MM/RR'),null,'CC','26264672','270010070801');
Insert into OASIS4.WEBSERV_JUNTA_PROFESIONAL (ID_JUPR,REPO_PERIODO,REPO_SERV_ID,REPO_TIRE_ID,NOPRESCRIPCION,FPRESCRIPCION,TIPOTECNOLOGIA,CONSECUTIVO,ESTJM,CODENTPROC,OBSERVACIONES,JUSTIFICACIONTECNICA,MODALIDAD,NOACTA,FECHAACTA,FPROCESO,TIPOIDPACIENTE,NROIDPACIENTE,CODENTJM) values ('801',to_date('30/06/19','DD/MM/RR'),'9','2','20190630181012883340',to_date('30/06/19','DD/MM/RR'),'S','1','2',null,null,null,null,null,to_date('01/01/70','DD/MM/RR'),null,'CC','4819162','270010070801');
Insert into OASIS4.WEBSERV_JUNTA_PROFESIONAL (ID_JUPR,REPO_PERIODO,REPO_SERV_ID,REPO_TIRE_ID,NOPRESCRIPCION,FPRESCRIPCION,TIPOTECNOLOGIA,CONSECUTIVO,ESTJM,CODENTPROC,OBSERVACIONES,JUSTIFICACIONTECNICA,MODALIDAD,NOACTA,FECHAACTA,FPROCESO,TIPOIDPACIENTE,NROIDPACIENTE,CODENTJM) values ('802',to_date('30/06/19','DD/MM/RR'),'9','2','20190630172012883362',to_date('30/06/19','DD/MM/RR'),'S','2','2',null,null,null,null,null,to_date('01/01/70','DD/MM/RR'),null,'CC','3546282','270010070801');
Insert into OASIS4.WEBSERV_JUNTA_PROFESIONAL (ID_JUPR,REPO_PERIODO,REPO_SERV_ID,REPO_TIRE_ID,NOPRESCRIPCION,FPRESCRIPCION,TIPOTECNOLOGIA,CONSECUTIVO,ESTJM,CODENTPROC,OBSERVACIONES,JUSTIFICACIONTECNICA,MODALIDAD,NOACTA,FECHAACTA,FPROCESO,TIPOIDPACIENTE,NROIDPACIENTE,CODENTJM) values ('803',to_date('30/06/19','DD/MM/RR'),'9','2','20190630156012883373',to_date('30/06/19','DD/MM/RR'),'S','2','2',null,null,null,null,null,to_date('01/01/70','DD/MM/RR'),null,'CC','11785816','270010070801');
Insert into OASIS4.WEBSERV_JUNTA_PROFESIONAL (ID_JUPR,REPO_PERIODO,REPO_SERV_ID,REPO_TIRE_ID,NOPRESCRIPCION,FPRESCRIPCION,TIPOTECNOLOGIA,CONSECUTIVO,ESTJM,CODENTPROC,OBSERVACIONES,JUSTIFICACIONTECNICA,MODALIDAD,NOACTA,FECHAACTA,FPROCESO,TIPOIDPACIENTE,NROIDPACIENTE,CODENTJM) values ('804',to_date('30/06/19','DD/MM/RR'),'9','2','20190630125012883391',to_date('30/06/19','DD/MM/RR'),'S','1','2',null,null,null,null,null,to_date('01/01/70','DD/MM/RR'),null,'CC','26264672','270010070801');
Insert into OASIS4.WEBSERV_JUNTA_PROFESIONAL (ID_JUPR,REPO_PERIODO,REPO_SERV_ID,REPO_TIRE_ID,NOPRESCRIPCION,FPRESCRIPCION,TIPOTECNOLOGIA,CONSECUTIVO,ESTJM,CODENTPROC,OBSERVACIONES,JUSTIFICACIONTECNICA,MODALIDAD,NOACTA,FECHAACTA,FPROCESO,TIPOIDPACIENTE,NROIDPACIENTE,CODENTJM) values ('805',to_date('30/06/19','DD/MM/RR'),'9','2','20190630196012883405',to_date('30/06/19','DD/MM/RR'),'S','2','2',null,null,null,null,null,to_date('01/01/70','DD/MM/RR'),null,'CC','4796015','270010070801');
Insert into OASIS4.WEBSERV_JUNTA_PROFESIONAL (ID_JUPR,REPO_PERIODO,REPO_SERV_ID,REPO_TIRE_ID,NOPRESCRIPCION,FPRESCRIPCION,TIPOTECNOLOGIA,CONSECUTIVO,ESTJM,CODENTPROC,OBSERVACIONES,JUSTIFICACIONTECNICA,MODALIDAD,NOACTA,FECHAACTA,FPROCESO,TIPOIDPACIENTE,NROIDPACIENTE,CODENTJM) values ('806',to_date('02/07/19','DD/MM/RR'),'9','2','20190702154012891829',to_date('02/07/19','DD/MM/RR'),'N','1','3','087580106601',null,'PCTE CON BAJO PESO Y TALLA PESO 10KG TALLA 86 CM PESO/EDAD DZ -3 TALLA/EDAD DZ -3 PESO/TALLA DZ -3 CON DESNUTRICION AGUDA','1','00008',to_date('13/07/19','DD/MM/RR'),'2019-07-13','RC','1045751954','087580106601');
Insert into OASIS4.WEBSERV_JUNTA_PROFESIONAL (ID_JUPR,REPO_PERIODO,REPO_SERV_ID,REPO_TIRE_ID,NOPRESCRIPCION,FPRESCRIPCION,TIPOTECNOLOGIA,CONSECUTIVO,ESTJM,CODENTPROC,OBSERVACIONES,JUSTIFICACIONTECNICA,MODALIDAD,NOACTA,FECHAACTA,FPROCESO,TIPOIDPACIENTE,NROIDPACIENTE,CODENTJM) values ('807',to_date('02/07/19','DD/MM/RR'),'9','2','20190702112012893666',to_date('02/07/19','DD/MM/RR'),'N','1','3','080010349401',null,'VALORACIÃ“N POR NUTRICION Y SE INSTAURA SUPLEMENTO NUTRICIONAL TIPO ENSURE','2','023',to_date('16/07/19','DD/MM/RR'),'2019-07-16','CC','26909097','080010349401');
Insert into OASIS4.WEBSERV_JUNTA_PROFESIONAL (ID_JUPR,REPO_PERIODO,REPO_SERV_ID,REPO_TIRE_ID,NOPRESCRIPCION,FPRESCRIPCION,TIPOTECNOLOGIA,CONSECUTIVO,ESTJM,CODENTPROC,OBSERVACIONES,JUSTIFICACIONTECNICA,MODALIDAD,NOACTA,FECHAACTA,FPROCESO,TIPOIDPACIENTE,NROIDPACIENTE,CODENTJM) values ('808',to_date('02/07/19','DD/MM/RR'),'9','2','20190702169012897079',to_date('02/07/19','DD/MM/RR'),'N','1','2',null,null,null,null,null,to_date('01/01/70','DD/MM/RR'),null,'TI','1079689474','ESS076');
Insert into OASIS4.WEBSERV_JUNTA_PROFESIONAL (ID_JUPR,REPO_PERIODO,REPO_SERV_ID,REPO_TIRE_ID,NOPRESCRIPCION,FPRESCRIPCION,TIPOTECNOLOGIA,CONSECUTIVO,ESTJM,CODENTPROC,OBSERVACIONES,JUSTIFICACIONTECNICA,MODALIDAD,NOACTA,FECHAACTA,FPROCESO,TIPOIDPACIENTE,NROIDPACIENTE,CODENTJM) values ('809',to_date('02/07/19','DD/MM/RR'),'9','2','20190702168012898214',to_date('02/07/19','DD/MM/RR'),'N','1','3','085580015701',null,'PACIENTE MASCULINO DE CON PESO DE 11,5KG TALLA 97CM DIAGNOSTICO NUTRICIONAL DE DESNUTRICION AGUDA SEVERA','1','03',to_date('02/07/19','DD/MM/RR'),'2019-07-02','RC','1046817241','085580015701');
Insert into OASIS4.WEBSERV_JUNTA_PROFESIONAL (ID_JUPR,REPO_PERIODO,REPO_SERV_ID,REPO_TIRE_ID,NOPRESCRIPCION,FPRESCRIPCION,TIPOTECNOLOGIA,CONSECUTIVO,ESTJM,CODENTPROC,OBSERVACIONES,JUSTIFICACIONTECNICA,MODALIDAD,NOACTA,FECHAACTA,FPROCESO,TIPOIDPACIENTE,NROIDPACIENTE,CODENTJM) values ('810',to_date('02/07/19','DD/MM/RR'),'9','2','20190702117012899309',to_date('02/07/19','DD/MM/RR'),'N','1','3','085580015701',null,'PACIENTE MASCULINO DE CON PESO DE 8,2 KG TALLA 74CM DIAGNOSTICO NUTRICIONAL RIESGO DE DESNUTRICIÃ“N AGUDA ','1','04',to_date('02/07/19','DD/MM/RR'),'2019-07-02','RC','1046818599','085580015701');
Insert into OASIS4.WEBSERV_JUNTA_PROFESIONAL (ID_JUPR,REPO_PERIODO,REPO_SERV_ID,REPO_TIRE_ID,NOPRESCRIPCION,FPRESCRIPCION,TIPOTECNOLOGIA,CONSECUTIVO,ESTJM,CODENTPROC,OBSERVACIONES,JUSTIFICACIONTECNICA,MODALIDAD,NOACTA,FECHAACTA,FPROCESO,TIPOIDPACIENTE,NROIDPACIENTE,CODENTJM) values ('811',to_date('02/07/19','DD/MM/RR'),'9','2','20190702172012903616',to_date('02/07/19','DD/MM/RR'),'N','1','4','761470067210',null,'NO HAY TALLA DEL PACIENTE POR LO TANTO NO SE PUEDE REALIZAR DIAGNOSTICO O JUSTIFICACIÃ“N.','1','34',to_date('10/07/19','DD/MM/RR'),'2019-07-10','CC','29365663','761470067210');
Insert into OASIS4.WEBSERV_JUNTA_PROFESIONAL (ID_JUPR,REPO_PERIODO,REPO_SERV_ID,REPO_TIRE_ID,NOPRESCRIPCION,FPRESCRIPCION,TIPOTECNOLOGIA,CONSECUTIVO,ESTJM,CODENTPROC,OBSERVACIONES,JUSTIFICACIONTECNICA,MODALIDAD,NOACTA,FECHAACTA,FPROCESO,TIPOIDPACIENTE,NROIDPACIENTE,CODENTJM) values ('812',to_date('02/07/19','DD/MM/RR'),'9','2','20190702167012903824',to_date('02/07/19','DD/MM/RR'),'N','1','3','130010178101',null,'CONSUME LOS ALIMENTOS DE  ACUERDO A TOLERANCIA Y LO QUE LE APETECE, DE CONSISTENCIA BLANDA, SE CONSIDERA INICIAR SUPLEMENTO NUTRICIONAL, PARA RECUPERAR MASA COR','1','54',to_date('03/07/19','DD/MM/RR'),'2019-07-03','CC','1127591535','130010178101');
Insert into OASIS4.WEBSERV_JUNTA_PROFESIONAL (ID_JUPR,REPO_PERIODO,REPO_SERV_ID,REPO_TIRE_ID,NOPRESCRIPCION,FPRESCRIPCION,TIPOTECNOLOGIA,CONSECUTIVO,ESTJM,CODENTPROC,OBSERVACIONES,JUSTIFICACIONTECNICA,MODALIDAD,NOACTA,FECHAACTA,FPROCESO,TIPOIDPACIENTE,NROIDPACIENTE,CODENTJM) values ('813',to_date('02/07/19','DD/MM/RR'),'9','2','20190702178012907206',to_date('02/07/19','DD/MM/RR'),'N','1','3','087580016101',null,'SE SOLICITA ALIMENTO COMPLETO Y BALANCEADO PARA RECUPERAR ESTADO NUTRICIONAL DEL PACIENTE.','1','0016',to_date('02/07/19','DD/MM/RR'),'2019-07-02','CC','1682999','087580016101');
Insert into OASIS4.WEBSERV_JUNTA_PROFESIONAL (ID_JUPR,REPO_PERIODO,REPO_SERV_ID,REPO_TIRE_ID,NOPRESCRIPCION,FPRESCRIPCION,TIPOTECNOLOGIA,CONSECUTIVO,ESTJM,CODENTPROC,OBSERVACIONES,JUSTIFICACIONTECNICA,MODALIDAD,NOACTA,FECHAACTA,FPROCESO,TIPOIDPACIENTE,NROIDPACIENTE,CODENTJM) values ('814',to_date('02/07/19','DD/MM/RR'),'9','2','20190702139012899016',to_date('02/07/19','DD/MM/RR'),'S','1','3','087580106601',null,'PCTE con cuadrparesia espastica e incontinencia de esfinteres, con alto riesgo de lesiones tipo ulcaeras y escoriaciones cutaneas en area genitaL','1','00006',to_date('13/07/19','DD/MM/RR'),'2019-07-13','TI','1042260914','087580106601');
Insert into OASIS4.WEBSERV_JUNTA_PROFESIONAL (ID_JUPR,REPO_PERIODO,REPO_SERV_ID,REPO_TIRE_ID,NOPRESCRIPCION,FPRESCRIPCION,TIPOTECNOLOGIA,CONSECUTIVO,ESTJM,CODENTPROC,OBSERVACIONES,JUSTIFICACIONTECNICA,MODALIDAD,NOACTA,FECHAACTA,FPROCESO,TIPOIDPACIENTE,NROIDPACIENTE,CODENTJM) values ('815',to_date('02/07/19','DD/MM/RR'),'9','2','20190702163012908225',to_date('02/07/19','DD/MM/RR'),'S','2','2',null,null,null,null,null,to_date('01/01/70','DD/MM/RR'),null,'CC','1732039','200010205401');
Insert into OASIS4.WEBSERV_JUNTA_PROFESIONAL (ID_JUPR,REPO_PERIODO,REPO_SERV_ID,REPO_TIRE_ID,NOPRESCRIPCION,FPRESCRIPCION,TIPOTECNOLOGIA,CONSECUTIVO,ESTJM,CODENTPROC,OBSERVACIONES,JUSTIFICACIONTECNICA,MODALIDAD,NOACTA,FECHAACTA,FPROCESO,TIPOIDPACIENTE,NROIDPACIENTE,CODENTJM) values ('816',to_date('03/07/19','DD/MM/RR'),'9','2','20190703187012914875',to_date('03/07/19','DD/MM/RR'),'N','1','3','761470067210',null,'se aprueba soporte nutricional ensure 9 latas por 90 dias, por patologia de paciente.','1','               23',to_date('03/07/19','DD/MM/RR'),'2019-07-03','CC','24377257','761470067210');
Insert into OASIS4.WEBSERV_JUNTA_PROFESIONAL (ID_JUPR,REPO_PERIODO,REPO_SERV_ID,REPO_TIRE_ID,NOPRESCRIPCION,FPRESCRIPCION,TIPOTECNOLOGIA,CONSECUTIVO,ESTJM,CODENTPROC,OBSERVACIONES,JUSTIFICACIONTECNICA,MODALIDAD,NOACTA,FECHAACTA,FPROCESO,TIPOIDPACIENTE,NROIDPACIENTE,CODENTJM) values ('817',to_date('03/07/19','DD/MM/RR'),'9','2','20190703175012915409',to_date('03/07/19','DD/MM/RR'),'N','1','2',null,null,null,null,null,to_date('01/01/70','DD/MM/RR'),null,'RC','1044661398','080010380001');
Insert into OASIS4.WEBSERV_JUNTA_PROFESIONAL (ID_JUPR,REPO_PERIODO,REPO_SERV_ID,REPO_TIRE_ID,NOPRESCRIPCION,FPRESCRIPCION,TIPOTECNOLOGIA,CONSECUTIVO,ESTJM,CODENTPROC,OBSERVACIONES,JUSTIFICACIONTECNICA,MODALIDAD,NOACTA,FECHAACTA,FPROCESO,TIPOIDPACIENTE,NROIDPACIENTE,CODENTJM) values ('818',to_date('03/07/19','DD/MM/RR'),'9','2','20190703127012915703',to_date('03/07/19','DD/MM/RR'),'N','1','2',null,null,null,null,null,to_date('01/01/70','DD/MM/RR'),null,'CC','6111164','ESS076');
Insert into OASIS4.WEBSERV_JUNTA_PROFESIONAL (ID_JUPR,REPO_PERIODO,REPO_SERV_ID,REPO_TIRE_ID,NOPRESCRIPCION,FPRESCRIPCION,TIPOTECNOLOGIA,CONSECUTIVO,ESTJM,CODENTPROC,OBSERVACIONES,JUSTIFICACIONTECNICA,MODALIDAD,NOACTA,FECHAACTA,FPROCESO,TIPOIDPACIENTE,NROIDPACIENTE,CODENTJM) values ('819',to_date('03/07/19','DD/MM/RR'),'9','2','20190703157012915957',to_date('03/07/19','DD/MM/RR'),'N','1','2',null,null,null,null,null,to_date('01/01/70','DD/MM/RR'),null,'TI','1044635453','080010380001');
Insert into OASIS4.WEBSERV_JUNTA_PROFESIONAL (ID_JUPR,REPO_PERIODO,REPO_SERV_ID,REPO_TIRE_ID,NOPRESCRIPCION,FPRESCRIPCION,TIPOTECNOLOGIA,CONSECUTIVO,ESTJM,CODENTPROC,OBSERVACIONES,JUSTIFICACIONTECNICA,MODALIDAD,NOACTA,FECHAACTA,FPROCESO,TIPOIDPACIENTE,NROIDPACIENTE,CODENTJM) values ('820',to_date('03/07/19','DD/MM/RR'),'9','2','20190703193012917307',to_date('03/07/19','DD/MM/RR'),'N','1','2',null,null,null,null,null,to_date('01/01/70','DD/MM/RR'),null,'RC','1045754494','080010380001');
Insert into OASIS4.WEBSERV_JUNTA_PROFESIONAL (ID_JUPR,REPO_PERIODO,REPO_SERV_ID,REPO_TIRE_ID,NOPRESCRIPCION,FPRESCRIPCION,TIPOTECNOLOGIA,CONSECUTIVO,ESTJM,CODENTPROC,OBSERVACIONES,JUSTIFICACIONTECNICA,MODALIDAD,NOACTA,FECHAACTA,FPROCESO,TIPOIDPACIENTE,NROIDPACIENTE,CODENTJM) values ('821',to_date('03/07/19','DD/MM/RR'),'9','2','20190703165012918042',to_date('03/07/19','DD/MM/RR'),'N','1','2',null,null,null,null,null,to_date('01/01/70','DD/MM/RR'),null,'CC','1114122077','761000252401');
Insert into OASIS4.WEBSERV_JUNTA_PROFESIONAL (ID_JUPR,REPO_PERIODO,REPO_SERV_ID,REPO_TIRE_ID,NOPRESCRIPCION,FPRESCRIPCION,TIPOTECNOLOGIA,CONSECUTIVO,ESTJM,CODENTPROC,OBSERVACIONES,JUSTIFICACIONTECNICA,MODALIDAD,NOACTA,FECHAACTA,FPROCESO,TIPOIDPACIENTE,NROIDPACIENTE,CODENTJM) values ('822',to_date('03/07/19','DD/MM/RR'),'9','2','20190703113012921011',to_date('03/07/19','DD/MM/RR'),'N','1','3','080010380001',null,'PACIENTE FEMENINA DE 66 AÃ‘OS QUE ASISTE A NUTRICIÃ“N POR BAJO APETITO Y DEPRESIÃ“N. REQUIERE ALIMENTACIÃ“N COMPLEMENTARIA ENSURE ADVANCE.','1','27',to_date('31/07/19','DD/MM/RR'),'2019-07-31','CC','39027978','080010380001');
Insert into OASIS4.WEBSERV_JUNTA_PROFESIONAL (ID_JUPR,REPO_PERIODO,REPO_SERV_ID,REPO_TIRE_ID,NOPRESCRIPCION,FPRESCRIPCION,TIPOTECNOLOGIA,CONSECUTIVO,ESTJM,CODENTPROC,OBSERVACIONES,JUSTIFICACIONTECNICA,MODALIDAD,NOACTA,FECHAACTA,FPROCESO,TIPOIDPACIENTE,NROIDPACIENTE,CODENTJM) values ('823',to_date('03/07/19','DD/MM/RR'),'9','2','20190703196012923007',to_date('03/07/19','DD/MM/RR'),'N','1','3','760010379901',null,' AMBUQ','1','0534-19',to_date('12/07/19','DD/MM/RR'),'2019-07-12','CC','6284297','760010379901');
Insert into OASIS4.WEBSERV_JUNTA_PROFESIONAL (ID_JUPR,REPO_PERIODO,REPO_SERV_ID,REPO_TIRE_ID,NOPRESCRIPCION,FPRESCRIPCION,TIPOTECNOLOGIA,CONSECUTIVO,ESTJM,CODENTPROC,OBSERVACIONES,JUSTIFICACIONTECNICA,MODALIDAD,NOACTA,FECHAACTA,FPROCESO,TIPOIDPACIENTE,NROIDPACIENTE,CODENTJM) values ('824',to_date('03/07/19','DD/MM/RR'),'9','2','20190703138012925190',to_date('03/07/19','DD/MM/RR'),'N','1','3','130010178101',null,'PRESENTA INDICE DE MASA CORPORAL BAJO, MANIFIESTA QUE ALGUNAS VECES, NO LE APETECE CONSUMIR LOS ALIMENTOS, NO CUMPLE CON LAS RACIONES INDICADAS, DEBIDO A LA SIT','1','55',to_date('03/07/19','DD/MM/RR'),'2019-07-03','CC','45459897','130010178101');
Insert into OASIS4.WEBSERV_JUNTA_PROFESIONAL (ID_JUPR,REPO_PERIODO,REPO_SERV_ID,REPO_TIRE_ID,NOPRESCRIPCION,FPRESCRIPCION,TIPOTECNOLOGIA,CONSECUTIVO,ESTJM,CODENTPROC,OBSERVACIONES,JUSTIFICACIONTECNICA,MODALIDAD,NOACTA,FECHAACTA,FPROCESO,TIPOIDPACIENTE,NROIDPACIENTE,CODENTJM) values ('825',to_date('03/07/19','DD/MM/RR'),'9','2','20190703124012931115',to_date('03/07/19','DD/MM/RR'),'N','1','3','761470851601',null,'quien requierecomplementar su nutricion con alimento para propÃ³sitos mÃ©dicos especiales en pacientes con enfermedad pulmonar crÃ³nica, 20% de grasa (TCM) ','1','MP0096',to_date('03/07/19','DD/MM/RR'),'2019-07-04','CC','29612260','761470851601');
Insert into OASIS4.WEBSERV_JUNTA_PROFESIONAL (ID_JUPR,REPO_PERIODO,REPO_SERV_ID,REPO_TIRE_ID,NOPRESCRIPCION,FPRESCRIPCION,TIPOTECNOLOGIA,CONSECUTIVO,ESTJM,CODENTPROC,OBSERVACIONES,JUSTIFICACIONTECNICA,MODALIDAD,NOACTA,FECHAACTA,FPROCESO,TIPOIDPACIENTE,NROIDPACIENTE,CODENTJM) values ('826',to_date('03/07/19','DD/MM/RR'),'9','2','20190703186012936654',to_date('03/07/19','DD/MM/RR'),'N','1','2',null,null,null,null,null,to_date('01/01/70','DD/MM/RR'),null,'CC','22536237','086380074501');
Insert into OASIS4.WEBSERV_JUNTA_PROFESIONAL (ID_JUPR,REPO_PERIODO,REPO_SERV_ID,REPO_TIRE_ID,NOPRESCRIPCION,FPRESCRIPCION,TIPOTECNOLOGIA,CONSECUTIVO,ESTJM,CODENTPROC,OBSERVACIONES,JUSTIFICACIONTECNICA,MODALIDAD,NOACTA,FECHAACTA,FPROCESO,TIPOIDPACIENTE,NROIDPACIENTE,CODENTJM) values ('827',to_date('03/07/19','DD/MM/RR'),'9','2','20190703130012936757',to_date('03/07/19','DD/MM/RR'),'N','1','2',null,null,null,null,null,to_date('01/01/70','DD/MM/RR'),null,'CC','22536248','086380074501');
Insert into OASIS4.WEBSERV_JUNTA_PROFESIONAL (ID_JUPR,REPO_PERIODO,REPO_SERV_ID,REPO_TIRE_ID,NOPRESCRIPCION,FPRESCRIPCION,TIPOTECNOLOGIA,CONSECUTIVO,ESTJM,CODENTPROC,OBSERVACIONES,JUSTIFICACIONTECNICA,MODALIDAD,NOACTA,FECHAACTA,FPROCESO,TIPOIDPACIENTE,NROIDPACIENTE,CODENTJM) values ('828',to_date('03/07/19','DD/MM/RR'),'9','2','20190703138012936802',to_date('03/07/19','DD/MM/RR'),'N','1','2',null,null,null,null,null,to_date('01/01/70','DD/MM/RR'),null,'CC','3734248','086380074501');
Insert into OASIS4.WEBSERV_JUNTA_PROFESIONAL (ID_JUPR,REPO_PERIODO,REPO_SERV_ID,REPO_TIRE_ID,NOPRESCRIPCION,FPRESCRIPCION,TIPOTECNOLOGIA,CONSECUTIVO,ESTJM,CODENTPROC,OBSERVACIONES,JUSTIFICACIONTECNICA,MODALIDAD,NOACTA,FECHAACTA,FPROCESO,TIPOIDPACIENTE,NROIDPACIENTE,CODENTJM) values ('829',to_date('03/07/19','DD/MM/RR'),'9','2','20190703184012913862',to_date('03/07/19','DD/MM/RR'),'S','1','3','761470067210',null,'SE APRUEBA EL TRATAMIENTO DE 450 PAÃ‘ALES POR 3 MESES AL PACIENTE POR PATOLOGÃ?AS.','1','36',to_date('11/07/19','DD/MM/RR'),'2019-07-11','CC','29132876','761470067210');
Insert into OASIS4.WEBSERV_JUNTA_PROFESIONAL (ID_JUPR,REPO_PERIODO,REPO_SERV_ID,REPO_TIRE_ID,NOPRESCRIPCION,FPRESCRIPCION,TIPOTECNOLOGIA,CONSECUTIVO,ESTJM,CODENTPROC,OBSERVACIONES,JUSTIFICACIONTECNICA,MODALIDAD,NOACTA,FECHAACTA,FPROCESO,TIPOIDPACIENTE,NROIDPACIENTE,CODENTJM) values ('830',to_date('03/07/19','DD/MM/RR'),'9','2','20190703165012918042',to_date('03/07/19','DD/MM/RR'),'S','2','2',null,null,null,null,null,to_date('01/01/70','DD/MM/RR'),null,'CC','1114122077','761000252401');
Insert into OASIS4.WEBSERV_JUNTA_PROFESIONAL (ID_JUPR,REPO_PERIODO,REPO_SERV_ID,REPO_TIRE_ID,NOPRESCRIPCION,FPRESCRIPCION,TIPOTECNOLOGIA,CONSECUTIVO,ESTJM,CODENTPROC,OBSERVACIONES,JUSTIFICACIONTECNICA,MODALIDAD,NOACTA,FECHAACTA,FPROCESO,TIPOIDPACIENTE,NROIDPACIENTE,CODENTJM) values ('831',to_date('03/07/19','DD/MM/RR'),'9','2','20190703165012918042',to_date('03/07/19','DD/MM/RR'),'S','3','2',null,null,null,null,null,to_date('01/01/70','DD/MM/RR'),null,'CC','1114122077','761000252401');
Insert into OASIS4.WEBSERV_JUNTA_PROFESIONAL (ID_JUPR,REPO_PERIODO,REPO_SERV_ID,REPO_TIRE_ID,NOPRESCRIPCION,FPRESCRIPCION,TIPOTECNOLOGIA,CONSECUTIVO,ESTJM,CODENTPROC,OBSERVACIONES,JUSTIFICACIONTECNICA,MODALIDAD,NOACTA,FECHAACTA,FPROCESO,TIPOIDPACIENTE,NROIDPACIENTE,CODENTJM) values ('832',to_date('03/07/19','DD/MM/RR'),'9','2','20190703130012924372',to_date('03/07/19','DD/MM/RR'),'S','2','2',null,null,null,null,null,to_date('01/01/70','DD/MM/RR'),null,'CC','941292','200010205401');
Insert into OASIS4.WEBSERV_JUNTA_PROFESIONAL (ID_JUPR,REPO_PERIODO,REPO_SERV_ID,REPO_TIRE_ID,NOPRESCRIPCION,FPRESCRIPCION,TIPOTECNOLOGIA,CONSECUTIVO,ESTJM,CODENTPROC,OBSERVACIONES,JUSTIFICACIONTECNICA,MODALIDAD,NOACTA,FECHAACTA,FPROCESO,TIPOIDPACIENTE,NROIDPACIENTE,CODENTJM) values ('833',to_date('04/07/19','DD/MM/RR'),'9','2','20190704140012943266',to_date('04/07/19','DD/MM/RR'),'M','1','3','130010178101',null,'paciente con cuadro CLÃ?NICO de hipertension pulmonar grupo 1 clase funcional de oms se adiciona sildenafilo de 20 mg cada 8 horas por la clase funcional.','1','60',to_date('10/07/19','DD/MM/RR'),'2019-07-10','CC','45368080','130010178101');
Insert into OASIS4.WEBSERV_JUNTA_PROFESIONAL (ID_JUPR,REPO_PERIODO,REPO_SERV_ID,REPO_TIRE_ID,NOPRESCRIPCION,FPRESCRIPCION,TIPOTECNOLOGIA,CONSECUTIVO,ESTJM,CODENTPROC,OBSERVACIONES,JUSTIFICACIONTECNICA,MODALIDAD,NOACTA,FECHAACTA,FPROCESO,TIPOIDPACIENTE,NROIDPACIENTE,CODENTJM) values ('834',to_date('04/07/19','DD/MM/RR'),'9','2','20190704174012953678',to_date('04/07/19','DD/MM/RR'),'M','1','4','761470851601',null,'NO SE APRUEBA JUNTA DEBIDO A QUE SE EVIDENCIA DOBLE FORMULACION DEL MEDICAMENTO CON UNA PRIMERA JUNTA APROBADA NUMERO 20190704186012900000','1','MP0099',to_date('05/07/19','DD/MM/RR'),'2019-07-05','CC','1112780753','761470851601');
Insert into OASIS4.WEBSERV_JUNTA_PROFESIONAL (ID_JUPR,REPO_PERIODO,REPO_SERV_ID,REPO_TIRE_ID,NOPRESCRIPCION,FPRESCRIPCION,TIPOTECNOLOGIA,CONSECUTIVO,ESTJM,CODENTPROC,OBSERVACIONES,JUSTIFICACIONTECNICA,MODALIDAD,NOACTA,FECHAACTA,FPROCESO,TIPOIDPACIENTE,NROIDPACIENTE,CODENTJM) values ('835',to_date('04/07/19','DD/MM/RR'),'9','2','20190704186012953883',to_date('04/07/19','DD/MM/RR'),'M','1','3','761470851601',null,'ALOPECIA REFRACTARIA A CLOQUINA','1','MP0098',to_date('05/07/19','DD/MM/RR'),'2019-07-05','CC','1112780753','761470851601');
Insert into OASIS4.WEBSERV_JUNTA_PROFESIONAL (ID_JUPR,REPO_PERIODO,REPO_SERV_ID,REPO_TIRE_ID,NOPRESCRIPCION,FPRESCRIPCION,TIPOTECNOLOGIA,CONSECUTIVO,ESTJM,CODENTPROC,OBSERVACIONES,JUSTIFICACIONTECNICA,MODALIDAD,NOACTA,FECHAACTA,FPROCESO,TIPOIDPACIENTE,NROIDPACIENTE,CODENTJM) values ('836',to_date('04/07/19','DD/MM/RR'),'9','2','20190704151012940686',to_date('04/07/19','DD/MM/RR'),'N','1','2',null,null,null,null,null,to_date('01/01/70','DD/MM/RR'),null,'RC','1048324111','470010094101');
Insert into OASIS4.WEBSERV_JUNTA_PROFESIONAL (ID_JUPR,REPO_PERIODO,REPO_SERV_ID,REPO_TIRE_ID,NOPRESCRIPCION,FPRESCRIPCION,TIPOTECNOLOGIA,CONSECUTIVO,ESTJM,CODENTPROC,OBSERVACIONES,JUSTIFICACIONTECNICA,MODALIDAD,NOACTA,FECHAACTA,FPROCESO,TIPOIDPACIENTE,NROIDPACIENTE,CODENTJM) values ('837',to_date('04/07/19','DD/MM/RR'),'9','2','20190704175012941911',to_date('04/07/19','DD/MM/RR'),'N','1','2',null,null,null,null,null,to_date('01/01/70','DD/MM/RR'),null,'TI','1175714788','470010094101');
Insert into OASIS4.WEBSERV_JUNTA_PROFESIONAL (ID_JUPR,REPO_PERIODO,REPO_SERV_ID,REPO_TIRE_ID,NOPRESCRIPCION,FPRESCRIPCION,TIPOTECNOLOGIA,CONSECUTIVO,ESTJM,CODENTPROC,OBSERVACIONES,JUSTIFICACIONTECNICA,MODALIDAD,NOACTA,FECHAACTA,FPROCESO,TIPOIDPACIENTE,NROIDPACIENTE,CODENTJM) values ('838',to_date('04/07/19','DD/MM/RR'),'9','2','20190704161012944218',to_date('04/07/19','DD/MM/RR'),'N','1','3','086340010501',null,'PACIENTE QUE RECAE NUEVAMENTE CON DESNUTRICION AGUDA CON UN PESO DE 12KG TALLA 100CM CON PATOLOGIA ASOCIADA DE PARALISIS CEREBRAL','1','25',to_date('04/07/19','DD/MM/RR'),'2019-07-04','RC','1042355377','086340010501');
Insert into OASIS4.WEBSERV_JUNTA_PROFESIONAL (ID_JUPR,REPO_PERIODO,REPO_SERV_ID,REPO_TIRE_ID,NOPRESCRIPCION,FPRESCRIPCION,TIPOTECNOLOGIA,CONSECUTIVO,ESTJM,CODENTPROC,OBSERVACIONES,JUSTIFICACIONTECNICA,MODALIDAD,NOACTA,FECHAACTA,FPROCESO,TIPOIDPACIENTE,NROIDPACIENTE,CODENTJM) values ('839',to_date('04/07/19','DD/MM/RR'),'9','2','20190704192012944899',to_date('04/07/19','DD/MM/RR'),'N','1','2',null,null,null,null,null,to_date('01/01/70','DD/MM/RR'),null,'CC','29137803','ESS076');
Insert into OASIS4.WEBSERV_JUNTA_PROFESIONAL (ID_JUPR,REPO_PERIODO,REPO_SERV_ID,REPO_TIRE_ID,NOPRESCRIPCION,FPRESCRIPCION,TIPOTECNOLOGIA,CONSECUTIVO,ESTJM,CODENTPROC,OBSERVACIONES,JUSTIFICACIONTECNICA,MODALIDAD,NOACTA,FECHAACTA,FPROCESO,TIPOIDPACIENTE,NROIDPACIENTE,CODENTJM) values ('840',to_date('04/07/19','DD/MM/RR'),'9','2','20190704186012945357',to_date('04/07/19','DD/MM/RR'),'N','1','2',null,null,null,null,null,to_date('01/01/70','DD/MM/RR'),null,'RC','1082254649','470010094101');
Insert into OASIS4.WEBSERV_JUNTA_PROFESIONAL (ID_JUPR,REPO_PERIODO,REPO_SERV_ID,REPO_TIRE_ID,NOPRESCRIPCION,FPRESCRIPCION,TIPOTECNOLOGIA,CONSECUTIVO,ESTJM,CODENTPROC,OBSERVACIONES,JUSTIFICACIONTECNICA,MODALIDAD,NOACTA,FECHAACTA,FPROCESO,TIPOIDPACIENTE,NROIDPACIENTE,CODENTJM) values ('841',to_date('04/07/19','DD/MM/RR'),'9','2','20190704175012945603',to_date('04/07/19','DD/MM/RR'),'N','1','2',null,null,null,null,null,to_date('01/01/70','DD/MM/RR'),null,'TI','1046707916','470010094101');
Insert into OASIS4.WEBSERV_JUNTA_PROFESIONAL (ID_JUPR,REPO_PERIODO,REPO_SERV_ID,REPO_TIRE_ID,NOPRESCRIPCION,FPRESCRIPCION,TIPOTECNOLOGIA,CONSECUTIVO,ESTJM,CODENTPROC,OBSERVACIONES,JUSTIFICACIONTECNICA,MODALIDAD,NOACTA,FECHAACTA,FPROCESO,TIPOIDPACIENTE,NROIDPACIENTE,CODENTJM) values ('842',to_date('04/07/19','DD/MM/RR'),'9','2','20190704157012947653',to_date('04/07/19','DD/MM/RR'),'N','1','2',null,null,null,null,null,to_date('01/01/70','DD/MM/RR'),null,'RC','1152943094','470010094101');
Insert into OASIS4.WEBSERV_JUNTA_PROFESIONAL (ID_JUPR,REPO_PERIODO,REPO_SERV_ID,REPO_TIRE_ID,NOPRESCRIPCION,FPRESCRIPCION,TIPOTECNOLOGIA,CONSECUTIVO,ESTJM,CODENTPROC,OBSERVACIONES,JUSTIFICACIONTECNICA,MODALIDAD,NOACTA,FECHAACTA,FPROCESO,TIPOIDPACIENTE,NROIDPACIENTE,CODENTJM) values ('843',to_date('04/07/19','DD/MM/RR'),'9','2','20190704182012948982',to_date('04/07/19','DD/MM/RR'),'N','1','3','080010445408',null,'PACIENTE FEMENINO DE 74 AÃ‘OS CON DX enfermedad cerebro vascular y  desnutriciÃ³n severa. requiere complemento para cubrir gran parte de requerimiento nutricional','2','264',to_date('05/07/19','DD/MM/RR'),'2019-07-05','CC','22816493','080010445408');
Insert into OASIS4.WEBSERV_JUNTA_PROFESIONAL (ID_JUPR,REPO_PERIODO,REPO_SERV_ID,REPO_TIRE_ID,NOPRESCRIPCION,FPRESCRIPCION,TIPOTECNOLOGIA,CONSECUTIVO,ESTJM,CODENTPROC,OBSERVACIONES,JUSTIFICACIONTECNICA,MODALIDAD,NOACTA,FECHAACTA,FPROCESO,TIPOIDPACIENTE,NROIDPACIENTE,CODENTJM) values ('844',to_date('04/07/19','DD/MM/RR'),'9','2','20190704146012951020',to_date('04/07/19','DD/MM/RR'),'N','1','2',null,null,null,null,null,to_date('01/01/70','DD/MM/RR'),null,'CC','7411734','230010011601');
Insert into OASIS4.WEBSERV_JUNTA_PROFESIONAL (ID_JUPR,REPO_PERIODO,REPO_SERV_ID,REPO_TIRE_ID,NOPRESCRIPCION,FPRESCRIPCION,TIPOTECNOLOGIA,CONSECUTIVO,ESTJM,CODENTPROC,OBSERVACIONES,JUSTIFICACIONTECNICA,MODALIDAD,NOACTA,FECHAACTA,FPROCESO,TIPOIDPACIENTE,NROIDPACIENTE,CODENTJM) values ('845',to_date('04/07/19','DD/MM/RR'),'9','2','20190704174012955851',to_date('04/07/19','DD/MM/RR'),'N','1','3','080010380001',null,'paciente condiagnostico de bajopeso es necesaria alimento suplemetario','1','000012',to_date('18/07/19','DD/MM/RR'),'2019-07-18','RC','1130282885','080010380001');
Insert into OASIS4.WEBSERV_JUNTA_PROFESIONAL (ID_JUPR,REPO_PERIODO,REPO_SERV_ID,REPO_TIRE_ID,NOPRESCRIPCION,FPRESCRIPCION,TIPOTECNOLOGIA,CONSECUTIVO,ESTJM,CODENTPROC,OBSERVACIONES,JUSTIFICACIONTECNICA,MODALIDAD,NOACTA,FECHAACTA,FPROCESO,TIPOIDPACIENTE,NROIDPACIENTE,CODENTJM) values ('846',to_date('04/07/19','DD/MM/RR'),'9','2','20190704145012956281',to_date('04/07/19','DD/MM/RR'),'N','1','2',null,null,null,null,null,to_date('01/01/70','DD/MM/RR'),null,'CC','3681145','080010380001');
Insert into OASIS4.WEBSERV_JUNTA_PROFESIONAL (ID_JUPR,REPO_PERIODO,REPO_SERV_ID,REPO_TIRE_ID,NOPRESCRIPCION,FPRESCRIPCION,TIPOTECNOLOGIA,CONSECUTIVO,ESTJM,CODENTPROC,OBSERVACIONES,JUSTIFICACIONTECNICA,MODALIDAD,NOACTA,FECHAACTA,FPROCESO,TIPOIDPACIENTE,NROIDPACIENTE,CODENTJM) values ('847',to_date('04/07/19','DD/MM/RR'),'9','2','20190704132012956758',to_date('04/07/19','DD/MM/RR'),'N','1','2',null,null,null,null,null,to_date('01/01/70','DD/MM/RR'),null,'CC','862758','086380015401');
Insert into OASIS4.WEBSERV_JUNTA_PROFESIONAL (ID_JUPR,REPO_PERIODO,REPO_SERV_ID,REPO_TIRE_ID,NOPRESCRIPCION,FPRESCRIPCION,TIPOTECNOLOGIA,CONSECUTIVO,ESTJM,CODENTPROC,OBSERVACIONES,JUSTIFICACIONTECNICA,MODALIDAD,NOACTA,FECHAACTA,FPROCESO,TIPOIDPACIENTE,NROIDPACIENTE,CODENTJM) values ('848',to_date('04/07/19','DD/MM/RR'),'9','2','20190704113012960248',to_date('04/07/19','DD/MM/RR'),'N','1','2',null,null,null,null,null,to_date('01/01/70','DD/MM/RR'),null,'CC','22886105','080010409201');
Insert into OASIS4.WEBSERV_JUNTA_PROFESIONAL (ID_JUPR,REPO_PERIODO,REPO_SERV_ID,REPO_TIRE_ID,NOPRESCRIPCION,FPRESCRIPCION,TIPOTECNOLOGIA,CONSECUTIVO,ESTJM,CODENTPROC,OBSERVACIONES,JUSTIFICACIONTECNICA,MODALIDAD,NOACTA,FECHAACTA,FPROCESO,TIPOIDPACIENTE,NROIDPACIENTE,CODENTJM) values ('849',to_date('04/07/19','DD/MM/RR'),'9','2','20190704157012961338',to_date('04/07/19','DD/MM/RR'),'N','1','3','086380074501',null,'MASCULINO DE 67 AÃ‘OS DE EDAD CON SECUELAS DE ISQUEMIA CEREBRAL ,INCONTINENCIA URINARIA Y DENUTRICION PROTEICO CALORICA Y ENF DE PARKINSON ,EN MAL ESTADO GENEral','1','004',to_date('04/07/19','DD/MM/RR'),'2019-09-17','CC','3759025','086380074501');
Insert into OASIS4.WEBSERV_JUNTA_PROFESIONAL (ID_JUPR,REPO_PERIODO,REPO_SERV_ID,REPO_TIRE_ID,NOPRESCRIPCION,FPRESCRIPCION,TIPOTECNOLOGIA,CONSECUTIVO,ESTJM,CODENTPROC,OBSERVACIONES,JUSTIFICACIONTECNICA,MODALIDAD,NOACTA,FECHAACTA,FPROCESO,TIPOIDPACIENTE,NROIDPACIENTE,CODENTJM) values ('850',to_date('04/07/19','DD/MM/RR'),'9','2','20190704154012947369',to_date('04/07/19','DD/MM/RR'),'S','1','2',null,null,null,null,null,to_date('01/01/70','DD/MM/RR'),null,'CC','33067173','134300077501');
Insert into OASIS4.WEBSERV_JUNTA_PROFESIONAL (ID_JUPR,REPO_PERIODO,REPO_SERV_ID,REPO_TIRE_ID,NOPRESCRIPCION,FPRESCRIPCION,TIPOTECNOLOGIA,CONSECUTIVO,ESTJM,CODENTPROC,OBSERVACIONES,JUSTIFICACIONTECNICA,MODALIDAD,NOACTA,FECHAACTA,FPROCESO,TIPOIDPACIENTE,NROIDPACIENTE,CODENTJM) values ('851',to_date('04/07/19','DD/MM/RR'),'9','2','20190704149012951755',to_date('04/07/19','DD/MM/RR'),'S','1','3','760010379901',null,'AMBUQ ,-SE  AUTORIZA  EL TRASLADO  EN UN  MEDIO  DIFERENTE A  AMBULANCIA  DE ACUERDO A RESOLUCION 5857 DE 26/12/2019 TÃ?TULO V TRANSPORTE O TRASLADO DE PACIENTE','1','0477-19',to_date('10/07/19','DD/MM/RR'),'2019-07-10','CC','31430012','760010379901');
Insert into OASIS4.WEBSERV_JUNTA_PROFESIONAL (ID_JUPR,REPO_PERIODO,REPO_SERV_ID,REPO_TIRE_ID,NOPRESCRIPCION,FPRESCRIPCION,TIPOTECNOLOGIA,CONSECUTIVO,ESTJM,CODENTPROC,OBSERVACIONES,JUSTIFICACIONTECNICA,MODALIDAD,NOACTA,FECHAACTA,FPROCESO,TIPOIDPACIENTE,NROIDPACIENTE,CODENTJM) values ('852',to_date('04/07/19','DD/MM/RR'),'9','2','20190704166012954522',to_date('04/07/19','DD/MM/RR'),'S','1','2',null,null,null,null,null,to_date('01/01/70','DD/MM/RR'),null,'CC','32827705','080010409201');
Insert into OASIS4.WEBSERV_JUNTA_PROFESIONAL (ID_JUPR,REPO_PERIODO,REPO_SERV_ID,REPO_TIRE_ID,NOPRESCRIPCION,FPRESCRIPCION,TIPOTECNOLOGIA,CONSECUTIVO,ESTJM,CODENTPROC,OBSERVACIONES,JUSTIFICACIONTECNICA,MODALIDAD,NOACTA,FECHAACTA,FPROCESO,TIPOIDPACIENTE,NROIDPACIENTE,CODENTJM) values ('853',to_date('05/07/19','DD/MM/RR'),'9','2','20190705187012968583',to_date('05/07/19','DD/MM/RR'),'M','1','2',null,null,null,null,null,to_date('01/01/70','DD/MM/RR'),null,'TI','1133689183','050010217501');
Insert into OASIS4.WEBSERV_JUNTA_PROFESIONAL (ID_JUPR,REPO_PERIODO,REPO_SERV_ID,REPO_TIRE_ID,NOPRESCRIPCION,FPRESCRIPCION,TIPOTECNOLOGIA,CONSECUTIVO,ESTJM,CODENTPROC,OBSERVACIONES,JUSTIFICACIONTECNICA,MODALIDAD,NOACTA,FECHAACTA,FPROCESO,TIPOIDPACIENTE,NROIDPACIENTE,CODENTJM) values ('854',to_date('05/07/19','DD/MM/RR'),'9','2','20190705197012979797',to_date('05/07/19','DD/MM/RR'),'M','1','3','080010226001',null,'paciente con mielomeningocele con vejiga neurogenica con incontinencia urinaria diurna y nocturna. se aprueba con diagnostico y mejoria clinica ','1','201923071150',to_date('23/07/19','DD/MM/RR'),'2019-07-23','TI','1043456724','080010226001');
Insert into OASIS4.WEBSERV_JUNTA_PROFESIONAL (ID_JUPR,REPO_PERIODO,REPO_SERV_ID,REPO_TIRE_ID,NOPRESCRIPCION,FPRESCRIPCION,TIPOTECNOLOGIA,CONSECUTIVO,ESTJM,CODENTPROC,OBSERVACIONES,JUSTIFICACIONTECNICA,MODALIDAD,NOACTA,FECHAACTA,FPROCESO,TIPOIDPACIENTE,NROIDPACIENTE,CODENTJM) values ('855',to_date('05/07/19','DD/MM/RR'),'9','2','20190705117012982650',to_date('05/07/19','DD/MM/RR'),'M','1','3','050010217501',null,'15 AÃ‘OS, ENCEFALITIS AUTOINMUN, DETERIORO NEUROLOG, MANEJO EN UNIDAD CUID INTENS, TRAT ESTEROIDES Y PLASMAFERESIS SIN MEJOR, REQ INMUNOGLOB UNICA ALTERNATIV.   ','1','1125',to_date('08/07/19','DD/MM/RR'),'2019-07-08','TI','1133689183','050010217501');
Insert into OASIS4.WEBSERV_JUNTA_PROFESIONAL (ID_JUPR,REPO_PERIODO,REPO_SERV_ID,REPO_TIRE_ID,NOPRESCRIPCION,FPRESCRIPCION,TIPOTECNOLOGIA,CONSECUTIVO,ESTJM,CODENTPROC,OBSERVACIONES,JUSTIFICACIONTECNICA,MODALIDAD,NOACTA,FECHAACTA,FPROCESO,TIPOIDPACIENTE,NROIDPACIENTE,CODENTJM) values ('856',to_date('05/07/19','DD/MM/RR'),'9','2','20190705167012964342',to_date('05/07/19','DD/MM/RR'),'N','1','3','761470067210',null,'Se aprueba soporte nutricional de 15 latas de ensure en polvo  a pte por PATOLOGÃ?AS.','1','37',to_date('11/07/19','DD/MM/RR'),'2019-07-11','TI','1114157232','761470067210');
Insert into OASIS4.WEBSERV_JUNTA_PROFESIONAL (ID_JUPR,REPO_PERIODO,REPO_SERV_ID,REPO_TIRE_ID,NOPRESCRIPCION,FPRESCRIPCION,TIPOTECNOLOGIA,CONSECUTIVO,ESTJM,CODENTPROC,OBSERVACIONES,JUSTIFICACIONTECNICA,MODALIDAD,NOACTA,FECHAACTA,FPROCESO,TIPOIDPACIENTE,NROIDPACIENTE,CODENTJM) values ('857',to_date('05/07/19','DD/MM/RR'),'9','2','20190705145012966439',to_date('05/07/19','DD/MM/RR'),'N','1','2',null,null,null,null,null,to_date('01/01/70','DD/MM/RR'),null,'CC','45730015','134300049201');
Insert into OASIS4.WEBSERV_JUNTA_PROFESIONAL (ID_JUPR,REPO_PERIODO,REPO_SERV_ID,REPO_TIRE_ID,NOPRESCRIPCION,FPRESCRIPCION,TIPOTECNOLOGIA,CONSECUTIVO,ESTJM,CODENTPROC,OBSERVACIONES,JUSTIFICACIONTECNICA,MODALIDAD,NOACTA,FECHAACTA,FPROCESO,TIPOIDPACIENTE,NROIDPACIENTE,CODENTJM) values ('858',to_date('05/07/19','DD/MM/RR'),'9','2','20190705127012974087',to_date('05/07/19','DD/MM/RR'),'N','1','3','082960002101',null,'LACTANTE PREMATURA CON INTESTINO CORTO, DESNUTRICION, NO RECIBE LACTANCIA MATERNA, INDICADA LECHE HIDROLIZADAS.','1','24',to_date('08/07/19','DD/MM/RR'),'2019-07-08','RC','1044230171','082960002101');
Insert into OASIS4.WEBSERV_JUNTA_PROFESIONAL (ID_JUPR,REPO_PERIODO,REPO_SERV_ID,REPO_TIRE_ID,NOPRESCRIPCION,FPRESCRIPCION,TIPOTECNOLOGIA,CONSECUTIVO,ESTJM,CODENTPROC,OBSERVACIONES,JUSTIFICACIONTECNICA,MODALIDAD,NOACTA,FECHAACTA,FPROCESO,TIPOIDPACIENTE,NROIDPACIENTE,CODENTJM) values ('859',to_date('05/07/19','DD/MM/RR'),'9','2','20190705144012977964',to_date('05/07/19','DD/MM/RR'),'N','1','3','087580016101',null,'SE RECOMIENDA ALIMENTO COMPLETO Y BALANCEADO PARA RECUPERAR ESTADO NUTRICIONAL DEL PACIENTE.','1','0017',to_date('05/07/19','DD/MM/RR'),'2019-07-05','CC','22286104','087580016101');
Insert into OASIS4.WEBSERV_JUNTA_PROFESIONAL (ID_JUPR,REPO_PERIODO,REPO_SERV_ID,REPO_TIRE_ID,NOPRESCRIPCION,FPRESCRIPCION,TIPOTECNOLOGIA,CONSECUTIVO,ESTJM,CODENTPROC,OBSERVACIONES,JUSTIFICACIONTECNICA,MODALIDAD,NOACTA,FECHAACTA,FPROCESO,TIPOIDPACIENTE,NROIDPACIENTE,CODENTJM) values ('860',to_date('05/07/19','DD/MM/RR'),'9','2','20190705131012964482',to_date('05/07/19','DD/MM/RR'),'S','1','3','761470067210',null,'SE APRUEBA 450 PAÃ‘ALES PARA UNA DURACIÃ“N DE 90 DÃ?AS PARA EL PACIENTE POR PATOLOGÃ?AS.','1','38',to_date('11/07/19','DD/MM/RR'),'2019-07-11','TI','1114157232','761470067210');
Insert into OASIS4.WEBSERV_JUNTA_PROFESIONAL (ID_JUPR,REPO_PERIODO,REPO_SERV_ID,REPO_TIRE_ID,NOPRESCRIPCION,FPRESCRIPCION,TIPOTECNOLOGIA,CONSECUTIVO,ESTJM,CODENTPROC,OBSERVACIONES,JUSTIFICACIONTECNICA,MODALIDAD,NOACTA,FECHAACTA,FPROCESO,TIPOIDPACIENTE,NROIDPACIENTE,CODENTJM) values ('861',to_date('05/07/19','DD/MM/RR'),'9','2','20190705150012966748',to_date('05/07/19','DD/MM/RR'),'S','1','3','080010003601',null,'Paciente quien presenta LEUCOMA CORNEAL Y SINEQUIA ANTERIOR OJO I. Un lente \ncosmoprotesico reducirÃ¡ al mÃ­nimo la hipoxia, la disrupciÃ³n de la pelÃ­cula lagrimal','1','001',to_date('05/07/19','DD/MM/RR'),'2019-07-05','CC','3741497','080010003601');
Insert into OASIS4.WEBSERV_JUNTA_PROFESIONAL (ID_JUPR,REPO_PERIODO,REPO_SERV_ID,REPO_TIRE_ID,NOPRESCRIPCION,FPRESCRIPCION,TIPOTECNOLOGIA,CONSECUTIVO,ESTJM,CODENTPROC,OBSERVACIONES,JUSTIFICACIONTECNICA,MODALIDAD,NOACTA,FECHAACTA,FPROCESO,TIPOIDPACIENTE,NROIDPACIENTE,CODENTJM) values ('862',to_date('05/07/19','DD/MM/RR'),'9','2','20190705118012968417',to_date('05/07/19','DD/MM/RR'),'S','1','3','080010003601',null,'SE INDICA LENTE DE CONTACTO COMO PRIMER NIVEL TERAPUTICO DEL QUERATOCONO','1','001',to_date('05/07/19','DD/MM/RR'),'2019-07-05','CC','1140903848','080010003601');
Insert into OASIS4.WEBSERV_JUNTA_PROFESIONAL (ID_JUPR,REPO_PERIODO,REPO_SERV_ID,REPO_TIRE_ID,NOPRESCRIPCION,FPRESCRIPCION,TIPOTECNOLOGIA,CONSECUTIVO,ESTJM,CODENTPROC,OBSERVACIONES,JUSTIFICACIONTECNICA,MODALIDAD,NOACTA,FECHAACTA,FPROCESO,TIPOIDPACIENTE,NROIDPACIENTE,CODENTJM) values ('863',to_date('06/07/19','DD/MM/RR'),'9','2','20190706148012988630',to_date('06/07/19','DD/MM/RR'),'M','1','3','082960002101',null,'SINDROME NEFROTICO, LUPUS ERITEMATOSO SISTEMICO, REPORTE DE DNA POSITIVO, SOLICITUD POR PEDIATRA DE HOSPITALIZACION ','1','19',to_date('08/07/19','DD/MM/RR'),'2019-07-08','TI','1047216499','082960002101');
Insert into OASIS4.WEBSERV_JUNTA_PROFESIONAL (ID_JUPR,REPO_PERIODO,REPO_SERV_ID,REPO_TIRE_ID,NOPRESCRIPCION,FPRESCRIPCION,TIPOTECNOLOGIA,CONSECUTIVO,ESTJM,CODENTPROC,OBSERVACIONES,JUSTIFICACIONTECNICA,MODALIDAD,NOACTA,FECHAACTA,FPROCESO,TIPOIDPACIENTE,NROIDPACIENTE,CODENTJM) values ('864',to_date('06/07/19','DD/MM/RR'),'9','2','20190706198012991420',to_date('06/07/19','DD/MM/RR'),'M','1','2',null,null,null,null,null,to_date('01/01/70','DD/MM/RR'),null,'CC','1042440495','087580001301');
Insert into OASIS4.WEBSERV_JUNTA_PROFESIONAL (ID_JUPR,REPO_PERIODO,REPO_SERV_ID,REPO_TIRE_ID,NOPRESCRIPCION,FPRESCRIPCION,TIPOTECNOLOGIA,CONSECUTIVO,ESTJM,CODENTPROC,OBSERVACIONES,JUSTIFICACIONTECNICA,MODALIDAD,NOACTA,FECHAACTA,FPROCESO,TIPOIDPACIENTE,NROIDPACIENTE,CODENTJM) values ('865',to_date('06/07/19','DD/MM/RR'),'9','2','20190706166012991549',to_date('06/07/19','DD/MM/RR'),'M','1','2',null,null,null,null,null,to_date('01/01/70','DD/MM/RR'),null,'CC','1042440495','087580001301');
Insert into OASIS4.WEBSERV_JUNTA_PROFESIONAL (ID_JUPR,REPO_PERIODO,REPO_SERV_ID,REPO_TIRE_ID,NOPRESCRIPCION,FPRESCRIPCION,TIPOTECNOLOGIA,CONSECUTIVO,ESTJM,CODENTPROC,OBSERVACIONES,JUSTIFICACIONTECNICA,MODALIDAD,NOACTA,FECHAACTA,FPROCESO,TIPOIDPACIENTE,NROIDPACIENTE,CODENTJM) values ('614',to_date('06/06/19','DD/MM/RR'),'9','2','20190606170012419763',to_date('06/06/19','DD/MM/RR'),'N','1','3','087580016101',null,'se recomienda producto nutricional para recuperar estado del paciente','2','01',to_date('02/07/19','DD/MM/RR'),'2019-07-02','CC','22946627','087580016101');
Insert into OASIS4.WEBSERV_JUNTA_PROFESIONAL (ID_JUPR,REPO_PERIODO,REPO_SERV_ID,REPO_TIRE_ID,NOPRESCRIPCION,FPRESCRIPCION,TIPOTECNOLOGIA,CONSECUTIVO,ESTJM,CODENTPROC,OBSERVACIONES,JUSTIFICACIONTECNICA,MODALIDAD,NOACTA,FECHAACTA,FPROCESO,TIPOIDPACIENTE,NROIDPACIENTE,CODENTJM) values ('615',to_date('06/06/19','DD/MM/RR'),'9','2','20190606188012420259',to_date('06/06/19','DD/MM/RR'),'N','1','3','080010380001',null,'pcte con diagnostico de DESNUTRICIÃ“N moderada requiere ALIMENTACIÃ“N complementaria para ayudarla  a recuperar su masa muscular y su CONDICIÃ“N FÃ?SICA. ','1','00001',to_date('07/06/19','DD/MM/RR'),'2019-06-07','CC','57455576','080010380001');
Insert into OASIS4.WEBSERV_JUNTA_PROFESIONAL (ID_JUPR,REPO_PERIODO,REPO_SERV_ID,REPO_TIRE_ID,NOPRESCRIPCION,FPRESCRIPCION,TIPOTECNOLOGIA,CONSECUTIVO,ESTJM,CODENTPROC,OBSERVACIONES,JUSTIFICACIONTECNICA,MODALIDAD,NOACTA,FECHAACTA,FPROCESO,TIPOIDPACIENTE,NROIDPACIENTE,CODENTJM) values ('616',to_date('06/06/19','DD/MM/RR'),'9','2','20190606120012420696',to_date('06/06/19','DD/MM/RR'),'N','1','3','086340010501',null,'PACIENTE DE 4 AÃ‘OS DE EDAD CON PESO DE 13 KG TALLA 98 CM  DIAGNOSTICO NUTRICIONAL DE RIESGO DE DESNUTRICIÃ“N REQUIERE DE ESTE COMPLEMENTO NUTRICIONAL ','1','20',to_date('06/06/19','DD/MM/RR'),'2019-06-06','RC','1042355720','086340010501');
Insert into OASIS4.WEBSERV_JUNTA_PROFESIONAL (ID_JUPR,REPO_PERIODO,REPO_SERV_ID,REPO_TIRE_ID,NOPRESCRIPCION,FPRESCRIPCION,TIPOTECNOLOGIA,CONSECUTIVO,ESTJM,CODENTPROC,OBSERVACIONES,JUSTIFICACIONTECNICA,MODALIDAD,NOACTA,FECHAACTA,FPROCESO,TIPOIDPACIENTE,NROIDPACIENTE,CODENTJM) values ('617',to_date('06/06/19','DD/MM/RR'),'9','2','20190606111012424399',to_date('06/06/19','DD/MM/RR'),'N','1','3','761470851601',null,'quien requiere complementar su NUTRICIÃ“N, con alimento liquido densamente calÃ³rico 1.3 Kcal/mL, hiperprotÃ©ico 20.5%, proteÃ­na hidrolizada a base de pÃ©ptidos','1','MP0088',to_date('07/06/19','DD/MM/RR'),'2019-06-07','CC','29802580','761470851601');
Insert into OASIS4.WEBSERV_JUNTA_PROFESIONAL (ID_JUPR,REPO_PERIODO,REPO_SERV_ID,REPO_TIRE_ID,NOPRESCRIPCION,FPRESCRIPCION,TIPOTECNOLOGIA,CONSECUTIVO,ESTJM,CODENTPROC,OBSERVACIONES,JUSTIFICACIONTECNICA,MODALIDAD,NOACTA,FECHAACTA,FPROCESO,TIPOIDPACIENTE,NROIDPACIENTE,CODENTJM) values ('618',to_date('06/06/19','DD/MM/RR'),'9','2','20190606132012429575',to_date('06/06/19','DD/MM/RR'),'N','1','3','080010380001',null,'PACIENTE QUE POR SU ESTADO DE SALUD Y SU PESO, NECESITA ALIMENTACION COMPLEMENTARIA PARA AYUDARLA A RECUPERAR SU ESTADO FISICO ','1','00003',to_date('07/06/19','DD/MM/RR'),'2019-06-07','CC','32817818','080010380001');
Insert into OASIS4.WEBSERV_JUNTA_PROFESIONAL (ID_JUPR,REPO_PERIODO,REPO_SERV_ID,REPO_TIRE_ID,NOPRESCRIPCION,FPRESCRIPCION,TIPOTECNOLOGIA,CONSECUTIVO,ESTJM,CODENTPROC,OBSERVACIONES,JUSTIFICACIONTECNICA,MODALIDAD,NOACTA,FECHAACTA,FPROCESO,TIPOIDPACIENTE,NROIDPACIENTE,CODENTJM) values ('619',to_date('06/06/19','DD/MM/RR'),'9','2','20190606133012430176',to_date('06/06/19','DD/MM/RR'),'N','1','3','080010380001',null,'femenina de 59 aÃ±os con dx: desnjutricion leve nesecita alimentacion complementaria, con inapetencia y cansancio ','1','00002',to_date('07/06/19','DD/MM/RR'),'2019-06-07','CC','22368118','080010380001');
Insert into OASIS4.WEBSERV_JUNTA_PROFESIONAL (ID_JUPR,REPO_PERIODO,REPO_SERV_ID,REPO_TIRE_ID,NOPRESCRIPCION,FPRESCRIPCION,TIPOTECNOLOGIA,CONSECUTIVO,ESTJM,CODENTPROC,OBSERVACIONES,JUSTIFICACIONTECNICA,MODALIDAD,NOACTA,FECHAACTA,FPROCESO,TIPOIDPACIENTE,NROIDPACIENTE,CODENTJM) values ('620',to_date('06/06/19','DD/MM/RR'),'9','2','20190606171012431070',to_date('06/06/19','DD/MM/RR'),'N','1','2',null,null,null,null,null,to_date('01/01/70','DD/MM/RR'),null,'CC','24526104','760410406501');
Insert into OASIS4.WEBSERV_JUNTA_PROFESIONAL (ID_JUPR,REPO_PERIODO,REPO_SERV_ID,REPO_TIRE_ID,NOPRESCRIPCION,FPRESCRIPCION,TIPOTECNOLOGIA,CONSECUTIVO,ESTJM,CODENTPROC,OBSERVACIONES,JUSTIFICACIONTECNICA,MODALIDAD,NOACTA,FECHAACTA,FPROCESO,TIPOIDPACIENTE,NROIDPACIENTE,CODENTJM) values ('621',to_date('06/06/19','DD/MM/RR'),'9','2','20190606131012431347',to_date('06/06/19','DD/MM/RR'),'N','1','3','761470067210',null,'Se aprueban 12 latas de ensure por 90 DÃ?AS a paciente por PATOLOGÃ?AS.','1','44',to_date('11/07/19','DD/MM/RR'),'2019-07-11','CC','17642974','761470067210');
Insert into OASIS4.WEBSERV_JUNTA_PROFESIONAL (ID_JUPR,REPO_PERIODO,REPO_SERV_ID,REPO_TIRE_ID,NOPRESCRIPCION,FPRESCRIPCION,TIPOTECNOLOGIA,CONSECUTIVO,ESTJM,CODENTPROC,OBSERVACIONES,JUSTIFICACIONTECNICA,MODALIDAD,NOACTA,FECHAACTA,FPROCESO,TIPOIDPACIENTE,NROIDPACIENTE,CODENTJM) values ('622',to_date('06/06/19','DD/MM/RR'),'9','2','20190606162012433687',to_date('06/06/19','DD/MM/RR'),'N','1','3','080010054401',null,' LA JUNTA MEDICA HA REVISADO SU CASO Y DECIDEN POR CONDICION CLINICA DEL PACIENTE SE AUTORIZA EL USO DE FORMULA NUTRICIONAL POLIMERICA ENSURE 237 ML','1','0854',to_date('06/06/19','DD/MM/RR'),'2019-06-06','CC','33194302','080010054401');
Insert into OASIS4.WEBSERV_JUNTA_PROFESIONAL (ID_JUPR,REPO_PERIODO,REPO_SERV_ID,REPO_TIRE_ID,NOPRESCRIPCION,FPRESCRIPCION,TIPOTECNOLOGIA,CONSECUTIVO,ESTJM,CODENTPROC,OBSERVACIONES,JUSTIFICACIONTECNICA,MODALIDAD,NOACTA,FECHAACTA,FPROCESO,TIPOIDPACIENTE,NROIDPACIENTE,CODENTJM) values ('623',to_date('06/06/19','DD/MM/RR'),'9','2','20190606119012436212',to_date('06/06/19','DD/MM/RR'),'S','1','3','080010003601',null,'SE INDICA LENTE DE CONTACTO COMO PRIMER NIVEL TERAPÃ‰UTICO DEL QUERATOCONO.','1','001',to_date('07/06/19','DD/MM/RR'),'2019-06-07','CC','19161300','080010003601');
Insert into OASIS4.WEBSERV_JUNTA_PROFESIONAL (ID_JUPR,REPO_PERIODO,REPO_SERV_ID,REPO_TIRE_ID,NOPRESCRIPCION,FPRESCRIPCION,TIPOTECNOLOGIA,CONSECUTIVO,ESTJM,CODENTPROC,OBSERVACIONES,JUSTIFICACIONTECNICA,MODALIDAD,NOACTA,FECHAACTA,FPROCESO,TIPOIDPACIENTE,NROIDPACIENTE,CODENTJM) values ('624',to_date('06/06/19','DD/MM/RR'),'9','2','20190606142012436421',to_date('06/06/19','DD/MM/RR'),'S','2','2',null,null,null,null,null,to_date('01/01/70','DD/MM/RR'),null,'CC','1149436563','200010205401');
Insert into OASIS4.WEBSERV_JUNTA_PROFESIONAL (ID_JUPR,REPO_PERIODO,REPO_SERV_ID,REPO_TIRE_ID,NOPRESCRIPCION,FPRESCRIPCION,TIPOTECNOLOGIA,CONSECUTIVO,ESTJM,CODENTPROC,OBSERVACIONES,JUSTIFICACIONTECNICA,MODALIDAD,NOACTA,FECHAACTA,FPROCESO,TIPOIDPACIENTE,NROIDPACIENTE,CODENTJM) values ('625',to_date('06/06/19','DD/MM/RR'),'9','2','20190606142012436421',to_date('06/06/19','DD/MM/RR'),'S','3','2',null,null,null,null,null,to_date('01/01/70','DD/MM/RR'),null,'CC','1149436563','200010205401');
Insert into OASIS4.WEBSERV_JUNTA_PROFESIONAL (ID_JUPR,REPO_PERIODO,REPO_SERV_ID,REPO_TIRE_ID,NOPRESCRIPCION,FPRESCRIPCION,TIPOTECNOLOGIA,CONSECUTIVO,ESTJM,CODENTPROC,OBSERVACIONES,JUSTIFICACIONTECNICA,MODALIDAD,NOACTA,FECHAACTA,FPROCESO,TIPOIDPACIENTE,NROIDPACIENTE,CODENTJM) values ('626',to_date('06/06/19','DD/MM/RR'),'9','2','20190606176012437573',to_date('06/06/19','DD/MM/RR'),'S','2','2',null,null,null,null,null,to_date('01/01/70','DD/MM/RR'),null,'CC','1739046','200010205401');
Insert into OASIS4.WEBSERV_JUNTA_PROFESIONAL (ID_JUPR,REPO_PERIODO,REPO_SERV_ID,REPO_TIRE_ID,NOPRESCRIPCION,FPRESCRIPCION,TIPOTECNOLOGIA,CONSECUTIVO,ESTJM,CODENTPROC,OBSERVACIONES,JUSTIFICACIONTECNICA,MODALIDAD,NOACTA,FECHAACTA,FPROCESO,TIPOIDPACIENTE,NROIDPACIENTE,CODENTJM) values ('627',to_date('07/06/19','DD/MM/RR'),'9','2','20190607170012446536',to_date('07/06/19','DD/MM/RR'),'M','1','2',null,null,null,null,null,to_date('01/01/70','DD/MM/RR'),null,'TI','1131314108','134300049201');
Insert into OASIS4.WEBSERV_JUNTA_PROFESIONAL (ID_JUPR,REPO_PERIODO,REPO_SERV_ID,REPO_TIRE_ID,NOPRESCRIPCION,FPRESCRIPCION,TIPOTECNOLOGIA,CONSECUTIVO,ESTJM,CODENTPROC,OBSERVACIONES,JUSTIFICACIONTECNICA,MODALIDAD,NOACTA,FECHAACTA,FPROCESO,TIPOIDPACIENTE,NROIDPACIENTE,CODENTJM) values ('628',to_date('07/06/19','DD/MM/RR'),'9','2','20190607173012455208',to_date('07/06/19','DD/MM/RR'),'M','1','3','760010379901',null,'ASOCIACIÃ“N MUTUAL BARRIOS UNIDOS DE QUIBDÃ“','1','0418-19',to_date('13/06/19','DD/MM/RR'),'2019-06-17','CC','16248006','760010379901');
Insert into OASIS4.WEBSERV_JUNTA_PROFESIONAL (ID_JUPR,REPO_PERIODO,REPO_SERV_ID,REPO_TIRE_ID,NOPRESCRIPCION,FPRESCRIPCION,TIPOTECNOLOGIA,CONSECUTIVO,ESTJM,CODENTPROC,OBSERVACIONES,JUSTIFICACIONTECNICA,MODALIDAD,NOACTA,FECHAACTA,FPROCESO,TIPOIDPACIENTE,NROIDPACIENTE,CODENTJM) values ('629',to_date('07/06/19','DD/MM/RR'),'9','2','20190607151012445990',to_date('07/06/19','DD/MM/RR'),'N','1','3','080010445404',null,'PACIENTE FEMENINO DE 70 AÃ‘OS CON DX MEDICO DE DM Insulinodependiente\n Y DX NUTRICIONAL DE DELGADEZ MODERADA. REQUIERE SUPLEMENTO. ','2','198',to_date('17/06/19','DD/MM/RR'),'2019-06-17','CC','22435887','080010445404');
Insert into OASIS4.WEBSERV_JUNTA_PROFESIONAL (ID_JUPR,REPO_PERIODO,REPO_SERV_ID,REPO_TIRE_ID,NOPRESCRIPCION,FPRESCRIPCION,TIPOTECNOLOGIA,CONSECUTIVO,ESTJM,CODENTPROC,OBSERVACIONES,JUSTIFICACIONTECNICA,MODALIDAD,NOACTA,FECHAACTA,FPROCESO,TIPOIDPACIENTE,NROIDPACIENTE,CODENTJM) values ('630',to_date('07/06/19','DD/MM/RR'),'9','2','20190607143012446305',to_date('07/06/19','DD/MM/RR'),'N','1','2',null,null,null,null,null,to_date('01/01/70','DD/MM/RR'),null,'CC','22376272','086380015401');
Insert into OASIS4.WEBSERV_JUNTA_PROFESIONAL (ID_JUPR,REPO_PERIODO,REPO_SERV_ID,REPO_TIRE_ID,NOPRESCRIPCION,FPRESCRIPCION,TIPOTECNOLOGIA,CONSECUTIVO,ESTJM,CODENTPROC,OBSERVACIONES,JUSTIFICACIONTECNICA,MODALIDAD,NOACTA,FECHAACTA,FPROCESO,TIPOIDPACIENTE,NROIDPACIENTE,CODENTJM) values ('631',to_date('07/06/19','DD/MM/RR'),'9','2','20190607153012448635',to_date('07/06/19','DD/MM/RR'),'N','1','3','087580001301',null,'PACIENTE QUE ASISTE A CITA DE CONTROL POR NUTRICION POR PRIMERA VEZ ,  REMITIDA POR EL MEDICO TRATANTE POR ENCONTRARSE EN DESNUTRICION , PERDIDA DE APETITO .','1','065-2019',to_date('10/06/19','DD/MM/RR'),'2019-06-12','CC','57400854','087580001301');
Insert into OASIS4.WEBSERV_JUNTA_PROFESIONAL (ID_JUPR,REPO_PERIODO,REPO_SERV_ID,REPO_TIRE_ID,NOPRESCRIPCION,FPRESCRIPCION,TIPOTECNOLOGIA,CONSECUTIVO,ESTJM,CODENTPROC,OBSERVACIONES,JUSTIFICACIONTECNICA,MODALIDAD,NOACTA,FECHAACTA,FPROCESO,TIPOIDPACIENTE,NROIDPACIENTE,CODENTJM) values ('632',to_date('07/06/19','DD/MM/RR'),'9','2','20190607170012449317',to_date('07/06/19','DD/MM/RR'),'N','1','3','134300290801',null,'pte con diabetes, requerimientos caloricos diarios estrictos alimentacion baja en hidratos de carbono','1','24',to_date('17/06/19','DD/MM/RR'),'2019-06-17','CC','22929431','134300290801');
Insert into OASIS4.WEBSERV_JUNTA_PROFESIONAL (ID_JUPR,REPO_PERIODO,REPO_SERV_ID,REPO_TIRE_ID,NOPRESCRIPCION,FPRESCRIPCION,TIPOTECNOLOGIA,CONSECUTIVO,ESTJM,CODENTPROC,OBSERVACIONES,JUSTIFICACIONTECNICA,MODALIDAD,NOACTA,FECHAACTA,FPROCESO,TIPOIDPACIENTE,NROIDPACIENTE,CODENTJM) values ('633',to_date('07/06/19','DD/MM/RR'),'9','2','20190607157012449594',to_date('07/06/19','DD/MM/RR'),'N','1','3','134300290801',null,'DESNUTRICION PROTEICOCALORICA SEVERA, NO ESPECIFICADA \n','1','019',to_date('10/06/19','DD/MM/RR'),'2019-06-10','CC','33206229','134300290801');
Insert into OASIS4.WEBSERV_JUNTA_PROFESIONAL (ID_JUPR,REPO_PERIODO,REPO_SERV_ID,REPO_TIRE_ID,NOPRESCRIPCION,FPRESCRIPCION,TIPOTECNOLOGIA,CONSECUTIVO,ESTJM,CODENTPROC,OBSERVACIONES,JUSTIFICACIONTECNICA,MODALIDAD,NOACTA,FECHAACTA,FPROCESO,TIPOIDPACIENTE,NROIDPACIENTE,CODENTJM) values ('634',to_date('07/06/19','DD/MM/RR'),'9','2','20190607116012449698',to_date('07/06/19','DD/MM/RR'),'N','1','2',null,null,null,null,null,to_date('01/01/70','DD/MM/RR'),null,'CC','22370267','086380015401');
Insert into OASIS4.WEBSERV_JUNTA_PROFESIONAL (ID_JUPR,REPO_PERIODO,REPO_SERV_ID,REPO_TIRE_ID,NOPRESCRIPCION,FPRESCRIPCION,TIPOTECNOLOGIA,CONSECUTIVO,ESTJM,CODENTPROC,OBSERVACIONES,JUSTIFICACIONTECNICA,MODALIDAD,NOACTA,FECHAACTA,FPROCESO,TIPOIDPACIENTE,NROIDPACIENTE,CODENTJM) values ('635',to_date('07/06/19','DD/MM/RR'),'9','2','20190607114012449763',to_date('07/06/19','DD/MM/RR'),'N','1','3','080010380001',null,'PACIENTE FEMENINA AÃ‘OSA EN SU NOVENA DÃ‰CADA CON DIAGNÃ“STICOS DE DESNUTRICIÃ“N Y ANEMIA FERROPENIA EN 10.7, PARA PREVENIR DESCOMPENSACIÃ“N REQUIERE DE SUPLEMENTO. ','1','11',to_date('07/06/19','DD/MM/RR'),'2019-06-07','CC','22284395','080010380001');
Insert into OASIS4.WEBSERV_JUNTA_PROFESIONAL (ID_JUPR,REPO_PERIODO,REPO_SERV_ID,REPO_TIRE_ID,NOPRESCRIPCION,FPRESCRIPCION,TIPOTECNOLOGIA,CONSECUTIVO,ESTJM,CODENTPROC,OBSERVACIONES,JUSTIFICACIONTECNICA,MODALIDAD,NOACTA,FECHAACTA,FPROCESO,TIPOIDPACIENTE,NROIDPACIENTE,CODENTJM) values ('636',to_date('07/06/19','DD/MM/RR'),'9','2','20190607172012450850',to_date('07/06/19','DD/MM/RR'),'N','1','3','082960002101',null,'DIABETES MELLITUS INSULINODEPENDIENTE, CON OTRAS COMPLICACIONES ESPECIFICAS','1','0017',to_date('20/06/19','DD/MM/RR'),'2019-06-20','CC','8791701','082960002101');
Insert into OASIS4.WEBSERV_JUNTA_PROFESIONAL (ID_JUPR,REPO_PERIODO,REPO_SERV_ID,REPO_TIRE_ID,NOPRESCRIPCION,FPRESCRIPCION,TIPOTECNOLOGIA,CONSECUTIVO,ESTJM,CODENTPROC,OBSERVACIONES,JUSTIFICACIONTECNICA,MODALIDAD,NOACTA,FECHAACTA,FPROCESO,TIPOIDPACIENTE,NROIDPACIENTE,CODENTJM) values ('637',to_date('07/06/19','DD/MM/RR'),'9','2','20190607130012451800',to_date('07/06/19','DD/MM/RR'),'N','1','3','087580001301',null,'PACIENTE QUE ASISTE A CITA DE CONTROL POR NUTRICION POR PRESENTAR DESNUTRICION PROTEICO CALORICA SEVERA se inicia soporte nutricional oral con 2 tomas diarias ','1','070-2019',to_date('15/06/19','DD/MM/RR'),'2019-06-20','CC','26716881','087580001301');
Insert into OASIS4.WEBSERV_JUNTA_PROFESIONAL (ID_JUPR,REPO_PERIODO,REPO_SERV_ID,REPO_TIRE_ID,NOPRESCRIPCION,FPRESCRIPCION,TIPOTECNOLOGIA,CONSECUTIVO,ESTJM,CODENTPROC,OBSERVACIONES,JUSTIFICACIONTECNICA,MODALIDAD,NOACTA,FECHAACTA,FPROCESO,TIPOIDPACIENTE,NROIDPACIENTE,CODENTJM) values ('638',to_date('07/06/19','DD/MM/RR'),'9','2','20190607193012452588',to_date('07/06/19','DD/MM/RR'),'N','1','3','080010054401',null,'LA JUNTA MEDICA HA REVISADO SU CASO Y DECIDEN POR CONDICION CLINICA DEL PACIENTE SE AUTORIZA EL USO DE FORMULA NUTRICIONAL POLIMERICA ENSURE 237 ML ','1','0856',to_date('07/06/19','DD/MM/RR'),'2019-06-07','CC','5132107','080010054401');
Insert into OASIS4.WEBSERV_JUNTA_PROFESIONAL (ID_JUPR,REPO_PERIODO,REPO_SERV_ID,REPO_TIRE_ID,NOPRESCRIPCION,FPRESCRIPCION,TIPOTECNOLOGIA,CONSECUTIVO,ESTJM,CODENTPROC,OBSERVACIONES,JUSTIFICACIONTECNICA,MODALIDAD,NOACTA,FECHAACTA,FPROCESO,TIPOIDPACIENTE,NROIDPACIENTE,CODENTJM) values ('639',to_date('07/06/19','DD/MM/RR'),'9','2','20190607182012453216',to_date('07/06/19','DD/MM/RR'),'N','1','3','130010178101',null,'SIGUE CON DESNUTRICIÃ“N/PROTEICO/CALORICA SEVERA, AUMENTÃ“ 2 KILOGRAMOS DE PESO, SU EPS, NO LE HAN SUMINISTRADO LOS SUPLEMENTOS NUTRICIONALES, SU RECUPERACIÃ“N NUT','1','33',to_date('11/06/19','DD/MM/RR'),'2019-06-11','CC','45473036','130010178101');
Insert into OASIS4.WEBSERV_JUNTA_PROFESIONAL (ID_JUPR,REPO_PERIODO,REPO_SERV_ID,REPO_TIRE_ID,NOPRESCRIPCION,FPRESCRIPCION,TIPOTECNOLOGIA,CONSECUTIVO,ESTJM,CODENTPROC,OBSERVACIONES,JUSTIFICACIONTECNICA,MODALIDAD,NOACTA,FECHAACTA,FPROCESO,TIPOIDPACIENTE,NROIDPACIENTE,CODENTJM) values ('640',to_date('07/06/19','DD/MM/RR'),'9','2','20190607147012455175',to_date('07/06/19','DD/MM/RR'),'N','1','3','080010380001',null,'Paciente masculino de 91 aÃ±os de edad con antecedente de desnutriciÃ³n proteicocalorica leve e inapetencia, requiere de suplemento dietario para prevenir.','1','12',to_date('07/06/19','DD/MM/RR'),'2019-06-07','CC','3708182','080010380001');
Insert into OASIS4.WEBSERV_JUNTA_PROFESIONAL (ID_JUPR,REPO_PERIODO,REPO_SERV_ID,REPO_TIRE_ID,NOPRESCRIPCION,FPRESCRIPCION,TIPOTECNOLOGIA,CONSECUTIVO,ESTJM,CODENTPROC,OBSERVACIONES,JUSTIFICACIONTECNICA,MODALIDAD,NOACTA,FECHAACTA,FPROCESO,TIPOIDPACIENTE,NROIDPACIENTE,CODENTJM) values ('641',to_date('07/06/19','DD/MM/RR'),'9','2','20190607187012456025',to_date('07/06/19','DD/MM/RR'),'N','1','3','080010380001',null,'ADOLESCENTE DE 13 AÃ‘OS DE EDAD CON DIAGNÃ“STICO DE DESNUTRICIÃ“N SEVERA CON 27 KG IMC: 13.7 REQUIERE DE ALIMENTACIÃ“N COMPLEMENTARIA Y SEGUIMIENTO POR NUTRICION.','1','8',to_date('07/06/19','DD/MM/RR'),'2019-06-07','TI','1044611847','080010380001');
Insert into OASIS4.WEBSERV_JUNTA_PROFESIONAL (ID_JUPR,REPO_PERIODO,REPO_SERV_ID,REPO_TIRE_ID,NOPRESCRIPCION,FPRESCRIPCION,TIPOTECNOLOGIA,CONSECUTIVO,ESTJM,CODENTPROC,OBSERVACIONES,JUSTIFICACIONTECNICA,MODALIDAD,NOACTA,FECHAACTA,FPROCESO,TIPOIDPACIENTE,NROIDPACIENTE,CODENTJM) values ('642',to_date('07/06/19','DD/MM/RR'),'9','2','20190607160012456883',to_date('07/06/19','DD/MM/RR'),'N','1','3','130010210201',null,'PERDIDA DE PESO 14.6 POR CIENTO  SEVERA EN ADULTO MAYOR IMPACTO ALTO DE MORTALIDAD CIRCUNFERENCIA DE PANTORRILLA 26 CM EMACIADA REQUIERE RECUPERAR NUTRICION','2','16',to_date('07/06/19','DD/MM/RR'),'2019-06-07','CC','4029871','130010210201');
Insert into OASIS4.WEBSERV_JUNTA_PROFESIONAL (ID_JUPR,REPO_PERIODO,REPO_SERV_ID,REPO_TIRE_ID,NOPRESCRIPCION,FPRESCRIPCION,TIPOTECNOLOGIA,CONSECUTIVO,ESTJM,CODENTPROC,OBSERVACIONES,JUSTIFICACIONTECNICA,MODALIDAD,NOACTA,FECHAACTA,FPROCESO,TIPOIDPACIENTE,NROIDPACIENTE,CODENTJM) values ('643',to_date('07/06/19','DD/MM/RR'),'9','2','20190607116012458046',to_date('07/06/19','DD/MM/RR'),'N','1','3','130010210201',null,'PERDIDA DE PESO EN ADULTO MAYOR SE PUEDE ASOCIAR  A MORTALIDAD EN LOS 5 AÃ‘OS SIGUIENTES  DE VIDA--REQUIERE GARANTIZAR APORTES CALORICOS ADECUADOS','2','17',to_date('07/06/19','DD/MM/RR'),'2019-06-07','CC','4008125','130010210201');
Insert into OASIS4.WEBSERV_JUNTA_PROFESIONAL (ID_JUPR,REPO_PERIODO,REPO_SERV_ID,REPO_TIRE_ID,NOPRESCRIPCION,FPRESCRIPCION,TIPOTECNOLOGIA,CONSECUTIVO,ESTJM,CODENTPROC,OBSERVACIONES,JUSTIFICACIONTECNICA,MODALIDAD,NOACTA,FECHAACTA,FPROCESO,TIPOIDPACIENTE,NROIDPACIENTE,CODENTJM) values ('644',to_date('07/06/19','DD/MM/RR'),'9','2','20190607141012459856',to_date('07/06/19','DD/MM/RR'),'S','1','2',null,null,null,null,null,to_date('01/01/70','DD/MM/RR'),null,'RC','1051680144','134300049201');
Insert into OASIS4.WEBSERV_JUNTA_PROFESIONAL (ID_JUPR,REPO_PERIODO,REPO_SERV_ID,REPO_TIRE_ID,NOPRESCRIPCION,FPRESCRIPCION,TIPOTECNOLOGIA,CONSECUTIVO,ESTJM,CODENTPROC,OBSERVACIONES,JUSTIFICACIONTECNICA,MODALIDAD,NOACTA,FECHAACTA,FPROCESO,TIPOIDPACIENTE,NROIDPACIENTE,CODENTJM) values ('645',to_date('08/06/19','DD/MM/RR'),'9','2','20190608124012471846',to_date('08/06/19','DD/MM/RR'),'M','1','2',null,null,null,null,null,to_date('01/01/70','DD/MM/RR'),null,'TI','1143244590','080010054401');
Insert into OASIS4.WEBSERV_JUNTA_PROFESIONAL (ID_JUPR,REPO_PERIODO,REPO_SERV_ID,REPO_TIRE_ID,NOPRESCRIPCION,FPRESCRIPCION,TIPOTECNOLOGIA,CONSECUTIVO,ESTJM,CODENTPROC,OBSERVACIONES,JUSTIFICACIONTECNICA,MODALIDAD,NOACTA,FECHAACTA,FPROCESO,TIPOIDPACIENTE,NROIDPACIENTE,CODENTJM) values ('646',to_date('08/06/19','DD/MM/RR'),'9','2','20190608147012468426',to_date('08/06/19','DD/MM/RR'),'N','1','2',null,null,null,null,null,to_date('01/01/70','DD/MM/RR'),null,'CC','1736803','200010205401');
Insert into OASIS4.WEBSERV_JUNTA_PROFESIONAL (ID_JUPR,REPO_PERIODO,REPO_SERV_ID,REPO_TIRE_ID,NOPRESCRIPCION,FPRESCRIPCION,TIPOTECNOLOGIA,CONSECUTIVO,ESTJM,CODENTPROC,OBSERVACIONES,JUSTIFICACIONTECNICA,MODALIDAD,NOACTA,FECHAACTA,FPROCESO,TIPOIDPACIENTE,NROIDPACIENTE,CODENTJM) values ('647',to_date('08/06/19','DD/MM/RR'),'9','2','20190608125012469752',to_date('08/06/19','DD/MM/RR'),'N','1','2',null,null,null,null,null,to_date('01/01/70','DD/MM/RR'),null,'CC','1149436563','200010205401');
Insert into OASIS4.WEBSERV_JUNTA_PROFESIONAL (ID_JUPR,REPO_PERIODO,REPO_SERV_ID,REPO_TIRE_ID,NOPRESCRIPCION,FPRESCRIPCION,TIPOTECNOLOGIA,CONSECUTIVO,ESTJM,CODENTPROC,OBSERVACIONES,JUSTIFICACIONTECNICA,MODALIDAD,NOACTA,FECHAACTA,FPROCESO,TIPOIDPACIENTE,NROIDPACIENTE,CODENTJM) values ('648',to_date('08/06/19','DD/MM/RR'),'9','2','20190608135012465031',to_date('08/06/19','DD/MM/RR'),'S','1','2',null,null,null,null,null,to_date('01/01/70','DD/MM/RR'),null,'CC','36586379','200010029001');
Insert into OASIS4.WEBSERV_JUNTA_PROFESIONAL (ID_JUPR,REPO_PERIODO,REPO_SERV_ID,REPO_TIRE_ID,NOPRESCRIPCION,FPRESCRIPCION,TIPOTECNOLOGIA,CONSECUTIVO,ESTJM,CODENTPROC,OBSERVACIONES,JUSTIFICACIONTECNICA,MODALIDAD,NOACTA,FECHAACTA,FPROCESO,TIPOIDPACIENTE,NROIDPACIENTE,CODENTJM) values ('649',to_date('08/06/19','DD/MM/RR'),'9','2','20190608185012467471',to_date('08/06/19','DD/MM/RR'),'S','2','2',null,null,null,null,null,to_date('01/01/70','DD/MM/RR'),null,'CC','1736803','200010205401');
Insert into OASIS4.WEBSERV_JUNTA_PROFESIONAL (ID_JUPR,REPO_PERIODO,REPO_SERV_ID,REPO_TIRE_ID,NOPRESCRIPCION,FPRESCRIPCION,TIPOTECNOLOGIA,CONSECUTIVO,ESTJM,CODENTPROC,OBSERVACIONES,JUSTIFICACIONTECNICA,MODALIDAD,NOACTA,FECHAACTA,FPROCESO,TIPOIDPACIENTE,NROIDPACIENTE,CODENTJM) values ('650',to_date('09/06/19','DD/MM/RR'),'9','2','20190609165012474880',to_date('09/06/19','DD/MM/RR'),'S','1','3','080010349401',null,'PACIENTE MASCULINO DE 64 AÃ‘OS DE EDAD CON DIAGNOSTICO DE, REALIZANDO DIURESIS EN SONDA SUPRAPUBICA Y DEPOSICIONES EN PAÃ‘ALES POR NO CONTROL DE ESFINTER,','2','010',to_date('11/06/19','DD/MM/RR'),'2019-06-11','CC','8661460','080010349401');
Insert into OASIS4.WEBSERV_JUNTA_PROFESIONAL (ID_JUPR,REPO_PERIODO,REPO_SERV_ID,REPO_TIRE_ID,NOPRESCRIPCION,FPRESCRIPCION,TIPOTECNOLOGIA,CONSECUTIVO,ESTJM,CODENTPROC,OBSERVACIONES,JUSTIFICACIONTECNICA,MODALIDAD,NOACTA,FECHAACTA,FPROCESO,TIPOIDPACIENTE,NROIDPACIENTE,CODENTJM) values ('651',to_date('10/06/19','DD/MM/RR'),'9','2','20190610198012484136',to_date('10/06/19','DD/MM/RR'),'M','1','3','200010053001',null,'PACIENTE CON PATRON MEMBRANOSO Y PROLIFERATIVO CLASE V DE NO RESPUESTA A C ICLOFOSFAMIDA ANTE LA PROGRESION DE LA PROTEINURIA A 6G Y DETERIORO DE FUNCION RENAL','1','0000029',to_date('11/06/19','DD/MM/RR'),'2019-06-11','CC','36695869','200010053001');
Insert into OASIS4.WEBSERV_JUNTA_PROFESIONAL (ID_JUPR,REPO_PERIODO,REPO_SERV_ID,REPO_TIRE_ID,NOPRESCRIPCION,FPRESCRIPCION,TIPOTECNOLOGIA,CONSECUTIVO,ESTJM,CODENTPROC,OBSERVACIONES,JUSTIFICACIONTECNICA,MODALIDAD,NOACTA,FECHAACTA,FPROCESO,TIPOIDPACIENTE,NROIDPACIENTE,CODENTJM) values ('652',to_date('10/06/19','DD/MM/RR'),'9','2','20190610187012501968',to_date('10/06/19','DD/MM/RR'),'M','1','2',null,null,null,null,null,to_date('01/01/70','DD/MM/RR'),null,'TI','1143244590','080010054401');
Insert into OASIS4.WEBSERV_JUNTA_PROFESIONAL (ID_JUPR,REPO_PERIODO,REPO_SERV_ID,REPO_TIRE_ID,NOPRESCRIPCION,FPRESCRIPCION,TIPOTECNOLOGIA,CONSECUTIVO,ESTJM,CODENTPROC,OBSERVACIONES,JUSTIFICACIONTECNICA,MODALIDAD,NOACTA,FECHAACTA,FPROCESO,TIPOIDPACIENTE,NROIDPACIENTE,CODENTJM) values ('653',to_date('10/06/19','DD/MM/RR'),'9','2','20190610128012480690',to_date('10/06/19','DD/MM/RR'),'N','1','3','134300290801',null,'PCTE CON SD DE DOWN, DESNUTRCION PROTEICOCALORICA MODERADA A SEVERA, SE INDICA ALIMENTACION HIPERPROTEICA E HIPERCALORICA','1','021',to_date('10/06/19','DD/MM/RR'),'2019-06-10','CC','1046398524','134300290801');
Insert into OASIS4.WEBSERV_JUNTA_PROFESIONAL (ID_JUPR,REPO_PERIODO,REPO_SERV_ID,REPO_TIRE_ID,NOPRESCRIPCION,FPRESCRIPCION,TIPOTECNOLOGIA,CONSECUTIVO,ESTJM,CODENTPROC,OBSERVACIONES,JUSTIFICACIONTECNICA,MODALIDAD,NOACTA,FECHAACTA,FPROCESO,TIPOIDPACIENTE,NROIDPACIENTE,CODENTJM) values ('654',to_date('10/06/19','DD/MM/RR'),'9','2','20190610116012485941',to_date('10/06/19','DD/MM/RR'),'N','1','3','130010210201',null,'DESNUTRICION SEVERA PREVIA AL EMBARAZO IMC 14 POR CIENTO  INCIDE EN EL ALTO RIESGO DE NEONATO BAJO PESO AL NACER  GARANTIZAR SOPORTE NUTRICIONAL','2','19',to_date('10/06/19','DD/MM/RR'),'2019-06-10','CC','1048611171','130010210201');
Insert into OASIS4.WEBSERV_JUNTA_PROFESIONAL (ID_JUPR,REPO_PERIODO,REPO_SERV_ID,REPO_TIRE_ID,NOPRESCRIPCION,FPRESCRIPCION,TIPOTECNOLOGIA,CONSECUTIVO,ESTJM,CODENTPROC,OBSERVACIONES,JUSTIFICACIONTECNICA,MODALIDAD,NOACTA,FECHAACTA,FPROCESO,TIPOIDPACIENTE,NROIDPACIENTE,CODENTJM) values ('655',to_date('10/06/19','DD/MM/RR'),'9','2','20190610113012489099',to_date('10/06/19','DD/MM/RR'),'N','1','3','080010409201',null,'PACIENTE MASCULINO DE 56 AÃ‘OS DE EDAD QUE PRESENTA PERDIDA IMPORTANTE DE PESO, ACTUALMENTE EN TRATAMIENTO CON QUIMIOTERAPIA, INAPETENCIA, SU','1','2',to_date('08/07/19','DD/MM/RR'),'2019-07-08','CC','8759707','080010409201');
Insert into OASIS4.WEBSERV_JUNTA_PROFESIONAL (ID_JUPR,REPO_PERIODO,REPO_SERV_ID,REPO_TIRE_ID,NOPRESCRIPCION,FPRESCRIPCION,TIPOTECNOLOGIA,CONSECUTIVO,ESTJM,CODENTPROC,OBSERVACIONES,JUSTIFICACIONTECNICA,MODALIDAD,NOACTA,FECHAACTA,FPROCESO,TIPOIDPACIENTE,NROIDPACIENTE,CODENTJM) values ('656',to_date('10/06/19','DD/MM/RR'),'9','2','20190610193012496580',to_date('10/06/19','DD/MM/RR'),'N','1','3','080010054401',null,' LA JUNTA MEDICA HA REVISADO SU CASO Y DECIDEN POR CONDICION CLINICA DEL PACIENTE SE AUTORIZA EL USO DE FORMULA NUTRICIONAL ALTA EN PROTEINAS TIPO PULMOCARE ','1','0860',to_date('11/06/19','DD/MM/RR'),'2019-06-11','CC','4975203','080010054401');
Insert into OASIS4.WEBSERV_JUNTA_PROFESIONAL (ID_JUPR,REPO_PERIODO,REPO_SERV_ID,REPO_TIRE_ID,NOPRESCRIPCION,FPRESCRIPCION,TIPOTECNOLOGIA,CONSECUTIVO,ESTJM,CODENTPROC,OBSERVACIONES,JUSTIFICACIONTECNICA,MODALIDAD,NOACTA,FECHAACTA,FPROCESO,TIPOIDPACIENTE,NROIDPACIENTE,CODENTJM) values ('657',to_date('10/06/19','DD/MM/RR'),'9','2','20190610133012496747',to_date('10/06/19','DD/MM/RR'),'N','1','2',null,null,null,null,null,to_date('01/01/70','DD/MM/RR'),null,'CC','26664708','470580002301');
Insert into OASIS4.WEBSERV_JUNTA_PROFESIONAL (ID_JUPR,REPO_PERIODO,REPO_SERV_ID,REPO_TIRE_ID,NOPRESCRIPCION,FPRESCRIPCION,TIPOTECNOLOGIA,CONSECUTIVO,ESTJM,CODENTPROC,OBSERVACIONES,JUSTIFICACIONTECNICA,MODALIDAD,NOACTA,FECHAACTA,FPROCESO,TIPOIDPACIENTE,NROIDPACIENTE,CODENTJM) values ('658',to_date('10/06/19','DD/MM/RR'),'9','2','20190610158012496775',to_date('10/06/19','DD/MM/RR'),'N','1','2',null,null,null,null,null,to_date('01/01/70','DD/MM/RR'),null,'CC','29381788','761470371502');
Insert into OASIS4.WEBSERV_JUNTA_PROFESIONAL (ID_JUPR,REPO_PERIODO,REPO_SERV_ID,REPO_TIRE_ID,NOPRESCRIPCION,FPRESCRIPCION,TIPOTECNOLOGIA,CONSECUTIVO,ESTJM,CODENTPROC,OBSERVACIONES,JUSTIFICACIONTECNICA,MODALIDAD,NOACTA,FECHAACTA,FPROCESO,TIPOIDPACIENTE,NROIDPACIENTE,CODENTJM) values ('659',to_date('10/06/19','DD/MM/RR'),'9','2','20190610156012486697',to_date('10/06/19','DD/MM/RR'),'S','1','3','080010003601',null,'PACIENTE QUE PRESENTA ALGÃšN GRADO DE LESIÃ“N EPITELIAL CORNEAL CON LA EXPOSICIÃ“N DE TERMINACIONES NERVIOSAS OCASIONANDO DOLOR ','1','001',to_date('10/06/19','DD/MM/RR'),'2019-06-10','CC','2786653','080010003601');
Insert into OASIS4.WEBSERV_JUNTA_PROFESIONAL (ID_JUPR,REPO_PERIODO,REPO_SERV_ID,REPO_TIRE_ID,NOPRESCRIPCION,FPRESCRIPCION,TIPOTECNOLOGIA,CONSECUTIVO,ESTJM,CODENTPROC,OBSERVACIONES,JUSTIFICACIONTECNICA,MODALIDAD,NOACTA,FECHAACTA,FPROCESO,TIPOIDPACIENTE,NROIDPACIENTE,CODENTJM) values ('660',to_date('10/06/19','DD/MM/RR'),'9','2','20190610131012498120',to_date('10/06/19','DD/MM/RR'),'S','1','3','760010379901',null,'ASOCIACIÃ“N MUTUAL BARRIOS UNIDOS DE QUIBDÃ“ ','1','0425-19',to_date('13/06/19','DD/MM/RR'),'2019-06-17','CC','31411772','760010379901');
Insert into OASIS4.WEBSERV_JUNTA_PROFESIONAL (ID_JUPR,REPO_PERIODO,REPO_SERV_ID,REPO_TIRE_ID,NOPRESCRIPCION,FPRESCRIPCION,TIPOTECNOLOGIA,CONSECUTIVO,ESTJM,CODENTPROC,OBSERVACIONES,JUSTIFICACIONTECNICA,MODALIDAD,NOACTA,FECHAACTA,FPROCESO,TIPOIDPACIENTE,NROIDPACIENTE,CODENTJM) values ('661',to_date('11/06/19','DD/MM/RR'),'9','2','20190611148012506242',to_date('11/06/19','DD/MM/RR'),'N','1','3','470580002301',null,'ADULTO MAYOR CON DESNUTRICIÃ“N PROTEICACALORICA SEVERA EMANCIACION, IMC 15.9 ANEMIA SECUNDARIA','1','011',to_date('08/07/19','DD/MM/RR'),'2019-07-08','CC','23242392','470580002301');
Insert into OASIS4.WEBSERV_JUNTA_PROFESIONAL (ID_JUPR,REPO_PERIODO,REPO_SERV_ID,REPO_TIRE_ID,NOPRESCRIPCION,FPRESCRIPCION,TIPOTECNOLOGIA,CONSECUTIVO,ESTJM,CODENTPROC,OBSERVACIONES,JUSTIFICACIONTECNICA,MODALIDAD,NOACTA,FECHAACTA,FPROCESO,TIPOIDPACIENTE,NROIDPACIENTE,CODENTJM) values ('662',to_date('11/06/19','DD/MM/RR'),'9','2','20190611155012509013',to_date('11/06/19','DD/MM/RR'),'N','1','3','130010210201',null,'IMPACTO NUTRICIONAL EN EFERMEDAD BASE LUPUS RECUPERANDOSE DE DESNUTRICION MODERADA IMC MEJORO A 21.2 POR CIENTO GARANTIZAR APORTES CALORICOS Y SUPERAR ANEMIA','2','21',to_date('11/06/19','DD/MM/RR'),'2019-06-11','CC','1052735846','130010210201');
Insert into OASIS4.WEBSERV_JUNTA_PROFESIONAL (ID_JUPR,REPO_PERIODO,REPO_SERV_ID,REPO_TIRE_ID,NOPRESCRIPCION,FPRESCRIPCION,TIPOTECNOLOGIA,CONSECUTIVO,ESTJM,CODENTPROC,OBSERVACIONES,JUSTIFICACIONTECNICA,MODALIDAD,NOACTA,FECHAACTA,FPROCESO,TIPOIDPACIENTE,NROIDPACIENTE,CODENTJM) values ('663',to_date('11/06/19','DD/MM/RR'),'9','2','20190611161012509480',to_date('11/06/19','DD/MM/RR'),'N','1','3','761470851601',null,'quien requiere COMPLEMENTAR con alimento en polvo con carbohidratos de digestiÃ³n lenta que favorece el control de la glicemia.','1','MP0089',to_date('11/06/19','DD/MM/RR'),'2019-06-11','CC','1113790273','761470851601');
Insert into OASIS4.WEBSERV_JUNTA_PROFESIONAL (ID_JUPR,REPO_PERIODO,REPO_SERV_ID,REPO_TIRE_ID,NOPRESCRIPCION,FPRESCRIPCION,TIPOTECNOLOGIA,CONSECUTIVO,ESTJM,CODENTPROC,OBSERVACIONES,JUSTIFICACIONTECNICA,MODALIDAD,NOACTA,FECHAACTA,FPROCESO,TIPOIDPACIENTE,NROIDPACIENTE,CODENTJM) values ('664',to_date('11/06/19','DD/MM/RR'),'9','2','20190611124012509823',to_date('11/06/19','DD/MM/RR'),'N','1','3','086340010501',null,'PACIENTE DE 71 AÃ‘OS CON PESO DE 49 KG TALLA 167CM DIAGNOSTICO NUTRICIONAL DE DELGADEZ','1','20',to_date('11/06/19','DD/MM/RR'),'2019-06-11','CC','22621871','086340010501');
Insert into OASIS4.WEBSERV_JUNTA_PROFESIONAL (ID_JUPR,REPO_PERIODO,REPO_SERV_ID,REPO_TIRE_ID,NOPRESCRIPCION,FPRESCRIPCION,TIPOTECNOLOGIA,CONSECUTIVO,ESTJM,CODENTPROC,OBSERVACIONES,JUSTIFICACIONTECNICA,MODALIDAD,NOACTA,FECHAACTA,FPROCESO,TIPOIDPACIENTE,NROIDPACIENTE,CODENTJM) values ('665',to_date('11/06/19','DD/MM/RR'),'9','2','20190611175012510554',to_date('11/06/19','DD/MM/RR'),'N','1','3','087580016101',null,'NOS REUNIMOS LOS PRESENTES CON EL FIN DE APROBAR LA UTILIZACION DEL SUPLEMENTO NUTRICIONAL CON EL PACIENTE EN MENCION DEBIDO A SU DX DE DNT PROTEICO CALORICA','1','0002',to_date('12/06/19','DD/MM/RR'),'2019-06-12','TI','1043129808','087580016101');
Insert into OASIS4.WEBSERV_JUNTA_PROFESIONAL (ID_JUPR,REPO_PERIODO,REPO_SERV_ID,REPO_TIRE_ID,NOPRESCRIPCION,FPRESCRIPCION,TIPOTECNOLOGIA,CONSECUTIVO,ESTJM,CODENTPROC,OBSERVACIONES,JUSTIFICACIONTECNICA,MODALIDAD,NOACTA,FECHAACTA,FPROCESO,TIPOIDPACIENTE,NROIDPACIENTE,CODENTJM) values ('666',to_date('11/06/19','DD/MM/RR'),'9','2','20190611145012524741',to_date('11/06/19','DD/MM/RR'),'N','1','3','761470851601',null,'quien requiere complementar su nutricion con alimento lÃ­quido completo y balanceado con HMB (ÃŸ-hidroxi-ÃŸ-metilbutirato), proteÃ­na y vitamina D','1','MP0090',to_date('12/06/19','DD/MM/RR'),'2019-06-12','CC','6234721','761470851601');
Insert into OASIS4.WEBSERV_JUNTA_PROFESIONAL (ID_JUPR,REPO_PERIODO,REPO_SERV_ID,REPO_TIRE_ID,NOPRESCRIPCION,FPRESCRIPCION,TIPOTECNOLOGIA,CONSECUTIVO,ESTJM,CODENTPROC,OBSERVACIONES,JUSTIFICACIONTECNICA,MODALIDAD,NOACTA,FECHAACTA,FPROCESO,TIPOIDPACIENTE,NROIDPACIENTE,CODENTJM) values ('667',to_date('11/06/19','DD/MM/RR'),'9','2','20190611163012528839',to_date('11/06/19','DD/MM/RR'),'N','1','2',null,null,null,null,null,to_date('01/01/70','DD/MM/RR'),null,'CC','4494069','761470371502');
Insert into OASIS4.WEBSERV_JUNTA_PROFESIONAL (ID_JUPR,REPO_PERIODO,REPO_SERV_ID,REPO_TIRE_ID,NOPRESCRIPCION,FPRESCRIPCION,TIPOTECNOLOGIA,CONSECUTIVO,ESTJM,CODENTPROC,OBSERVACIONES,JUSTIFICACIONTECNICA,MODALIDAD,NOACTA,FECHAACTA,FPROCESO,TIPOIDPACIENTE,NROIDPACIENTE,CODENTJM) values ('668',to_date('11/06/19','DD/MM/RR'),'9','2','20190611166012513220',to_date('11/06/19','DD/MM/RR'),'S','1','3','470010096901',null,'TRASLADO FECHA 17 DE JUNIO \nHORA : 2:30 PM \nIP CARRERA 16 #14-106 REHABILITADORES ASOCIADOS LTDA \nDIRECCIÃ“N DEL DOMICILIO : CALLE 71 #30-67 BARRIO CHIRIQUÃ?','1','894',to_date('11/06/19','DD/MM/RR'),'2019-06-11','CC','1065586067','470010096901');
Insert into OASIS4.WEBSERV_JUNTA_PROFESIONAL (ID_JUPR,REPO_PERIODO,REPO_SERV_ID,REPO_TIRE_ID,NOPRESCRIPCION,FPRESCRIPCION,TIPOTECNOLOGIA,CONSECUTIVO,ESTJM,CODENTPROC,OBSERVACIONES,JUSTIFICACIONTECNICA,MODALIDAD,NOACTA,FECHAACTA,FPROCESO,TIPOIDPACIENTE,NROIDPACIENTE,CODENTJM) values ('669',to_date('12/06/19','DD/MM/RR'),'9','2','20190612159012537688',to_date('12/06/19','DD/MM/RR'),'N','1','3','080010133501',null,'paciente con mal control glicemico tanto con picos o bajadas de glicemia, por lo que requiere suplemento dietario para controlar valores de glicemia','1','001',to_date('27/08/19','DD/MM/RR'),'2019-08-28','CC','32713103','080010133501');
Insert into OASIS4.WEBSERV_JUNTA_PROFESIONAL (ID_JUPR,REPO_PERIODO,REPO_SERV_ID,REPO_TIRE_ID,NOPRESCRIPCION,FPRESCRIPCION,TIPOTECNOLOGIA,CONSECUTIVO,ESTJM,CODENTPROC,OBSERVACIONES,JUSTIFICACIONTECNICA,MODALIDAD,NOACTA,FECHAACTA,FPROCESO,TIPOIDPACIENTE,NROIDPACIENTE,CODENTJM) values ('670',to_date('12/06/19','DD/MM/RR'),'9','2','20190612135012537702',to_date('12/06/19','DD/MM/RR'),'N','1','3','134300290801',null,'pcte con stress metabolico por enfermedad renal de base en dialisis, se indica uso de dieta hiperproteica para compensar perdidas','1','23',to_date('12/06/19','DD/MM/RR'),'2019-06-12','CC','22160163','134300290801');
Insert into OASIS4.WEBSERV_JUNTA_PROFESIONAL (ID_JUPR,REPO_PERIODO,REPO_SERV_ID,REPO_TIRE_ID,NOPRESCRIPCION,FPRESCRIPCION,TIPOTECNOLOGIA,CONSECUTIVO,ESTJM,CODENTPROC,OBSERVACIONES,JUSTIFICACIONTECNICA,MODALIDAD,NOACTA,FECHAACTA,FPROCESO,TIPOIDPACIENTE,NROIDPACIENTE,CODENTJM) values ('671',to_date('12/06/19','DD/MM/RR'),'9','2','20190612152012540448',to_date('12/06/19','DD/MM/RR'),'N','1','3','080010380001',null,'PACIENTE DE 83 AÃ‘OS CON DESNUTRICIÃ“N LEVE , MANTIENE NIVELES ALTOS DE GLICEMIA , INAPETENTE. SE RECOMIENDA GLUCERNA','1','29',to_date('31/07/19','DD/MM/RR'),'2019-07-31','CC','23082035','080010380001');
Insert into OASIS4.WEBSERV_JUNTA_PROFESIONAL (ID_JUPR,REPO_PERIODO,REPO_SERV_ID,REPO_TIRE_ID,NOPRESCRIPCION,FPRESCRIPCION,TIPOTECNOLOGIA,CONSECUTIVO,ESTJM,CODENTPROC,OBSERVACIONES,JUSTIFICACIONTECNICA,MODALIDAD,NOACTA,FECHAACTA,FPROCESO,TIPOIDPACIENTE,NROIDPACIENTE,CODENTJM) values ('672',to_date('12/06/19','DD/MM/RR'),'9','2','20190612153012541600',to_date('12/06/19','DD/MM/RR'),'N','1','3','080010226001',null,'\tPACIENTE FEMENINA, 7 MESES DE EDAD, CORREGIDA. PESO ACTUAL 3,3KG, TALLA 50CM. CURVAS DE FENTON PARA PREMATUROS PESO EDAD MENOR A MENOS 3DS, TALLA EDAD MENOR A ','1','201923071218',to_date('23/07/19','DD/MM/RR'),'2019-07-23','RC','1044230171','080010226001');
Insert into OASIS4.WEBSERV_JUNTA_PROFESIONAL (ID_JUPR,REPO_PERIODO,REPO_SERV_ID,REPO_TIRE_ID,NOPRESCRIPCION,FPRESCRIPCION,TIPOTECNOLOGIA,CONSECUTIVO,ESTJM,CODENTPROC,OBSERVACIONES,JUSTIFICACIONTECNICA,MODALIDAD,NOACTA,FECHAACTA,FPROCESO,TIPOIDPACIENTE,NROIDPACIENTE,CODENTJM) values ('673',to_date('12/06/19','DD/MM/RR'),'9','2','20190612133012543247',to_date('12/06/19','DD/MM/RR'),'N','1','3','080010380001',null,'paciente con DIAGNÃ“STICO de DESNUTRICIÃ“N proteicocalorica severa por imc de 15.02 requiere de ALIMENTACIÃ“N complementaria para reponer DÃ‰FICIT nutricional.','1','14',to_date('14/06/19','DD/MM/RR'),'2019-06-14','CC','1043445786','080010380001');
Insert into OASIS4.WEBSERV_JUNTA_PROFESIONAL (ID_JUPR,REPO_PERIODO,REPO_SERV_ID,REPO_TIRE_ID,NOPRESCRIPCION,FPRESCRIPCION,TIPOTECNOLOGIA,CONSECUTIVO,ESTJM,CODENTPROC,OBSERVACIONES,JUSTIFICACIONTECNICA,MODALIDAD,NOACTA,FECHAACTA,FPROCESO,TIPOIDPACIENTE,NROIDPACIENTE,CODENTJM) values ('674',to_date('12/06/19','DD/MM/RR'),'9','2','20190612127012543820',to_date('12/06/19','DD/MM/RR'),'N','1','3','080010380001',null,'paciente de 83 aÃ±os de edad con antecedente de diabetes mellitus asociada con DESNUTRICIÃ“N, requiere de suplemento especial para DIABÃ‰TICOS.','1','15',to_date('14/06/19','DD/MM/RR'),'2019-06-14','CC','23082035','080010380001');
Insert into OASIS4.WEBSERV_JUNTA_PROFESIONAL (ID_JUPR,REPO_PERIODO,REPO_SERV_ID,REPO_TIRE_ID,NOPRESCRIPCION,FPRESCRIPCION,TIPOTECNOLOGIA,CONSECUTIVO,ESTJM,CODENTPROC,OBSERVACIONES,JUSTIFICACIONTECNICA,MODALIDAD,NOACTA,FECHAACTA,FPROCESO,TIPOIDPACIENTE,NROIDPACIENTE,CODENTJM) values ('675',to_date('12/06/19','DD/MM/RR'),'9','2','20190612164012554070',to_date('12/06/19','DD/MM/RR'),'N','1','3','761470067210',null,'Se aprueba 27 latas de ensure 400g para 90 DÃ?AS a paciente por PATOLOGÃ?AS.','1','54',to_date('18/07/19','DD/MM/RR'),'2019-07-18','CC','1112776855','761470067210');
Insert into OASIS4.WEBSERV_JUNTA_PROFESIONAL (ID_JUPR,REPO_PERIODO,REPO_SERV_ID,REPO_TIRE_ID,NOPRESCRIPCION,FPRESCRIPCION,TIPOTECNOLOGIA,CONSECUTIVO,ESTJM,CODENTPROC,OBSERVACIONES,JUSTIFICACIONTECNICA,MODALIDAD,NOACTA,FECHAACTA,FPROCESO,TIPOIDPACIENTE,NROIDPACIENTE,CODENTJM) values ('676',to_date('12/06/19','DD/MM/RR'),'9','2','20190612162012553907',to_date('12/06/19','DD/MM/RR'),'S','1','3','761470067210',null,'se aprueba 450 paÃ±ales a paciente por PATOLOGÃ?A para 90 dÃ­as.','1','54',to_date('18/07/19','DD/MM/RR'),'2019-07-18','CC','1112776855','761470067210');
Insert into OASIS4.WEBSERV_JUNTA_PROFESIONAL (ID_JUPR,REPO_PERIODO,REPO_SERV_ID,REPO_TIRE_ID,NOPRESCRIPCION,FPRESCRIPCION,TIPOTECNOLOGIA,CONSECUTIVO,ESTJM,CODENTPROC,OBSERVACIONES,JUSTIFICACIONTECNICA,MODALIDAD,NOACTA,FECHAACTA,FPROCESO,TIPOIDPACIENTE,NROIDPACIENTE,CODENTJM) values ('677',to_date('12/06/19','DD/MM/RR'),'9','2','20190612120012555503',to_date('12/06/19','DD/MM/RR'),'S','1','3','470010096901',null,'TRASLADO REDONDO FECHA 26 DE JUNIO HORA: 9:00AM CLINICA SANTA ISABEL-CARRERA 18B #22-33 VALLEDUPAR DOMICILIO MANZANA J CASA 15 URBANIZACIÃ“N VILLA LUZ - BECERRIL','1','895',to_date('12/06/19','DD/MM/RR'),'2019-06-12','CC','18968031','470010096901');
Insert into OASIS4.WEBSERV_JUNTA_PROFESIONAL (ID_JUPR,REPO_PERIODO,REPO_SERV_ID,REPO_TIRE_ID,NOPRESCRIPCION,FPRESCRIPCION,TIPOTECNOLOGIA,CONSECUTIVO,ESTJM,CODENTPROC,OBSERVACIONES,JUSTIFICACIONTECNICA,MODALIDAD,NOACTA,FECHAACTA,FPROCESO,TIPOIDPACIENTE,NROIDPACIENTE,CODENTJM) values ('678',to_date('12/06/19','DD/MM/RR'),'9','2','20190612192012558954',to_date('12/06/19','DD/MM/RR'),'S','1','3','080010349401',null,'PACIENTE CON INCONTINENCIA FECAL Y URINARIA QUE REQUIERE PAÃ‘ALES DESECHABLES PARA OPTIMIZAR CONDICIONES DE HIGIENE.','2','13',to_date('18/06/19','DD/MM/RR'),'2019-06-18','CC','23213020','080010349401');
Insert into OASIS4.WEBSERV_JUNTA_PROFESIONAL (ID_JUPR,REPO_PERIODO,REPO_SERV_ID,REPO_TIRE_ID,NOPRESCRIPCION,FPRESCRIPCION,TIPOTECNOLOGIA,CONSECUTIVO,ESTJM,CODENTPROC,OBSERVACIONES,JUSTIFICACIONTECNICA,MODALIDAD,NOACTA,FECHAACTA,FPROCESO,TIPOIDPACIENTE,NROIDPACIENTE,CODENTJM) values ('679',to_date('13/06/19','DD/MM/RR'),'9','2','20190613163012572600',to_date('13/06/19','DD/MM/RR'),'N','1','3','080010409201',null,'paciente con deterioro de la salud y transtorno del metabolismo ','1','1',to_date('08/07/19','DD/MM/RR'),'2019-07-08','CC','49687465','080010409201');
Insert into OASIS4.WEBSERV_JUNTA_PROFESIONAL (ID_JUPR,REPO_PERIODO,REPO_SERV_ID,REPO_TIRE_ID,NOPRESCRIPCION,FPRESCRIPCION,TIPOTECNOLOGIA,CONSECUTIVO,ESTJM,CODENTPROC,OBSERVACIONES,JUSTIFICACIONTECNICA,MODALIDAD,NOACTA,FECHAACTA,FPROCESO,TIPOIDPACIENTE,NROIDPACIENTE,CODENTJM) values ('680',to_date('13/06/19','DD/MM/RR'),'9','2','20190613114012573390',to_date('13/06/19','DD/MM/RR'),'N','1','3','080010409201',null,'PACIENTE REQUIERE DE SUPLEMENTACION ESPECIAL','2','SILOE-018',to_date('06/09/19','DD/MM/RR'),'2019-09-06','TI','1043152445','080010409201');
Insert into OASIS4.WEBSERV_JUNTA_PROFESIONAL (ID_JUPR,REPO_PERIODO,REPO_SERV_ID,REPO_TIRE_ID,NOPRESCRIPCION,FPRESCRIPCION,TIPOTECNOLOGIA,CONSECUTIVO,ESTJM,CODENTPROC,OBSERVACIONES,JUSTIFICACIONTECNICA,MODALIDAD,NOACTA,FECHAACTA,FPROCESO,TIPOIDPACIENTE,NROIDPACIENTE,CODENTJM) values ('946',to_date('12/07/19','DD/MM/RR'),'9','2','20190712117013127378',to_date('12/07/19','DD/MM/RR'),'N','1','3','130010210201',null,'OPTIMIZAR EL ESTADO NUTRICIONAL EVITANDO RECAIDA Y MEJOR CONTROL DE EPILEPSIA REQUIERE SOPORTE NUTRICIONAL  ADECUADO  GARANTIZADO CUALITATIVAMENTE ','1','59',to_date('12/07/19','DD/MM/RR'),'2019-07-12','TI','1043988363','130010210201');
Insert into OASIS4.WEBSERV_JUNTA_PROFESIONAL (ID_JUPR,REPO_PERIODO,REPO_SERV_ID,REPO_TIRE_ID,NOPRESCRIPCION,FPRESCRIPCION,TIPOTECNOLOGIA,CONSECUTIVO,ESTJM,CODENTPROC,OBSERVACIONES,JUSTIFICACIONTECNICA,MODALIDAD,NOACTA,FECHAACTA,FPROCESO,TIPOIDPACIENTE,NROIDPACIENTE,CODENTJM) values ('947',to_date('12/07/19','DD/MM/RR'),'9','2','20190712141013109978',to_date('12/07/19','DD/MM/RR'),'S','1','3','080010003601',null,'SE INDICA LENTE DE CONTACTO COMO PRIMER NIVEL TERAPÃ‰UTICO DEL QUERATOCONO. TOPOGRAFÃ?A  11//08/2018   OD  CYL 5.40  PAQUI 474/543','1','001',to_date('12/07/19','DD/MM/RR'),'2019-07-12','CC','1002130857','080010003601');
Insert into OASIS4.WEBSERV_JUNTA_PROFESIONAL (ID_JUPR,REPO_PERIODO,REPO_SERV_ID,REPO_TIRE_ID,NOPRESCRIPCION,FPRESCRIPCION,TIPOTECNOLOGIA,CONSECUTIVO,ESTJM,CODENTPROC,OBSERVACIONES,JUSTIFICACIONTECNICA,MODALIDAD,NOACTA,FECHAACTA,FPROCESO,TIPOIDPACIENTE,NROIDPACIENTE,CODENTJM) values ('948',to_date('12/07/19','DD/MM/RR'),'9','2','20190712117013113076',to_date('12/07/19','DD/MM/RR'),'S','1','2',null,null,null,null,null,to_date('01/01/70','DD/MM/RR'),null,'TI','1066094394','200010205401');
Insert into OASIS4.WEBSERV_JUNTA_PROFESIONAL (ID_JUPR,REPO_PERIODO,REPO_SERV_ID,REPO_TIRE_ID,NOPRESCRIPCION,FPRESCRIPCION,TIPOTECNOLOGIA,CONSECUTIVO,ESTJM,CODENTPROC,OBSERVACIONES,JUSTIFICACIONTECNICA,MODALIDAD,NOACTA,FECHAACTA,FPROCESO,TIPOIDPACIENTE,NROIDPACIENTE,CODENTJM) values ('949',to_date('12/07/19','DD/MM/RR'),'9','2','20190712167013113328',to_date('12/07/19','DD/MM/RR'),'S','1','2',null,null,null,null,null,to_date('01/01/70','DD/MM/RR'),null,'TI','1066094394','200010205401');
Insert into OASIS4.WEBSERV_JUNTA_PROFESIONAL (ID_JUPR,REPO_PERIODO,REPO_SERV_ID,REPO_TIRE_ID,NOPRESCRIPCION,FPRESCRIPCION,TIPOTECNOLOGIA,CONSECUTIVO,ESTJM,CODENTPROC,OBSERVACIONES,JUSTIFICACIONTECNICA,MODALIDAD,NOACTA,FECHAACTA,FPROCESO,TIPOIDPACIENTE,NROIDPACIENTE,CODENTJM) values ('950',to_date('12/07/19','DD/MM/RR'),'9','2','20190712176013113495',to_date('12/07/19','DD/MM/RR'),'S','1','2',null,null,null,null,null,to_date('01/01/70','DD/MM/RR'),null,'TI','1066094394','200010205401');
Insert into OASIS4.WEBSERV_JUNTA_PROFESIONAL (ID_JUPR,REPO_PERIODO,REPO_SERV_ID,REPO_TIRE_ID,NOPRESCRIPCION,FPRESCRIPCION,TIPOTECNOLOGIA,CONSECUTIVO,ESTJM,CODENTPROC,OBSERVACIONES,JUSTIFICACIONTECNICA,MODALIDAD,NOACTA,FECHAACTA,FPROCESO,TIPOIDPACIENTE,NROIDPACIENTE,CODENTJM) values ('951',to_date('12/07/19','DD/MM/RR'),'9','2','20190712117013128101',to_date('12/07/19','DD/MM/RR'),'S','1','2',null,null,null,null,null,to_date('01/01/70','DD/MM/RR'),null,'RC','1051679248','134300049201');
Insert into OASIS4.WEBSERV_JUNTA_PROFESIONAL (ID_JUPR,REPO_PERIODO,REPO_SERV_ID,REPO_TIRE_ID,NOPRESCRIPCION,FPRESCRIPCION,TIPOTECNOLOGIA,CONSECUTIVO,ESTJM,CODENTPROC,OBSERVACIONES,JUSTIFICACIONTECNICA,MODALIDAD,NOACTA,FECHAACTA,FPROCESO,TIPOIDPACIENTE,NROIDPACIENTE,CODENTJM) values ('952',to_date('14/07/19','DD/MM/RR'),'9','2','20190714167013144218',to_date('14/07/19','DD/MM/RR'),'N','1','3','080010349401',null,'SUPLEMENTO NUTRICIONAL TIPO ENSURE, POR INCONTINENCIA DE ESFINTERES Y CUADRO DE DESNUTRICION PROTEICO CALORICA LEVE ','2','022',to_date('15/07/19','DD/MM/RR'),'2019-07-15','CC','84041200','080010349401');
Insert into OASIS4.WEBSERV_JUNTA_PROFESIONAL (ID_JUPR,REPO_PERIODO,REPO_SERV_ID,REPO_TIRE_ID,NOPRESCRIPCION,FPRESCRIPCION,TIPOTECNOLOGIA,CONSECUTIVO,ESTJM,CODENTPROC,OBSERVACIONES,JUSTIFICACIONTECNICA,MODALIDAD,NOACTA,FECHAACTA,FPROCESO,TIPOIDPACIENTE,NROIDPACIENTE,CODENTJM) values ('953',to_date('14/07/19','DD/MM/RR'),'9','2','20190714156013144260',to_date('14/07/19','DD/MM/RR'),'N','1','3','080010349401',null,'REQUERIMIENTO DE SUPLEMENTO NUTRIICONAL TIPO GLUCERNA TENIENDO EN CUENTA ANTECEDENTES, POR LO QUE SE ACTUALIZA FORMULA MEDICA','2','027',to_date('18/07/19','DD/MM/RR'),'2019-07-18','CC','22260341','080010349401');
Insert into OASIS4.WEBSERV_JUNTA_PROFESIONAL (ID_JUPR,REPO_PERIODO,REPO_SERV_ID,REPO_TIRE_ID,NOPRESCRIPCION,FPRESCRIPCION,TIPOTECNOLOGIA,CONSECUTIVO,ESTJM,CODENTPROC,OBSERVACIONES,JUSTIFICACIONTECNICA,MODALIDAD,NOACTA,FECHAACTA,FPROCESO,TIPOIDPACIENTE,NROIDPACIENTE,CODENTJM) values ('954',to_date('14/07/19','DD/MM/RR'),'9','2','20190714179013144322',to_date('14/07/19','DD/MM/RR'),'N','1','3','080010349401',null,'PACIENTE CON DIAGNOSTICO DE INCONTINENCIA FECAL Y URINARIA POR LO QUE REQUIERE PAÃ‘AES DESCHABLES PARA OPTIMIZAR CONDICIONES DE HIGIENE ','2','031',to_date('23/07/19','DD/MM/RR'),'2019-07-23','CC','4998329','080010349401');
Insert into OASIS4.WEBSERV_JUNTA_PROFESIONAL (ID_JUPR,REPO_PERIODO,REPO_SERV_ID,REPO_TIRE_ID,NOPRESCRIPCION,FPRESCRIPCION,TIPOTECNOLOGIA,CONSECUTIVO,ESTJM,CODENTPROC,OBSERVACIONES,JUSTIFICACIONTECNICA,MODALIDAD,NOACTA,FECHAACTA,FPROCESO,TIPOIDPACIENTE,NROIDPACIENTE,CODENTJM) values ('955',to_date('15/07/19','DD/MM/RR'),'9','2','20190715150013155230',to_date('15/07/19','DD/MM/RR'),'M','1','1','050010217501',null,'7 aÃ±, epilepsia focal ahora refractaria a tratam, exacerbac de crisis, La agudizac coincid con disminuciÃ³n dosis, valcote er tiene indic invima en multip crisis','1',null,to_date('16/07/19','DD/MM/RR'),'2019-07-16','TI','1078463258','050010217501');
Insert into OASIS4.WEBSERV_JUNTA_PROFESIONAL (ID_JUPR,REPO_PERIODO,REPO_SERV_ID,REPO_TIRE_ID,NOPRESCRIPCION,FPRESCRIPCION,TIPOTECNOLOGIA,CONSECUTIVO,ESTJM,CODENTPROC,OBSERVACIONES,JUSTIFICACIONTECNICA,MODALIDAD,NOACTA,FECHAACTA,FPROCESO,TIPOIDPACIENTE,NROIDPACIENTE,CODENTJM) values ('956',to_date('15/07/19','DD/MM/RR'),'9','2','20190715137013146694',to_date('15/07/19','DD/MM/RR'),'N','1','3','080010380001',null,'PACIENTE ADULTO MAYOR SIN ALCANCE ECONOMICO PARA CUMPLIR CON DIETA, REQUIERE DE SOPORTE ALIMENTARIO CON SUPLEMENTO IDONEO PARA PRESERVAR ESTADO OPTIMO DE SALUD.','1','24',to_date('15/07/19','DD/MM/RR'),'2019-07-15','CC','7436750','080010380001');
Insert into OASIS4.WEBSERV_JUNTA_PROFESIONAL (ID_JUPR,REPO_PERIODO,REPO_SERV_ID,REPO_TIRE_ID,NOPRESCRIPCION,FPRESCRIPCION,TIPOTECNOLOGIA,CONSECUTIVO,ESTJM,CODENTPROC,OBSERVACIONES,JUSTIFICACIONTECNICA,MODALIDAD,NOACTA,FECHAACTA,FPROCESO,TIPOIDPACIENTE,NROIDPACIENTE,CODENTJM) values ('957',to_date('15/07/19','DD/MM/RR'),'9','2','20190715130013149550',to_date('15/07/19','DD/MM/RR'),'N','1','2',null,null,null,null,null,to_date('01/01/70','DD/MM/RR'),null,'CC','1118236233','ESS076');
Insert into OASIS4.WEBSERV_JUNTA_PROFESIONAL (ID_JUPR,REPO_PERIODO,REPO_SERV_ID,REPO_TIRE_ID,NOPRESCRIPCION,FPRESCRIPCION,TIPOTECNOLOGIA,CONSECUTIVO,ESTJM,CODENTPROC,OBSERVACIONES,JUSTIFICACIONTECNICA,MODALIDAD,NOACTA,FECHAACTA,FPROCESO,TIPOIDPACIENTE,NROIDPACIENTE,CODENTJM) values ('958',to_date('15/07/19','DD/MM/RR'),'9','2','20190715158013154314',to_date('15/07/19','DD/MM/RR'),'N','1','2',null,null,null,null,null,to_date('01/01/70','DD/MM/RR'),null,'CC','1114399342','ESS076');
Insert into OASIS4.WEBSERV_JUNTA_PROFESIONAL (ID_JUPR,REPO_PERIODO,REPO_SERV_ID,REPO_TIRE_ID,NOPRESCRIPCION,FPRESCRIPCION,TIPOTECNOLOGIA,CONSECUTIVO,ESTJM,CODENTPROC,OBSERVACIONES,JUSTIFICACIONTECNICA,MODALIDAD,NOACTA,FECHAACTA,FPROCESO,TIPOIDPACIENTE,NROIDPACIENTE,CODENTJM) values ('959',to_date('15/07/19','DD/MM/RR'),'9','2','20190715153013166605',to_date('15/07/19','DD/MM/RR'),'N','1','2',null,null,null,null,null,to_date('01/01/70','DD/MM/RR'),null,'CC','1077478047','270010070801');
Insert into OASIS4.WEBSERV_JUNTA_PROFESIONAL (ID_JUPR,REPO_PERIODO,REPO_SERV_ID,REPO_TIRE_ID,NOPRESCRIPCION,FPRESCRIPCION,TIPOTECNOLOGIA,CONSECUTIVO,ESTJM,CODENTPROC,OBSERVACIONES,JUSTIFICACIONTECNICA,MODALIDAD,NOACTA,FECHAACTA,FPROCESO,TIPOIDPACIENTE,NROIDPACIENTE,CODENTJM) values ('960',to_date('15/07/19','DD/MM/RR'),'9','2','20190715153013166605',to_date('15/07/19','DD/MM/RR'),'N','2','2',null,null,null,null,null,to_date('01/01/70','DD/MM/RR'),null,'CC','1077478047','270010070801');
Insert into OASIS4.WEBSERV_JUNTA_PROFESIONAL (ID_JUPR,REPO_PERIODO,REPO_SERV_ID,REPO_TIRE_ID,NOPRESCRIPCION,FPRESCRIPCION,TIPOTECNOLOGIA,CONSECUTIVO,ESTJM,CODENTPROC,OBSERVACIONES,JUSTIFICACIONTECNICA,MODALIDAD,NOACTA,FECHAACTA,FPROCESO,TIPOIDPACIENTE,NROIDPACIENTE,CODENTJM) values ('961',to_date('15/07/19','DD/MM/RR'),'9','2','20190715130013149550',to_date('15/07/19','DD/MM/RR'),'S','1','2',null,null,null,null,null,to_date('01/01/70','DD/MM/RR'),null,'CC','1118236233','ESS076');
Insert into OASIS4.WEBSERV_JUNTA_PROFESIONAL (ID_JUPR,REPO_PERIODO,REPO_SERV_ID,REPO_TIRE_ID,NOPRESCRIPCION,FPRESCRIPCION,TIPOTECNOLOGIA,CONSECUTIVO,ESTJM,CODENTPROC,OBSERVACIONES,JUSTIFICACIONTECNICA,MODALIDAD,NOACTA,FECHAACTA,FPROCESO,TIPOIDPACIENTE,NROIDPACIENTE,CODENTJM) values ('962',to_date('15/07/19','DD/MM/RR'),'9','2','20190715187013158656',to_date('15/07/19','DD/MM/RR'),'S','2','2',null,null,null,null,null,to_date('01/01/70','DD/MM/RR'),null,'CC','1739384','200010205401');
Insert into OASIS4.WEBSERV_JUNTA_PROFESIONAL (ID_JUPR,REPO_PERIODO,REPO_SERV_ID,REPO_TIRE_ID,NOPRESCRIPCION,FPRESCRIPCION,TIPOTECNOLOGIA,CONSECUTIVO,ESTJM,CODENTPROC,OBSERVACIONES,JUSTIFICACIONTECNICA,MODALIDAD,NOACTA,FECHAACTA,FPROCESO,TIPOIDPACIENTE,NROIDPACIENTE,CODENTJM) values ('963',to_date('15/07/19','DD/MM/RR'),'9','2','20190715187013158656',to_date('15/07/19','DD/MM/RR'),'S','3','2',null,null,null,null,null,to_date('01/01/70','DD/MM/RR'),null,'CC','1739384','200010205401');
Insert into OASIS4.WEBSERV_JUNTA_PROFESIONAL (ID_JUPR,REPO_PERIODO,REPO_SERV_ID,REPO_TIRE_ID,NOPRESCRIPCION,FPRESCRIPCION,TIPOTECNOLOGIA,CONSECUTIVO,ESTJM,CODENTPROC,OBSERVACIONES,JUSTIFICACIONTECNICA,MODALIDAD,NOACTA,FECHAACTA,FPROCESO,TIPOIDPACIENTE,NROIDPACIENTE,CODENTJM) values ('964',to_date('15/07/19','DD/MM/RR'),'9','2','20190715187013158656',to_date('15/07/19','DD/MM/RR'),'S','4','2',null,null,null,null,null,to_date('01/01/70','DD/MM/RR'),null,'CC','1739384','200010205401');
Insert into OASIS4.WEBSERV_JUNTA_PROFESIONAL (ID_JUPR,REPO_PERIODO,REPO_SERV_ID,REPO_TIRE_ID,NOPRESCRIPCION,FPRESCRIPCION,TIPOTECNOLOGIA,CONSECUTIVO,ESTJM,CODENTPROC,OBSERVACIONES,JUSTIFICACIONTECNICA,MODALIDAD,NOACTA,FECHAACTA,FPROCESO,TIPOIDPACIENTE,NROIDPACIENTE,CODENTJM) values ('965',to_date('16/07/19','DD/MM/RR'),'9','2','20190716134013178667',to_date('16/07/19','DD/MM/RR'),'N','1','3','761470067210',null,'Se aprueba 90 botellas de enterex para tratamiento de 90 DÃ?AS a paciente por PATOLOGÃ?A.','1','53',to_date('18/07/19','DD/MM/RR'),'2019-07-18','CC','31199808','761470067210');
Insert into OASIS4.WEBSERV_JUNTA_PROFESIONAL (ID_JUPR,REPO_PERIODO,REPO_SERV_ID,REPO_TIRE_ID,NOPRESCRIPCION,FPRESCRIPCION,TIPOTECNOLOGIA,CONSECUTIVO,ESTJM,CODENTPROC,OBSERVACIONES,JUSTIFICACIONTECNICA,MODALIDAD,NOACTA,FECHAACTA,FPROCESO,TIPOIDPACIENTE,NROIDPACIENTE,CODENTJM) values ('966',to_date('16/07/19','DD/MM/RR'),'9','2','20190716189013178881',to_date('16/07/19','DD/MM/RR'),'N','1','3','134300290801',null,'DESNUTRICIÃ“N PROTEICOCALORICA SEVERA NO ESPECIFICADA \n','1','38',to_date('19/07/19','DD/MM/RR'),'2019-07-19','CC','22933038','134300290801');
Insert into OASIS4.WEBSERV_JUNTA_PROFESIONAL (ID_JUPR,REPO_PERIODO,REPO_SERV_ID,REPO_TIRE_ID,NOPRESCRIPCION,FPRESCRIPCION,TIPOTECNOLOGIA,CONSECUTIVO,ESTJM,CODENTPROC,OBSERVACIONES,JUSTIFICACIONTECNICA,MODALIDAD,NOACTA,FECHAACTA,FPROCESO,TIPOIDPACIENTE,NROIDPACIENTE,CODENTJM) values ('967',to_date('16/07/19','DD/MM/RR'),'9','2','20190716186013179540',to_date('16/07/19','DD/MM/RR'),'N','1','3','134300290801',null,'DESNUTRICIÃ“N PROTEICOCALORICA SEVERA NO ESPECIFICADA ','1','37',to_date('19/07/19','DD/MM/RR'),'2019-07-19','RC','1052996218','134300290801');
Insert into OASIS4.WEBSERV_JUNTA_PROFESIONAL (ID_JUPR,REPO_PERIODO,REPO_SERV_ID,REPO_TIRE_ID,NOPRESCRIPCION,FPRESCRIPCION,TIPOTECNOLOGIA,CONSECUTIVO,ESTJM,CODENTPROC,OBSERVACIONES,JUSTIFICACIONTECNICA,MODALIDAD,NOACTA,FECHAACTA,FPROCESO,TIPOIDPACIENTE,NROIDPACIENTE,CODENTJM) values ('968',to_date('16/07/19','DD/MM/RR'),'9','2','20190716120013182644',to_date('16/07/19','DD/MM/RR'),'N','1','3','134300290801',null,'BAJO PESO PARA LA EDAD GESTACIONAL. ','1','32',to_date('18/07/19','DD/MM/RR'),'2019-07-18','CC','1002500369','134300290801');
Insert into OASIS4.WEBSERV_JUNTA_PROFESIONAL (ID_JUPR,REPO_PERIODO,REPO_SERV_ID,REPO_TIRE_ID,NOPRESCRIPCION,FPRESCRIPCION,TIPOTECNOLOGIA,CONSECUTIVO,ESTJM,CODENTPROC,OBSERVACIONES,JUSTIFICACIONTECNICA,MODALIDAD,NOACTA,FECHAACTA,FPROCESO,TIPOIDPACIENTE,NROIDPACIENTE,CODENTJM) values ('969',to_date('16/07/19','DD/MM/RR'),'9','2','20190716163013184531',to_date('16/07/19','DD/MM/RR'),'N','1','3','134300290801',null,'DESNUTRICIÃ“N PROTEICOCALORICA SEVERA NO ESPECIFICADA ','1','32',to_date('18/07/19','DD/MM/RR'),'2019-07-18','RC','1053006010','134300290801');
Insert into OASIS4.WEBSERV_JUNTA_PROFESIONAL (ID_JUPR,REPO_PERIODO,REPO_SERV_ID,REPO_TIRE_ID,NOPRESCRIPCION,FPRESCRIPCION,TIPOTECNOLOGIA,CONSECUTIVO,ESTJM,CODENTPROC,OBSERVACIONES,JUSTIFICACIONTECNICA,MODALIDAD,NOACTA,FECHAACTA,FPROCESO,TIPOIDPACIENTE,NROIDPACIENTE,CODENTJM) values ('970',to_date('16/07/19','DD/MM/RR'),'9','2','20190716173013185662',to_date('16/07/19','DD/MM/RR'),'N','1','3','134300290801',null,'DESNUTRICIÃ“N PROTEICOCALORICA SEVERA NO ESPECIFICADA ','1','32',to_date('18/07/19','DD/MM/RR'),'2019-07-18','RC','1053009111','134300290801');
Insert into OASIS4.WEBSERV_JUNTA_PROFESIONAL (ID_JUPR,REPO_PERIODO,REPO_SERV_ID,REPO_TIRE_ID,NOPRESCRIPCION,FPRESCRIPCION,TIPOTECNOLOGIA,CONSECUTIVO,ESTJM,CODENTPROC,OBSERVACIONES,JUSTIFICACIONTECNICA,MODALIDAD,NOACTA,FECHAACTA,FPROCESO,TIPOIDPACIENTE,NROIDPACIENTE,CODENTJM) values ('971',to_date('16/07/19','DD/MM/RR'),'9','2','20190716165013188374',to_date('16/07/19','DD/MM/RR'),'N','1','3','080010054401',null,'LA JUNTA MEDICA HA REVISADO SU CASO Y DECIDEN POR CONDICION CLINICA DEL PACIENTE SE AUTORIZA EL USO DE FORMULA NUTRICIONAL POLIMERICA ENSURE CLINICAL 220 ML ','1','0907',to_date('16/07/19','DD/MM/RR'),'2019-07-16','CC','33173199','080010054401');
Insert into OASIS4.WEBSERV_JUNTA_PROFESIONAL (ID_JUPR,REPO_PERIODO,REPO_SERV_ID,REPO_TIRE_ID,NOPRESCRIPCION,FPRESCRIPCION,TIPOTECNOLOGIA,CONSECUTIVO,ESTJM,CODENTPROC,OBSERVACIONES,JUSTIFICACIONTECNICA,MODALIDAD,NOACTA,FECHAACTA,FPROCESO,TIPOIDPACIENTE,NROIDPACIENTE,CODENTJM) values ('972',to_date('16/07/19','DD/MM/RR'),'9','2','20190716133013191396',to_date('16/07/19','DD/MM/RR'),'N','1','3','080010349401',null,'DESNUTRICION PROTEICO CALORICA MODERADA SEGÃšN IMC','2','033',to_date('29/07/19','DD/MM/RR'),'2019-07-29','CC','32617036','080010349401');
Insert into OASIS4.WEBSERV_JUNTA_PROFESIONAL (ID_JUPR,REPO_PERIODO,REPO_SERV_ID,REPO_TIRE_ID,NOPRESCRIPCION,FPRESCRIPCION,TIPOTECNOLOGIA,CONSECUTIVO,ESTJM,CODENTPROC,OBSERVACIONES,JUSTIFICACIONTECNICA,MODALIDAD,NOACTA,FECHAACTA,FPROCESO,TIPOIDPACIENTE,NROIDPACIENTE,CODENTJM) values ('973',to_date('16/07/19','DD/MM/RR'),'9','2','20190716166013192213',to_date('16/07/19','DD/MM/RR'),'N','1','2',null,null,null,null,null,to_date('01/01/70','DD/MM/RR'),null,'CC','4998329','080010349401');
Insert into OASIS4.WEBSERV_JUNTA_PROFESIONAL (ID_JUPR,REPO_PERIODO,REPO_SERV_ID,REPO_TIRE_ID,NOPRESCRIPCION,FPRESCRIPCION,TIPOTECNOLOGIA,CONSECUTIVO,ESTJM,CODENTPROC,OBSERVACIONES,JUSTIFICACIONTECNICA,MODALIDAD,NOACTA,FECHAACTA,FPROCESO,TIPOIDPACIENTE,NROIDPACIENTE,CODENTJM) values ('974',to_date('16/07/19','DD/MM/RR'),'9','2','20190716134013192823',to_date('16/07/19','DD/MM/RR'),'N','1','3','080010027801',null,'PORTADOR DE SONDA NASOGASTRICA QUE REQUIERE FORMULA POLIMERICA CON CARBOHIDRATOS DE ABSORCIÃ“N LENTA.','1','018/12',to_date('17/12/19','DD/MM/RR'),'2019-12-17','CC','3870991','080010027801');
Insert into OASIS4.WEBSERV_JUNTA_PROFESIONAL (ID_JUPR,REPO_PERIODO,REPO_SERV_ID,REPO_TIRE_ID,NOPRESCRIPCION,FPRESCRIPCION,TIPOTECNOLOGIA,CONSECUTIVO,ESTJM,CODENTPROC,OBSERVACIONES,JUSTIFICACIONTECNICA,MODALIDAD,NOACTA,FECHAACTA,FPROCESO,TIPOIDPACIENTE,NROIDPACIENTE,CODENTJM) values ('975',to_date('16/07/19','DD/MM/RR'),'9','2','20190716133013193870',to_date('16/07/19','DD/MM/RR'),'N','1','2',null,null,null,null,null,to_date('01/01/70','DD/MM/RR'),null,'CC','22673362','080010349401');
Insert into OASIS4.WEBSERV_JUNTA_PROFESIONAL (ID_JUPR,REPO_PERIODO,REPO_SERV_ID,REPO_TIRE_ID,NOPRESCRIPCION,FPRESCRIPCION,TIPOTECNOLOGIA,CONSECUTIVO,ESTJM,CODENTPROC,OBSERVACIONES,JUSTIFICACIONTECNICA,MODALIDAD,NOACTA,FECHAACTA,FPROCESO,TIPOIDPACIENTE,NROIDPACIENTE,CODENTJM) values ('976',to_date('16/07/19','DD/MM/RR'),'9','2','20190716193013196344',to_date('16/07/19','DD/MM/RR'),'N','1','2',null,null,null,null,null,to_date('01/01/70','DD/MM/RR'),null,'CC','7410381','080010349401');
Insert into OASIS4.WEBSERV_JUNTA_PROFESIONAL (ID_JUPR,REPO_PERIODO,REPO_SERV_ID,REPO_TIRE_ID,NOPRESCRIPCION,FPRESCRIPCION,TIPOTECNOLOGIA,CONSECUTIVO,ESTJM,CODENTPROC,OBSERVACIONES,JUSTIFICACIONTECNICA,MODALIDAD,NOACTA,FECHAACTA,FPROCESO,TIPOIDPACIENTE,NROIDPACIENTE,CODENTJM) values ('977',to_date('16/07/19','DD/MM/RR'),'9','2','20190716118013199876',to_date('16/07/19','DD/MM/RR'),'N','1','3','080010349401',null,'DESNUTRICION PROTEICO CALORICA MODERADA SEGÃšN IMC','2','028',to_date('22/07/19','DD/MM/RR'),'2019-07-22','CC','22341487','080010349401');
Insert into OASIS4.WEBSERV_JUNTA_PROFESIONAL (ID_JUPR,REPO_PERIODO,REPO_SERV_ID,REPO_TIRE_ID,NOPRESCRIPCION,FPRESCRIPCION,TIPOTECNOLOGIA,CONSECUTIVO,ESTJM,CODENTPROC,OBSERVACIONES,JUSTIFICACIONTECNICA,MODALIDAD,NOACTA,FECHAACTA,FPROCESO,TIPOIDPACIENTE,NROIDPACIENTE,CODENTJM) values ('978',to_date('16/07/19','DD/MM/RR'),'9','2','20190716155013176843',to_date('16/07/19','DD/MM/RR'),'S','1','3','470010096901',null,'TRASLADO REDONDO CITA FECHA: 22 DE JULIO 2019 HORA :8 AM DIR :CENTRO RADIOLOGIA ELISA CLARA CRA 15 #14-36 ALFONSO LÃ“PEZ DOMICILIO CARRERA 24 #38-15 VALLEDUPAR','1','925',to_date('16/07/19','DD/MM/RR'),'2019-07-16','CC','49608177','470010096901');
Insert into OASIS4.WEBSERV_JUNTA_PROFESIONAL (ID_JUPR,REPO_PERIODO,REPO_SERV_ID,REPO_TIRE_ID,NOPRESCRIPCION,FPRESCRIPCION,TIPOTECNOLOGIA,CONSECUTIVO,ESTJM,CODENTPROC,OBSERVACIONES,JUSTIFICACIONTECNICA,MODALIDAD,NOACTA,FECHAACTA,FPROCESO,TIPOIDPACIENTE,NROIDPACIENTE,CODENTJM) values ('979',to_date('17/07/19','DD/MM/RR'),'9','2','20190717116013203356',to_date('17/07/19','DD/MM/RR'),'N','1','3','080010349401',null,'SUPLEMENTO NUTRICIONAL TIPO ENTEREX PARA MEJORAR CONDICIONES MUSCULOESQUELETICAS','2','024',to_date('17/07/19','DD/MM/RR'),'2019-07-17','CC','22673362','080010349401');
Insert into OASIS4.WEBSERV_JUNTA_PROFESIONAL (ID_JUPR,REPO_PERIODO,REPO_SERV_ID,REPO_TIRE_ID,NOPRESCRIPCION,FPRESCRIPCION,TIPOTECNOLOGIA,CONSECUTIVO,ESTJM,CODENTPROC,OBSERVACIONES,JUSTIFICACIONTECNICA,MODALIDAD,NOACTA,FECHAACTA,FPROCESO,TIPOIDPACIENTE,NROIDPACIENTE,CODENTJM) values ('980',to_date('17/07/19','DD/MM/RR'),'9','2','20190717177013204455',to_date('17/07/19','DD/MM/RR'),'N','1','2',null,null,null,null,null,to_date('01/01/70','DD/MM/RR'),null,'CC','29132945','ESS076');
Insert into OASIS4.WEBSERV_JUNTA_PROFESIONAL (ID_JUPR,REPO_PERIODO,REPO_SERV_ID,REPO_TIRE_ID,NOPRESCRIPCION,FPRESCRIPCION,TIPOTECNOLOGIA,CONSECUTIVO,ESTJM,CODENTPROC,OBSERVACIONES,JUSTIFICACIONTECNICA,MODALIDAD,NOACTA,FECHAACTA,FPROCESO,TIPOIDPACIENTE,NROIDPACIENTE,CODENTJM) values ('981',to_date('17/07/19','DD/MM/RR'),'9','2','20190717157013206438',to_date('17/07/19','DD/MM/RR'),'N','1','2',null,null,null,null,null,to_date('01/01/70','DD/MM/RR'),null,'CC','22431638','082960002101');
Insert into OASIS4.WEBSERV_JUNTA_PROFESIONAL (ID_JUPR,REPO_PERIODO,REPO_SERV_ID,REPO_TIRE_ID,NOPRESCRIPCION,FPRESCRIPCION,TIPOTECNOLOGIA,CONSECUTIVO,ESTJM,CODENTPROC,OBSERVACIONES,JUSTIFICACIONTECNICA,MODALIDAD,NOACTA,FECHAACTA,FPROCESO,TIPOIDPACIENTE,NROIDPACIENTE,CODENTJM) values ('982',to_date('17/07/19','DD/MM/RR'),'9','2','20190717142013206827',to_date('17/07/19','DD/MM/RR'),'N','1','2',null,null,null,null,null,to_date('01/01/70','DD/MM/RR'),null,'CC','1114399226','ESS076');
Insert into OASIS4.WEBSERV_JUNTA_PROFESIONAL (ID_JUPR,REPO_PERIODO,REPO_SERV_ID,REPO_TIRE_ID,NOPRESCRIPCION,FPRESCRIPCION,TIPOTECNOLOGIA,CONSECUTIVO,ESTJM,CODENTPROC,OBSERVACIONES,JUSTIFICACIONTECNICA,MODALIDAD,NOACTA,FECHAACTA,FPROCESO,TIPOIDPACIENTE,NROIDPACIENTE,CODENTJM) values ('983',to_date('17/07/19','DD/MM/RR'),'9','2','20190717177013208650',to_date('17/07/19','DD/MM/RR'),'N','1','3','130010210201',null,'OPTIMIZAR EL ESTADO NUTRICIONAL  PREVIO A LOS DOS AÃ‘OS DE EDAD ETAPA IMPORTANTE NEURODESARROLLO  IMC 13.3 POR CIEN REQUIERE SOPORTE NUTRICIONAL CUALITATIVO','1','63',to_date('17/07/19','DD/MM/RR'),'2019-07-17','RC','1201270754','130010210201');
Insert into OASIS4.WEBSERV_JUNTA_PROFESIONAL (ID_JUPR,REPO_PERIODO,REPO_SERV_ID,REPO_TIRE_ID,NOPRESCRIPCION,FPRESCRIPCION,TIPOTECNOLOGIA,CONSECUTIVO,ESTJM,CODENTPROC,OBSERVACIONES,JUSTIFICACIONTECNICA,MODALIDAD,NOACTA,FECHAACTA,FPROCESO,TIPOIDPACIENTE,NROIDPACIENTE,CODENTJM) values ('984',to_date('17/07/19','DD/MM/RR'),'9','2','20190717141013210891',to_date('17/07/19','DD/MM/RR'),'N','1','3','080010445432',null,'PACIENTE FEMENINO DE 83 AÃ‘OS CON DX MEDICO: HTA, DM ENFERMEDAD RENAL Y CARDÃ?ACA Y DX NUTRICIONAL DESNUTRICIÃ“N MODERADA. REQUIERE COMPLEMENTO.','2','319',to_date('17/07/19','DD/MM/RR'),'2019-07-17','CC','22484218','080010445432');
Insert into OASIS4.WEBSERV_JUNTA_PROFESIONAL (ID_JUPR,REPO_PERIODO,REPO_SERV_ID,REPO_TIRE_ID,NOPRESCRIPCION,FPRESCRIPCION,TIPOTECNOLOGIA,CONSECUTIVO,ESTJM,CODENTPROC,OBSERVACIONES,JUSTIFICACIONTECNICA,MODALIDAD,NOACTA,FECHAACTA,FPROCESO,TIPOIDPACIENTE,NROIDPACIENTE,CODENTJM) values ('985',to_date('17/07/19','DD/MM/RR'),'9','2','20190717195013217826',to_date('17/07/19','DD/MM/RR'),'N','1','2',null,null,null,null,null,to_date('01/01/70','DD/MM/RR'),null,'CC','22436342','084330205401');
Insert into OASIS4.WEBSERV_JUNTA_PROFESIONAL (ID_JUPR,REPO_PERIODO,REPO_SERV_ID,REPO_TIRE_ID,NOPRESCRIPCION,FPRESCRIPCION,TIPOTECNOLOGIA,CONSECUTIVO,ESTJM,CODENTPROC,OBSERVACIONES,JUSTIFICACIONTECNICA,MODALIDAD,NOACTA,FECHAACTA,FPROCESO,TIPOIDPACIENTE,NROIDPACIENTE,CODENTJM) values ('986',to_date('17/07/19','DD/MM/RR'),'9','2','20190717192013218857',to_date('17/07/19','DD/MM/RR'),'N','1','2',null,null,null,null,null,to_date('01/01/70','DD/MM/RR'),null,'CC','8784565','080010349401');
Insert into OASIS4.WEBSERV_JUNTA_PROFESIONAL (ID_JUPR,REPO_PERIODO,REPO_SERV_ID,REPO_TIRE_ID,NOPRESCRIPCION,FPRESCRIPCION,TIPOTECNOLOGIA,CONSECUTIVO,ESTJM,CODENTPROC,OBSERVACIONES,JUSTIFICACIONTECNICA,MODALIDAD,NOACTA,FECHAACTA,FPROCESO,TIPOIDPACIENTE,NROIDPACIENTE,CODENTJM) values ('987',to_date('17/07/19','DD/MM/RR'),'9','2','20190717138013220231',to_date('17/07/19','DD/MM/RR'),'N','1','2',null,null,null,null,null,to_date('01/01/70','DD/MM/RR'),null,'CC','29183547','761000252401');
Insert into OASIS4.WEBSERV_JUNTA_PROFESIONAL (ID_JUPR,REPO_PERIODO,REPO_SERV_ID,REPO_TIRE_ID,NOPRESCRIPCION,FPRESCRIPCION,TIPOTECNOLOGIA,CONSECUTIVO,ESTJM,CODENTPROC,OBSERVACIONES,JUSTIFICACIONTECNICA,MODALIDAD,NOACTA,FECHAACTA,FPROCESO,TIPOIDPACIENTE,NROIDPACIENTE,CODENTJM) values ('988',to_date('17/07/19','DD/MM/RR'),'9','2','20190717148013220685',to_date('17/07/19','DD/MM/RR'),'N','1','3','087580016101',null,'SE SOLICITA ALIMENTO PARA RECUPERAR ESTADO NUTRICIONAL DEL PACIENTE EN DELGADEZ+ EPOC.','1','0020',to_date('17/07/19','DD/MM/RR'),'2019-07-17','CC','22681253','087580016101');
Insert into OASIS4.WEBSERV_JUNTA_PROFESIONAL (ID_JUPR,REPO_PERIODO,REPO_SERV_ID,REPO_TIRE_ID,NOPRESCRIPCION,FPRESCRIPCION,TIPOTECNOLOGIA,CONSECUTIVO,ESTJM,CODENTPROC,OBSERVACIONES,JUSTIFICACIONTECNICA,MODALIDAD,NOACTA,FECHAACTA,FPROCESO,TIPOIDPACIENTE,NROIDPACIENTE,CODENTJM) values ('989',to_date('17/07/19','DD/MM/RR'),'9','2','20190717130013221615',to_date('17/07/19','DD/MM/RR'),'N','1','3','080010349401',null,'PACIENTE FEMENINA DE  59 AÃ‘OS DE EDAD CON DIAGNOSTICO DESNUTRICION LEVE SEGÃšN IMC, SE INICIA TERAPIA MEDICA NUTRICIONAL CON UNA DOSIS DE PULMOCARE ','2','026',to_date('18/07/19','DD/MM/RR'),'2019-07-18','CC','22268404','080010349401');
Insert into OASIS4.WEBSERV_JUNTA_PROFESIONAL (ID_JUPR,REPO_PERIODO,REPO_SERV_ID,REPO_TIRE_ID,NOPRESCRIPCION,FPRESCRIPCION,TIPOTECNOLOGIA,CONSECUTIVO,ESTJM,CODENTPROC,OBSERVACIONES,JUSTIFICACIONTECNICA,MODALIDAD,NOACTA,FECHAACTA,FPROCESO,TIPOIDPACIENTE,NROIDPACIENTE,CODENTJM) values ('990',to_date('17/07/19','DD/MM/RR'),'9','2','20190717129013225523',to_date('17/07/19','DD/MM/RR'),'N','1','2',null,null,null,null,null,to_date('01/01/70','DD/MM/RR'),null,'CC','49651834','200010205401');
Insert into OASIS4.WEBSERV_JUNTA_PROFESIONAL (ID_JUPR,REPO_PERIODO,REPO_SERV_ID,REPO_TIRE_ID,NOPRESCRIPCION,FPRESCRIPCION,TIPOTECNOLOGIA,CONSECUTIVO,ESTJM,CODENTPROC,OBSERVACIONES,JUSTIFICACIONTECNICA,MODALIDAD,NOACTA,FECHAACTA,FPROCESO,TIPOIDPACIENTE,NROIDPACIENTE,CODENTJM) values ('991',to_date('17/07/19','DD/MM/RR'),'9','2','20190717165013228804',to_date('17/07/19','DD/MM/RR'),'N','1','3','080010349401',null,'SUPLEMENTO NUTRICIONAL TIPO ENSURE PARA OPTIMIZAR CONDICIONES MUSCULOESQUELETICAS','2','025',to_date('18/07/19','DD/MM/RR'),'2019-07-18','CC','22680917','080010349401');
Insert into OASIS4.WEBSERV_JUNTA_PROFESIONAL (ID_JUPR,REPO_PERIODO,REPO_SERV_ID,REPO_TIRE_ID,NOPRESCRIPCION,FPRESCRIPCION,TIPOTECNOLOGIA,CONSECUTIVO,ESTJM,CODENTPROC,OBSERVACIONES,JUSTIFICACIONTECNICA,MODALIDAD,NOACTA,FECHAACTA,FPROCESO,TIPOIDPACIENTE,NROIDPACIENTE,CODENTJM) values ('992',to_date('17/07/19','DD/MM/RR'),'9','2','20190717127013225239',to_date('17/07/19','DD/MM/RR'),'S','2','2',null,null,null,null,null,to_date('01/01/70','DD/MM/RR'),null,'CC','49651834','200010205401');
Insert into OASIS4.WEBSERV_JUNTA_PROFESIONAL (ID_JUPR,REPO_PERIODO,REPO_SERV_ID,REPO_TIRE_ID,NOPRESCRIPCION,FPRESCRIPCION,TIPOTECNOLOGIA,CONSECUTIVO,ESTJM,CODENTPROC,OBSERVACIONES,JUSTIFICACIONTECNICA,MODALIDAD,NOACTA,FECHAACTA,FPROCESO,TIPOIDPACIENTE,NROIDPACIENTE,CODENTJM) values ('993',to_date('17/07/19','DD/MM/RR'),'9','2','20190717185013228591',to_date('17/07/19','DD/MM/RR'),'S','1','2',null,null,null,null,null,to_date('01/01/70','DD/MM/RR'),null,'CC','3734248','086380074501');
Insert into OASIS4.WEBSERV_JUNTA_PROFESIONAL (ID_JUPR,REPO_PERIODO,REPO_SERV_ID,REPO_TIRE_ID,NOPRESCRIPCION,FPRESCRIPCION,TIPOTECNOLOGIA,CONSECUTIVO,ESTJM,CODENTPROC,OBSERVACIONES,JUSTIFICACIONTECNICA,MODALIDAD,NOACTA,FECHAACTA,FPROCESO,TIPOIDPACIENTE,NROIDPACIENTE,CODENTJM) values ('994',to_date('18/07/19','DD/MM/RR'),'9','2','20190718197013248457',to_date('18/07/19','DD/MM/RR'),'M','1','3','200010043101',null,'Paciente con antecedentes de crisis convulsiva que venÃ­a recibiendo divalproico de sodio de 500, mg. Ya que el principio activo  Ã¡cido valproico no se encontrab','1','0012',to_date('06/08/19','DD/MM/RR'),'2019-08-06','CC','42489560','200010043101');
